Titulo,Numero_de_videos,Descricao,Imagem_de_perfil,Numero_de_visualizacoes,Link,Numero_de_inscritos,Data,Canal_ID,Pais_codigo
DaFuq!?Boom!,303,"DaFuq!?Boom!40 MILLION SUBSCRIBERS - 30th March 202430 MILLION SUBSCRIBERS - 19th September 202325 MILLION SUBSCRIBERS - 17th August 202320 MILLION SUBSCRIBERS - 18th July 202310 MILLION SUBSCRIBERS - 7th June 20235 MILLION SUBSCRIBERS - 15th May 20231 MILLION SUBSCRIBERS - 5:43 A.M., 23rd November 2021900k subscribers 4th April 2021700k subscribers 19th July 2020200 MILLION VIEWS IN TOTAL - 2nd April 2020600k subscribers 27th March 2020500k subscribers 23rd November 2019100 MILLION VIEWS IN TOTAL  - 12 April 2019300k subscribers - 27 February 201935 million views in total - 08/02/201850k subscribers - 12/04/201710 million views in total - 11/28/201730k subscribers - 08/03/20173 million views in total - 07/11/201720k subscribers - 07/05/201710k subscribers - 05/18/2017",https://yt3.ggpht.com/P2dEEGGTZdLx7313inVbiONF5Kz-Pqik9o6s255XtMWMoxikwsswwvf57o3xBq7NSGsXK9lDNQ=s88-c-k-c0x00ffffff-no-rj,17840782655,https://www.youtube.com/channel/UCsSsgPaZ2GSmO6il8Cb5iGA,44200000,2024-11-01,UCsSsgPaZ2GSmO6il8Cb5iGA,US
TV Senado,98542,"Acompanhe ao vivo as atividades do Senado Federal. Confira ainda: discursos dos senadores, debates e votação de projetos, a cobertura jornalística, documentários e entrevistas especiais. A participação de todos é bem-vinda e nos esforçaremos para acompanhar a conversa sempre que possível. A TV Senado encoraja todos a comentarem as publicações. Os comentários, no entanto, não representam a opinião da TV Senado. Comentários que forem considerados inapropriados ou ofensivos poderão ser removidos e, em caso de reincidência, a conta do autor do comentário poderá ser bloqueada. Comentário difamatório, que moleste, ameace ou que, de qualquer forma, viole direitos de terceiros, poderá ser retirado e encaminhado à Polícia do Senado para investigação. Para manter um ambiente de civilidade, comentários que não respeitem a urbanidade ou sejam agressivos poderão ser apagados, assim como spams, propaganda eleitoral, publicidade em geral e comentários que fujam ao tema.Equipe da TV Senado",https://yt3.ggpht.com/DTcmWpfqi3PXQYOGopPTdB_pyCyofAVdO25MFvbLqvsikp1Iydl64x5eDppPPM71gGKM-GrBN9w=s88-c-k-c0x00ffffff-no-rj,305592263,https://www.youtube.com/channel/UCLgti7NuK0RuW9wty-fxPjQ,1560000,2024-11-01,UCLgti7NuK0RuW9wty-fxPjQ,ZA
Rigopes,429,"Eu sou Rigopes, da RigoLândia e gosto de Minecraft!Sejam bem-vindos 💚Contato: riguecomercial@gmail.com 📸Meu Instagram: https://www.instagram.com/rigueoficial/🟢Meu Discord: https://discord.gg/TU5DYYmbEn",https://yt3.ggpht.com/pAxrOoeIlEb79dUfNge38DUUk-JlN3ap6KKLkeIZLHfL2IYyUuUI4Q-vD9sde0arXJxY9ZzhoA=s88-c-k-c0x00ffffff-no-rj,8792970,https://www.youtube.com/channel/UCvS_sCesX7hD5oQY2ThxeBA,56900,2024-11-01,UCvS_sCesX7hD5oQY2ThxeBA,BR
Bruna Constantino,863,"Bem vindos ao meu canal, galerinha! Bruna Constantino na área! Vídeos todos os dias 12h no canal! Obrigada por me acompanharem e por realizarem meu sonho de chegar aos 100k! Começarei a postar shorts pra vocês como forma de agradecer! A meta agora é chegarmos nos 200k! Me sigam no insta e no tik tok @eubrunaconstantino para acompanhar meu dia-a-dia!",https://yt3.ggpht.com/SW_w7pRlerFOTye47XNoROdk72GpVBSrfWPRtU4Is1eXLXfMDc3KgYAq4mvi3q-nfqvpQlK4Jw=s88-c-k-c0x00ffffff-no-rj,566061100,https://www.youtube.com/channel/UCfW44jAwxqCI8VB_Dd7KkXQ,2510000,2024-11-01,UCfW44jAwxqCI8VB_Dd7KkXQ,BR
Hora do Faro,4091,Este é o canal oficial no YouTube do programa Hora do Faro exibido pela Record e apresentado por Rodrigo Faro.,https://yt3.ggpht.com/LiW3Rhg0JgFgFEvJnWEFA2DxGRnHEd8eap1t1smCPqjx5QSJ4vSB01Vaj-WrN8qH7fGecEFV7A=s88-c-k-c0x00ffffff-no-rj,1103430799,https://www.youtube.com/channel/UC6IV24QPvsASJbzqDbmK8gw,4570000,2024-11-01,UC6IV24QPvsASJbzqDbmK8gw,ZZ
Eu Hipe,113,Última tentativa ,https://yt3.ggpht.com/VlqD1y0gG73bwxFS8XdxrA7ha0aMScIzoWNpR4N-39i7ZY8xr0xzyPcDUd54zvPMz9iK0TJOFw=s88-c-k-c0x00ffffff-no-rj,68763618,https://www.youtube.com/channel/UCOQmBVfATKImz1du_L4jIeg,979000,2024-11-01,UCOQmBVfATKImz1du_L4jIeg,ZZ
Mob Entertainment,157,Welcome to the official Mob Entertainment YouTube channel.Currently developing Poppy Playtime and Project Playtime,https://yt3.ggpht.com/3sNL6ThBhi6vYLGVBDeVT8DU5_Wuhl7IcQSwvUpA4IATW7T_weakNsLHMlwr3ZENWDQ_itgtSw=s88-c-k-c0x00ffffff-no-rj,530541878,https://www.youtube.com/channel/UCXqV4yoyC_mmZye6VbKFPeQ,3220000,2024-11-01,UCXqV4yoyC_mmZye6VbKFPeQ,ZZ
Brawl Stars,246,Fast-paced 3v3 multiplayer and battle royale made for mobile! Play with friends or solo across a variety of game modes in under three minutes.,https://yt3.ggpht.com/FVJpJyrV85TDL2nyiFbnaBuZzuYX1thQywPXCvilPAuw7DmPjFoXphPgkCqekYNIfqFtqGrvCg=s88-c-k-c0x00ffffff-no-rj,2934011885,https://www.youtube.com/channel/UCooVYzDxdwTtGYAkcPmOgOw,20600000,2024-11-01,UCooVYzDxdwTtGYAkcPmOgOw,FI
Vovô Raul Gil Oficial,5928,"CONTATO p/ LICENCIAMENTO E DIVULGAÇÃO NO CANAL DO VOVÔ RAULvovoraulgilcontatos@gmail.comEsse é o canal oficial do Vovô Raul, todos os dias vídeos inéditos para você se divertir!! SE INSCREVA NO CANAL DO VOVÔ RAUL - http://bit.ly/2TBKzlASIGA O INSTAGRAM DO SHADOW: https://www.instagram.com/shadowgospeloficial/INSTAGRAM RAULZINHO - https://www.instagram.com/raulgiljr/INSTAGRAM RAUL GIL- https://www.instagram.com/raulgiljr/INSTAGRAM CLARINHA GIL - https://www.instagram.com/clarinhagil.oficial/SIGA NOSSO INSTAGRAM: https://www.instagram.com/vovoraulgil/Esse é o canal Oficial do Programa Raul Gil. Todo sábado vídeos inéditos!DEIXE SEU LIKE E INSCREVA-SE NO CANAL",https://yt3.ggpht.com/rjRo9ua3oVtUzthlIBP-u7LMZ8ufhibaa__BPrE3TMCWpVurL9ApV3Ml-FuEa69GGPGv4mThjw=s88-c-k-c0x00ffffff-no-rj,2145913630,https://www.youtube.com/channel/UC7mMSiAr_-bqP_Duf-PAF0A,6080000,2024-11-01,UC7mMSiAr_-bqP_Duf-PAF0A,BR
Marcelo e Duda,18,INSCREVA-SE no mundo DUPLAMENTE DIVERTIDO com Marcelo e Duda! 💕Preparem-se para se divertir e passar por desafios incríveis! 🔥,https://yt3.ggpht.com/VfJivL7aN4QV5kxeVs8fG2JjBKeIvJxlWxORsOduyrIZ7rrWaZcHYzl6piKpNAiaNFPXwDmYag=s88-c-k-c0x00ffffff-no-rj,35009512,https://www.youtube.com/channel/UC8iAxsG_7lIViTS5LmJdT1A,488000,2024-11-01,UC8iAxsG_7lIViTS5LmJdT1A,BR
League of Legends,1501,"Recently recognized as the most played video game in the world—100 million play every month—League of Legends® is a multiplayer online battle arena game (MOBA).Players choose a role from an expanding cast of powerful champions and join forces in strategic, fast-paced gameplay to take control of the enemy’s end of the battlefield.Sign up for a free League of Legends account at http://riot.com/signup",https://yt3.ggpht.com/olIZhSlrdVwqLu0Xte6d9yjTTKn256CEa1u36pXTKoioQ5c0rmOIV_MQRxybo5ekWzAbA4NV=s88-c-k-c0x00ffffff-no-rj,8245784920,https://www.youtube.com/channel/UC2t5bjwHdUX4vM2g8TRDq5g,15500000,2024-11-01,UC2t5bjwHdUX4vM2g8TRDq5g,US
Maxedy,89,Epic animation channel 👌🥶⭐️ Creator of a new animating style (Live action + 2D art + 3D all in one)contact me: maxedyYT@gmail.com,https://yt3.ggpht.com/QNjIgVQNzSdOYFzTkKD3dPZTer3BvwLu42FDYa-NFD-ShKZQQfm5NmUeiF46YoIkcjKs0b68SeY=s88-c-k-c0x00ffffff-no-rj,344613451,https://www.youtube.com/channel/UCPEM1vZqAD7J7VO-7hAhcXg,1540000,2024-11-01,UCPEM1vZqAD7J7VO-7hAhcXg,US
Splash,17966,"🟣 Site: https://www.uol.com.br/splash/ultimas/🔵 TT: https://www.tiktok.com/@splash_uol🟡 TW: https://twitter.com/splash_uol🟢 IG: https://www.instagram.com/splash_uol/🔴 FB: https://www.facebook.com/SplashUOLSomos o canal Splash, do UOL, onde você encontra nossa cobertura de celebridades, música, filmes, séries, reality shows e programas originais. Tudo com um timaço formado por nomes como Otaviano Costa, Chico Barney, Lucas Pasin, Zeca Camargo, Fefito, Márcia Sensitiva, Marcelle Carvalho, Dieguinho Schueng e Yas Fiorelo. ",https://yt3.ggpht.com/4IbdmJGaYMzKjn_zsrqsWvLl-X7BKdo-iWlpJrLXYg3sxV3xcbqw-5mA64yqvsJnH2veGMvQUQ=s88-c-k-c0x00ffffff-no-rj,531649703,https://www.youtube.com/channel/UCVrx8gt9oAHPbOjA-EjFblw,692000,2024-11-01,UCVrx8gt9oAHPbOjA-EjFblw,BR
Seu Desejo,136,"Seu Desejo é uma banda de forró romântico brasileira com sede em Petrolina-PE e parte do prestigiado casting de artistas da Camarote Shows, liderada por Wesley Safadão, é uma colaboração musical de destaque composta por Yara Tchê e Alessandro Costa.Com mais de 20 anos de carreira, Yara Tchê e Alessandro Costa são artistas experientes que trilharam um caminho brilhante. Durante mais de 16 anos fizeram parte da icônica banda Desejo de Menina, consagrando grandes sucessos como To Bem Passou, Cumplicidade, Raio de Sol, Vida Vazia, “Adeus Aquele Amor”, “Sorte”, “Diga sim pra mim” e o fenômeno Baú da Desejo. Ao longo de suas trajetórias, Yara Tchê e Alessandro conquistaram uma extensa legião de fãs em todo o país, refletindo sua originalidade e excelência musical. Com shows sempre lotados, a dupla apresenta um repertório emocionante, repleto de canções marcantes que cativam o público.",https://yt3.ggpht.com/um9sIbcZPycaReKXCiDHx36aYtf61LLT9eTH7aW2xmQ_TQJCkb-YX7MXVmfs66cfI-Dw9fkdBUI=s88-c-k-c0x00ffffff-no-rj,343011731,https://www.youtube.com/channel/UCQRBaPdOmWAlw0B1ir1yxoA,869000,2024-11-01,UCQRBaPdOmWAlw0B1ir1yxoA,BR
Manu Bahtidão,259,"Com certeza você já ouviu falar no Tecnomelody, estilo musical que vem crescendo no país e vem diretamente do estado do Pará. Manu Bahtidão, uma das maiores artistas do segmento, chegou para consolidar a carreira com o lançamento do seu DVD Daqui Pra Sempre.O DVD contém 11 faixas autorais e 3 versões. O primeiro single do projeto “Quem Perde É Quem Trai” conquistou os maiores influenciadores do país e se tornou um sucesso. Com a faixa-título, Manu emplacou um hit nacional e internacional colocando a canção em 1º lugar no Youtube Brasil, Top 10 no Youtube de Portugal, Top 2 no Spotify Brasil e mais de 1 milhão de vídeos nas redes sociais. Com o single Torre Eiffel, Manu atingiu o Top 1 no Spotify Brasil.A artista que é sucesso por onde passa, com shows lotados por todo o Brasil, cravou em 2023 o seu nome no cenário musical brasileiro e se tornou uma das maiores artista do País. No segundo semestre de 2024 ela dá continuidade ao seu sucesso lançando seu novo single Universo.",https://yt3.ggpht.com/OGGpgsYteTr_vd3K2kW_GoigzaAab_FKPVpQfsrsOcq6zU_i1U5vwc57SS9IXhSXfeEKWv2qtJs=s88-c-k-c0x00ffffff-no-rj,1414378346,https://www.youtube.com/channel/UCTa_X-4mmje4Tk0lig9t4Mw,2720000,2024-11-01,UCTa_X-4mmje4Tk0lig9t4Mw,BR
Irmãs Pina,9920,Bem vindos ao nosso canal 🥳Vai se apaixonar 🤩,https://yt3.ggpht.com/M4AO2e3Fqs-yITIfN2wjJgYtt-nsVeAmr5pi2Gj3JcZumz6VjqVsEVckqDjnYHHC7QawpYHe0w=s88-c-k-c0x00ffffff-no-rj,5050830099,https://www.youtube.com/channel/UCPQKC_B2zXGxNpN9_va7OCw,6250000,2024-11-01,UCPQKC_B2zXGxNpN9_va7OCw,BR
BANGTANTV,2629,This is the official YouTube channel of BTS. 방탄소년단 공식 유튜브 채널 입니다.,https://yt3.ggpht.com/zL7KDS7WEHVbgpo6dM91hL5e91etHiuq2umW32iSePrhE5411SPsEdpAEcf5m5mYS-a_vpl7Ww=s88-c-k-c0x00ffffff-no-rj,23916986199,https://www.youtube.com/channel/UCLkAepWjdylmXSltofFvsYQ,79200000,2024-11-01,UCLkAepWjdylmXSltofFvsYQ,ZZ
Marcelo Bechler,599,"Jornalista esportivo. Correspondente desde 2015 em Barcelona. Aqui para analisar futebol, da forma mais simples possível, para vocês!",https://yt3.ggpht.com/ytc/AIdro_m8krl9CuweQI-Y7wGTgvX6z5qTI_QR7G5VLxAzS0WkBBU=s88-c-k-c0x00ffffff-no-rj,30543723,https://www.youtube.com/channel/UCr3S50A3UmXeBsHBTHCW-Ow,246000,2024-11-01,UCr3S50A3UmXeBsHBTHCW-Ow,ZZ
Iguinho e Lulinha,469,Canal Oficial da dupla Iguinho e Lulinha no YouTube.,https://yt3.ggpht.com/DoYi3VFIx1FHq5-Gbm8Xapb6nQ0eFxBRrfF_jOJEpXa6zpA5POjtnTC_itxh4MN5dBVH4IUrWPo=s88-c-k-c0x00ffffff-no-rj,714734484,https://www.youtube.com/channel/UCSS13SwFDxkiC6Yz-tF11UA,826000,2024-11-01,UCSS13SwFDxkiC6Yz-tF11UA,BR
Pablo Oficial,321,Shows: 75- 9. 9127-5417  /  71 - 9.9967-3537,https://yt3.ggpht.com/8sF40Lo6Y_AUEHrmTI_NFWq90NCAIZJUxcoOr0QfXHmVIo0HEdr3ubpnR_9xGYU89lBDbewB9g=s88-c-k-c0x00ffffff-no-rj,3027115260,https://www.youtube.com/channel/UCvW6D401uETeZuvMrNfgwdg,4310000,2024-11-01,UCvW6D401uETeZuvMrNfgwdg,BR
Rafa & Luiz,3809,"Aqui no nosso canal vocês vão encontrar vídeos legais, engraçados e super divertidos! Vocês fazem parte dessa aventura, então inscrevam-se já e não fiquem fora dessa !INSCREVAM-SE!   CONSULTAS EMPRESARIAS: comercial@rafaeluiz.com.br",https://yt3.ggpht.com/csgBd2Yk74cB4i6Zpi5JXSPoZmKd_bcA9ThWmwNcM6IzynYtlW-ZET8CLTW3Y8ITssmzZ86K=s88-c-k-c0x00ffffff-no-rj,10046215740,https://www.youtube.com/channel/UC6paX0kLA8D81aYogceMufw,27800000,2024-11-01,UC6paX0kLA8D81aYogceMufw,BR
Virgínia Fonseca,1533,"Oii, amigos! Sejam bem-vindos ao meu canal, por aqui conseguimos ficar ainda mais próximos. Inscreva-se! Instagram: @virginiaEmail para contato: virginia@talismadigital.com.br",https://yt3.ggpht.com/tiOzl6g-T-BIoyfV5r0ElpicAXogRkSIlYSy7IpTxr2QVD4kv6hXw4j9jmG0pkncV_20NOdi=s88-c-k-c0x00ffffff-no-rj,1569823473,https://www.youtube.com/channel/UCsaB2VrLZrtGbum6Eo0ClbA,11800000,2024-11-01,UCsaB2VrLZrtGbum6Eo0ClbA,BR
NBA Brasil,3826,"Canal oficial no Brasil da NBA, a maior liga profissional de basquete do mundo que atinge 215 países.TODOS os dias, você acompanha aqui no canal o melhor dos jogos da noite anterior com o Rodada NBA, durante a temporada! Além disso, temos jogos ao vivo todas as segundas-feiras, junto com o melhor da rodada no Crunchtime.E todas as quartas vocês ainda acompanham os bastidores mais incríveis das franquias da NBA com o NBA Na Estrada. Aqui você fica por dentro de tudo que rola na Liga!",https://yt3.ggpht.com/nHdZcHfst2VxOuEe1o0wPO8X4w9xXjqO0zWIH06LNlUN8BimHIWXFisNZ4pEHUzZQiVVXDEI=s88-c-k-c0x00ffffff-no-rj,239302297,https://www.youtube.com/channel/UCsiCOcr5SZAWlJMfcw9P__w,1220000,2024-11-01,UCsiCOcr5SZAWlJMfcw9P__w,BR
Marcos e Belutti,390,"Este é o canal oficial da dupla sertaneja Marcos e Belutti.Na estrada desde 2008, os criadores dos sucessos “Domingo de Manhã” e “Aquele 1%”, surgiram em São Paulo, mas já ganharam o Brasil.Inscreva-se no canal e fique por dentro das novidades! 🎶Contato para shows:(11) 97547‑8877 | falco@noixmusic.com.brshows@marcosebelutti.com.brPublicidade: publicidade@marcosebelutti.com.br",https://yt3.ggpht.com/8ZItR8Ps8v9YJ6KV4lupBqxw7GPu2enfQSJe3c6KH76y2kh8J8fzfo2CmuSwWxvbui8t8LG9=s88-c-k-c0x00ffffff-no-rj,2069783499,https://www.youtube.com/channel/UC605s7hMHDSDaUx3txHckGQ,3840000,2024-11-01,UC605s7hMHDSDaUx3txHckGQ,BR
NOBRU,930,"Sejam bem-vindos ao meu canal Nobru. Meu nome é Bruno, tenho 21 anos e moro em São Paulo. Aqui vocês encontram diversos conteúdos de gameplay de Free Fire, muita resenha, vlogplays e muito mais.Se inscrevam no canal e ativem o sininho para não perder nenhum vídeo!Contato comercial: nobruesports@gmail.com",https://yt3.ggpht.com/QGfSLn5uA7rkFRSs_5wkDWWeb7q5xL8AR-Ghsnez80EFo0hedIy7QhpmvyKrAQzbIZUcD3WjaA=s88-c-k-c0x00ffffff-no-rj,581293139,https://www.youtube.com/channel/UCqWmLengIKFXRjuL1YyXNSg,15700000,2024-11-01,UCqWmLengIKFXRjuL1YyXNSg,BR
Eduardo Costa,1014,Brazilian Singer.Acompanhe Eduardo Costa nas redes sociais:Site Oficial: http://cantoreduardocosta.com.brFacebook: https://www.facebook.com/eduardocosta...Instagram: http://instagram.com/eduardocostaTwitter: http://twitter.com/eduardocosta,https://yt3.ggpht.com/sYmu7FqmF38UTFUdAO6BQVNJVagHuje5FerGWewnBDtBTzw_8G2rRh-N1oMZTWU9kg_eBTUGw1w=s88-c-k-c0x00ffffff-no-rj,5441021954,https://www.youtube.com/channel/UC2aVfU3JUEFYVFEIX2zTzGQ,7610000,2024-11-01,UC2aVfU3JUEFYVFEIX2zTzGQ,BR
MK MUSIC,6582,"Este é o canal oficial da gravadora MK Music. Aqui você fica por dentro de vídeos relacionados aos nossos artistas e seus lançamentos. Nosso conteúdo é atualizado diariamente, garantindo vídeos bastante diversificados como Clipes, Previews de lançamentos, VideoLetras de músicas exclusivas, eventos e apresentações ao vivo, Trailers de DVDs, além de Clipes #MemóriaMK: nossos arquivos desde 1986. Tudo isso bem separado em seções e playlists criadas especialmente para facilitar a sua vida.Aproveite e inscreva-se no nosso canal!    http://bit.ly/1vH0D1a ;)Obrigada pela sua visita!Acesse nosso site: www.mkmusic.com.br ",https://yt3.ggpht.com/M7ZULh9WhNuHwk-Iv4vWljG2r8zjvnGCvB5RtTuG81KUdzut_GF-rr8Vp9An2tPuzV9zkgk4=s88-c-k-c0x00ffffff-no-rj,11358523688,https://www.youtube.com/channel/UCbVwJCxsVbmaP1PFmbGQDeQ,17400000,2024-11-01,UCbVwJCxsVbmaP1PFmbGQDeQ,BR
CazéTV,7583,,https://yt3.ggpht.com/XiDI4jKrS7jiTTMpQPVnjQUwiZlMmW-5uTqY8L2-2rFzijy16o2QsHvvF3JVrNBNzHqlIYbIag=s88-c-k-c0x00ffffff-no-rj,1933751601,https://www.youtube.com/channel/UCZiYbVptd3PVPf4f6eR6UaQ,16600000,2024-11-01,UCZiYbVptd3PVPf4f6eR6UaQ,BR
GR6 EXPLODE,3265,,https://yt3.ggpht.com/SahCIj4fyMUcrq0JGidN_XhfX93kGrwsLecVJ0drg5ycQVWKT9TTVPL6TYe0jzMm9GoX3iFtkQ=s88-c-k-c0x00ffffff-no-rj,28648004312,https://www.youtube.com/channel/UCNUQK9mQoqi4yNXw2_Rj6SA,41400000,2024-11-01,UCNUQK9mQoqi4yNXw2_Rj6SA,BR
Gregory e Matheus,150,"Gregory e Matheus iniciaram a vida artística ainda na infância, Matheus teve seu primeiro contato com a música aos 3 anos de idade com seu pai, já Gregory vivenciou a experiência na igreja, tocando bateria. Em 2013 ambos já estavam compondo músicas para grandes artistas do gênero sertanejo e o mercado os apresentou. Foi através da afinidade musical que se iniciou uma longa amizade, como compositores contribuíram para a construção de carreira de artistas como Marília Mendonça, Henrique e Juliano, Maiara e Maraisa, Cleber e Cauan, João Neto e Frederico, Cristiano Araújo, entre outros.Mas foi só em 2020 em meio a pandemia que a dupla sertaneja se formou. Após uma trajetória em outra dupla, Gregory seguiu positivo e animado em continuar sua história no mercado sertanejo, sendo assim estendeu o convite a Matheus, que inicialmente se sentiu inseguro com o cenário que vivenciavam. Mesmo assim, juntaram seus talentos e experiência e assim davam início a uma nova história, Gregory e Matheus.",https://yt3.ggpht.com/ZAjMHJYe5d_FDufk83nTSf72VWW7ovqc4mmtFosz4b42afw3deSQxayOeP-eo96GLVZ2qX6tSA=s88-c-k-c0x00ffffff-no-rj,5749996,https://www.youtube.com/channel/UCp2CxUyauR1aCUtPCA3u2bA,35100,2024-11-01,UCp2CxUyauR1aCUtPCA3u2bA,BR
Wiris Viana,253,"“A vida é uma peça de teatro que não permite ensaios. Por isso, cante, ria, dance, chore e viva intensamente cada momento de sua vida, antes que a cortina se feche e a peça termine sem aplausos.” ― Charles Chaplin",https://yt3.ggpht.com/Op2Vet0RCZNtT68fZ2sv8dCBDmnRVQYCFZTbdQQ8tND6Sfouy4CCi5kL5haT_T0txie5F895iks=s88-c-k-c0x00ffffff-no-rj,2020969449,https://www.youtube.com/channel/UCz2A8OXLR2xwYE63zWbu7IA,6270000,2024-11-01,UCz2A8OXLR2xwYE63zWbu7IA,BR
HYBE LABELS,2172,"Welcome to the official YouTube channel of HYBE, the content hub for BIGHIT MUSIC, BELIFT LAB, SOURCE MUSIC, PLEDIS Entertainment, KOZ ENTERTAINMENT, ADOR and more.",https://yt3.ggpht.com/ytc/AIdro_l8g0yRFG8xoe_qeqk8Ki9UFy36cB2IjZEWZWz0h7gl-t0=s88-c-k-c0x00ffffff-no-rj,36578093771,https://www.youtube.com/channel/UC3IZKseVpdzPSBaWxBxundA,75900000,2024-11-01,UC3IZKseVpdzPSBaWxBxundA,KR
LadyGagaVEVO,221,"Lady Gaga on Vevo - Official Music Videos, Live Performances, Interviews and more...",https://yt3.ggpht.com/yzOEXrp_77aevhp7br98XrNC0Gl3afLllOStYv91C5_MdGr-s2GtRdCzWVqN2psTN6xlBhidCw=s88-c-k-c0x00ffffff-no-rj,15177344343,https://www.youtube.com/channel/UC07Kxew-cMIaykMOkzqHtBQ,8890000,2024-11-01,UC07Kxew-cMIaykMOkzqHtBQ,US
Cartoloucos,409,"Bem-vindo ao canal Cartoloucos. O lugar do torcedor, do churrasquinho de gato e da loucura. É só apertar esse botãozinho “inscrever” para ser feliz. Obrigado por estar aqui! ",https://yt3.ggpht.com/WWeOeuy9LXRhXU5RICqAVD_ng6OTTDYfxR4q7n5FxihtiFPCqY0nvblALQGrlBtoVgNs73T3LMs=s88-c-k-c0x00ffffff-no-rj,222430262,https://www.youtube.com/channel/UCfBw30ryGwSC-6YyTPseHPw,1320000,2024-11-01,UCfBw30ryGwSC-6YyTPseHPw,BR
MC Poze do Rodo,32,CANAL OFICIAL DO MC POZE DO RODOINSCREVA-SE AGORAContatos:- Shows: showspoze@mainstreetrecords.com.br- Twitter: https://twitter.com/mcpozedorodo- Instagram: https://www.instagram.com/mcpozedorodo/,https://yt3.ggpht.com/QvUlwfjrhvPDNd3ZIMtNK7WCvfr4Gjpm3n7rgoLFw1J2xVqSve1Y2MkjlTD25l_I4Cl1iZtBIw=s88-c-k-c0x00ffffff-no-rj,1548932361,https://www.youtube.com/channel/UCsyd_nnNNDxlOs9TYrDvCoQ,4300000,2024-11-01,UCsyd_nnNNDxlOs9TYrDvCoQ,BR
NPR Music,2589,"The official YouTube channel for NPR Music featuring Tiny Desk Concerts, live shows, documentaries and more.  Find more at www.npr.org/music",https://yt3.ggpht.com/0xQ36bByrRGcbiCG2a6Xb-pft78OAm0GW-5vRjC_uPGWD1mfAK8w7J-IjL4NbZGKbimh3QE1Zg=s88-c-k-c0x00ffffff-no-rj,3323797690,https://www.youtube.com/channel/UC4eYXhJI4-7wSWc8UNRwD4A,10100000,2024-11-01,UC4eYXhJI4-7wSWc8UNRwD4A,US
Sonar Produtora ,518,,https://yt3.ggpht.com/xbj60MeDkon8m9Vt_Bqj_0wVlkx0ORmewld5Y2etfpVuW___BDJN1HnWkt3pYRdQupxEyeIdEA=s88-c-k-c0x00ffffff-no-rj,1220083762,https://www.youtube.com/channel/UClhFyS7uI884HtPGyI31pRw,1330000,2024-11-01,UClhFyS7uI884HtPGyI31pRw,BR
Prime Video Brasil,2110,O canal oficial do YouTube do Prime Video Brasil.,https://yt3.ggpht.com/ecSKIYMEdAkbYKLTOhlzFw6rBMzxE9ISQaQxBBaxH52mkNivXEK9uGfRIHphCjMEL4RB-9eO=s88-c-k-c0x00ffffff-no-rj,691600667,https://www.youtube.com/channel/UCuNjvqjTzw9LcD9PVpTVWRA,3420000,2024-11-01,UCuNjvqjTzw9LcD9PVpTVWRA,BR
SBT Sports,3836,"Casa da Copa Sul-Americana e Champions League, com cobertura diária dos principais torneios do mundo e informações exclusivas. Você também pode conferir tudo o que rola no programa esportivo mais raiz da TV, o Arena SBT.",https://yt3.ggpht.com/kwzMcZ6CQhfL9xVI-Qoa_QymBaqB6az-wbhONAWTo5v-kkWRHARJeC5MhxGEGO0oNbMyB0Pdte8=s88-c-k-c0x00ffffff-no-rj,313559107,https://www.youtube.com/channel/UCxc3marqP9BJSkQ0_K4mqDg,1350000,2024-11-01,UCxc3marqP9BJSkQ0_K4mqDg,ZZ
Tonimek,1549,"Fundada em 1969 e exclusivamente prestando serviços de mecânica, ao longo de 50 anos a Tonimek passou por algumas transformações e hoje conta com uma área produtiva de mais de 3600m2 e especializada em todos os serviços que o seu carro pode precisar, nos tornamos a maior oficina multimarcas da cidade de São Paulo.Decidimos criar o canal para mostrar pra você, como funciona a rotina de um Centro Automotivo, além de poder tirar todas as dúvidas no processo de reparo de funilaria e pintura e mecânica.",https://yt3.ggpht.com/KCyTrWi4q3yj7cie2YLKjyYjyux5M6AD1M6l501v6A-pYLBP0Vo-MZLdzqFxNK5-Yd5c_LV4iQ=s88-c-k-c0x00ffffff-no-rj,97282335,https://www.youtube.com/channel/UCwRM1SXROyxSSJqrOTQzILw,650000,2024-11-01,UCwRM1SXROyxSSJqrOTQzILw,BR
Linkin Park,901,LINKINPARK.COM,https://yt3.ggpht.com/FPtlEh_UDOVYZ_A5YVAcodS8PP5wTVF2zP7za7hOtp3C-Ieh-qJHEgudKODznU60Eo1ctIQi=s88-c-k-c0x00ffffff-no-rj,16219417111,https://www.youtube.com/channel/UCZU9T1ceaOgwfLRq7OKFU4Q,22600000,2024-11-01,UCZU9T1ceaOgwfLRq7OKFU4Q,US
CazéTV,7583,,https://yt3.ggpht.com/XiDI4jKrS7jiTTMpQPVnjQUwiZlMmW-5uTqY8L2-2rFzijy16o2QsHvvF3JVrNBNzHqlIYbIag=s88-c-k-c0x00ffffff-no-rj,1933751601,https://www.youtube.com/channel/UCZiYbVptd3PVPf4f6eR6UaQ,16600000,2024-11-01,UCZiYbVptd3PVPf4f6eR6UaQ,BR
Amy Scarlet,744,💕 | Toda Honra e Glória a Deus,https://yt3.ggpht.com/XyVJ8wmeCxXyiAKJZh10JfqLfQioO-Q8VpzDfjsUvprIM9NiA_Hcy6dJPfTGc4cwrA46irppUw=s88-c-k-c0x00ffffff-no-rj,1468832355,https://www.youtube.com/channel/UCABon3LeMfnU5ajXaOYC1oA,5630000,2024-11-01,UCABon3LeMfnU5ajXaOYC1oA,BR
FORMULA 1,7991,"The home of risk takers, late brakers and history makers! 💫NEXT UP - RACE 21 OF 24: BRAZIL 🇧🇷 01-03 NOVEMBER",https://yt3.ggpht.com/tyLW5LsJGwr4ViM30OeYbuLcu_MXfpRzP8y-X9_aKfTNJeMFHmnNbPyxxhaFDA9NRgwEu9mT-g=s88-c-k-c0x00ffffff-no-rj,7281161720,https://www.youtube.com/channel/UCB_qr75-ydFVKSF9Dmo6izg,11200000,2024-11-01,UCB_qr75-ydFVKSF9Dmo6izg,ZZ
MUSSA,557,"Esse é o canal oficial do Mussa, seu Barbudo Favorito. Músicas divertidas e batalhas de rima para todas as idades. Aprenda a rimar, batalhe com os amigos e divirta-se com as Batalhas de Youtubers, Batalhas com Games e com as musicas e videos mais engraçados e animados do Mussoumano. Conteúdo livre para todos os públicos e idades. Chame sua família e entre agora no Mussa Style! Venha curtir as Batalhas de rap mais loucas do Youtube.Parcerias e publicidade:contato@mussastyle.com.brsiga @mussoumano",https://yt3.ggpht.com/HjS8Tj0OPumsW8joXIeBIP7dcSvlF-aAVqdzpYZBaMA96AI_EfT6hkHg9MqZh7VpyGNNeR0s=s88-c-k-c0x00ffffff-no-rj,2163104761,https://www.youtube.com/channel/UC607Gii1uo93qDqiGR6-c3w,13000000,2024-11-01,UC607Gii1uo93qDqiGR6-c3w,BR
Bruno Mars,103,"The official YouTube channel of Bruno Mars. Subscribe for the latest official music videos, live performances, official audio, and more: https://Atlantic.lnk.to/BMsubscribe 15x GRAMMY Award winner and 27x GRAMMY Award nominee Bruno Mars is a celebrated singer, songwriter, producer, and musician with iconic hits like The Lazy Song, That's What I Like, Just The Way You Are, 24K Magic, Locked Out Of Heaven, and When I Was Your Man. His legendary body of work also includes blockbuster albums such as Doo-Wops & Hooligans, Unorthodox Jukebox, and 24K Magic, as well as era-defining collaborations like Uptown Funk with Mark Ronson, Finesse with Cardi B, and Nothin' On You with B.o.B. Forever classic, yet supremely innovative, Bruno continues to redefine music, style, and popular culture, pushing the boundaries of pop, R&B, funk, soul, hip-hop, and dance, and remains as influential as ever.",https://yt3.ggpht.com/aqNdAvqqq69k4af_gfPdyw-UrP-K0sgXYpLPxpSLRA42bopt0iwUcMfdzYrsbaHZxWF5ld9cjA=s88-c-k-c0x00ffffff-no-rj,21888905651,https://www.youtube.com/channel/UCoUM-UJ7rirJYP8CQ0EIaHA,39000000,2024-11-01,UCoUM-UJ7rirJYP8CQ0EIaHA,ZZ
