Titulo,Numero_de_videos,Descricao,Imagem_de_perfil,Numero_de_visualizacoes,Link,Numero_de_inscritos,Data,Canal_ID,Pais_codigo
Netflix,7607,"time travel movies take place in 2003 nowNetflix is one of the world's leading entertainment services, with 283 million paid memberships in over 190 countries enjoying TV series, films and games across a wide variety of genres and languages. Members can play, pause and resume watching as much as they want, anytime, anywhere, and can change their plans at any time.",https://yt3.ggpht.com/c5D1xS3wEG2XDLhBaW_4VCJ081qcT5rxo7X3DO-0zabsBntw_D58KwiTXThWZaizcYNmpSMhRQ=s88-c-k-c0x00ffffff-no-rj,8932434409,https://www.youtube.com/channel/UCWOA1ZGywLbqmigxE4Qlvuw,29100000,2024-11-01,UCWOA1ZGywLbqmigxE4Qlvuw,US
Os Donos da Bola,878,"Canal oficial do programa Os Donos da Bola, veiculado de segunda a sexta, na tela da Band.",https://yt3.ggpht.com/ytc/AIdro_nL367dr7u3kcGkl3EavjHmQTfhPONmZEPjaTfmac2M8r0=s88-c-k-c0x00ffffff-no-rj,64600955,https://www.youtube.com/channel/UCjlcZ5YIXlBTaob0BkS_gDg,2700000,2024-11-01,UCjlcZ5YIXlBTaob0BkS_gDg,BR
Bruno Formiga,697,Comercial: bruno.formiga@94.football,https://yt3.ggpht.com/8l4uW5zzGuUWCgxY93m1OFNZVEvPWjZUiUzCw4jqmAKBes99WRztW3EGDt2GX9hpnx4Bo-cq0j0=s88-c-k-c0x00ffffff-no-rj,40970568,https://www.youtube.com/channel/UCNFf1QdVK-73ZODRfpFwubg,393000,2024-11-01,UCNFf1QdVK-73ZODRfpFwubg,BR
rezendeevil,12343,Contato Comercial: Rezende@adragencia.com.brInstagram: rezendeTwitter: @rezende_evilSnapchat: Imrezende,https://yt3.ggpht.com/TX93DoEJrvJi10f8WrPOej9VS0YrMUmuRt_tzT6Kj5A3qBvFx6iOspfirq42jXDUo6cmRcVQ-A=s88-c-k-c0x00ffffff-no-rj,13669234838,https://www.youtube.com/channel/UCbTVTephX30ZhQF5zwFppBg,33800000,2024-11-01,UCbTVTephX30ZhQF5zwFppBg,BR
Henrique Buttler,1000,"Olá, pessoal. Tudo bem com vocês?Meu nome é Henrique Buttler! Neste canal compartilho com vocês minha vida no interior de São Paulo!Sejam muito bem-vindas e bem-vindos e não se esqueçam de se inscrever no canal e ativar as notificações para não perder os vídeos novos!📩 canalhenriquebuttler@gmail.com",https://yt3.ggpht.com/ytc/AIdro_mcwBJz07QPboIufwCDJm69WlZQ_TJppQqiN-EPIQsn3hk=s88-c-k-c0x00ffffff-no-rj,71504007,https://www.youtube.com/channel/UC5KuuqNAH_darWlQg1fuJtw,467000,2024-11-01,UC5KuuqNAH_darWlQg1fuJtw,BR
Enaldinho,4592,"Falaaa, galera! Beleza??  Preparem-se para uma explosão de diversão toda semana no meu canal do YouTube! Pegadinhas, desafios e vlogs - tudo para garantir muitas risadas! Se inscreva já para não perder nenhum momento dessa aventura!",https://yt3.ggpht.com/ytc/AIdro_nuUiBgezNCkwsLB0lPoKEjHqLVuv9FGgAdFB9BQAqrYOM=s88-c-k-c0x00ffffff-no-rj,17581008884,https://www.youtube.com/channel/UC2bYhAHyaqfWlPXWBVk4BcA,39400000,2024-11-01,UC2bYhAHyaqfWlPXWBVk4BcA,BR
Power Couple Gaming,495,"Nosso canal está atualmente focando em Brawl Stars, o que consideramos o melhor jogo da Supercell... mas somos um canal de jogos em geral, portanto outras coisas podem vir!Em geral, nossos nomes nos jogos são Craudiu e Cristina!",https://yt3.ggpht.com/B3D-7sO5_7MIbhF73W-qrvFv8eND3MmY8c6ESn1TjEHOJPDjS9F8mv1ZY2sTRGAbVMc9_82OHA=s88-c-k-c0x00ffffff-no-rj,38221176,https://www.youtube.com/channel/UCodlsUaW3LIJ8FJa3Bg9P8Q,210000,2024-11-01,UCodlsUaW3LIJ8FJa3Bg9P8Q,CA
Rafa & Luiz,3809,"Aqui no nosso canal vocês vão encontrar vídeos legais, engraçados e super divertidos! Vocês fazem parte dessa aventura, então inscrevam-se já e não fiquem fora dessa !INSCREVAM-SE!   CONSULTAS EMPRESARIAS: comercial@rafaeluiz.com.br",https://yt3.ggpht.com/csgBd2Yk74cB4i6Zpi5JXSPoZmKd_bcA9ThWmwNcM6IzynYtlW-ZET8CLTW3Y8ITssmzZ86K=s88-c-k-c0x00ffffff-no-rj,10046215740,https://www.youtube.com/channel/UC6paX0kLA8D81aYogceMufw,27800000,2024-11-01,UC6paX0kLA8D81aYogceMufw,BR
Adeline Camargo,1490,"Oi, pessoal! Sejam todos bem-vindos ao nosso canal! Aqui, você encontrará uma variedade de conteúdos, com o objetivo de proporcionar entretenimento para pessoas de todas as idades e compartilhar nossa vida aqui nos Estados Unidos. Ao clicar no botão 'inscrever-se', você fará parte da nossa jornada. Então, mais uma vez, muito obrigado por estar conosco 🙏🏻. Vamos crescer juntos!Adeline Camargo, All Rights ReservedEste canal é apenas para fins de entretenimento. Não somos especialistas e não estamos fazendo recomendações. Compartilhamos nossas opiniões e o que funciona para nós, Sempre consulte especialistas e faça sua própria pesquisa. Aproveite, mas questione, explore mais e tome suas próprias decisões.",https://yt3.ggpht.com/XuFCzY4BuZXV5odOez1hcnRWG27XC_cf_tQByHeQDS0Lul2yPv79UPaHd2SugreLz_37Y_6k=s88-c-k-c0x00ffffff-no-rj,306980885,https://www.youtube.com/channel/UCXQe9ldCtjN_RP1V_c9hNUw,946000,2024-11-01,UCXQe9ldCtjN_RP1V_c9hNUw,ZZ
Mc Paiva ZS,22,Canal oficial do artista MC Paiva@lovefunkprodutora,https://yt3.ggpht.com/PIvfKp9LPFDo--B3EiWD4HRIn5PyQbv9ZskMGcSahglWY2N_D-1-26bZHfyio-xLxVZ1FcA6=s88-c-k-c0x00ffffff-no-rj,321773101,https://www.youtube.com/channel/UCXR-SD44lM9HtfWGYm77Ztw,449000,2024-11-01,UCXR-SD44lM9HtfWGYm77Ztw,BR
Chico Garcia,3715,"Análises, leituras e divagações sobre o mundo esportivo, mas essencialmente o futebol. Twitter, Instagram e TikTok: @chicogarciaa.Seja membro do canal!",https://yt3.ggpht.com/7yLxyT7_F2YbIx41iibm3uwUxPXg6ydQjf77S-DvLWq0ZfikUs-MopQOZKycFRzB6zLOOU7suw=s88-c-k-c0x00ffffff-no-rj,205245872,https://www.youtube.com/channel/UC9nH0tJpMtChvJOqpMA9AHA,1050000,2024-11-01,UC9nH0tJpMtChvJOqpMA9AHA,BR
Jazzghost,5921,Jogo uns jogos e passo vergonha. CONTATO: comercial@agenciacurta.com,https://yt3.ggpht.com/_QWLAwBwKXViiV5aOQBIpipDrh7iMhrpv7EMbqIL4kfVealfeXJ7CY49Uma1VeqVnkYUucW4r8Q=s88-c-k-c0x00ffffff-no-rj,7854907737,https://www.youtube.com/channel/UCIXguhHCl8eDTkXpEuiGPUA,18000000,2024-11-01,UCIXguhHCl8eDTkXpEuiGPUA,ZZ
Canal GB,355,"Bem amigos do Canal GB! Este é o novo canal de entretenimento e esportes do Galvão Bueno. Fiquem ligados na nossa programação pois vem muita novidade por aí. Haja conteúdo, amigos!",https://yt3.ggpht.com/MqopK6zWz3EZ9rG2kBsPoJHgW0clvPldcaReWTiR_tePoy8Zc_ACxT_gAgV4zNqjXEfaVSqM=s88-c-k-c0x00ffffff-no-rj,56625911,https://www.youtube.com/channel/UCm1_S0MCQYO9EWukQoAcRFA,1050000,2024-11-01,UCm1_S0MCQYO9EWukQoAcRFA,BR
Fred Caldeira,308,"Repórter da TNT Sports desde 2011, correspondente em Manchester, na Inglaterra, desde 2016. Inscrições, likes, elogios, críticas e xingamentos brandos são bem-vindos.",https://yt3.ggpht.com/2NCRq_QmrED2DcgZHzuuj7XXNLcpp-nCrrFnSMhJmO9kimm6eKFb_N1YNFqYw2Ng0vJ743NESQ=s88-c-k-c0x00ffffff-no-rj,20604247,https://www.youtube.com/channel/UCMLMnpzB7f06mq0Kx3oFzew,214000,2024-11-01,UCMLMnpzB7f06mq0Kx3oFzew,GB
A24,711,"The studio behind MOONLIGHT, LADY BIRD, EX MACHINA, THE WITCH, EIGHTH GRADE, HEREDITARY, UNCUT GEMS, MINARI, THE GREEN KNIGHT, EVERYTHING EVERYWHERE ALL AT ONCE & more.",https://yt3.ggpht.com/ytc/AIdro_kA7-mt-6SgSSbhnjLQX7_qzvAle93pz26h5GQ9t7iyrpg=s88-c-k-c0x00ffffff-no-rj,1207062529,https://www.youtube.com/channel/UCuPivVjnfNo4mb3Oog_frZg,1350000,2024-11-01,UCuPivVjnfNo4mb3Oog_frZg,US
"Tyler, The Creator - Topic",322,,https://yt3.ggpht.com/-1Bt8eufq601KzmA0Rk1yrIzz372UDDeBkIpWytlztkcAyh1w6g2bNfXVnR6hadnezvUCq0XICA=s88-c-k-c0x00ffffff-no-rj,1374082659,https://www.youtube.com/channel/UCo1DYcm1IZ9v3UPkpiAcgtg,91100,2024-11-01,UCo1DYcm1IZ9v3UPkpiAcgtg,ZZ
ge,17992,"Bem-vindos ao nosso canal 🙌🙌O ESPORTE DA GLOBO ta muito on aqui no Youtube! 💥Aqui, vocês vão encontrar os melhores conteúdos de esporte com a qualidade que só a Globo tem.- melhores momentos do Campeonato Brasileiro ⚽- destaques dos principais eventos que só o sportv transmite ⚽🏐🏀- o melhor da programação dos canais de esporte da Globo 📺Além, é claro, de games, lives, vídeos com conteúdos originais e muita resenha!Todo dia, muuuuitos vídeos pra vocês maratonarem à vontade ⚽🍿DIVIRTAM-SE! ",https://yt3.ggpht.com/XHCE1FH6F1fBdRQjaf4Q08y4_GpdyiLU1vEFG20H2rs4sdRP00O-c6M8EBTJbwn01cHQ1lFR=s88-c-k-c0x00ffffff-no-rj,3220496871,https://www.youtube.com/channel/UCgCKagVhzGnZcuP9bSMgMCg,5390000,2024-11-01,UCgCKagVhzGnZcuP9bSMgMCg,BR
ESPN Brasil,39336,"Seja bem-vindo ao canal de esportes da Disney no Brasil.Aqui você encontra o melhor das principais competições do mundo: CONMEBOL Libertadores e CONMEBOL Sudamericana, Premier League, LALIGA, Campeonato Italiano, Copa do Nordeste, NFL, NBA, MotoGP, Grand Slams de tênis e muito mais!Além disso, aproveite as opiniões e análises da melhor referência de jornalismo esportivo do país e muito conteúdo original com o nosso pesado time de talentos!Para acompanhar todos os eventos esportivos assista à ESPN no Disney+: http://dis.la/ESPNenDisneyPlus_YT_BR#ESPN #DisneyPlus",https://yt3.ggpht.com/ytc/AIdro_ma030CksbiH0ueLUATKsGGEmZkmIdjFcS_uiI49Mton8Jz=s88-c-k-c0x00ffffff-no-rj,4333073400,https://www.youtube.com/channel/UCw5-xj3AKqEizC7MvHaIPqA,6480000,2024-11-01,UCw5-xj3AKqEizC7MvHaIPqA,BR
De Placa,6748,"O melhor do futebol brasileiro e internacional, do jeito que você gosta! Lives diárias do De Placa e conteúdos exclusivos pros inscritos do canal do melhor programa de debate sobre futebol do Youtube!Canal oficial da TNT Sports.",https://yt3.ggpht.com/ytc/AIdro_k5y-2C_ip8GIZnvEP98HjpkT5NMdosjR6U9mYYFEaqNEw=s88-c-k-c0x00ffffff-no-rj,330589806,https://www.youtube.com/channel/UCdkhkda5VQPbKSzx03HohMw,1060000,2024-11-01,UCdkhkda5VQPbKSzx03HohMw,US
Ordem Paranormal,28,Canal oficial Ordem Paranormal®,https://yt3.ggpht.com/S9QQVaWuZYOg94GXiPeVaiebPhPd8H9FqHY2quEPb254VfD8BdbELbE5i6n-z--v2ofQVya0=s88-c-k-c0x00ffffff-no-rj,31753859,https://www.youtube.com/channel/UCMRaVyexv18FrJu3NiYsbgQ,444000,2024-11-01,UCMRaVyexv18FrJu3NiYsbgQ,BR
ge,17992,"Bem-vindos ao nosso canal 🙌🙌O ESPORTE DA GLOBO ta muito on aqui no Youtube! 💥Aqui, vocês vão encontrar os melhores conteúdos de esporte com a qualidade que só a Globo tem.- melhores momentos do Campeonato Brasileiro ⚽- destaques dos principais eventos que só o sportv transmite ⚽🏐🏀- o melhor da programação dos canais de esporte da Globo 📺Além, é claro, de games, lives, vídeos com conteúdos originais e muita resenha!Todo dia, muuuuitos vídeos pra vocês maratonarem à vontade ⚽🍿DIVIRTAM-SE! ",https://yt3.ggpht.com/XHCE1FH6F1fBdRQjaf4Q08y4_GpdyiLU1vEFG20H2rs4sdRP00O-c6M8EBTJbwn01cHQ1lFR=s88-c-k-c0x00ffffff-no-rj,3220496871,https://www.youtube.com/channel/UCgCKagVhzGnZcuP9bSMgMCg,5390000,2024-11-01,UCgCKagVhzGnZcuP9bSMgMCg,BR
Mundo Sem Fim,829,"Olá! Somos Renan, Michele e Mucuvinha, um casal e um macaquinho de pelúcia que estão viajando pelo mundo! Saímos do Brasil no final de 2015, e nossa viagem não tem planos de acabar. Acompanhe por aqui nossa jornada pelos países mais pitorescos do mundo!",https://yt3.ggpht.com/ytc/AIdro_mXUrgXNpmk9zNkZfjgLO7HeF7J-MFwTihaV2EJd9IKTYA=s88-c-k-c0x00ffffff-no-rj,395590127,https://www.youtube.com/channel/UCOJNw9aHGRkYuIOqwU7yK-Q,1690000,2024-11-01,UCOJNw9aHGRkYuIOqwU7yK-Q,BR
IZALICK ,162,FILHA DO VELHO MAIS BONITO DO BRASIL ,https://yt3.ggpht.com/BE0_jGT21r5O4PhGSqNDIrZuVQab-cI9lmLv1odhtdtKJW0uThxaP-UaFabkIv537qLEURadpA=s88-c-k-c0x00ffffff-no-rj,17911841,https://www.youtube.com/channel/UC8bOVwDs_i7Be8Zxi_phtVA,112000,2024-11-01,UC8bOVwDs_i7Be8Zxi_phtVA,BR
Bandai Namco Entertainment,9688,バンダイナムコエンターテインメント　公式YouTubeチャンネルThis is the official site in YouTube of the Bandai Namco Entertainment Inc.=====※2022年4月よりコーポレートブランド変更に伴い「876TV」は「Bandai Namco Entertainment」へ名称が変更されました。=====,https://yt3.ggpht.com/tRyXJNKry6h_jWQOp-LEdw1hVJQDCVzyXLIlEGjfjg9U1woUwSkOjnlTjDzen_n_QPWn7tlbzA=s88-c-k-c0x00ffffff-no-rj,977288091,https://www.youtube.com/channel/UCqly9F4Fr_jf2Y1Cy5hacRg,1800000,2024-11-01,UCqly9F4Fr_jf2Y1Cy5hacRg,JP
Sabadou com Virginia,556,"O seu Sabadou nunca mais será o mesmo ✨O Sabadou com Virginia é um programa de entretenimento que combina entrevistas, muita interação e brincadeiras com a plateia, proporcionando um final de noite mais leve e cheio de diversão.No ar aos sábados, a partir das 22h15 (de Brasília), a atração traz a maior influencer do Brasil comandando seu primeiro programa de televisão. Virginia recebe semanalmente convidados das mais diversas áreas para um encontro repleto de games, musicais, boas histórias e muita interação com a plateia e o público de casa.Siga nossas redes sociais:Instagram: https://www.instagram.com/sbtsabadoucomvirginia?igsh=MXg2YWoxa2I4OGh3Mg%3D%3DTikTok: https://www.tiktok.com/@sabadoucomvirginiasbt?_t=8kmxH6BrWUv&_r=1Facebook: https://www.facebook.com/sabadoucomvirginiaSITE: https://www.sbt.com.br/programas/variedades/sabadou-com-virginia#fique-por-dentro#SabadouComVirginia",https://yt3.ggpht.com/efX5k7oZ7bBJ9k9IlFtyEQ762ZteMy6VD-E_G0muhztZJFRiQ9viZYFT84LbhC1iLm7PKIP3UA=s88-c-k-c0x00ffffff-no-rj,190191389,https://www.youtube.com/channel/UCzjghS2JZWK0SNSvhL1Ztyg,585000,2024-11-01,UCzjghS2JZWK0SNSvhL1Ztyg,BR
Netflix Brasil,5760,"Aqui você encontra trailers fresquinhos, novidades, recomendações e muuuuuuito mais. ✨Se inscreve aí para não perder nada!",https://yt3.ggpht.com/r4m9_f2nH87wTf1yoBFvwRe5pjE_lJIaKCZUkdgOq8MokC5dnpM6WbcJ4i5RQlBuBcsoRJB0cA=s88-c-k-c0x00ffffff-no-rj,1927675208,https://www.youtube.com/channel/UCc1l5mTmAv2GC_PXrBpqyKQ,12600000,2024-11-01,UCc1l5mTmAv2GC_PXrBpqyKQ,BR
Porta dos Fundos,2723,"Porta dos Fundos é um coletivo criativo fundado em 2012 por Antonio Tabet, Fábio Porchat, Gregorio Duvivier, João Vicente de Castro e Ian SBF. O que começou despretensiosamente, com um grupo de amigos em busca de liberdade criativa, hoje é uma produtora consolidada, referência em entretenimento multiplataforma, atuando em séries, filmes, branded content, estabelecendo parcerias com empresas, canais de TV e plataformas de streaming, e vencedora do Emmy Internacional de Comédia em 2019, pelo Especial de Natal feito para a Netflix.É um dos maiores canais do YouTube Brasil, ultrapassando 7 bilhões de visualizações e 18 milhões de inscritos. Em abril de 2019, chegou ao México com o canal Backdoor - Humor por donde no lo esperas, já com 4,7 milhões de inscritos.Assista também aos esquetes exclusivos no Mercado Play, no site ou app do Mercado Livre: https://bit.ly/portanomercadoplayCONTATO: contato@portadosfundos.comCOMERCIAL: comercial@portadosfundos.com",https://yt3.ggpht.com/vPDI93oKZrpEF-5i2Q5n6UTW-DyQuCMtmtgHoZMTvDn-Xem-2mMad-ZSxBWkHOj_9Wp9i4c9=s88-c-k-c0x00ffffff-no-rj,8335697498,https://www.youtube.com/channel/UCEWHPFNilsT0IfQfutVzsag,18200000,2024-11-01,UCEWHPFNilsT0IfQfutVzsag,BR
Nintendo of America,6595,"Welcome to the official Nintendo YouTube channel where you'll find all the latest videos, news and content from Nintendo including the Nintendo Switch family of systems.For customer support, please visit https://en-americas-support.nintendo.com/",https://yt3.ggpht.com/R0U0EvZCB10kisxpg2xK-1c0oVHMXWtJo-DWZKofufsf0q1yQXHAcSjcETab1GGnWKN7xrUBUQ=s88-c-k-c0x00ffffff-no-rj,3601628654,https://www.youtube.com/channel/UCGIY_O-8vW4rfX98KlMkvRg,9620000,2024-11-01,UCGIY_O-8vW4rfX98KlMkvRg,US
ESPN Brasil,39336,"Seja bem-vindo ao canal de esportes da Disney no Brasil.Aqui você encontra o melhor das principais competições do mundo: CONMEBOL Libertadores e CONMEBOL Sudamericana, Premier League, LALIGA, Campeonato Italiano, Copa do Nordeste, NFL, NBA, MotoGP, Grand Slams de tênis e muito mais!Além disso, aproveite as opiniões e análises da melhor referência de jornalismo esportivo do país e muito conteúdo original com o nosso pesado time de talentos!Para acompanhar todos os eventos esportivos assista à ESPN no Disney+: http://dis.la/ESPNenDisneyPlus_YT_BR#ESPN #DisneyPlus",https://yt3.ggpht.com/ytc/AIdro_ma030CksbiH0ueLUATKsGGEmZkmIdjFcS_uiI49Mton8Jz=s88-c-k-c0x00ffffff-no-rj,4333073400,https://www.youtube.com/channel/UCw5-xj3AKqEizC7MvHaIPqA,6480000,2024-11-01,UCw5-xj3AKqEizC7MvHaIPqA,BR
"Tyler, The Creator - Topic",322,,https://yt3.ggpht.com/-1Bt8eufq601KzmA0Rk1yrIzz372UDDeBkIpWytlztkcAyh1w6g2bNfXVnR6hadnezvUCq0XICA=s88-c-k-c0x00ffffff-no-rj,1374082659,https://www.youtube.com/channel/UCo1DYcm1IZ9v3UPkpiAcgtg,91100,2024-11-01,UCo1DYcm1IZ9v3UPkpiAcgtg,ZZ
"Tyler, The Creator - Topic",322,,https://yt3.ggpht.com/-1Bt8eufq601KzmA0Rk1yrIzz372UDDeBkIpWytlztkcAyh1w6g2bNfXVnR6hadnezvUCq0XICA=s88-c-k-c0x00ffffff-no-rj,1374082659,https://www.youtube.com/channel/UCo1DYcm1IZ9v3UPkpiAcgtg,91100,2024-11-01,UCo1DYcm1IZ9v3UPkpiAcgtg,ZZ
Jazzghost,5921,Jogo uns jogos e passo vergonha. CONTATO: comercial@agenciacurta.com,https://yt3.ggpht.com/_QWLAwBwKXViiV5aOQBIpipDrh7iMhrpv7EMbqIL4kfVealfeXJ7CY49Uma1VeqVnkYUucW4r8Q=s88-c-k-c0x00ffffff-no-rj,7854907737,https://www.youtube.com/channel/UCIXguhHCl8eDTkXpEuiGPUA,18000000,2024-11-01,UCIXguhHCl8eDTkXpEuiGPUA,ZZ
Brawl Stars,246,Fast-paced 3v3 multiplayer and battle royale made for mobile! Play with friends or solo across a variety of game modes in under three minutes.,https://yt3.ggpht.com/FVJpJyrV85TDL2nyiFbnaBuZzuYX1thQywPXCvilPAuw7DmPjFoXphPgkCqekYNIfqFtqGrvCg=s88-c-k-c0x00ffffff-no-rj,2934011885,https://www.youtube.com/channel/UCooVYzDxdwTtGYAkcPmOgOw,20600000,2024-11-01,UCooVYzDxdwTtGYAkcPmOgOw,FI
MK MUSIC,6582,"Este é o canal oficial da gravadora MK Music. Aqui você fica por dentro de vídeos relacionados aos nossos artistas e seus lançamentos. Nosso conteúdo é atualizado diariamente, garantindo vídeos bastante diversificados como Clipes, Previews de lançamentos, VideoLetras de músicas exclusivas, eventos e apresentações ao vivo, Trailers de DVDs, além de Clipes #MemóriaMK: nossos arquivos desde 1986. Tudo isso bem separado em seções e playlists criadas especialmente para facilitar a sua vida.Aproveite e inscreva-se no nosso canal!    http://bit.ly/1vH0D1a ;)Obrigada pela sua visita!Acesse nosso site: www.mkmusic.com.br ",https://yt3.ggpht.com/M7ZULh9WhNuHwk-Iv4vWljG2r8zjvnGCvB5RtTuG81KUdzut_GF-rr8Vp9An2tPuzV9zkgk4=s88-c-k-c0x00ffffff-no-rj,11358523688,https://www.youtube.com/channel/UCbVwJCxsVbmaP1PFmbGQDeQ,17400000,2024-11-01,UCbVwJCxsVbmaP1PFmbGQDeQ,BR
FORMULA 1,7991,"The home of risk takers, late brakers and history makers! 💫NEXT UP - RACE 21 OF 24: BRAZIL 🇧🇷 01-03 NOVEMBER",https://yt3.ggpht.com/tyLW5LsJGwr4ViM30OeYbuLcu_MXfpRzP8y-X9_aKfTNJeMFHmnNbPyxxhaFDA9NRgwEu9mT-g=s88-c-k-c0x00ffffff-no-rj,7281161720,https://www.youtube.com/channel/UCB_qr75-ydFVKSF9Dmo6izg,11200000,2024-11-01,UCB_qr75-ydFVKSF9Dmo6izg,ZZ
FREITAS,817,Obrigado por assistir ❤️instagram: @freitaasp,https://yt3.ggpht.com/ytc/AIdro_knx5WsYetdy3arCn-9tnMwRbUsMPX2qWFMljO4iIkJFME=s88-c-k-c0x00ffffff-no-rj,404759290,https://www.youtube.com/channel/UCVse66mti9GN2SWF2eh_SCg,2740000,2024-11-01,UCVse66mti9GN2SWF2eh_SCg,BR
Matheus Fernandes - Topic,139,"Matheus Fernandes de Paiva é um cantor e compositor brasileiro. Oriundo do forró, costuma misturar elementos do sertanejo e trazer batidas eletrônicas em suas músicas",https://yt3.ggpht.com/wMWXzfCf7suYqgLTGl69SCKZwD_ZhQs6E7fq7PsmDWNH3p8CXVPw8HOs6KTNbUNWKht8H6t_RA=s88-c-k-c0x00ffffff-no-rj,209758351,https://www.youtube.com/channel/UCB_pe-Hc4LyOeFoV5q8ITQw,1790,2024-11-01,UCB_pe-Hc4LyOeFoV5q8ITQw,ZZ
JYP Entertainment,2231,"JYPnation Official YouTubeLEADER IN ENTERTAINMENTThere are values and goals that JYP Entertainment (JYP) has pursued. JYP prides itself with those values and strives to be an exemplary leader in the entertainment industry. With the lead of Park Jin Young as one of Asia’s most prominent producers in the entertainment industry, JYP has discovered and produced some of the most popular and successful K-Pop artists, such as god, Rain, Wonder Girls, 2PM, 2AM, miss A, GOT7, DAY6, TWICE, Stray Kids, ITZY, Xdinary Heroes and NMIXX.Also, we have introduced and led K-Pop’s dominance by expanding the activities of our artists to the global music industry through the network of our overseas subsidiaries, JYP Japan and JYP China. JYP not only focuses on ordinary business, like planning and creating music, finding and managing artists, conducting online, mobile and overseas business, but also strives to scout creative talents and develop them to be suitable for the entertainment industry.",https://yt3.ggpht.com/kcV7NQkBm-UvvzVTJvrg1Yf1eHSqi-DLXuZPt_ECa3cHEPefujS951Dxj6KUEQ5i9Z7_fyMUjw=s88-c-k-c0x00ffffff-no-rj,23497702233,https://www.youtube.com/channel/UCaO6TYtlC8U5ttz62hTrZgg,29800000,2024-11-01,UCaO6TYtlC8U5ttz62hTrZgg,ZZ
Mylon,540,,https://yt3.ggpht.com/ytc/AIdro_nRU8lK76jaBrhna3OJk9LJOG2wZKXMK21LynWksYTZ7g=s88-c-k-c0x00ffffff-no-rj,150814765,https://www.youtube.com/channel/UC46L3Cku3SplGDbIAliRssA,447000,2024-11-01,UC46L3Cku3SplGDbIAliRssA,BR
André Piunti,1564,"Canal de música sertaneja focado em entrevistas e bate-papos informais. Comandado pelo jornalista André Piunti.___André Piunti, 36 anos, é formado em jornalismo pela Facamp. Criou, em 2007, o blog Universo Sertanejo.De 2009 a 2014, manteve o blog no portal UOL.Estreou na Nativa FM em 2010, e na Paranaíba FM em 2018, onde segue até hoje dando notícias sobre o mercado da música sertaneja.Assinou o roteiro e foi responsável pelo conteúdo histórico do “Bem Sertanejo”, projeto apresentado por Michel Teló no Fantástico em 2014, 2017 e 2019.Em 2015, ao lado de Teló, lançou o livro “Bem Sertanejo”, com histórias registradas durante as gravações da primeira temporada da série.A partir de 2015, passou a fazer participações no programa “Encontro”, de Fátima Bernardes, para falar sobre música sertaneja. No início de 2020, apresentou a série “Fábrica de Talentos” no programa.Em 2016, 2017 e 2018 fez parte da equipe do “Festeja Brasil”, especial sertanejo de fim de ano da Globo.",https://yt3.ggpht.com/ytc/AIdro_kk4qTYFhG39K8tByfGARbvzIjsqqoXmutVbbMvwHs6UA=s88-c-k-c0x00ffffff-no-rj,153176485,https://www.youtube.com/channel/UCSu2Vzr9U_wll67scohy42w,568000,2024-11-01,UCSu2Vzr9U_wll67scohy42w,BR
Sport Club Internacional,3478,"Canal oficial do Colorado no YouTube! De torcedor pra torcedor, aqui você acompanha os bastidores do Clube, desafios com personalidades, a paixão da torcida, os segredos e curiosidades de colorados e coloradas que fazem parte da trajetória do Clube do Povo e muito mais! Inscreva-se no Canal do Inter!Tem mais Clube do Povo nas nossas redes sociais:socio.internacional.com.brfacebook.com/SCInternacionaltwitter.com/SCInternacionalinstagram.com/SCinternacionalEsse canal é uma produção e realização da equipe de Comunicação do Sport Club Internacional.",https://yt3.ggpht.com/ytc/AIdro_lqDgM1b0OOKybMFzUQxJkCoEhkf_w13HpWta9ji4qngIo=s88-c-k-c0x00ffffff-no-rj,53788496,https://www.youtube.com/channel/UC7hAvFDWwVajRqrI86KCoxA,412000,2024-11-01,UC7hAvFDWwVajRqrI86KCoxA,BR
Léo Foguete 🚀,20,Ouça agora o primeiro single da carreira do Léo Foguete com a participação de Kaká e Pedrinho.SHOWS - ACERTEI PRODUÇÕES :(85) 99982 -3582,https://yt3.ggpht.com/lyl8vhQ-bbudFwuiHFJ31qO3iJVO23-QVnM3X76RB5nPTL_m7GQaksnjQ9yXoXuUdnqP18xaLg=s88-c-k-c0x00ffffff-no-rj,22050465,https://www.youtube.com/channel/UC90eu9zXQkuE39brM_RZA0g,57400,2024-11-01,UC90eu9zXQkuE39brM_RZA0g,BR
JYP Entertainment,2231,"JYPnation Official YouTubeLEADER IN ENTERTAINMENTThere are values and goals that JYP Entertainment (JYP) has pursued. JYP prides itself with those values and strives to be an exemplary leader in the entertainment industry. With the lead of Park Jin Young as one of Asia’s most prominent producers in the entertainment industry, JYP has discovered and produced some of the most popular and successful K-Pop artists, such as god, Rain, Wonder Girls, 2PM, 2AM, miss A, GOT7, DAY6, TWICE, Stray Kids, ITZY, Xdinary Heroes and NMIXX.Also, we have introduced and led K-Pop’s dominance by expanding the activities of our artists to the global music industry through the network of our overseas subsidiaries, JYP Japan and JYP China. JYP not only focuses on ordinary business, like planning and creating music, finding and managing artists, conducting online, mobile and overseas business, but also strives to scout creative talents and develop them to be suitable for the entertainment industry.",https://yt3.ggpht.com/kcV7NQkBm-UvvzVTJvrg1Yf1eHSqi-DLXuZPt_ECa3cHEPefujS951Dxj6KUEQ5i9Z7_fyMUjw=s88-c-k-c0x00ffffff-no-rj,23497702233,https://www.youtube.com/channel/UCaO6TYtlC8U5ttz62hTrZgg,29800000,2024-11-01,UCaO6TYtlC8U5ttz62hTrZgg,ZZ
Eda Atilla,70,,https://yt3.ggpht.com/leuRUInZdxcatLX-c0BBVAkwve4-Ey4-ncITnWx4K61-irQr1o74wyDmPotUKOfpXuWqJ2518A=s88-c-k-c0x00ffffff-no-rj,10501956,https://www.youtube.com/channel/UC9eqqiRqOShIza9WvVEtJow,258000,2024-11-01,UC9eqqiRqOShIza9WvVEtJow,BR
+Igu,413,"oi, eu sou o igu, toca aqui 🖐",https://yt3.ggpht.com/9ljheDptyIVPr8lAB8pImF1Gm8XFoy9VYMoZrelOCCc7KLp71siRq43-W5VOoKWfsoQCm3YhQg=s88-c-k-c0x00ffffff-no-rj,58991855,https://www.youtube.com/channel/UCrrK1Ek0XI0miBz9fFF_CnA,269000,2024-11-01,UCrrK1Ek0XI0miBz9fFF_CnA,ZZ
