Titulo,Numero_de_videos,Descricao,Imagem_de_perfil,Numero_de_visualizacoes,Link,Numero_de_inscritos,Data,Canal_ID,Pais_codigo
Jonny Devaney,154,CanadianDogs are cool,https://yt3.ggpht.com/k8PBIqECQRCUX8KEAcqRkpKxTzchHVFFVAJ2aoYAVvdDq5N3jHDmvRlDKqanYDZ3At20ZOdMSA=s88-c-k-c0x00ffffff-no-rj,1208894447,https://www.youtube.com/channel/UC1G9pwKwx9RpFwSohdkmhxA,2530000,2024-11-01,UC1G9pwKwx9RpFwSohdkmhxA,US
Star Wars,2089,"Welcome to the official Star Wars YouTube channel -- home to a galaxy of Star Wars videos including trailers, behind-the-scenes featurettes, and original series. Enjoy breaking news, in-depth looks into your favorite Star Wars content, and insights into legendary Star Wars characters.At Lucasfilm, we are committed to bringing great stories, characters, and experiences to fans around the world.  We strive to foster an inclusive, diverse, respectful, and safe environment for all fans. We ask the same of our fan communities. As such, we reserve the right to take action including but not limited to hiding, deleting, blocking, and reporting any posts on this account or page. Please also be aware that Lucasfilm & The Walt Disney Company do not accept or consider unsolicited idea submissions.",https://yt3.ggpht.com/1-DNvHqrqXCIrMMfHDu1kWUUM4mkOSBERS_9gj_W7r3ZNVnCzK9UW11hlka-ezUceQHSOIK73ps=s88-c-k-c0x00ffffff-no-rj,1548707188,https://www.youtube.com/channel/UCZGYJFUizSax-yElQaFDp5Q,4110000,2024-11-01,UCZGYJFUizSax-yElQaFDp5Q,US
Netflix,7607,"time travel movies take place in 2003 nowNetflix is one of the world's leading entertainment services, with 283 million paid memberships in over 190 countries enjoying TV series, films and games across a wide variety of genres and languages. Members can play, pause and resume watching as much as they want, anytime, anywhere, and can change their plans at any time.",https://yt3.ggpht.com/c5D1xS3wEG2XDLhBaW_4VCJ081qcT5rxo7X3DO-0zabsBntw_D58KwiTXThWZaizcYNmpSMhRQ=s88-c-k-c0x00ffffff-no-rj,8932434409,https://www.youtube.com/channel/UCWOA1ZGywLbqmigxE4Qlvuw,29100000,2024-11-01,UCWOA1ZGywLbqmigxE4Qlvuw,US
Mariah Carey,149,"Welcome to Mariah Carey's official YouTube channel!MARIAH CAREY is the best-selling female artist of all time with more than 200 million albums sold to date and 19 Billboard Hot 100 #1 singles (18 self-penned), more than any solo artist in history. Mariah is a singer/songwriter/producer recognized with multiple Grammy Awards, numerous American Music Awards, Billboard's 'Artist of the Decade' Award, the World Music Award for 'World's Best Selling Female Artist of the Millennium' and BMI's 'Icon Award' for her outstanding achievements in songwriting, to name a few – with her distinct five-octave vocal range, prolific songwriting, and producing talent, Mariah is truly the template of the modern pop performance. Mariah's ongoing impact has transcended the music industry to leave an indelible imprint upon the world at large.",https://yt3.ggpht.com/mkX_M8twWnQRIA8y5GLkGghbHqn59Cvefqs_RrCmICwmHaKgqok_LT2POUv5W9IHVqsRl8eDrg=s88-c-k-c0x00ffffff-no-rj,9188318968,https://www.youtube.com/channel/UCurpiDXSkcUbgdMwHNZkrCg,11200000,2024-11-01,UCurpiDXSkcUbgdMwHNZkrCg,US
Law&Crime Trials,2066,"Law & Crime is the leading multi-platform network that covers live court video, high-profile criminal trials, crazy crime, celebrity justice, and smart legal analysis. Created by TV’s top legal commentator and attorney, Dan Abrams, Law & Crime brings common sense written and video analysis to the often confusing and always intriguing world of the law. The network's team of journalists and lawyers provide real-time news updates along with live courtroom coverage of the most fascinating trials and legal stories. Watch the courtroom drama unfold live by tuning in at 9am ET each morning M-F. Watch Law&Crime Network NOW on YouTubeTV: https://tv.youtube.com/welcome/?utm_servlet=prod&zipcode=99202Watch Law&Crime on over 50 different video platforms: https://lawandcrime.com/where-to-watch/READ MORE GREAT ARTICLES FROM LAW&CRIME NETWORK HERE:https://lawandcrime.comA Dan Abrams Production. ",https://yt3.ggpht.com/xDgx60D7U0jnpVtgJefdbCFsjROcZfu1lwTO2v2I0RcIrJt1ZE_w1bQZcRhCJZOcM-TR6a7nQw=s88-c-k-c0x00ffffff-no-rj,176684056,https://www.youtube.com/channel/UCXCLaaClAWQiTkl3pw9ZdLw,546000,2024-11-01,UCXCLaaClAWQiTkl3pw9ZdLw,US
Law&Crime Trials,2066,"Law & Crime is the leading multi-platform network that covers live court video, high-profile criminal trials, crazy crime, celebrity justice, and smart legal analysis. Created by TV’s top legal commentator and attorney, Dan Abrams, Law & Crime brings common sense written and video analysis to the often confusing and always intriguing world of the law. The network's team of journalists and lawyers provide real-time news updates along with live courtroom coverage of the most fascinating trials and legal stories. Watch the courtroom drama unfold live by tuning in at 9am ET each morning M-F. Watch Law&Crime Network NOW on YouTubeTV: https://tv.youtube.com/welcome/?utm_servlet=prod&zipcode=99202Watch Law&Crime on over 50 different video platforms: https://lawandcrime.com/where-to-watch/READ MORE GREAT ARTICLES FROM LAW&CRIME NETWORK HERE:https://lawandcrime.comA Dan Abrams Production. ",https://yt3.ggpht.com/xDgx60D7U0jnpVtgJefdbCFsjROcZfu1lwTO2v2I0RcIrJt1ZE_w1bQZcRhCJZOcM-TR6a7nQw=s88-c-k-c0x00ffffff-no-rj,176684056,https://www.youtube.com/channel/UCXCLaaClAWQiTkl3pw9ZdLw,546000,2024-11-01,UCXCLaaClAWQiTkl3pw9ZdLw,US
BABYMONSTER,332,BABYMONSTER Official YouTube Channel베이비몬스터 공식 유튜브 채널입니다.,https://yt3.ggpht.com/79MZT_n38ZBWrEUjhxwjOGVqsTtBLJBmUEojOvTNNcZguBuoxvZtQse-A-D0Kt6GamsYVPCnqQ=s88-c-k-c0x00ffffff-no-rj,2785108912,https://www.youtube.com/channel/UCqwUnggBBct-AY2lAdI88jQ,7200000,2024-11-01,UCqwUnggBBct-AY2lAdI88jQ,KR
LIL UZI VERT,230,Connect with Lil Uzi Vert:https://twitter.com/LILUZIVERThttps://www.instagram.com/liluzivert/https://www.facebook.com/LilUziVert/https://soundcloud.com/liluzivert,https://yt3.ggpht.com/BYugujIZ_6_S3C0zm0LwLzSvt-07_ziNoI3njep5-CXPsFZL02-dTR5SJJa3cjLvi6eNXKdNwg0=s88-c-k-c0x00ffffff-no-rj,5168439853,https://www.youtube.com/channel/UCqwxMqUcL-XC3D9-fTP93Mg,9810000,2024-11-01,UCqwxMqUcL-XC3D9-fTP93Mg,ZZ
Tito Double P,45,Double P Records,https://yt3.ggpht.com/pZm-8i-9KGkgr2rjE2LeH_sA1S2XcHUd9WytlRzgpQgwuju7ADKXb4JlVE6XVl1DvBDyfEeiRw=s88-c-k-c0x00ffffff-no-rj,747973447,https://www.youtube.com/channel/UCj1EfO3tUyVxOPnWlyKCBBQ,611000,2024-11-01,UCj1EfO3tUyVxOPnWlyKCBBQ,MX
MLB,296963,,https://yt3.ggpht.com/ytc/AIdro_m7Zarb7n7bd4-NiuFBupJiuYleRAvPl3O7I3fnbkaCC_Lo=s88-c-k-c0x00ffffff-no-rj,5807521762,https://www.youtube.com/channel/UCoLrcjPV5PbUrUyXq5mjc_A,5870000,2024-11-01,UCoLrcjPV5PbUrUyXq5mjc_A,ZZ
NakeyJakey,127,:)jaquan the jequelhttps://www.youtube.com/@JaquantheJequel,https://yt3.ggpht.com/76PVNK8rPwgXTGtOVMVzdAUXaziEa1Igzx86wEAw9rtK0x1zzeIRlgnRKZH7ezfXWfUVGcuFeA=s88-c-k-c0x00ffffff-no-rj,215720247,https://www.youtube.com/channel/UCSdma21fnJzgmPodhC9SJ3g,2060000,2024-11-01,UCSdma21fnJzgmPodhC9SJ3g,US
FUERZA REGIDA,219,OFFICIAL CHANNEL FOR FUERZA REGIDA!,https://yt3.ggpht.com/moyow-qOJYC4UaI4ft1BxEa3W2ul1uO0RZBqB00JWAjJUHGqFVn2DrtLslWwVvCEXAmnEQl4Wg=s88-c-k-c0x00ffffff-no-rj,5928816201,https://www.youtube.com/channel/UCFLI6KAjrKRtydD7KqiYvAw,4300000,2024-11-01,UCFLI6KAjrKRtydD7KqiYvAw,US
PM7,278,Subscribe for shiny luck! ✨,https://yt3.ggpht.com/OP9Fpse3sZsuePiVKdW3UdqRy3Pc346-akUFFNe2-3ITyWkGntlxjWjX6j9JWWwpnTWBpGt2jA=s88-c-k-c0x00ffffff-no-rj,253374633,https://www.youtube.com/channel/UCLc_ZQgQ8h2XKUAQpqcvIdw,1030000,2024-11-01,UCLc_ZQgQ8h2XKUAQpqcvIdw,US
First We Feast,1857,"HOT ONESFor every question that they field from host Sean Evans, guests must join him in eating a progressively spicy chicken wing.HEAT EATERSIn this ultimate spicy food adventure, chef Esther Choi hits the streets to eat her way through the world's spiciest cuisines, and gain a deeper appreciation for the chili pepper.TACOS CON TODOStand-up comedian Jesus Trejo interviews the world’s funniest comedians while searching for the best tacos in SoCal.PIZZA WARSNicole Russell will go head-to-head with the city’s most respected chefs and Internet personalities, competing in a new pizza-themed competition weekly.THE BURGER SHOWThe Burger Show explores modern burger culture through the eyes of chef Alvin Cailan.BURGER SCHOLAR SESSIONSBurger Scholar George Motz gives a master class on regional burger styles, teaching viewers essential techniques and burger history.SNACKEDCelebrities break down their favorite snacks that are near and dear to their hearts.",https://yt3.ggpht.com/oC78s2u8x6ibq7S2nbnPVgTBo9Wg-ihCcqCgMnD6gPpBenG_UkT-LvhitSiX-1yYX2y1TVuY=s88-c-k-c0x00ffffff-no-rj,4146815421,https://www.youtube.com/channel/UCPD_bxCRGpmmeQcbe2kpPaA,14100000,2024-11-01,UCPD_bxCRGpmmeQcbe2kpPaA,ZZ
Laufey,369,"“As a musician, my goal is to bring jazz and classical music to my generation,” declares GRAMMY-winning composer, singer, producer, and multi-instrumentalist Laufey. In 2022, the Icelandic-Chinese artist’s trailblazing approach paid off, with a performance on Jimmy Kimmel LIVE! in support of her debut album Everything I Know About Love, sold out tours of North America, Asia, and Australia, and she was the most streamed jazz artist on Spotify.The Los Angeles-based Laufey (pronounced lāy-vāy) continued her story by writing and recording Bewitched, her second album. Inspired by jazz greats and classical masters while possessing a point of view that could only be conveyed by a 21st-century twentysomething, Bewitched represents an expansion of Laufey’s sonic palette. The album has gone on to break the record as the biggest debut for a jazz album on Spotify in history and earned a 2024 GRAMMY win for Best Traditional Pop Vocal Album.",https://yt3.ggpht.com/nJ0tuU2C0bEwE6hZOQNXm0RTithc3HREG-zMSXLl0oEqQvTiA9AyK0Sxa1CTnjGuuaHWw4OyBg=s88-c-k-c0x00ffffff-no-rj,443802186,https://www.youtube.com/channel/UChpKl3waLmccNeYH9LGYjUQ,1860000,2024-11-01,UChpKl3waLmccNeYH9LGYjUQ,US
That Track Channel,872,"That Track Channel is here to cover all things racing!  I'm a driver and I compete in Time Attack events and have a ton of driving experience. I placed 1st 3 years in a row (2018, 2019, 2020) with our local group, The Winnipeg Sports Car Club. I was awarded Soloist of the Year in 2020 by the Western Canada Motorsports Association and was driver of the year in 2021 with the Winnipeg Sports Car Club. Hit that subscribe button and follow along as I explore some race tracks and find out how well the ZL1 1LE (my current car) does compared to others",https://yt3.ggpht.com/erx9jttmKhytB0mXwxRzL7fizpizPB_fyhLuzJyQIKntiYxg9j87ff2HJKKrtuoABBeMHc85zzc=s88-c-k-c0x00ffffff-no-rj,7431177,https://www.youtube.com/channel/UCIWB3DlhYMzxj1LT-OlqeWw,32100,2024-11-01,UCIWB3DlhYMzxj1LT-OlqeWw,ZZ
Ice Cream Sandwich,50,"resident comics boy.DISCLAIMER: Ice Cream Sandwich content is inappropriate for children under 13 years old. For children over 13 years old, parental discretion is advised. Content may contain drug references, sexual references, adult language, and other adult/offensive situations. Content may also contain audio, visual, or written representations of people, events, and subjects protected by some cultures and governments. Content may trigger epileptic seizures, post-traumatic stress disorder, and other medical conditions for some viewers. Ice Cream Sandwich does not control the comments produced by third-party users. By watching, reading, or otherwise consuming Ice Cream Sandwich content, you agree that (1) you are over the age of 13 years, (2) you agree to abide by Youtube's Terms of Service, and (3) you accept all risks by viewing this content.",https://yt3.ggpht.com/ytc/AIdro_nfaehZCNR35m9QPE3-s4pB9Aww7U3mWG_zlYeeymlu3T4=s88-c-k-c0x00ffffff-no-rj,294715209,https://www.youtube.com/channel/UCOsATJw-IZgqGT8MFrHjKGg,3250000,2024-11-01,UCOsATJw-IZgqGT8MFrHjKGg,US
IShowSpeed,1480,Thank God👏🏽🙏🏽,https://yt3.ggpht.com/_Mj_eHbehGaSOe8yi57I_b99kagnBcFNuWvgtM64eqqmZZ4jLRzhvCAkfakuZL-QswRXM3xNew=s88-c-k-c0x00ffffff-no-rj,3218439967,https://www.youtube.com/channel/UCWsDFcIhY2DBi3GB5uykGXA,32800000,2024-11-01,UCWsDFcIhY2DBi3GB5uykGXA,US
Sr Pelo,200,"Hi! I am Pelo, hope you enjoy the ride",https://yt3.ggpht.com/Br1cB1hxuSGUfSi2HGZ7O8wYdRBeu1RuNVnoMEoaUGUaQYyvQ1AcGo1x8nK3biZ8xTfSrC9U=s88-c-k-c0x00ffffff-no-rj,1634467234,https://www.youtube.com/channel/UCt-GOpCw4dOBlIyqL9A1ztA,7000000,2024-11-01,UCt-GOpCw4dOBlIyqL9A1ztA,MX
EYstreem,1977,"When waves rise, You still them.🌊 (Psalm 89:9)Hey! Do you love Minecraft and Gaming content? Then Subscribe to jump on the EYwave and ride with me in my next video! I can't wait to see you there 😜Owned and operated by Spawnpoint Media.https://spawnpointmedia.com/",https://yt3.ggpht.com/u8YI5o1jCT3jz1I1gMLPJ1HYJGxRwZOOjiw2lU3DUhHpWMpvZ9Z3IUefGM5fusebUbolCKjs=s88-c-k-c0x00ffffff-no-rj,4108137029,https://www.youtube.com/channel/UC-g_O9HWb5B0rVDG1hLd5Hw,11000000,2024-11-01,UC-g_O9HWb5B0rVDG1hLd5Hw,AU
Jorge Rivera-Herrans,608,"EPIC: The Vengeance Saga 🔱🩸releasing October 31, 2024The story so far👇🏼🥹",https://yt3.ggpht.com/5uhfH0CmDFvz6yzk03K12egMNrNDRZOnpelVCumJZhzkrRDWpmoGVx5iWa9pMEM4Agw2alRDHA=s88-c-k-c0x00ffffff-no-rj,220625620,https://www.youtube.com/channel/UCvayv7u6HrpENlleXekJ2fg,563000,2024-11-01,UCvayv7u6HrpENlleXekJ2fg,ZZ
Scott The Woz,281,"Hey all, Scott here.Scott The Woz is a comedic video game centric variety show that focuses on reviews, editorials, retrospectives and much more. New episodes are uploaded 2-4 times each month.Other original content, mainly comedic shorts, can be found here as well. New originals are uploaded sporadically.Scott The Woz Logo/Banner by Nico Vliek (@WhaddupNico)",https://yt3.ggpht.com/ytc/AIdro_mIkb4KUR9VjGmN_yrh0YcXZGiCAz-u8ghugXJIqA5CyYY=s88-c-k-c0x00ffffff-no-rj,725573733,https://www.youtube.com/channel/UC4rqhyiTs7XyuODcECvuiiQ,1940000,2024-11-01,UC4rqhyiTs7XyuODcECvuiiQ,US
MandaloreGaming,130,King of Limbo. Video games.,https://yt3.ggpht.com/ytc/AIdro_l4ZWNonbEMgPnnBCHa-Vs5nKKI3dmH6_VbASuDAy_fozU=s88-c-k-c0x00ffffff-no-rj,232848959,https://www.youtube.com/channel/UClOGLGPOqlAiLmOvXW5lKbw,902000,2024-11-01,UClOGLGPOqlAiLmOvXW5lKbw,US
OfficialGDRAGON,4,G-DRAGON Official YouTube ChannelG-DRAGON 공식 유튜브 채널입니다.,https://yt3.ggpht.com/EB3Z5-_HrnYoSMfhg714oVbLsib8f71RYukIym3LsIOg6TP0uVg53NYDKlYAWgzmAUmXux9NJQ=s88-c-k-c0x00ffffff-no-rj,347828157,https://www.youtube.com/channel/UCeU5qTuBiqTU5z-hyL6WITQ,2810000,2024-11-01,UCeU5qTuBiqTU5z-hyL6WITQ,ZZ
FINAL FANTASY XIV,1038,"ESRB Rating: TEEN with Violence, Blood, Sexual Themes, Partial Nudity, Language, Use of Alcohol and Violence. FINAL FANTASY XIV CHANNELは株式会社スクウェア・エニックスのYouTube内 公式サイトです。The FINAL FANTASY XIV CHANNEL is the official YouTube site for Square Enix Co., Ltd.",https://yt3.ggpht.com/ytc/AIdro_nEr_fywDWlgvfip_bJ7fpYemGSjBk8mabvB61GPdB11A=s88-c-k-c0x00ffffff-no-rj,296722948,https://www.youtube.com/channel/UCpx2BZg8ABgaDV50sGJtWAg,700000,2024-11-01,UCpx2BZg8ABgaDV50sGJtWAg,JP
Overly Sarcastic Productions,723,"Sarcastic, yet informative, summaries of classic and not-so-classic literature and mythology, as well as major historical events!This channel is intended for use by high school students and up. Our videos frequently cover subjects of violence, assault, murder, and the books your english teachers make you read for high school. Also we cuss sometimes. Treat us as a TV-14 show and don't show us to your kids.For information on sponsorships, art commissions, fanmail, topic suggestions, and more, please refer to our FAQ, where you can also find our EMAIL, for business enquiries. OverlySarcasticProductions.com/faq-contactWant to hear more from us?Check us out at OverlySarcasticProductions.com, Twitter.com/OSPyoutube, and Patreon.com/OSPWanna buy our merch? Here's our store!https://overlysarcastic.shop/",https://yt3.ggpht.com/ytc/AIdro_n_Uclnl7m2dCrddbBBmymj0JfkPvE3ERNS6GIPfD-_DO8=s88-c-k-c0x00ffffff-no-rj,750338626,https://www.youtube.com/channel/UCodbH5mUeF-m_BsNueRDjcw,2360000,2024-11-01,UCodbH5mUeF-m_BsNueRDjcw,US
ChrisMD,518,Doing this YouTube thing. Don't have a real job.,https://yt3.ggpht.com/ytc/AIdro_msYPdtIQKOne2NG97vBBQfKETFLZj2vgzZmo0Q9YpkhtY=s88-c-k-c0x00ffffff-no-rj,1601832527,https://www.youtube.com/channel/UCQ-YJstgVdAiCT52TiBWDbg,6120000,2024-11-01,UCQ-YJstgVdAiCT52TiBWDbg,GB
Les Do Makeup,402,Hi babygirls!! Welcome to my youtube channel where I upload a little bit of everything about my life! OH i also love cake decorating :)❤️ LOVE YOU GUYS THANK YOU FOR THE CONTINUOUS SUPPORT!!! ❤️❤️watch me live on facebook! LES DO MAKEUP ❤️❤️INSTAGRAM @lesdomakeupTWITTER @lexxxlieee Business inquires only: lesdomakeup@revel-mgmt.com,https://yt3.ggpht.com/YYMBRCuN1slgIuLDbhLJ2ywQWGV4JdLlYmBQE_2nrSa3Wtsm_hCMEDtZBJYwduSpYTyzt4hN030=s88-c-k-c0x00ffffff-no-rj,221206588,https://www.youtube.com/channel/UCDSJCBYqL7VQrlXfhr1RtwA,1270000,2024-11-01,UCDSJCBYqL7VQrlXfhr1RtwA,US
NFL,43365,"The official YouTube page of the NFL.Subscribe to the NFL YouTube channel to see immediate in-game highlights from your favorite teams and players, daily fantasy football updates, all your favorite NFL podcasts, and more!",https://yt3.ggpht.com/kDUg480xOHHjIEnvADRDAz8w9MapJEx-3UJjJQzfeg4O-SrAGHTOSpd5Tm5QtJi0RlSfafMxQg=s88-c-k-c0x00ffffff-no-rj,10881444009,https://www.youtube.com/channel/UCDVYQ4Zhbm3S2dlz7P1GBDg,13400000,2024-11-01,UCDVYQ4Zhbm3S2dlz7P1GBDg,ZZ
ElAlfaElJefeTV,201,"Emanuel Herrera Batista (nacido el 18 DE Diciembre de 1990 en Haina, Santo Domingo), mejor conocido como “El Alfa” es un artista urbano dominicano, denominado por el público como “El más influyente artista de dembow de todos los tiempos”.Se dio a conocer con éxitos como “Coche Bomba”, “Muevete Jevi” y “Tarzan”, en otros.Tiene en su haber más de 100 millones de visitas en Youtube, siendo este el artista más visto de su género en la plataforma digital de videos más grande del internet.Además de intérprete es un gran innovador de los sonidos musical del dembow, ya que se mete en lleno en cada una de las producciones musicales en la que participa.Se ha presentado en grandes escenarios, entre ellos Madison Square Garden invitado por la famosa emisora “La Mega NYC”.MANAGEMENT: @EuryMatos @dherrera175",https://yt3.ggpht.com/UEtIkeyRgBRn47iwI1f2o2ly3NZ6sTFNUnLvWi1UvmUn0XQJl6NnXZNMnPYjTFKLBxNkiWqs=s88-c-k-c0x00ffffff-no-rj,5644460369,https://www.youtube.com/channel/UCEU5ZK7DwN9ppqPFJiGah3A,10300000,2024-11-01,UCEU5ZK7DwN9ppqPFJiGah3A,DO
theneedledrop,4586,"Hi, everyone! Anthony Fantano here! Basically, this channel is passionately dedicated to reviewing music. If you choose to subscribe, you can expect to see daily reviews on the latest in rock, pop, electronic, metal, hip hop, and experimental music. We're not always going to agree, but that's OK. I still love you.If you want to suggest an album or song for review, leave a comment on my latest video.Team (2016 - Present)Jeremy: Lead EditsAnthony: Final CutsAusten: Proofing, Publishing",https://yt3.ggpht.com/ytc/AIdro_mzMXQAq-Dhs5h5XiM-050_NwMqBdP63kpTVCAnA2DXnls=s88-c-k-c0x00ffffff-no-rj,1070446261,https://www.youtube.com/channel/UCt7fwAhXDy3oNFTAzF2o8Pw,2930000,2024-11-01,UCt7fwAhXDy3oNFTAzF2o8Pw,ZZ
Settled,232,I do things on runescape (the old one)Business: settled@clovertalent.gg,https://yt3.ggpht.com/S7ARL3kyzMxPumtRq6FDuNhJNLsobEn5noBLqjhk1q_y2asPXuOGwhLiTzrWDf3PfIjRzyZ4ILQ=s88-c-k-c0x00ffffff-no-rj,126595055,https://www.youtube.com/channel/UCs-w7E2HZWwXmjt9RTvBB_A,721000,2024-11-01,UCs-w7E2HZWwXmjt9RTvBB_A,US
TheWeekndVEVO,205,"The Weeknd on Vevo - Official Music Videos, Live Performances, Interviews and more...",https://yt3.ggpht.com/E9LfgUnjdf7A_d8_9iqVvai4HSwIvrE6NE6yKXOIQjHNXzWdWg5NNU7-a1flZGspflBmYXKtxw=s88-c-k-c0x00ffffff-no-rj,20207560776,https://www.youtube.com/channel/UCF_fDSgPpBQuh1MsUTgIARQ,10400000,2024-11-01,UCF_fDSgPpBQuh1MsUTgIARQ,CA
All Elite Wrestling,7612,"About AEWFounded by CEO, GM and Head of Creative Tony Khan in 2019, AEW is offering an alternative to mainstream wrestling, with a roster of world-class talent that is injecting new spirit, freshness and energy into the industry.  “AEW: Dynamite” airs every Wednesday from 8-10 p.m. ET on TBS and attracts the youngest wrestling audience on television.  The fight-forward “AEW: Rampage” airs every Friday from 10-11 p.m. ET on TNT, and “AEW: Collision” airs every Saturday from 8-10 p.m. ET on TNT.  AEW’s multi-platform content also includes “Being the Elite,” a weekly behind-the-scenes YouTube series, and “AEW Unrestricted,” a weekly podcast seriesFor more info, check out X.com/AEW; Instagram.com/AEW; YouTube.com/AEW; Facebook.com/AEW; tiktok.com/@aew",https://yt3.ggpht.com/8fQ5mFx3EqQg4tZ3Bxuy_rTXaFk0abKSnPTmvwHS7aS2ok_6Eo4MDxExzjj6_WrZKW-8FVQoGzE=s88-c-k-c0x00ffffff-no-rj,2374123668,https://www.youtube.com/channel/UCFN4JkGP_bVhAdBsoV9xftA,4250000,2024-11-01,UCFN4JkGP_bVhAdBsoV9xftA,US
Jorge Rivera-Herrans - Topic,39,,https://yt3.ggpht.com/5uhfH0CmDFvz6yzk03K12egMNrNDRZOnpelVCumJZhzkrRDWpmoGVx5iWa9pMEM4Agw2alRDHA=s88-c-k-c0x00ffffff-no-rj,128366775,https://www.youtube.com/channel/UCZtjRzC4fFimZ2Y-nhn8Cig,45400,2024-11-01,UCZtjRzC4fFimZ2Y-nhn8Cig,ZZ
NRL - National Rugby League,9158,"The Official YouTube Channel of the National Rugby League.  Every week will feature exclusive interviews, highlights, and the greatest moments that the NRL has ever produced!Subscribe and hit that notification bell to know when new videos are available here.Follow us on social @nrl and visit NRL.com for all the latest news and updates!",https://yt3.ggpht.com/Pui0xFjDp_F-x0UK5Rkfh1tGkwZLy7fkU4Pr44Zht3DJcMwWXLnxoVIGSRS5Pr7SVxgES0-ouA=s88-c-k-c0x00ffffff-no-rj,358122790,https://www.youtube.com/channel/UC33-OkQ6VCYk8xtml8Pk4-g,451000,2024-11-01,UC33-OkQ6VCYk8xtml8Pk4-g,AU
LIL UZI VERT,230,Connect with Lil Uzi Vert:https://twitter.com/LILUZIVERThttps://www.instagram.com/liluzivert/https://www.facebook.com/LilUziVert/https://soundcloud.com/liluzivert,https://yt3.ggpht.com/BYugujIZ_6_S3C0zm0LwLzSvt-07_ziNoI3njep5-CXPsFZL02-dTR5SJJa3cjLvi6eNXKdNwg0=s88-c-k-c0x00ffffff-no-rj,5168439853,https://www.youtube.com/channel/UCqwxMqUcL-XC3D9-fTP93Mg,9810000,2024-11-01,UCqwxMqUcL-XC3D9-fTP93Mg,ZZ
Hay Day,194,"Best. Farm. Ever. Welcome to Hay Day, the most popular farming game on mobiles and tablets, number one in 122 countries.Get Hay Day ►► https://link.haydaygame.com/Learn the lay of the land, tend to your crops, and trade goods with neighbors and friends. It’s a real special place where the crops never die even though it never rains. Sharing the farm with our quirky animals only makes things more fun!Hay Day is available for devices running iOS, Android and Kindle!Subscribe for more videos ►► https://supr.cl/SubHayDayFollow us on our Socials!Twitter ►► https://twitter.com/HayDay/Instagram ►► https://www.instagram.com/hayday Facebook ►► https://www.facebook.com/haydayofficialHay Day Discord Chat ►► https://discord.gg/F7BmubqHay Day Reddit ►► https://www.reddit.com/r/HayDay/",https://yt3.ggpht.com/3uuvLxttvZAZ7qZSWSa8jKQB1HZa7MKZnHgQTLAtvatZfAw_jKoWs52Uwi684l26qOEldDEE=s88-c-k-c0x00ffffff-no-rj,320577023,https://www.youtube.com/channel/UCBrMq7wkdPWb3PxR-GUR61A,2250000,2024-11-01,UCBrMq7wkdPWb3PxR-GUR61A,FI
LadyGagaVEVO,221,"Lady Gaga on Vevo - Official Music Videos, Live Performances, Interviews and more...",https://yt3.ggpht.com/yzOEXrp_77aevhp7br98XrNC0Gl3afLllOStYv91C5_MdGr-s2GtRdCzWVqN2psTN6xlBhidCw=s88-c-k-c0x00ffffff-no-rj,15177344343,https://www.youtube.com/channel/UC07Kxew-cMIaykMOkzqHtBQ,8890000,2024-11-01,UC07Kxew-cMIaykMOkzqHtBQ,US
Marvel Entertainment,9222,"Marvel is committed to bringing great stories, characters, and experiences to fans all over the world. We strive to foster an inclusive, diverse, respectful, and safe environment for all of our fans, and we ask the same of our fan communities. As such, we reserve the right to take action including but not limited to hiding, deleting, blocking, and reporting any posts on this account or page. Please also be aware that Marvel does not accept or consider unsolicited idea submissions.",https://yt3.ggpht.com/P_qIGe_-Jt5V4JT_UtIuURsq9RBRDIZ88tvFJx1AzACWzsuRIrrOfb6jDH2OnoukFdS06AN5nQ=s88-c-k-c0x00ffffff-no-rj,6254209227,https://www.youtube.com/channel/UCvC4D8onUfXzvjTOM-dBfEA,21000000,2024-11-01,UCvC4D8onUfXzvjTOM-dBfEA,US
Clash of Clans,953,The official YouTube channel for Clash of Clans. Develop your strategy. Build your defenses. Attack your enemies. Conquer. Did somebody say Hog Rider?,https://yt3.ggpht.com/sKnSDOlMiUodnrAS1mBy61M7WqvgplLAzlmAox29S_fw9r6f04VAH-GF7jO8x_PDAx0WkDKD=s88-c-k-c0x00ffffff-no-rj,4695764115,https://www.youtube.com/channel/UCD1Em4q90ZUK2R5HKesszJg,20900000,2024-11-01,UCD1Em4q90ZUK2R5HKesszJg,ZZ
Gomer Simpson ,152,Yapping about baseball,https://yt3.ggpht.com/RCNEKsBJPnom5pHKCWpadQfXHEnLp7iY_Z2ZPffvXJOoadGS2CR2IHLZOI7No1ujO2KW5iB4YQ=s88-c-k-c0x00ffffff-no-rj,5077648,https://www.youtube.com/channel/UCBjiLLFSINNtaQr_X4fRLrg,12600,2024-11-01,UCBjiLLFSINNtaQr_X4fRLrg,US
Bryson DeChambeau,142,I hit a little white ball around,https://yt3.ggpht.com/1WGPZFeoijy47yjztu2BkDRmYNE19Ny5y5WkQS_XUJzjlMBqu3mYFpBxqFbHAZkiyTosX99BKwU=s88-c-k-c0x00ffffff-no-rj,218506790,https://www.youtube.com/channel/UCCxF55adGXOscJ3L8qdKnrQ,1570000,2024-11-01,UCCxF55adGXOscJ3L8qdKnrQ,ZZ
