Titulo,Numero_de_videos,Descricao,Imagem_de_perfil,Numero_de_visualizacoes,Link,Numero_de_inscritos,Data,Canal_ID,Pais_codigo
Grian,769,"This channel focuses on gaming (specifically minecraft) content aimed at a general audience. I build minecraft houses and make minecraft house tutorials along with everything else minecraft. If you want to learn how to build minecraft houses, or like hermitcraft, check out my videos. If you want to learn how to build in minecraft this is the place for you!Safety Disclaimer: I never add viewers on any personal accounts, such as Discord. Please be wary who you add on Discord or other instant messaging programs! Also never comment your personal contact information such as Skype, discord or e-mail address on my videos. Please be safe online! If you think you have me added IT IS NOT ME. I don't use social media, but you can see my linked accounts for verification.",https://yt3.ggpht.com/ytc/AIdro_nyjQZU-LepEchkLUZAXz4gNeiF8F28SshYks_Fm-w_HdQ=s88-c-k-c0x00ffffff-no-rj,2528278233,https://www.youtube.com/channel/UCR9Gcq0CMm6YgTzsDxAxjOQ,8620000,2024-11-01,UCR9Gcq0CMm6YgTzsDxAxjOQ,GB
Mob Entertainment,157,Welcome to the official Mob Entertainment YouTube channel.Currently developing Poppy Playtime and Project Playtime,https://yt3.ggpht.com/3sNL6ThBhi6vYLGVBDeVT8DU5_Wuhl7IcQSwvUpA4IATW7T_weakNsLHMlwr3ZENWDQ_itgtSw=s88-c-k-c0x00ffffff-no-rj,530541878,https://www.youtube.com/channel/UCXqV4yoyC_mmZye6VbKFPeQ,3220000,2024-11-01,UCXqV4yoyC_mmZye6VbKFPeQ,ZZ
pierson,382,,https://yt3.ggpht.com/ytc/AIdro_nkR6VYEUapKd9zLMJpqAU9vQisvOXWMikH7tVFoAPYpxc=s88-c-k-c0x00ffffff-no-rj,1784842268,https://www.youtube.com/channel/UCVAbWl3d3XuHY28wU9DoDpA,5980000,2024-11-01,UCVAbWl3d3XuHY28wU9DoDpA,US
MrRoflWaffles,2149,"Hi Guys, MrRoflWaffles Here! Welcome to my No Nonsense channel :)",https://yt3.ggpht.com/ytc/AIdro_lE4gFIA0ZiwaWvsyVZq7np0OA5SJ94ia_WT3lbAVzF7T8=s88-c-k-c0x00ffffff-no-rj,553952378,https://www.youtube.com/channel/UCzH3H8sRfqH3rEVZcpTV2Cw,2080000,2024-11-01,UCzH3H8sRfqH3rEVZcpTV2Cw,GB
arcsystemworks,1325,YouTube　アークシステムワークス公式動画チャンネル“BLAZBLUE””GUILTY GEAR”他、アークシステムワークスの多彩なゲーム情報・映像をお届け！,https://yt3.ggpht.com/ytc/AIdro_ky1_mLT1xKsvA0s0dQ7_RFxC02CPySw2WasyMYHn98bn8=s88-c-k-c0x00ffffff-no-rj,117907558,https://www.youtube.com/channel/UClqUSY9SshvuFja6yNXp4nQ,259000,2024-11-01,UClqUSY9SshvuFja6yNXp4nQ,JP
Westen Champlin,180,My name's Westen. We make videos and have fun doing so.,https://yt3.ggpht.com/ytc/AIdro_kjgijMDl1XYxmGhRdULrQDLT7s3Z5TIamSXNjHAd97Uw=s88-c-k-c0x00ffffff-no-rj,359451820,https://www.youtube.com/channel/UChRlaISXbl2gECFAmDzxgzg,3650000,2024-11-01,UChRlaISXbl2gECFAmDzxgzg,US
Science Time,555,"Science Time for science enthusiasts. This channel is dedicated to people who are interested in the latest achievements in science and technology. We upload a new science video every Saturday, 12 pm (PDT). Our videos touch almost every aspect in the fields of science. Whether it's about space exploration, technological advancments in A.I or artificial intelligence, VR or virtual reality, AR or augmented reality, Extended Reality - XR,  Biology, the use of CRISPR, prime editing, gene editing, philosophical ideas, essentially everything you wanted to know about science, you will find it on our YouTube channel Science Time.Help us grow by sharing, liking & commenting on our science videos and consider subscribing & ringing the bell to be notified about new videos: https://www.youtube.com/sciencetime24",https://yt3.ggpht.com/ytc/AIdro_mN4DgluO3diwiJ_WZ38ebMpTSfD3l4zm49paq6adP3VdY=s88-c-k-c0x00ffffff-no-rj,124815051,https://www.youtube.com/channel/UCxoz4YfS4M3H3C57FD4jW4Q,836000,2024-11-01,UCxoz4YfS4M3H3C57FD4jW4Q,PT
FREESTYLEBENDER,302,Official Youtube Channel of Israel 'The Last Stylebender' Adesanya!,https://yt3.ggpht.com/72c-MNoC9lZWxkR4SkhGDfDqVZDip_TBxt0QHkjus4eattgGyU2PvTiAdzL4nM-cElSqm1aP=s88-c-k-c0x00ffffff-no-rj,147030465,https://www.youtube.com/channel/UC1oigGPZ4A6atKCnj17ow8Q,1150000,2024-11-01,UC1oigGPZ4A6atKCnj17ow8Q,NZ
CBS Sports Golazo,8124,"Home of Serie A, NWSL, Concacaf Men's and Women's Nations League and World Cup Qualifiers, Argentina’s Liga Profesional de Fútbol, Brazil’s Campeonato Brasileirão Série A and UEFA men’s club competitions including the Europa League, Europa Conference League and... 🎶 THE CHAAAMPIONSSS 🎶 Don't Miss the World's Game on Paramount Plus.",https://yt3.ggpht.com/EKBT19BrrkDkhoxOjenonvDxIf0s4wDljOnCzPos7z3qAbmwA_cgNCDY_a1i_K_3dhH1BWmknQ=s88-c-k-c0x00ffffff-no-rj,2316826813,https://www.youtube.com/channel/UCET00YnetHT7tOpu12v8jxg,2080000,2024-11-01,UCET00YnetHT7tOpu12v8jxg,US
MollyMae,204,,https://yt3.ggpht.com/Ap7jFLFZ3HTHPygFqhcRshtzSM27wIZxbhj60jRRMV4nzq7yM4hP4brPXyy2HpRtKX2sPW7l7m0=s88-c-k-c0x00ffffff-no-rj,217293936,https://www.youtube.com/channel/UC-F3kTU4V680v550AavEOsQ,1950000,2024-11-01,UC-F3kTU4V680v550AavEOsQ,ZZ
CBS Sunday Morning,7958,"CBS Sunday Morning, hosted by Jane Pauley, is the #1 Sunday morning news program, featuring stories on the arts, music, nature, entertainment, history, science, sports and Americana, and highlighting unique human accomplishments and achievements. Check local listings for CBS Sunday Morning broadcast times.For licensing inquiries, contact: licensing@veritone.com",https://yt3.ggpht.com/KTHUZNQzXip9LiJjaZU8tB_gQYRmggPDm0npT-vYQ9Fgo2zLaEIuh2u8t2MUxFSz6WkipXNa=s88-c-k-c0x00ffffff-no-rj,1021921346,https://www.youtube.com/channel/UCVT1tPkR-fUVlO652EcO3ow,1570000,2024-11-01,UCVT1tPkR-fUVlO652EcO3ow,ZZ
Serie A,29376,"Welcome to the Official Serie A channel. Over the season, we are going to produce and upload more than 5000 clips, updated everyday with Official Highlights, Magazine & Compilations (such as Best Saves, Numbers, Top 11, etc), Exclusive Interviews, Press Conferences and much more. If you are a football fan and you want to be part of our community don't forget to subscribe to Serie A channel.",https://yt3.ggpht.com/2bMmxx14op_NNRylFwN9dI4mDEWa6O6whg_e-KbDeQwpNvP9uzpp4WjJcJtryP8dos9l0Kcsnw=s88-c-k-c0x00ffffff-no-rj,4134918326,https://www.youtube.com/channel/UCBJeMCIeLQos7wacox4hmLQ,9580000,2024-11-01,UCBJeMCIeLQos7wacox4hmLQ,IT
League of Legends,1501,"Recently recognized as the most played video game in the world—100 million play every month—League of Legends® is a multiplayer online battle arena game (MOBA).Players choose a role from an expanding cast of powerful champions and join forces in strategic, fast-paced gameplay to take control of the enemy’s end of the battlefield.Sign up for a free League of Legends account at http://riot.com/signup",https://yt3.ggpht.com/olIZhSlrdVwqLu0Xte6d9yjTTKn256CEa1u36pXTKoioQ5c0rmOIV_MQRxybo5ekWzAbA4NV=s88-c-k-c0x00ffffff-no-rj,8245784920,https://www.youtube.com/channel/UC2t5bjwHdUX4vM2g8TRDq5g,15500000,2024-11-01,UC2t5bjwHdUX4vM2g8TRDq5g,US
TeeVee,355,"Turn on Notifications! 🔔Hi, I'm TeeVee! I'm here to play Minecraft with my friends Honeycomb, Gary, Bethany, Digi, and Slime Block! Subscribe to join our fun adventures! This channel is rated E for Everyone! 👍Videos are similar to Aphmau, Cash and Nico, Omz, Johnny Minecraft and Tyler and Snowi! 📺",https://yt3.ggpht.com/jIDRWGLJG3NXYI5hc5_9MUc6MOLOgowVAaoUu80kY9qYbmyUGecnEa30I8wEJVI2J81XKxRc=s88-c-k-c0x00ffffff-no-rj,65246259,https://www.youtube.com/channel/UCsdz4BjK_Eg7DfSgI3cDZHg,396000,2024-11-01,UCsdz4BjK_Eg7DfSgI3cDZHg,US
CrunchLabs,143,Welcoming ALL the future engineers and creators! Visit CrunchLabs.com,https://yt3.ggpht.com/iSCrQ7-Xlk4D4rswTTGj2KNqQeEYa4s3nyzPiKuw-yKMic6pkL-OQBmNlHX0D1liPeLOUgiIkA=s88-c-k-c0x00ffffff-no-rj,181199500,https://www.youtube.com/channel/UC513PdAP2-jWkJunTh5kXRw,1160000,2024-11-01,UC513PdAP2-jWkJunTh5kXRw,US
MrDalekJD,4486,"MrDalekJD - Subscribe today!Welcome to the best place for Call of Duty news & gameplays, specializing in Zombies & co-op modes. Also a zombie lover at heart for many other video games! :)🎮Business contact: business@mrdalekjd.com",https://yt3.ggpht.com/ytc/AIdro_mNs5wnDnZeJSG1-wSrzLHwld41cGetOfWT5r2FGRJuMFU=s88-c-k-c0x00ffffff-no-rj,1032108088,https://www.youtube.com/channel/UCMUP9j-QidC_S0KLlO06uCg,2760000,2024-11-01,UCMUP9j-QidC_S0KLlO06uCg,GB
Talkin' Yanks,2451,A podcast all about the New York Yankees presented by Jomboy Media,https://yt3.ggpht.com/ytc/AIdro_nJ1XY1_jemyUZmK4dgqZ0iSShuEZqRPq8b8nhiMcwglg=s88-c-k-c0x00ffffff-no-rj,35958598,https://www.youtube.com/channel/UCzcaZfAmCJlCSoBOiNWx20Q,98500,2024-11-01,UCzcaZfAmCJlCSoBOiNWx20Q,US
Got Talent Global,1533,"Got Talent is the show with NO age limit, NO talent restrictions and NO cultural boundaries. Since its launch in 2006, this award-winning ratings hit has been breaking audience records around the world. The Guinness World Record holder for Most Successful Reality Format has been made in 69 territories globally and continues to grow. With millions of TV viewers and even more social media fans, this phenomenal global success has dominated on all platforms for more than decade. Got Talent Global brings together the very best in worldwide talent, creating a central hub for fans of the show to keep up to date with sensational performances from around the world.",https://yt3.ggpht.com/ytc/AIdro_kU98CWFZF2KgEP-b3a9QsMZm8Qm8eTCKA5dT5Fq_IlRIw=s88-c-k-c0x00ffffff-no-rj,2711413058,https://www.youtube.com/channel/UCe_Fx4EZAgKjDz0aQ_Y7hSA,21000000,2024-11-01,UCe_Fx4EZAgKjDz0aQ_Y7hSA,ZZ
Magic The Noah,251,Subscribe If You Have A Face,https://yt3.ggpht.com/TXQ1-QpvgHVvC-FBJ3dqxPGl7p1w9dl_13_8d7HN9by-ptPhZdVhW8Dh66YksbwxRHD8DsB0Yw=s88-c-k-c0x00ffffff-no-rj,126678648,https://www.youtube.com/channel/UCYqsJbDDngvxb_rbHzHpYGA,1150000,2024-11-01,UCYqsJbDDngvxb_rbHzHpYGA,ZZ
Dustin Hadley,699,Hey I’m That 40 Year Guy! Glad ya stopped by! Over 9 million Followers across my social platforms! Hit that subscribe button and follow along too! I appreciate y’all! https://linktr.ee/that40yearguy,https://yt3.ggpht.com/k5b9B7aJfWsqTy_vvsxvMaSDGEOwK0NYVfSt38-W-FfZR6A5WiToUQ7zVdU5U3gb6tMR085nbQ=s88-c-k-c0x00ffffff-no-rj,419175622,https://www.youtube.com/channel/UCnu5cai036X0tzQBmX2s3AQ,721000,2024-11-01,UCnu5cai036X0tzQBmX2s3AQ,ZZ
The Rest Is Football,303,,https://yt3.ggpht.com/ZwnqATVBA2omNkig4vBiOM12-aPnSQAVtx_6e3IlFeQ8bA034KldhdXR2IHf6mIVJluwJWEu5sQ=s88-c-k-c0x00ffffff-no-rj,53592883,https://www.youtube.com/channel/UCkgsrOXWQNZRS_Cj8-_7sPw,318000,2024-11-01,UCkgsrOXWQNZRS_Cj8-_7sPw,GB
The Nursery Nurse,93,"take all your troubles and throw them away, at your favourite imaginary nursery. ",https://yt3.ggpht.com/Tw33SloohI-vocKo8Nsxw21D3T6P4gpCdegL0Hs4RdZms7yF7RfDdvsYk1gRJjreUjw8ke2YQ6M=s88-c-k-c0x00ffffff-no-rj,3021829,https://www.youtube.com/channel/UCaUeobrwnhpLJHqs92_JRGg,81300,2024-11-01,UCaUeobrwnhpLJHqs92_JRGg,GB
Polo G,80,The Official YouTube Channel for Polo GYk I’m bound to turn the summer up every time 1300x808🔥🔥🔥TORDNADO WEATHER🌪🌪🌪🌪🌪🌪🌪Email:pologbookings@gmail.comIG:polo.capalotFB:Polo CapalotSC:polo.buckz,https://yt3.ggpht.com/GUWZeIl72aHwM8_D-DwYvv1QrcsS99PoEOKSL2jOyzUcWivzc-OsPY-PAtTHhjr8MctYdcsMnw=s88-c-k-c0x00ffffff-no-rj,3877492230,https://www.youtube.com/channel/UC0ifXd2AVf1LMYbqwB5GH4g,6130000,2024-11-01,UC0ifXd2AVf1LMYbqwB5GH4g,US
LDShadowLady,1081,"Minecraft is love. Minecraft is life.Crazy Craft 3.0, Shadowcraft, Minecraft, Mini-games, Minecraft mods & Random indie games!http://ldshadowlady.com/I'm Let's Play Gamer called Lizzie!I love cats and anything cute :3P.S. Sorry I don't have an upload schedule! I try to post frequently but I've found that the best videos are made when I'm inspired and motivated. Trying to stick to a schedule drains away all the spontaneity and excitement from making videos. I still want to keep this as fun as possible for me so hopefully it's more fun for you to watch too!Channel Banner by: https://twitter.com/BlooSims",https://yt3.ggpht.com/ytc/AIdro_loVvz-5y3s38zJnTXR0E88D6zgprykC8f_4OfVoai2vgY=s88-c-k-c0x00ffffff-no-rj,3487000104,https://www.youtube.com/channel/UCzTlXb7ivVzuFlugVCv3Kvg,7240000,2024-11-01,UCzTlXb7ivVzuFlugVCv3Kvg,GB
Megan Thee Stallion,338,Houston's own real H-Town Hottie! Young Tina Snow. ‘MEGAN’ Is Out Now https://mts.lnk.to/megan,https://yt3.ggpht.com/Isb1-iaJsOcWZAvnC6vDwEV7Qz6dl0OEBoStzSTzK6_tkpaCQy-PuIUxKGP3mjTSlY3LnCIYs1w=s88-c-k-c0x00ffffff-no-rj,3185885743,https://www.youtube.com/channel/UCKrdjiuS66yXOdEZ_cOD_TA,6900000,2024-11-01,UCKrdjiuS66yXOdEZ_cOD_TA,US
The B3,193,"Building a LEGO city, with a story!My name is Josh, but you can call me The B3! I love creating houses for my LEGO minifigures to live in and creating an interconnected story along the way, all to the glory of my Creator and Savior. ✝️ Check out my new series building an entire LEGO City for the Series 25 Collectible Minifigures called “25-Ville” and stay tuned for more plastic interlocking brick shenanigans in the future!",https://yt3.ggpht.com/Eswai-jaG800YESzQG1GcJIK_Le5FJ2V5jSYlfa_ryadYTo7B5ry7EFN9eY3iy9xxr6fHJmPeg=s88-c-k-c0x00ffffff-no-rj,152077232,https://www.youtube.com/channel/UCJ2GvhrAJ2GQVPZ0auza4vw,728000,2024-11-01,UCJ2GvhrAJ2GQVPZ0auza4vw,US
Serie A,29376,"Welcome to the Official Serie A channel. Over the season, we are going to produce and upload more than 5000 clips, updated everyday with Official Highlights, Magazine & Compilations (such as Best Saves, Numbers, Top 11, etc), Exclusive Interviews, Press Conferences and much more. If you are a football fan and you want to be part of our community don't forget to subscribe to Serie A channel.",https://yt3.ggpht.com/2bMmxx14op_NNRylFwN9dI4mDEWa6O6whg_e-KbDeQwpNvP9uzpp4WjJcJtryP8dos9l0Kcsnw=s88-c-k-c0x00ffffff-no-rj,4134918326,https://www.youtube.com/channel/UCBJeMCIeLQos7wacox4hmLQ,9580000,2024-11-01,UCBJeMCIeLQos7wacox4hmLQ,IT
DAZN Boxing,6343,DAZN. The global home of boxing.Subscribe to our YouTube channel 👉  http://bit.ly/DAZNBoxingYouTubeDownload the DAZN app now 👉  http://DAZN.com/youtubeFollow DAZN Boxing On Social Media 👇Twitter: https://www.twitter.com/DAZNBoxingInstagram: https://www.instagram.com/DAZNBoxingFacebook: https://www.facebook.com/DAZN,https://yt3.ggpht.com/lR-8MjQOgWRoiOa_vmkHHAmsMHaZyeNLnc1TI3ypBX5oFIef2LCUoHH1uHhJdYRSgeFbFYr7jQ=s88-c-k-c0x00ffffff-no-rj,2013047498,https://www.youtube.com/channel/UCurvRE5fGcdUgCYWgh-BDsg,4450000,2024-11-01,UCurvRE5fGcdUgCYWgh-BDsg,US
Eyewitness News ABC7NY,27884,"Hi!   We're in New York City and hope you love us on YouTube as much as you do on television!FAQsQ:  Where can I send a news tip?A:  You can email us using the link below or give us a call at 917-260-7700.Q:  How can I connect with Bill Ritter?A:  He's on Facebook and Twitter along with the rest of the Eyewitness News team.Q:  How do I send you a photo or video of a news event?A:  Use the hashtag #abc7NY or http://photos.abc7ny.com/ to upload.Q:  Where can I watch Eyewitness News Live?A:   Channel 7 on your TV, our website (abc7ny.com) or by downloading our Eyewitness News app or the ABC app.Q:  Where in New York City are you located?A:  On the beautiful Upper West Side of New York City at 67th and Columbus Avenue.   We even have a streetside studio on the corner of 66th and Columbus so you can stand on the sidewalk and watch us, take selfies or dance.Q:  When did Eyewitness News debut?A:  In 1968 with Roger Grimsby.  Visit us at http://abc7ny.com/",https://yt3.ggpht.com/ytc/AIdro_k1_mRYQG-HAspwbSjYcshWT6yECtfxdmfmCfIchUZsWHB9=s88-c-k-c0x00ffffff-no-rj,2278660926,https://www.youtube.com/channel/UCrlIS7z20CnVaCrMvdkig_g,2460000,2024-11-01,UCrlIS7z20CnVaCrMvdkig_g,US
Quando Rondo,246,"Quando Rondo cements his legacy in ironclad bars and hazy hooks, building out a prolific body of work meant to last. The  platinum Savannah, GA rapper spits with classic dexterity as he spouts off modern melodies with emotional precision and a head-nodding bounce. Since 2017, he has consistently amplified the spirit of the streets throughout the mainstream on his own terms, translating the struggles of Savannah(and hoods everywhere)into a dynamic documentary-style sound. Along the way, he logged a couple of platinum singles with “ABG” and “I Remember” [feat. Lil Baby], and multiple  gold  singles—“Imperfect Flower,” “Scarred From Love,” and YoungBoy Never Broke Again’s “I Am Who They Say I Am” with Kevin Gates. In between a string of critically acclaimed mixtapes and sold out tour dates, he served up his 2020 full-length debut album, QPac, and bowed in the Top 25 of the BillboardTop 200. He continues to set his legacy in stone on the 2021 album Still Taking Risks and much more to come.",https://yt3.ggpht.com/RrDAPG0jjuSbZQOM4qsBctPDL4PTvMboO1DtRWWWP5twVWqcW5JpNZmxjORB54XY8lPzMlFpoQ=s88-c-k-c0x00ffffff-no-rj,1208148736,https://www.youtube.com/channel/UCLr1r2bBAwBPG3KJubtYyyg,2210000,2024-11-01,UCLr1r2bBAwBPG3KJubtYyyg,US
Maxedy,89,Epic animation channel 👌🥶⭐️ Creator of a new animating style (Live action + 2D art + 3D all in one)contact me: maxedyYT@gmail.com,https://yt3.ggpht.com/QNjIgVQNzSdOYFzTkKD3dPZTer3BvwLu42FDYa-NFD-ShKZQQfm5NmUeiF46YoIkcjKs0b68SeY=s88-c-k-c0x00ffffff-no-rj,344613451,https://www.youtube.com/channel/UCPEM1vZqAD7J7VO-7hAhcXg,1540000,2024-11-01,UCPEM1vZqAD7J7VO-7hAhcXg,US
Drew Gooden,158,i am the only person who makes videos,https://yt3.ggpht.com/ytc/AIdro_k6nOBtpDfkW6O9KBWiLn7LhKsXfOuo_ikV8Gyjf6l_QFo=s88-c-k-c0x00ffffff-no-rj,921874215,https://www.youtube.com/channel/UCTSRIY3GLFYIpkR2QwyeklA,4330000,2024-11-01,UCTSRIY3GLFYIpkR2QwyeklA,US
Evbo,150,The best professional minecraft videos on the internet,https://yt3.ggpht.com/ytc/AIdro_lDcbO5TgNyPHvIi4KRDaMhPbRGGStXv4MzYpGr1dPnEUo=s88-c-k-c0x00ffffff-no-rj,941760568,https://www.youtube.com/channel/UC1HL3TABt6QGd_P857BH_CA,2880000,2024-11-01,UC1HL3TABt6QGd_P857BH_CA,US
SummerWalkerVEVO,26,,https://yt3.ggpht.com/k8N51QdDYxAE25A8ZtD38NvcoojPG7QpEBJxcQtbC5lYto7rvECSF3vywXLcGmMxBT2JR1YpLw=s88-c-k-c0x00ffffff-no-rj,418871802,https://www.youtube.com/channel/UC4NBMVsQp6QvIjzUeaqX3ZA,48800,2024-11-01,UC4NBMVsQp6QvIjzUeaqX3ZA,ZZ
NBA,59787,"The 2024-25 NBA season continues Friday on ESPN! 🏀 7:00pm/et: Magic/Cavaliers 🏀 9:30pm/et: Nuggets/Timberwolves The NBA is the premier professional basketball league in the United States and Canada. The league is truly global, with games and programming in 215 countries and territories in 47 languages. The NBA consists of 30 teams. The NBA offers real time access to live regular season NBA games with a subscription to NBA LEAGUE PASS, available globally for TV, broadband, and mobile.  Real-time Stats, Scores, Highlights and more are available to fans on web and mobile with the NBA App. For news, stories, highlights and more, go to our official website at https://app.link.nba.com/e/NBA_site",https://yt3.ggpht.com/9rkIU1GppqML26EOeGgxHgO-ZZSMPNRe_PAiIirXRLR7UrNC0fLkaPLb_C24-9MA0KuQJLlB=s88-c-k-c0x00ffffff-no-rj,14530568836,https://www.youtube.com/channel/UCWJ2lWNubArHWmf3FIHbfcQ,22300000,2024-11-01,UCWJ2lWNubArHWmf3FIHbfcQ,US
ESPN College Football,11284,ESPN's official home for College Football,https://yt3.ggpht.com/HS5_CRjOOoLSdekU-7yV131AzBKT9C7YGrbpZrZuAseX3Kq4E8dcCyXM8HJm-tBdmGK6SDbQdw=s88-c-k-c0x00ffffff-no-rj,677975636,https://www.youtube.com/channel/UCzRWWsFjqHk1an4OnVPsl9g,927000,2024-11-01,UCzRWWsFjqHk1an4OnVPsl9g,US
Leah Kateb,3,HI GUYS! Let’s spend some more time together<3insta: leahkatebtiktok: leah.kateb,https://yt3.ggpht.com/Zbc3vUZmwZdgNmi8hnUj_R_oX5ZUQb39kkaB6H5p4iGBytEqdLIw3berHmaWrnIm1Gz1uCQA=s88-c-k-c0x00ffffff-no-rj,1114525,https://www.youtube.com/channel/UCqagxSZd0poU7LcVg3lTp0A,204000,2024-11-01,UCqagxSZd0poU7LcVg3lTp0A,ZZ
VIVINOS,49,vivinos@studiolico.com,https://yt3.ggpht.com/wxcTILsAW1bbpFsmxYd7MJRkUyhe8Drip5hCkjmLucD30OzVcCoTJ9avilOgDBP6NhBJkAc_=s88-c-k-c0x00ffffff-no-rj,195024840,https://www.youtube.com/channel/UCch9Dmg5Juwp8MZGvAmAp4Q,1530000,2024-11-01,UCch9Dmg5Juwp8MZGvAmAp4Q,ZZ
Donut,1604,"it's ok to like cars.Questions, comments? Do you have a racetrack we can film on? Reach out: (*we don't take video idea pitches, to avoid hurt feelings)info@donut.media",https://yt3.ggpht.com/_gFkGv3SysgBQqzCC-oznppMmPAQ6vhbppnvS8juDCiTvHVICJc_tOb5hYiuGXBeRhKNruyP1g=s88-c-k-c0x00ffffff-no-rj,2795249246,https://www.youtube.com/channel/UCL6JmiMXKoXS6bpP1D3bk8g,8860000,2024-11-01,UCL6JmiMXKoXS6bpP1D3bk8g,US
Moriah Elizabeth,485,"Hey it's ME (Moriah Elizabeth).FAQ'SWhat editing program do you use? Adobe Premiere Pro CCWhat camera do you film with? Canon EOS 5D Mark IVWhat ethnicity are you? My mom is white, my dad is peruvian/italianHow old are you? 27Did you make Create This Book? Yes! I wrote it, illustrated it and published it myself. It is sold on Amazon.com For business or promotional inquiries please contact Moriah@nightmedia.co____MAIL ME____For sending squishies, Letters, or general fan mail, please contact: FANMAIL@MORIAH.VIDEO to request my P.O. box address :)•FOR SERIOUS INQUIRIES ONLY PLEASE! Unfortunately I can only respond to a small amount of people each week. This is to make sure that I get a reasonable amount of mail and can feature the maximum amount on camera. I apologize in advance if you do not hear back from me. This email get SUPER clogged with thousands of messages. SORRY PEEPS!*",https://yt3.ggpht.com/06SZXUL0QLbL1jocuchPISrEsjo7sgS1jjR96Sgq-c01PVWW3fX9TQAC-kCBMfVbtI9UwGJWgg=s88-c-k-c0x00ffffff-no-rj,4107341564,https://www.youtube.com/channel/UCYAB7hh1ohA8-iX54EpMdeA,10200000,2024-11-01,UCYAB7hh1ohA8-iX54EpMdeA,ZZ
Jordan Matter,489,My daughter has taken over my channel!,https://yt3.ggpht.com/ytc/AIdro_nGAmMX7vEl0_6aZUzTitOEUI0ZikSwl38pmc-phT9dsgk=s88-c-k-c0x00ffffff-no-rj,9288849652,https://www.youtube.com/channel/UCKaCalz5N5ienIbfPzEbYuA,25900000,2024-11-01,UCKaCalz5N5ienIbfPzEbYuA,US
NPR Music,2589,"The official YouTube channel for NPR Music featuring Tiny Desk Concerts, live shows, documentaries and more.  Find more at www.npr.org/music",https://yt3.ggpht.com/0xQ36bByrRGcbiCG2a6Xb-pft78OAm0GW-5vRjC_uPGWD1mfAK8w7J-IjL4NbZGKbimh3QE1Zg=s88-c-k-c0x00ffffff-no-rj,3323797690,https://www.youtube.com/channel/UC4eYXhJI4-7wSWc8UNRwD4A,10100000,2024-11-01,UC4eYXhJI4-7wSWc8UNRwD4A,US
HYBE LABELS,2172,"Welcome to the official YouTube channel of HYBE, the content hub for BIGHIT MUSIC, BELIFT LAB, SOURCE MUSIC, PLEDIS Entertainment, KOZ ENTERTAINMENT, ADOR and more.",https://yt3.ggpht.com/ytc/AIdro_l8g0yRFG8xoe_qeqk8Ki9UFy36cB2IjZEWZWz0h7gl-t0=s88-c-k-c0x00ffffff-no-rj,36578093771,https://www.youtube.com/channel/UC3IZKseVpdzPSBaWxBxundA,75900000,2024-11-01,UC3IZKseVpdzPSBaWxBxundA,KR
Gucci Mane,526,Official Youtube channel of Atlantic Records recording artist and The New 1017 label founder Gucci Mane.,https://yt3.ggpht.com/rA78H-5Zuw7YEnKoNwWLI8xatjbA_GjwTyr1u2axE0LRESoafHIXdI5T_T9a17L287jaV2osvw=s88-c-k-c0x00ffffff-no-rj,4234543068,https://www.youtube.com/channel/UCSugZEYrWbzqIWGD195V-YA,5690000,2024-11-01,UCSugZEYrWbzqIWGD195V-YA,ZZ
Bright Sun Travels,25,"Quality, Honest Travel Reviews.Expect at least one new video each month on a range of experiences from Disney, unique hotels around the world and cruise ships!Bright Sun Films 2024",https://yt3.ggpht.com/QbBZui4eDf-ojag3DEZCYHbENFnHkWeZutv0vR8nIPjiEkRrNFeLifvNoyDmw6u0wrDqXVZOXA=s88-c-k-c0x00ffffff-no-rj,19770628,https://www.youtube.com/channel/UCHudN_9O_OD5KQIueahpYvg,191000,2024-11-01,UCHudN_9O_OD5KQIueahpYvg,CA
WWE,80018,"WWE on YouTube is your number one spot to catch WWE original shows and exclusives!Watch videos from all of your favorite WWE Superstars, backstage fallout from live shows including Raw, SmackDown, NXT and original shows such as Top 10, WWE Playlist, Superstar Playback and much more! Subscribe - https://goo.gl/2YO0IsStream WWE on Peacock https://pck.tv/2PIAQJI in the U.S. and on WWE Network http://wwe.yt/wwenetwork everywhere else.",https://yt3.ggpht.com/ytc/AIdro_kRzpOO6EOnWYXSBHEhJft2_uVXk2uIjCWVJSAlAOCUOdgc=s88-c-k-c0x00ffffff-no-rj,89157565087,https://www.youtube.com/channel/UCJ5v_MCY6GNUBTO8-D3XoAg,105000000,2024-11-01,UCJ5v_MCY6GNUBTO8-D3XoAg,ZZ
Lucy Edwards,1106,,https://yt3.ggpht.com/Oc6CjbrU6zNCoq5X1qlGfFnkM-uOiNkL91CQceC2yosMiKC1mCG5DcKyncvNsSHBNPslwCnOa0Y=s88-c-k-c0x00ffffff-no-rj,539963323,https://www.youtube.com/channel/UChhMknOcAZOQXC1rh0ler-Q,808000,2024-11-01,UChhMknOcAZOQXC1rh0ler-Q,GB
LadyGagaVEVO,221,"Lady Gaga on Vevo - Official Music Videos, Live Performances, Interviews and more...",https://yt3.ggpht.com/yzOEXrp_77aevhp7br98XrNC0Gl3afLllOStYv91C5_MdGr-s2GtRdCzWVqN2psTN6xlBhidCw=s88-c-k-c0x00ffffff-no-rj,15177344343,https://www.youtube.com/channel/UC07Kxew-cMIaykMOkzqHtBQ,8890000,2024-11-01,UC07Kxew-cMIaykMOkzqHtBQ,US
Diggy Graves,42,I like making music...So I figured I'd run with it and quit my day job. Just a lil something to make life easier so we all can go to sleep at night. *Warning*Viewer Discretion is Advised,https://yt3.ggpht.com/ytc/AIdro_luaRR7xEIar90hPfHLVIngWmZHmLByq2GjLK1X8tiOkg=s88-c-k-c0x00ffffff-no-rj,71157229,https://www.youtube.com/channel/UCrnvtdLN6AHgQ8SdFGLalfw,155000,2024-11-01,UCrnvtdLN6AHgQ8SdFGLalfw,ZZ
AddisonRaeVEVO,3,,https://yt3.ggpht.com/KjQpR7Zw5H5Ysu1xPtjZct5QSq_NxGhWzxEXLl4OPon4i_gUsQemkaSRtUdRDIypbfsY5nZXgQ=s88-c-k-c0x00ffffff-no-rj,11072091,https://www.youtube.com/channel/UC3Cs0kPcr0GQPCVzX32NQPg,309,2024-11-01,UC3Cs0kPcr0GQPCVzX32NQPg,ZZ
a bit more willne,460,business: enquiries@willne.com,https://yt3.ggpht.com/RxeCPiecjQcMEVJIrHQsT3ac9Euh40Wc-NJKNQEOruNrlRlBI-wSb7b5pHUFCZWZ7WaI7lg=s88-c-k-c0x00ffffff-no-rj,611818326,https://www.youtube.com/channel/UC5JYRErFekvgcd2Sb-s8-Tg,2320000,2024-11-01,UC5JYRErFekvgcd2Sb-s8-Tg,GB
Unspeakable,968,eat pizza for breakfast ,https://yt3.ggpht.com/ytc/AIdro_k1q4k6wBQhpttw6QOZv8KEtv90YoQfLThEWDPStcI9FvQ=s88-c-k-c0x00ffffff-no-rj,10857863756,https://www.youtube.com/channel/UCwIWAbIeu0xI0ReKWOcw3eg,18000000,2024-11-01,UCwIWAbIeu0xI0ReKWOcw3eg,US
