Titulo,Numero_de_videos,Descricao,Imagem_de_perfil,Numero_de_visualizacoes,Link,Numero_de_inscritos,Data,Canal_ID,Pais_codigo
WWE on USA,2638,"WWE on USA is the official destination for all of your favorite WWE Superstars from Raw, NXT 2.0, and SmackDown. Cody Rhodes, Seth Rollins, Edge, Becky Lynch, Bianca Belair, and others square off in the ring and behind the scenes. If it's WWE Raw, it must be Monday. Tune in to Raw every Monday at 8/7c on USA Network.  Don’t miss Roxanne Perez, Johnny Gargano, Cora Jade, Bron Breakker, and more on NXT 2.0 every Tuesday at 8/7c on USA Network. USA Network has been the home of WWE programming for decades. Watch live and full episodes on the free USA app: https://usa.app.link/gAjGYP9cIeb. Subscribe to USA Network: https://usanet.tv/2u3tOVH  Peacock is now the exclusive home of WWE Network. Stream now on Peacock: https://pck.tv/3s4aWyr WWE on USA is part of NBCUniversal, one of the world's leading media and entertainment companies. NBCUniversal is a subsidiary of Comcast Corporation.",https://yt3.ggpht.com/ytc/AIdro_km7dt79kGP3yc0F7vUFMv0UQ-Gl2Gx489SACilMfdmcg=s88-c-k-c0x00ffffff-no-rj,381568767,https://www.youtube.com/channel/UCSy3TvvwAV12MD0rLsHyClQ,617000,2024-11-01,UCSy3TvvwAV12MD0rLsHyClQ,ZZ
Jay Leno's Garage,1181,"A new video every Monday! Visit Jay Leno's Garage, the Emmy-winning series where Jay Leno gives car reviews, motorcycle reviews, compares cars, and shares his passion and expertise on anything that rolls, explodes, and makes noise. Classic cars, restomods, super cars like the McLaren P1, sports cars like Porsche 918 Spyder and Camaro Z28, cafe racers, vintage cars, and much, much more. Subscribe for more: http://bit.ly/JLGSubscribeEpisodes available for purchase. https://www.apple.com/itunes/",https://yt3.ggpht.com/L-WhYPgwjpImXksN6oKM1N6VjbcceEn08tzXJHubROOZXUJHE7s-1skGSi0spiWbAIADafp2=s88-c-k-c0x00ffffff-no-rj,980341620,https://www.youtube.com/channel/UCQMELFlXQL38KPm8kM-4Adg,3740000,2024-11-01,UCQMELFlXQL38KPm8kM-4Adg,US
TODAY,39647,"TODAY brings you the latest headlines and expert tips on parenting, food, home, style, and health and wellness.",https://yt3.ggpht.com/ytc/AIdro_lnggXxbPuQ-eqqJIyjT2pM0DBvtlHV0iBxtW0MWNzaqVnZ=s88-c-k-c0x00ffffff-no-rj,3602558389,https://www.youtube.com/channel/UChDKyKQ59fYz3JO2fl0Z6sg,4600000,2024-11-01,UChDKyKQ59fYz3JO2fl0Z6sg,ZZ
NFL,43365,"The official YouTube page of the NFL.Subscribe to the NFL YouTube channel to see immediate in-game highlights from your favorite teams and players, daily fantasy football updates, all your favorite NFL podcasts, and more!",https://yt3.ggpht.com/kDUg480xOHHjIEnvADRDAz8w9MapJEx-3UJjJQzfeg4O-SrAGHTOSpd5Tm5QtJi0RlSfafMxQg=s88-c-k-c0x00ffffff-no-rj,10881444009,https://www.youtube.com/channel/UCDVYQ4Zhbm3S2dlz7P1GBDg,13400000,2024-11-01,UCDVYQ4Zhbm3S2dlz7P1GBDg,ZZ
HeavyDSparks,823,"Do you wanna see the real side and personal lives of Heavy D and Diesel Dave  from Diesel Brothers and experience some of the wildest vehicles, stunts, and pranks the world has ever seen?...if your answer is no, go follow Dr Phil, if your answer is yes....hit that SUBSCRIBE button now!",https://yt3.ggpht.com/E1J6bOqm6NFoLvmGJG5yDrmzreNbdnVPOExtqGsucKDTCpyDbwh3TQNxwqfqBkifyKdvo_BL7g=s88-c-k-c0x00ffffff-no-rj,937829121,https://www.youtube.com/channel/UCGTKwjs1ctvgwCRa67RNO-Q,4050000,2024-11-01,UCGTKwjs1ctvgwCRa67RNO-Q,US
ESPN FC,25157,ESPN's official home for all things football. All the time. ,https://yt3.ggpht.com/ytc/AIdro_m9M03AM9MAPhowS2oDLOamub1K-6D4mlzMYY0I44Sn4bY=s88-c-k-c0x00ffffff-no-rj,4002365144,https://www.youtube.com/channel/UC6c1z7bA__85CIWZ_jpCK-Q,4420000,2024-11-01,UC6c1z7bA__85CIWZ_jpCK-Q,US
Apple,201,"Welcome to the official Apple YouTube channel. Here you’ll find news about product launches, tutorials, and other great content. Apple revolutionized personal technology with the introduction of the Macintosh in 1984. Today Apple continues to be a global leader in innovation with products like iPhone, iPad, Mac, Apple Watch and Apple Vision Pro. Our six software platforms (iOS, iPadOS, macOS, watchOS, tvOS, and visionOS) provide seamless experiences across Apple devices. Breakthrough services include the App Store, Apple Music, Apple Pay, and iCloud. And Apple keeps pursuing innovation with products like HomePod, Apple Fitness+, and Apple Card. Apple’s more than 160,000 employees are dedicated to making the best products on earth, and to leaving the world better than we found it. Additional products include AirPods, AirTags, Apple Arcade, Apple Books, Apple News, Apple Podcasts, and Apple TV.",https://yt3.ggpht.com/05lhMeAH6tZrPIUsp2yHNz3DwzhKbDUQcxcY0_qeXVyZttR_pktBzw0FcLUSR6D4fVqsEgL3ZO0=s88-c-k-c0x00ffffff-no-rj,1182083323,https://www.youtube.com/channel/UCE_M8A5yxnLfW0KghEeajjw,19800000,2024-11-01,UCE_M8A5yxnLfW0KghEeajjw,US
DEATH BATTLE!,1829,Death Battle is the show that answers the question Who would win in a fight? between your favorite pop culture characters! ►Get extra perks as a Death Battle CHAMPION: https://www.youtube.com/deathbattle/join►Click to SUBSCRIBE: http://bit.ly/SubToDeathBattleOFFICIAL DEATH BATTLE SUGGESTION FORM: https://bit.ly/DBSuggest2425Check out our socials:Our Facebook: http://www.facebook.com/OfficialDeathBattle/Our Twitter: https://twitter.com/DEATHBATTLEOur  Instagram: https://www.instagram.com/rt_deathbattleOur TikTok: https://www.tiktok.com/@deathbattle_officialConnect with the team on Twitter:Ben B. Singer - https://twitter.com/BenBSingerChad James - https://twitter.com/ChadJamesRTSam Mitchell - https://twitter.com/ScrewAttackSamAustin Harper - https://twitter.com/PotatoHound,https://yt3.ggpht.com/ytc/AIdro_nC3d3fI5NmYOkwtAEPoa3q5Sk_GbLIESSHMUZa9yV04w=s88-c-k-c0x00ffffff-no-rj,1875806155,https://www.youtube.com/channel/UCB9_VH_CNbbH4GfKu8qh63w,6070000,2024-11-01,UCB9_VH_CNbbH4GfKu8qh63w,US
Quenlin Blackwell,63,"Hey Y'all, it's me Quen Blackwell, GODDESS of the internet. ",https://yt3.ggpht.com/ytc/AIdro_kiTYIdkZ80nYq-1T3pOUvYPiB0aRBynwAzpbiy1JHD82k=s88-c-k-c0x00ffffff-no-rj,148148102,https://www.youtube.com/channel/UCRE2zmVNW9wG2dndMoV4JKQ,1910000,2024-11-01,UCRE2zmVNW9wG2dndMoV4JKQ,US
Cinemassacre,1859,"Cinemassacre creates reviews and comedy shows about video games and movies, including: the Angry Video Game Nerd, Monster Madness, You Know What's BS, Movie Reviews, and more! If you would like to contact us about brand deals or other inquiries contact the email below.",https://yt3.ggpht.com/KaMlbpL5pLAY3vNDvFTz60xeM_LvccYoZzjIgATSDVsDvHvw3FZT_7UbHnJ8Q4FLSK7KBWrV=s88-c-k-c0x00ffffff-no-rj,2286139402,https://www.youtube.com/channel/UC0M0rxSz3IF0CsSour1iWmw,3850000,2024-11-01,UC0M0rxSz3IF0CsSour1iWmw,US
"Tyler, The Creator - Topic",322,,https://yt3.ggpht.com/-1Bt8eufq601KzmA0Rk1yrIzz372UDDeBkIpWytlztkcAyh1w6g2bNfXVnR6hadnezvUCq0XICA=s88-c-k-c0x00ffffff-no-rj,1374082659,https://www.youtube.com/channel/UCo1DYcm1IZ9v3UPkpiAcgtg,91100,2024-11-01,UCo1DYcm1IZ9v3UPkpiAcgtg,ZZ
"Tyler, The Creator - Topic",322,,https://yt3.ggpht.com/-1Bt8eufq601KzmA0Rk1yrIzz372UDDeBkIpWytlztkcAyh1w6g2bNfXVnR6hadnezvUCq0XICA=s88-c-k-c0x00ffffff-no-rj,1374082659,https://www.youtube.com/channel/UCo1DYcm1IZ9v3UPkpiAcgtg,91100,2024-11-01,UCo1DYcm1IZ9v3UPkpiAcgtg,ZZ
Kurzgesagt – In a Nutshell,255,"Animation videos explaining things with optimistic nihilism since 12,013.We’re a team of illustrators, animators, number crunchers and one dog who aim to spark curiosity about science and the world we live in. To us nothing is boring if you tell a good story.For updates on our videos and other news from the kurzgesagt universe follow us on Twitter, Facebook, Instagram and LinkedIn.",https://yt3.ggpht.com/ytc/AIdro_n1Ribd7LwdP_qKtqWL3ZDfIgv9M1d6g78VwpHGXVR2Ir4=s88-c-k-c0x00ffffff-no-rj,2997954943,https://www.youtube.com/channel/UCsXVk37bltHxD1rDPwtNM8Q,23100000,2024-11-01,UCsXVk37bltHxD1rDPwtNM8Q,DE
The Pat McAfee Show,8885,,https://yt3.ggpht.com/ytc/AIdro_nHUJ0l-y5TjU09vHwPXJhSNkVpSNJIuDWXu5hOCSUbeoU=s88-c-k-c0x00ffffff-no-rj,2080987823,https://www.youtube.com/channel/UCxcTeAKWJca6XyJ37_ZoKIQ,2680000,2024-11-01,UCxcTeAKWJca6XyJ37_ZoKIQ,US
JaidenAnimations,136,hi it's jaiden and birdchannel profile picture made by: mechannel banner art made by: https://twitter.com/motiCHIKUBI,https://yt3.ggpht.com/gopbHeiDtEB932rIFqLlR4D_hFtd-BcdGrQgGeyDpkD3guskkbT74DsJYPGo3x7MqkyqtgL-=s88-c-k-c0x00ffffff-no-rj,2653816010,https://www.youtube.com/channel/UCGwu0nbY2wSkW8N-cghnLpA,13900000,2024-11-01,UCGwu0nbY2wSkW8N-cghnLpA,US
Ghost,162,"GHOST continues to elevate & reaffirm its status as one of the world's most esteemed & celebrated creative forces. Accumulating well over a billion streams, the GRAMMY-winning Swedish theatrical rock band continues to bring theeuphoric spectacle (ROLLING STONE) of its live shows to ever-growing & increasingly impassioned crowds, headlining arena tours including sold out shows from the New York's Barclays Center to London's 02 Arena. In March 2022, THE LOS ANGELES TIMES reported that Ghost had conquered metal & the charts when its 5th album IMPERA debuted at #1 in a sweep of the US album charts, entering the BILLBOARD 200 at #2 & bowing at #1 in the band's native Sweden as well as Germany & Finland, while cracking the top 5 in the UK (#2), Netherlands (#2), Belgium (#2) & more. ",https://yt3.ggpht.com/h2oUnd0ooQgDsEoypmAxD4UvYKgnPx8h8whke76DhkieJNNLbEWi4dnPdjqZ9hFrBkjGhkum9w=s88-c-k-c0x00ffffff-no-rj,1206895655,https://www.youtube.com/channel/UCAOiVaJJlH0Oduv48NN0mMA,2880000,2024-11-01,UCAOiVaJJlH0Oduv48NN0mMA,US
FORMULA 1,7991,"The home of risk takers, late brakers and history makers! 💫NEXT UP - RACE 21 OF 24: BRAZIL 🇧🇷 01-03 NOVEMBER",https://yt3.ggpht.com/tyLW5LsJGwr4ViM30OeYbuLcu_MXfpRzP8y-X9_aKfTNJeMFHmnNbPyxxhaFDA9NRgwEu9mT-g=s88-c-k-c0x00ffffff-no-rj,7281161720,https://www.youtube.com/channel/UCB_qr75-ydFVKSF9Dmo6izg,11200000,2024-11-01,UCB_qr75-ydFVKSF9Dmo6izg,ZZ
Footasylum,1275,"We make videos and sell streetwear. Watch original series, exclusive interviews and event coverage featuring the best UK talent. SAVE 10% off with YOUTUBE10Shop the latest from global brands like Nike, adidas, Puma and independent labels across 70 stores, or right here:https://www.footasylum.com/youtube/",https://yt3.ggpht.com/gdqteWhgvaTUadrMUZY_eZLFuq368tbLfEu_HBspp7v2OJ5i6Be3w2z9symtMwwaytrHiXx8Tw=s88-c-k-c0x00ffffff-no-rj,839265963,https://www.youtube.com/channel/UCSTJELgD0j0gW2_wgF_TYuA,2820000,2024-11-01,UCSTJELgD0j0gW2_wgF_TYuA,GB
DaFuq!?Boom!,303,"DaFuq!?Boom!40 MILLION SUBSCRIBERS - 30th March 202430 MILLION SUBSCRIBERS - 19th September 202325 MILLION SUBSCRIBERS - 17th August 202320 MILLION SUBSCRIBERS - 18th July 202310 MILLION SUBSCRIBERS - 7th June 20235 MILLION SUBSCRIBERS - 15th May 20231 MILLION SUBSCRIBERS - 5:43 A.M., 23rd November 2021900k subscribers 4th April 2021700k subscribers 19th July 2020200 MILLION VIEWS IN TOTAL - 2nd April 2020600k subscribers 27th March 2020500k subscribers 23rd November 2019100 MILLION VIEWS IN TOTAL  - 12 April 2019300k subscribers - 27 February 201935 million views in total - 08/02/201850k subscribers - 12/04/201710 million views in total - 11/28/201730k subscribers - 08/03/20173 million views in total - 07/11/201720k subscribers - 07/05/201710k subscribers - 05/18/2017",https://yt3.ggpht.com/P2dEEGGTZdLx7313inVbiONF5Kz-Pqik9o6s255XtMWMoxikwsswwvf57o3xBq7NSGsXK9lDNQ=s88-c-k-c0x00ffffff-no-rj,17840782655,https://www.youtube.com/channel/UCsSsgPaZ2GSmO6il8Cb5iGA,44200000,2024-11-01,UCsSsgPaZ2GSmO6il8Cb5iGA,US
JxmyHighroller,226,Bringing you the best content on all things basketball. Uploading daily and weekly about the latest stories in the basketball world.Contact for business and sponsors:jxmyhighroller@algebramedia.com,https://yt3.ggpht.com/ytc/AIdro_nXjrwiXf97_A2b_wql-KaTEAwQ9JzmyEybvoC7T8MkycQ=s88-c-k-c0x00ffffff-no-rj,524714314,https://www.youtube.com/channel/UC3L9XPe0_FGfRG-CMGtBvFg,2510000,2024-11-01,UC3L9XPe0_FGfRG-CMGtBvFg,US
Gavin Magnus,923,"The names Gavin Magnus, and I'm an artist and creator on all platforms. Catch me on the radio soon with my new hit song Lonely and in more creative videos with my friends! You won't wanna miss the amazing adventures we go on so make sure you subscribe.",https://yt3.ggpht.com/G9w5up_o02symtnXms9NE_hbEWDl2WFfadHc438rL-ojSDbSXSz9Tin0voN_A3VxzRsFKaFxyw=s88-c-k-c0x00ffffff-no-rj,1651557037,https://www.youtube.com/channel/UCsDUx3IrrXQI0CbfKMxTCww,7100000,2024-11-01,UCsDUx3IrrXQI0CbfKMxTCww,US
JYP Entertainment,2231,"JYPnation Official YouTubeLEADER IN ENTERTAINMENTThere are values and goals that JYP Entertainment (JYP) has pursued. JYP prides itself with those values and strives to be an exemplary leader in the entertainment industry. With the lead of Park Jin Young as one of Asia’s most prominent producers in the entertainment industry, JYP has discovered and produced some of the most popular and successful K-Pop artists, such as god, Rain, Wonder Girls, 2PM, 2AM, miss A, GOT7, DAY6, TWICE, Stray Kids, ITZY, Xdinary Heroes and NMIXX.Also, we have introduced and led K-Pop’s dominance by expanding the activities of our artists to the global music industry through the network of our overseas subsidiaries, JYP Japan and JYP China. JYP not only focuses on ordinary business, like planning and creating music, finding and managing artists, conducting online, mobile and overseas business, but also strives to scout creative talents and develop them to be suitable for the entertainment industry.",https://yt3.ggpht.com/kcV7NQkBm-UvvzVTJvrg1Yf1eHSqi-DLXuZPt_ECa3cHEPefujS951Dxj6KUEQ5i9Z7_fyMUjw=s88-c-k-c0x00ffffff-no-rj,23497702233,https://www.youtube.com/channel/UCaO6TYtlC8U5ttz62hTrZgg,29800000,2024-11-01,UCaO6TYtlC8U5ttz62hTrZgg,ZZ
Nintendo of America,6595,"Welcome to the official Nintendo YouTube channel where you'll find all the latest videos, news and content from Nintendo including the Nintendo Switch family of systems.For customer support, please visit https://en-americas-support.nintendo.com/",https://yt3.ggpht.com/R0U0EvZCB10kisxpg2xK-1c0oVHMXWtJo-DWZKofufsf0q1yQXHAcSjcETab1GGnWKN7xrUBUQ=s88-c-k-c0x00ffffff-no-rj,3601628654,https://www.youtube.com/channel/UCGIY_O-8vW4rfX98KlMkvRg,9620000,2024-11-01,UCGIY_O-8vW4rfX98KlMkvRg,US
Premier Boxing Champions,4084,"A night at the fights used to be something big. Boxing meant flashbulbs, floodlights, and excitement, hundreds of voices cheering two men in the squared circle at the center of it all. Yes, there was a time when boxing was really something to see. And now, that time is here again.Introduced January 14, 2015, Premier Boxing Champions is a boxing series that returns the sweet science to its rightful place atop the sports pantheon. Featuring today’s best and brightest stars in their toughest, most anticipated bouts, Premier Boxing Champions airs on Fox, FS1 and SHOWTIME. PBC is taking boxing back to its roots. This is boxing, pure and simple, where what’s brought to the fight, mentally and physically, is what determines who goes home the winner, and who just goes home. Get ready for the fights, people. This is boxing at its best.",https://yt3.ggpht.com/MKFUgbrKO1aR0BOmNa89kEVziFbv0yYggqwwxkYE33Ji9HtHA58T0gTfWU2Hp8wo_QH4M7tqOD0=s88-c-k-c0x00ffffff-no-rj,1119945047,https://www.youtube.com/channel/UCWXYAGB9SadlL6p5Bb66wWw,2390000,2024-11-01,UCWXYAGB9SadlL6p5Bb66wWw,US
JYP Entertainment,2231,"JYPnation Official YouTubeLEADER IN ENTERTAINMENTThere are values and goals that JYP Entertainment (JYP) has pursued. JYP prides itself with those values and strives to be an exemplary leader in the entertainment industry. With the lead of Park Jin Young as one of Asia’s most prominent producers in the entertainment industry, JYP has discovered and produced some of the most popular and successful K-Pop artists, such as god, Rain, Wonder Girls, 2PM, 2AM, miss A, GOT7, DAY6, TWICE, Stray Kids, ITZY, Xdinary Heroes and NMIXX.Also, we have introduced and led K-Pop’s dominance by expanding the activities of our artists to the global music industry through the network of our overseas subsidiaries, JYP Japan and JYP China. JYP not only focuses on ordinary business, like planning and creating music, finding and managing artists, conducting online, mobile and overseas business, but also strives to scout creative talents and develop them to be suitable for the entertainment industry.",https://yt3.ggpht.com/kcV7NQkBm-UvvzVTJvrg1Yf1eHSqi-DLXuZPt_ECa3cHEPefujS951Dxj6KUEQ5i9Z7_fyMUjw=s88-c-k-c0x00ffffff-no-rj,23497702233,https://www.youtube.com/channel/UCaO6TYtlC8U5ttz62hTrZgg,29800000,2024-11-01,UCaO6TYtlC8U5ttz62hTrZgg,ZZ
Nintendo Mobile,1689,このチャンネル内の日本語の動画は、日本のお客様向けに公開しているものです。,https://yt3.ggpht.com/ytc/AIdro_k-8dkCR1f4oM_3k_xCDxiV13mbAWyED4A-zeZdPH21et4=s88-c-k-c0x00ffffff-no-rj,249546916,https://www.youtube.com/channel/UCs1pApqJNPZBcPcDjEWn6MA,490000,2024-11-01,UCs1pApqJNPZBcPcDjEWn6MA,ZZ
Brawl Stars,246,Fast-paced 3v3 multiplayer and battle royale made for mobile! Play with friends or solo across a variety of game modes in under three minutes.,https://yt3.ggpht.com/FVJpJyrV85TDL2nyiFbnaBuZzuYX1thQywPXCvilPAuw7DmPjFoXphPgkCqekYNIfqFtqGrvCg=s88-c-k-c0x00ffffff-no-rj,2934011885,https://www.youtube.com/channel/UCooVYzDxdwTtGYAkcPmOgOw,20600000,2024-11-01,UCooVYzDxdwTtGYAkcPmOgOw,FI
Throttle House,513,"Welcome to THROTTLE HOUSE. Here, you will find everything from car reviews to track tests, to epic adventures. SUBSCRIBE  for weekly content!",https://yt3.ggpht.com/deDXCaHYS2Oya803d42wyok04YZtKbNZ4VxFvkn8NxHGlihxl4JbwTnwSXeNuMiVv9QOQWxL=s88-c-k-c0x00ffffff-no-rj,639800937,https://www.youtube.com/channel/UCyXiDU5qjfOPxgOPeFWGwKw,3100000,2024-11-01,UCyXiDU5qjfOPxgOPeFWGwKw,ZZ
NFL,43365,"The official YouTube page of the NFL.Subscribe to the NFL YouTube channel to see immediate in-game highlights from your favorite teams and players, daily fantasy football updates, all your favorite NFL podcasts, and more!",https://yt3.ggpht.com/kDUg480xOHHjIEnvADRDAz8w9MapJEx-3UJjJQzfeg4O-SrAGHTOSpd5Tm5QtJi0RlSfafMxQg=s88-c-k-c0x00ffffff-no-rj,10881444009,https://www.youtube.com/channel/UCDVYQ4Zhbm3S2dlz7P1GBDg,13400000,2024-11-01,UCDVYQ4Zhbm3S2dlz7P1GBDg,ZZ
Mat Armstrong MK2,72,,https://yt3.ggpht.com/hzywAxJp0WBYwA2dqjjMGmyZmP84O_QpMGDNndctYMqWfa5Tk0vI2iMspo6NolINffu3rymt2A=s88-c-k-c0x00ffffff-no-rj,171774429,https://www.youtube.com/channel/UC2FZQeaJkpnO6IMkQglvPsg,1290000,2024-11-01,UC2FZQeaJkpnO6IMkQglvPsg,GB
Steve Wallis,322,"ABC, Always Be Camping. Welcome to my channel! I camp all the time. I’ve lived in vehicles, motorhomes, tents, forests, and in a van down by the river! I boondock, backpack, cycle, gold mine, raft, and car camp my way around Canada. I camp 4 seasons in some of the coldest places inhabited by man. I’m no survivalist, but I try to avoid public campgrounds. I’m usually up to something strange and genuinely interesting to the outdoors crowd. Check it out!Yes, after many requests... I have made T-shirts and Hoodies Available. You can grab one here if you are interested! https://crowdmade.com/collections/stevewallisBitcoin: 1H6DCJdXADYRPPvto8yNexrV6guenDxAUz",https://yt3.ggpht.com/ytc/AIdro_lxDevINPpiqaJJ0LnB4Ih1NXx-7tPu5KA0919KmPbXk4E=s88-c-k-c0x00ffffff-no-rj,274218191,https://www.youtube.com/channel/UCSnqXeK94-iNmwqGO__eJ5g,1590000,2024-11-01,UCSnqXeK94-iNmwqGO__eJ5g,CA
MoreSidemen,1138,Welcome to the Official Sidemen 2nd Channel which is also officially the greatest channel on YouTube… ENJOY!,https://yt3.ggpht.com/ytc/AIdro_kg8VuO1devOCTB3RVbqdxXeUY_nwVkG-YYuWqs55fXyzo=s88-c-k-c0x00ffffff-no-rj,4795859329,https://www.youtube.com/channel/UCh5mLn90vUaB1PbRRx_AiaA,8960000,2024-11-01,UCh5mLn90vUaB1PbRRx_AiaA,GB
Detroit Lions,5029,"Welcome to the official Youtube page of the Detroit Lions.Subscribe to the Detroit Lions Youtube page to watch our latest highlights, features, interviews, press conferences, and more!#OnePride #NFL",https://yt3.ggpht.com/ytc/AIdro_lzJ6Jw3A1mwIlaEoJ_d89bUBKk6ULyxBmkR13RZEO6oA=s88-c-k-c0x00ffffff-no-rj,99442492,https://www.youtube.com/channel/UCv5J06V-ESk5_1uriG65f3w,220000,2024-11-01,UCv5J06V-ESk5_1uriG65f3w,US
aCookieGod,211,The weird dude with a deep voice who plays video games.official merch store: https://acookiegod.com/Business Email: acookiegod@mythictalent.comEverything Else: acookiegod@gmail.com,https://yt3.ggpht.com/sNsmW8cDqvLbjtdCI2rpPXpkYXFJxv7eM4tttd6kvdQSNyB60Kama-HukwSqaFVzuXqZGI_eZQ=s88-c-k-c0x00ffffff-no-rj,1106646195,https://www.youtube.com/channel/UCIVSqoHCUN1XdEpiVItxfoQ,6060000,2024-11-01,UCIVSqoHCUN1XdEpiVItxfoQ,CA
Sushant KC,80,"Born and raised in the culturally rich landscapes of Nepal, Sushant KC emerged as a captivating force in the realm of music, enchanting audiences with his emotive melodies and thought-provoking lyrics. His early years were marked by a deep reverence for the acoustic guitar. Inspired by the eclectic sounds of both Eastern and Western musical traditions, Sushant embarked on a quest to weave together the tapestry of his cultural heritage with contemporary sensibilities, blending elements of folk, pop, and rock to create a sound uniquely his own. Turning him into one of the biggest Pop Icons in the country.His journey as an independent artist has been marked by an insatiable thirst for growth and learning. This pursuit led him to the prestigious Berklee College of Music, where he honed his craft and expanded his musical horizons.",https://yt3.ggpht.com/ytc/AIdro_kbJowJBGONn_lzLzyjLFGVzAXHZQ-diWHaleNlk-7gaKv2=s88-c-k-c0x00ffffff-no-rj,496852174,https://www.youtube.com/channel/UCAM35Xuk2-GM4Mb8g0MGSZw,1850000,2024-11-01,UCAM35Xuk2-GM4Mb8g0MGSZw,NP
The United Stand,10688,"Manchester United news and updates from the number one independent Manchester United fan channel on YouTube. The United Stand provides you with the latest Manchester United transfer news, highlights, goal reviews and much more. So if you love football, get involved and join the United Stand.We provide Manchester United fans a platform to express real fan opinionated content from the people who matter most - Manchester United fans. No scripted ex professional footballers, no out of touch journalists, the United Stand totally focused on Manchester United fans views. Whether it's Man Utd players in the first time or the Manchester United academy. So get involved and have your say on the biggest club in world football. Manchester United.",https://yt3.ggpht.com/oFBDKZerDHzf1mulG8psu1d1pUIDYNUCs2JdEdvxuzpMZpUPEugb5G6fNE6fKWuGTUaLbJZ5lQ=s88-c-k-c0x00ffffff-no-rj,1406793630,https://www.youtube.com/channel/UCMmVPVb0BwSIOWVeDwlPocQ,1960000,2024-11-01,UCMmVPVb0BwSIOWVeDwlPocQ,GB
BehindThePlay,3478,BehindThePlay,https://yt3.ggpht.com/1nDDbkjz43d2q5tcuAe1j0Sqw3a_Bbeb9ZEtU0BBuM9oS5CmjXMsBPE7mDUauFPAdaT_DXke=s88-c-k-c0x00ffffff-no-rj,14571486,https://www.youtube.com/channel/UCjmPFCKEAbgX-AInOujDHNQ,11700,2024-11-01,UCjmPFCKEAbgX-AInOujDHNQ,US
FOX Sports,5816,"Your home for NFL on FOX, MLB on FOX, USGA Coverage and more from FOX Sports.",https://yt3.ggpht.com/ytc/AIdro_kRD_CzEE876U_cVjUDaMF-hFzDQB906eoYWLq1JT0u99Q=s88-c-k-c0x00ffffff-no-rj,680422090,https://www.youtube.com/channel/UCwNqHDsnBCKT-olwJwIFyfg,1250000,2024-11-01,UCwNqHDsnBCKT-olwJwIFyfg,ZZ
FaZe Jev,3531,HEADPHONE USERS BEWARE!,https://yt3.ggpht.com/ytc/AIdro_ms7EFD_wd-kjfunIs20Bm8zSkb33LtwtTmVn5qexFLw_g=s88-c-k-c0x00ffffff-no-rj,2375301333,https://www.youtube.com/channel/UC7trU46U_9XPDtMnDbiDPUQ,5410000,2024-11-01,UC7trU46U_9XPDtMnDbiDPUQ,US
VonOff1700,129,LETS B HONEST WE RUN THE CITY,https://yt3.ggpht.com/MjQL88GCZMzDC1CS5SVY_hUWRkf4w4TuIpTFoBSJcn6kkOTjIbsj1UdtO3pk1Q3zv9jbVYnhCSs=s88-c-k-c0x00ffffff-no-rj,62815739,https://www.youtube.com/channel/UC023sB-A8vI7F3ByKMF9BGA,181000,2024-11-01,UC023sB-A8vI7F3ByKMF9BGA,US
MrRoflWaffles,2149,"Hi Guys, MrRoflWaffles Here! Welcome to my No Nonsense channel :)",https://yt3.ggpht.com/ytc/AIdro_lE4gFIA0ZiwaWvsyVZq7np0OA5SJ94ia_WT3lbAVzF7T8=s88-c-k-c0x00ffffff-no-rj,553952378,https://www.youtube.com/channel/UCzH3H8sRfqH3rEVZcpTV2Cw,2080000,2024-11-01,UCzH3H8sRfqH3rEVZcpTV2Cw,GB
ESPN MLB,1942,The official home of MLB on ESPN,https://yt3.ggpht.com/Ykjp2sDJberwlx-16gyWu5NhUk3Mg9nUB8hcZePKiu38u2Eu1AQzYsaKadznsL9Gm9UffPXC=s88-c-k-c0x00ffffff-no-rj,780593409,https://www.youtube.com/channel/UCvHm-lDQEhRJNCd8BdpzDkQ,342000,2024-11-01,UCvHm-lDQEhRJNCd8BdpzDkQ,US
SEC Shorts,210,Making videos about the craziness that is football down south.  Videos by Robert Clay and Josh Snead.***Not affiliated with the Southeastern Conference***,https://yt3.ggpht.com/EBWiAmXR2_Ny87zAhcPI_YACJMBTziS3yix9MstPRGOiLdMBM6tjeDx6PzFhdnP6aUPEHIp_Gyg=s88-c-k-c0x00ffffff-no-rj,91407728,https://www.youtube.com/channel/UCUOZvgB9Q8AgZjjLYcLWztQ,291000,2024-11-01,UCUOZvgB9Q8AgZjjLYcLWztQ,US
Jiji Wonder,18,Hey!! Welcome to my channel!🤍,https://yt3.ggpht.com/PERN5zlZSNYmgPpMzlgHZuFZtJqDJrQYWcYjy9Bo-JECvd52qzABI7SwV5Ln4DO6QFlvcxtRrA=s88-c-k-c0x00ffffff-no-rj,6247705,https://www.youtube.com/channel/UCmmc_ObsixkMiLq7BXobAnQ,243000,2024-11-01,UCmmc_ObsixkMiLq7BXobAnQ,US
