Titulo,Numero_de_videos,Descricao,Imagem_de_perfil,Numero_de_visualizacoes,Link,Numero_de_inscritos,Data,Canal_ID,Pais_codigo
VIVINOS,49,vivinos@studiolico.com,https://yt3.ggpht.com/wxcTILsAW1bbpFsmxYd7MJRkUyhe8Drip5hCkjmLucD30OzVcCoTJ9avilOgDBP6NhBJkAc_=s88-c-k-c0x00ffffff-no-rj,195024840,https://www.youtube.com/channel/UCch9Dmg5Juwp8MZGvAmAp4Q,1530000,2024-11-01,UCch9Dmg5Juwp8MZGvAmAp4Q,ZZ
Renato Cariani,3822,,https://yt3.ggpht.com/ytc/AIdro_mFRcNgmptqL_HVJXr8Gx4WuXar5Dr4KNSh8ucWI00SN6o=s88-c-k-c0x00ffffff-no-rj,1341206410,https://www.youtube.com/channel/UCPX0gLduKAfgr-HJENa7CFw,7280000,2024-11-01,UCPX0gLduKAfgr-HJENa7CFw,BR
AddisonRaeVEVO,3,,https://yt3.ggpht.com/KjQpR7Zw5H5Ysu1xPtjZct5QSq_NxGhWzxEXLl4OPon4i_gUsQemkaSRtUdRDIypbfsY5nZXgQ=s88-c-k-c0x00ffffff-no-rj,11072091,https://www.youtube.com/channel/UC3Cs0kPcr0GQPCVzX32NQPg,309,2024-11-01,UC3Cs0kPcr0GQPCVzX32NQPg,ZZ
TNT Sports Brasil,9121,Seja bem-vindo ao canal da TNT Sports Brasil! Veja aqui os melhores momentos da Champions League e o que de melhor acontece no futebol brasileiro e internacional!,https://yt3.ggpht.com/nbzvAOJQJTB_FzBJDvg9mcCAPwl5NkEv3dKVQrfsmaROJ7naWGv3sh4SgDifQo25x9JVC5Yxnw=s88-c-k-c0x00ffffff-no-rj,3104849737,https://www.youtube.com/channel/UCs-6sCz2LJm1PrWQN4ErsPw,11300000,2024-11-01,UCs-6sCz2LJm1PrWQN4ErsPw,BR
Euphoric Brothers,124,2 young brothers addicted to game dev!The official creators of Garten of Banban.,https://yt3.ggpht.com/-iV42DwvFdtj22UBA2R7KFhXMoGcE8h4FH3gy7Rb5fgjS6vyt3Wq1Ls7VbeKUigl_AOcc76NUUQ=s88-c-k-c0x00ffffff-no-rj,195406366,https://www.youtube.com/channel/UCzDYgkEUa7tcWFmhfVItiiA,1210000,2024-11-01,UCzDYgkEUa7tcWFmhfVItiiA,ZZ
NBA Brasil,3826,"Canal oficial no Brasil da NBA, a maior liga profissional de basquete do mundo que atinge 215 países.TODOS os dias, você acompanha aqui no canal o melhor dos jogos da noite anterior com o Rodada NBA, durante a temporada! Além disso, temos jogos ao vivo todas as segundas-feiras, junto com o melhor da rodada no Crunchtime.E todas as quartas vocês ainda acompanham os bastidores mais incríveis das franquias da NBA com o NBA Na Estrada. Aqui você fica por dentro de tudo que rola na Liga!",https://yt3.ggpht.com/nHdZcHfst2VxOuEe1o0wPO8X4w9xXjqO0zWIH06LNlUN8BimHIWXFisNZ4pEHUzZQiVVXDEI=s88-c-k-c0x00ffffff-no-rj,239302297,https://www.youtube.com/channel/UCsiCOcr5SZAWlJMfcw9P__w,1220000,2024-11-01,UCsiCOcr5SZAWlJMfcw9P__w,BR
Iguinho e Lulinha - Topic,185,"Nascer em um pequeno município no interior do sertão Sergipano não impediu que Iguinho e Lulinha sonhassem com o sucesso e hoje, são a primeira dupla de cantores de piseiro do Brasil!Naturais de Canindé de São Francisco, SE, os irmãos tiveram as primeiras experiências artísticas ao lado do avó Zé Leobino, conhecido vaqueiro nacional e figura folclórica da região onde viviam.  A família sempre esteve muito presente na vida dos meninos. Na companhia do pai e tio, eles iam em cavalgadas, vaquejadas e até mesmo a programas de rádio e televisão local.",https://yt3.ggpht.com/DoYi3VFIx1FHq5-Gbm8Xapb6nQ0eFxBRrfF_jOJEpXa6zpA5POjtnTC_itxh4MN5dBVH4IUrWPo=s88-c-k-c0x00ffffff-no-rj,69244558,https://www.youtube.com/channel/UCEPpLe_ffyNrV8m1zt_1Keg,10600,2024-11-01,UCEPpLe_ffyNrV8m1zt_1Keg,ZZ
Paramount+ Brasil,2032,Somos todos soldados da Zoe Saldaña 🫡,https://yt3.ggpht.com/9YbVRdlQhUyY_EyD5OmuILuutqiWop4P_2zH2ALtmR1L73E-b8IZoEUhiW73CvMHsrRAbmFWROM=s88-c-k-c0x00ffffff-no-rj,142153113,https://www.youtube.com/channel/UCAnCxJ1Weh2pUAKJW0bro0Q,512000,2024-11-01,UCAnCxJ1Weh2pUAKJW0bro0Q,BR
JENNIE,58,,https://yt3.ggpht.com/et6Hg97svg-QT3lBhfA2V_URD0Ll7nuat2PLRpHAzRKveL1evz2iv3upwLX2Iy-wMZMA9SD1aw=s88-c-k-c0x00ffffff-no-rj,592068100,https://www.youtube.com/channel/UCNYi_zGmR519r5gYdOKLTjQ,12200000,2024-11-01,UCNYi_zGmR519r5gYdOKLTjQ,ZZ
TNT Sports Brasil,9121,Seja bem-vindo ao canal da TNT Sports Brasil! Veja aqui os melhores momentos da Champions League e o que de melhor acontece no futebol brasileiro e internacional!,https://yt3.ggpht.com/nbzvAOJQJTB_FzBJDvg9mcCAPwl5NkEv3dKVQrfsmaROJ7naWGv3sh4SgDifQo25x9JVC5Yxnw=s88-c-k-c0x00ffffff-no-rj,3104849737,https://www.youtube.com/channel/UCs-6sCz2LJm1PrWQN4ErsPw,11300000,2024-11-01,UCs-6sCz2LJm1PrWQN4ErsPw,BR
Botafogo TV,4848,Canal oficial do Botafogo!,https://yt3.ggpht.com/F1-jZe4_B3jlUvQBYpskpfF8P6DQdwg5QCraDy9s-MA64IbWFVlsGB5n3L-kQ6Tzp8ao8iTs0w=s88-c-k-c0x00ffffff-no-rj,128931000,https://www.youtube.com/channel/UCFxjZDrLCOCHkUCu632AmMQ,595000,2024-11-01,UCFxjZDrLCOCHkUCu632AmMQ,BR
Virgínia Fonseca,1533,"Oii, amigos! Sejam bem-vindos ao meu canal, por aqui conseguimos ficar ainda mais próximos. Inscreva-se! Instagram: @virginiaEmail para contato: virginia@talismadigital.com.br",https://yt3.ggpht.com/tiOzl6g-T-BIoyfV5r0ElpicAXogRkSIlYSy7IpTxr2QVD4kv6hXw4j9jmG0pkncV_20NOdi=s88-c-k-c0x00ffffff-no-rj,1569823473,https://www.youtube.com/channel/UCsaB2VrLZrtGbum6Eo0ClbA,11800000,2024-11-01,UCsaB2VrLZrtGbum6Eo0ClbA,BR
Megan Thee Stallion,338,Houston's own real H-Town Hottie! Young Tina Snow. ‘MEGAN’ Is Out Now https://mts.lnk.to/megan,https://yt3.ggpht.com/Isb1-iaJsOcWZAvnC6vDwEV7Qz6dl0OEBoStzSTzK6_tkpaCQy-PuIUxKGP3mjTSlY3LnCIYs1w=s88-c-k-c0x00ffffff-no-rj,3185885743,https://www.youtube.com/channel/UCKrdjiuS66yXOdEZ_cOD_TA,6900000,2024-11-01,UCKrdjiuS66yXOdEZ_cOD_TA,US
Weder Silva,745,Receitas Especiais direto de Goiás,https://yt3.ggpht.com/ytc/AIdro_mbuCnCDcIRVNJnLzq0Q_pQmhoQR1Hc-33QKXhNkdNQrrY=s88-c-k-c0x00ffffff-no-rj,297383687,https://www.youtube.com/channel/UCixcSMY0QCvK96xtO9Atifg,3040000,2024-11-01,UCixcSMY0QCvK96xtO9Atifg,BR
MC Kako,53,"Jackson Frayle Toledo Campos, conhecido como MC Kako (27), é um dos maiores nomes da música urbana. Nascido em Maringá, Paraná, ele teve contato com a música desde a infância, influenciado pelo pai, baterista de uma banda de rock. Aos 17 anos, já escrevia suas próprias letras e, hoje, acumula mais de 8 milhões de ouvintes no Spotify e milhões de visualizações no YouTube. Em 2023, lançou o álbum 734, mostrando sua versatilidade com músicas acústicas e um visual mais intimista. A canção Ísis, em homenagem à sua filha, foi um grande sucesso, com mais de 100 milhões de plays. Em 2024, Kako apresenta o álbum Coisas Que Eu Já Deveria Ter Dito Há Um Tempo, com canções que resgatam o estilo de sua trajetória inicial.",https://yt3.ggpht.com/miwA4DgdPj2OGzbZWzIHT7glr95GPnCASmKZ05IVbaDif5Ybx7gR0LB0R0PsdY2Ppc0LytiVIg=s88-c-k-c0x00ffffff-no-rj,393351648,https://www.youtube.com/channel/UC78CKlsbDeQt-zSkzvxOcsg,708000,2024-11-01,UC78CKlsbDeQt-zSkzvxOcsg,ZZ
30PRAUM,133,30PRAUM▶ Shows: booking@30praum.com▶ Instagram: @30PRAUM▶ Twitter: @30PRAUM▶ Facebook.com/30PRAUMMATUÊ▶ Instagram: @matue▶ Twitter: @matue30WIU▶ Instagram: @hotwiu30▶ Twitter: @hotwiu30TETO▶ Instagram: @euteto▶ Twitter: @seutetoBRANDÃO▶ Instagram: @brandao085▶ Twitter: @brandao085,https://yt3.ggpht.com/LDh4W_e4WQ9AZdqOTw_wshwu61VdQjH_yM2Efuwd0CwTznKDQVv1BacdQvn60AfBOl12S1GV=s88-c-k-c0x00ffffff-no-rj,3961849939,https://www.youtube.com/channel/UCoHV8LxUFKeIvifJsB3c7Ww,6420000,2024-11-01,UCoHV8LxUFKeIvifJsB3c7Ww,BR
Naru,1114,"Oiieeee Eu xou o Naru, e voxê tem que axistir o meu canal!Contato Comercial: naru@kr3w.gg",https://yt3.ggpht.com/Ku6fGxZASbPZhc2M02DhKF6R0XmHeN9upN0YvNJNFIuYb3UjMBdWNmDBzjhjL_hUaiQXucZrcCM=s88-c-k-c0x00ffffff-no-rj,117005535,https://www.youtube.com/channel/UCx6SJ-EWSTZM0Vgxk5HTjWg,1130000,2024-11-01,UCx6SJ-EWSTZM0Vgxk5HTjWg,BR
Mnet K-POP,39889,K-POP Channel of World's No.1 Music Channel MnetWatch the latest and hottest K-POP contents on ✨Mnet K-POP✨ⓒCJ ENM. Corp ALL RIGHTS RESERVED,https://yt3.ggpht.com/ytc/AIdro_nUqO-dRLZjKIvfKHI-6pRWYjmx_5ZFEVgcKfMo0m6HTLKH=s88-c-k-c0x00ffffff-no-rj,16948059340,https://www.youtube.com/channel/UCbD8EppRX3ZwJSou-TVo90A,21200000,2024-11-01,UCbD8EppRX3ZwJSou-TVo90A,ZZ
Hay Day,194,"Best. Farm. Ever. Welcome to Hay Day, the most popular farming game on mobiles and tablets, number one in 122 countries.Get Hay Day ►► https://link.haydaygame.com/Learn the lay of the land, tend to your crops, and trade goods with neighbors and friends. It’s a real special place where the crops never die even though it never rains. Sharing the farm with our quirky animals only makes things more fun!Hay Day is available for devices running iOS, Android and Kindle!Subscribe for more videos ►► https://supr.cl/SubHayDayFollow us on our Socials!Twitter ►► https://twitter.com/HayDay/Instagram ►► https://www.instagram.com/hayday Facebook ►► https://www.facebook.com/haydayofficialHay Day Discord Chat ►► https://discord.gg/F7BmubqHay Day Reddit ►► https://www.reddit.com/r/HayDay/",https://yt3.ggpht.com/3uuvLxttvZAZ7qZSWSa8jKQB1HZa7MKZnHgQTLAtvatZfAw_jKoWs52Uwi684l26qOEldDEE=s88-c-k-c0x00ffffff-no-rj,320577023,https://www.youtube.com/channel/UCBrMq7wkdPWb3PxR-GUR61A,2250000,2024-11-01,UCBrMq7wkdPWb3PxR-GUR61A,FI
É o Vini,1074,,https://yt3.ggpht.com/cZE2WRHryYgvBGGgwdwtPwnXGAJXN5oCOoQWwq7S3l7OmrHduqOfKoDEGSDY4oFRMs9Y9Eu95w=s88-c-k-c0x00ffffff-no-rj,106451645,https://www.youtube.com/channel/UCHNc0vOmeDCRLSzw5VgvNrQ,1380000,2024-11-01,UCHNc0vOmeDCRLSzw5VgvNrQ,BR
NBA Brasil,3826,"Canal oficial no Brasil da NBA, a maior liga profissional de basquete do mundo que atinge 215 países.TODOS os dias, você acompanha aqui no canal o melhor dos jogos da noite anterior com o Rodada NBA, durante a temporada! Além disso, temos jogos ao vivo todas as segundas-feiras, junto com o melhor da rodada no Crunchtime.E todas as quartas vocês ainda acompanham os bastidores mais incríveis das franquias da NBA com o NBA Na Estrada. Aqui você fica por dentro de tudo que rola na Liga!",https://yt3.ggpht.com/nHdZcHfst2VxOuEe1o0wPO8X4w9xXjqO0zWIH06LNlUN8BimHIWXFisNZ4pEHUzZQiVVXDEI=s88-c-k-c0x00ffffff-no-rj,239302297,https://www.youtube.com/channel/UCsiCOcr5SZAWlJMfcw9P__w,1220000,2024-11-01,UCsiCOcr5SZAWlJMfcw9P__w,BR
Canal Edu Guedes,41,"Olá, pessoal!Depois de uma pausa, estou de volta com tudo para trazer muito conteúdo incrível para vocês!Com mais de 30 anos de carreira na TV e publicidade, 9 etapas completas no automobilismo, agora estou expandindo para o universo digital. Meu canal passou por uma reformulação completa para mostrar mais da minha vida, rotina e tudo que considero positivo. Aqui teremos espaço para compartilhar bons momentos e histórias íntimas que só quem é próximo de mim conhece.Preparem-se para acompanhar dicas, lifestyle, estilo pessoal e muitas receitas. Se inscrevam no canal e ativem o sininho para não perder nenhuma novidade!Deixem nos comentários o que vocês gostariam de ver nos próximos vídeos. Estou super animado para compartilhar muitas novidades e interagir com todos vocês!Te espero aqui toda quarta-feira , às 20h!",https://yt3.ggpht.com/cSqNivG_rc8Xyikb9NPYwTLCDrhiq9VLq5NMohQh4XH1MrncjDjCiwyfVRpKs0WpTyAHOzJZ=s88-c-k-c0x00ffffff-no-rj,3226133,https://www.youtube.com/channel/UCsSSv2wJhUrH5ksK-wMnV7Q,138000,2024-11-01,UCsSSv2wJhUrH5ksK-wMnV7Q,BR
GR6 EXPLODE,3265,,https://yt3.ggpht.com/SahCIj4fyMUcrq0JGidN_XhfX93kGrwsLecVJ0drg5ycQVWKT9TTVPL6TYe0jzMm9GoX3iFtkQ=s88-c-k-c0x00ffffff-no-rj,28648004312,https://www.youtube.com/channel/UCNUQK9mQoqi4yNXw2_Rj6SA,41400000,2024-11-01,UCNUQK9mQoqi4yNXw2_Rj6SA,BR
rezendeevil,12343,Contato Comercial: Rezende@adragencia.com.brInstagram: rezendeTwitter: @rezende_evilSnapchat: Imrezende,https://yt3.ggpht.com/TX93DoEJrvJi10f8WrPOej9VS0YrMUmuRt_tzT6Kj5A3qBvFx6iOspfirq42jXDUo6cmRcVQ-A=s88-c-k-c0x00ffffff-no-rj,13669234838,https://www.youtube.com/channel/UCbTVTephX30ZhQF5zwFppBg,33800000,2024-11-01,UCbTVTephX30ZhQF5zwFppBg,BR
BBC News Brasil,7376,Aqui você encontra o melhor da produção em vídeo da BBC News Brasil. Inscreva-se no nosso canal!,https://yt3.ggpht.com/ytc/AIdro_nxfAGf2WYRHqMTgrScAVCAKN4ZHqwY89Z_5KirrVNsQTmi=s88-c-k-c0x00ffffff-no-rj,1014544291,https://www.youtube.com/channel/UCthbIFAxbXTTQEC7EcQvP1Q,3810000,2024-11-01,UCthbIFAxbXTTQEC7EcQvP1Q,BR
30PRAUM,133,30PRAUM▶ Shows: booking@30praum.com▶ Instagram: @30PRAUM▶ Twitter: @30PRAUM▶ Facebook.com/30PRAUMMATUÊ▶ Instagram: @matue▶ Twitter: @matue30WIU▶ Instagram: @hotwiu30▶ Twitter: @hotwiu30TETO▶ Instagram: @euteto▶ Twitter: @seutetoBRANDÃO▶ Instagram: @brandao085▶ Twitter: @brandao085,https://yt3.ggpht.com/LDh4W_e4WQ9AZdqOTw_wshwu61VdQjH_yM2Efuwd0CwTznKDQVv1BacdQvn60AfBOl12S1GV=s88-c-k-c0x00ffffff-no-rj,3961849939,https://www.youtube.com/channel/UCoHV8LxUFKeIvifJsB3c7Ww,6420000,2024-11-01,UCoHV8LxUFKeIvifJsB3c7Ww,BR
30PRAUM,133,30PRAUM▶ Shows: booking@30praum.com▶ Instagram: @30PRAUM▶ Twitter: @30PRAUM▶ Facebook.com/30PRAUMMATUÊ▶ Instagram: @matue▶ Twitter: @matue30WIU▶ Instagram: @hotwiu30▶ Twitter: @hotwiu30TETO▶ Instagram: @euteto▶ Twitter: @seutetoBRANDÃO▶ Instagram: @brandao085▶ Twitter: @brandao085,https://yt3.ggpht.com/LDh4W_e4WQ9AZdqOTw_wshwu61VdQjH_yM2Efuwd0CwTznKDQVv1BacdQvn60AfBOl12S1GV=s88-c-k-c0x00ffffff-no-rj,3961849939,https://www.youtube.com/channel/UCoHV8LxUFKeIvifJsB3c7Ww,6420000,2024-11-01,UCoHV8LxUFKeIvifJsB3c7Ww,BR
Todah Music,978,"Todah Music: Somos Feitos de SonhosA Todah Music, criada em 2012 pelo Pr. Osmar Goulart e Alessandro Porfírio, nasceu com o propósito de levar a palavra de Deus através do louvor. Inspirada no conceito de mãos estendidas da palavra TODAH, a gravadora acredita que cada artista tem um chamado divino e ajuda a realizar sonhos por meio da música.Com foco no Reino, a Todah Music investe em novas estratégias, grandes artistas e forte presença no digital, mantendo sua missão de ampliar e divulgar a Palavra de Deus através da música.",https://yt3.ggpht.com/YlCLznOKBSj-syiThuNZbrGlTWlkt83VCpxi2k0lIznl5HFpPc4ZOJdhX0StKw6AO9HFvoRM=s88-c-k-c0x00ffffff-no-rj,4264103724,https://www.youtube.com/channel/UCpf5YXmzGHC4m5uLCdlrrfA,6760000,2024-11-01,UCpf5YXmzGHC4m5uLCdlrrfA,BR
Caike Pro,78, IFBB PRO Classic Physique 🇧🇷/🇺🇸@darcsport code: Caike10@growthsupplements cupom: Caike,https://yt3.ggpht.com/XiH4zZcgSdJpatLW0O9wzAVmtVUez8AfrCzCx0lrCgQSgE78uhUl2iFmys1zHnoeBZZTGF1o1g=s88-c-k-c0x00ffffff-no-rj,7299397,https://www.youtube.com/channel/UCA_WXRDt9nz8exYNLto1gSA,197000,2024-11-01,UCA_WXRDt9nz8exYNLto1gSA,ZZ
Família Maria Clara e JP,353,"Sejam bem-vindos à Família Maria Clara e JP! Moramos em Orlando nos Estados Unidos e toda semana postamos vídeos do nosso dia a dia, viagens, desafios, jogos e fazemos vlogs de tudo! Esperamos que goste dos nossos vídeos ❤️Obrigado por visitar nosso canal. Por favor, inscreva-se para que você possa participar de nossas aventuras!╔♫═╗╔╗ ╚╗╔╝║║♫═╦╦╦╔╗╔╝╚╗♫╚╣║║║║╔╣╚═♫╝╚═╩═╩♫╩═╝╔╦♫═╦╦╗║║║║║║║╠═╠═╩═♥♫═╝Lembre-se: Uma família não precisa ser perfeita, só precisa ser unida.",https://yt3.ggpht.com/HPYwC-cjbgqSIhja966MW-kWxvC1jaWC3ZmPps7WX3l7wrlGYgi5mL-xAdNX0ShPaky7jvVYdg=s88-c-k-c0x00ffffff-no-rj,1872504774,https://www.youtube.com/channel/UC040XFJEsSRhTkmieXp1kDQ,6350000,2024-11-01,UC040XFJEsSRhTkmieXp1kDQ,BR
Larissa Miranda ,240,Uma menina que saiu da cidade grande para morar na roça e demonstrar o cotidiano no meio do mato sendo uma adolescente de 16 anos. Tiktok: larissamiranda.8Kawai: LarissaMiranda.08,https://yt3.ggpht.com/GN4sDBV6sUAk3r--MamZkcyYVPx386jAvJzGXP97w2Ef4z_J6SVFJieMcNTBbw8pOWurZjXVKXg=s88-c-k-c0x00ffffff-no-rj,2459276,https://www.youtube.com/channel/UC8hxLO3J5ld1Xhdo6lSDsiQ,19500,2024-11-01,UC8hxLO3J5ld1Xhdo6lSDsiQ,BR
Leozinn 077,438,"ola sou o leozinn ! sou youtuber, tik toker influencer digital ! meu unico e maior sonho e deixar todos felizes :) faco o que eu amo ! obrigado ",https://yt3.ggpht.com/qsyT5KRPkUOgcAsMpjPvHsQEfhnv0MoMkAyDK4K8EktfPC1ik_2ECsssCq5Mq9oaOZy73jL72w=s88-c-k-c0x00ffffff-no-rj,4565908555,https://www.youtube.com/channel/UCIRNu5s24r7zAPTFic_eWNw,12900000,2024-11-01,UCIRNu5s24r7zAPTFic_eWNw,ZZ
Apple TV,2251,The official rabbit hole of Apple TV+Apple TV+ is a streaming service with original stories from the most creative minds in TV and film. Watch now on the Apple TV app: https://apple.co/_AppleTVapp,https://yt3.ggpht.com/ytc/AIdro_kjbQEFDiUGUQMyo7ETYP4DZI4piL-3msIXiyhE8V9one8=s88-c-k-c0x00ffffff-no-rj,1367077355,https://www.youtube.com/channel/UC1Myj674wRVXB9I4c6Hm5zA,1850000,2024-11-01,UC1Myj674wRVXB9I4c6Hm5zA,US
Ricardinho,35,,https://yt3.ggpht.com/f8aLP9Y5gc6IUsZ-hMwFGc34nKmJw_l0NovE063alMs9X_INBxi2-HpiahA-xz8wAxGfGaC-jPE=s88-c-k-c0x00ffffff-no-rj,3265014,https://www.youtube.com/channel/UCtPYmhNzbNBoAaZByv9vwxg,108000,2024-11-01,UCtPYmhNzbNBoAaZByv9vwxg,BR
K Tech,1350,"Sejam muito bem vindos ao canal K Tech, sigam as nossas redes sociais 😘https://linktr.ee/canalktech",https://yt3.ggpht.com/p7o02LBjihbnyO36l7Lfv-vsQ88CHPpLSCy4lyvF1W27fatS0oQIwRdyE8e0pzvTXBuLICvfCVo=s88-c-k-c0x00ffffff-no-rj,170991939,https://www.youtube.com/channel/UCJY41yD2uXdj3sV-8sMOcGw,1370000,2024-11-01,UCJY41yD2uXdj3sV-8sMOcGw,PT
Lady Gaga,193,ladygaga.comhauslabs.com,https://yt3.ggpht.com/yzOEXrp_77aevhp7br98XrNC0Gl3afLllOStYv91C5_MdGr-s2GtRdCzWVqN2psTN6xlBhidCw=s88-c-k-c0x00ffffff-no-rj,18347404895,https://www.youtube.com/channel/UCNL1ZadSjHpjm4q9j2sVtOA,25100000,2024-11-01,UCNL1ZadSjHpjm4q9j2sVtOA,ZZ
LUIZ DO SOM,2697,"Bem-vindo ao canal Luiz do Som, onde a diversão é garantida! Conheça Luiz, um senhor de idade que vive em um sítio cercado pelos seus queridos animais e que tem o banho como o seu inimigo número um. Acompanhe suas aventuras diárias com seu genro Manetikin e os personagens que adicionam uma dose de comédia ao canal, como Raul, o entregador que só quer receber o seu frete, Waldique, o feiticeiro dono de um ferro-velho, Delegado Ramos, o guardião da lei, e o amável Padre Serafim, entre outros.Embarque conosco em sagas repletas de terror, suspense, ação, aventura e muita diversão. Luiz do Som, Manetikin e sua trupe estão aqui para garantir muitas risadas em cada vídeo. Inscreva-se agora e prepare-se para se surpreender e se apaixonar pelo vovô mais amado do Brasil!",https://yt3.ggpht.com/J7VNa5rKO5m3pf8Fhb0m3Sui8q_OB5UcLqztgGONT2GXgD_UUnAalzfAB7uw3hwVP4HYjNE0=s88-c-k-c0x00ffffff-no-rj,641111415,https://www.youtube.com/channel/UCFJvAGjel1N2QWyOu50pNeQ,856000,2024-11-01,UCFJvAGjel1N2QWyOu50pNeQ,BR
Fraternidade São João Paulo II,3330,"Fundada em primeiro de maio de dois mil e doze (01/05/2012), por Pe. Ailton Fernandes Cardoso (fundador) Somos um Instituto de Vida Religiosa de natureza sacerdotal tendo como modelo inspirador João Paulo II. Após um período de inquietação e muitos sinais, nosso fundador sente-se chamado por Deus a deixar suas seguranças e se lançar na vontade do Senhor.Nosso carisma é expresso pelo lema  TOTUS TUUS IESU PER MARIAM, pois temos esse desejo de SER TODO DE JESUS POR MARIA, e em todas as coisas nos confiarmos a Mãe, pois sabemos que Ela nos levará ao seu Filho.Dentro do nosso carisma temos a missão de SANTIFICAR O CLERO através de nosso testemunho e sermos solícitos as necessidades dos sacerdotes, nos colocando a disposição pela oração e serviço. Com um zelo cada dia maior RESTAURAR AS FAMÍLIAS e movidos por um espírito missionário SALVAR A JUVENTUDE.Nossa regra é o EVANGELHO vivido na radicalidade onde seguimos o CRISTO POBRE, OBEDIENTE E CASTO.",https://yt3.ggpht.com/NwFas-BmhL-S3gcv6o2pmB0ryC60MgMEaknjrQxXsT97Jt7sL449igxUJIUR0GjNZ0Fp4M0w=s88-c-k-c0x00ffffff-no-rj,83204318,https://www.youtube.com/channel/UCvG8Ap6M8l0L80LvHA3wI1w,332000,2024-11-01,UCvG8Ap6M8l0L80LvHA3wI1w,BR
HYBE LABELS,2172,"Welcome to the official YouTube channel of HYBE, the content hub for BIGHIT MUSIC, BELIFT LAB, SOURCE MUSIC, PLEDIS Entertainment, KOZ ENTERTAINMENT, ADOR and more.",https://yt3.ggpht.com/ytc/AIdro_l8g0yRFG8xoe_qeqk8Ki9UFy36cB2IjZEWZWz0h7gl-t0=s88-c-k-c0x00ffffff-no-rj,36578093771,https://www.youtube.com/channel/UC3IZKseVpdzPSBaWxBxundA,75900000,2024-11-01,UC3IZKseVpdzPSBaWxBxundA,KR
Família Oliveira,269,,https://yt3.ggpht.com/7mxsLz8-QhHx-f03m6Sz8ee3kQmJbokNw_IbMAZPpVrLufOpY9Pq5W_1CTuX0h9xN9kNvuCa=s88-c-k-c0x00ffffff-no-rj,183134354,https://www.youtube.com/channel/UCgJnKtIMg8gv_9jTwW-EFpA,856000,2024-11-01,UCgJnKtIMg8gv_9jTwW-EFpA,BR
SMTOWN,4440,Welcome to SM Entertainment Official YouTube Channel!You can enjoy SM artist's latest videos on SMTOWN Official YouTube Channel.,https://yt3.ggpht.com/_1Z4I2qpWaCN9g3BcDd3cVA9MDHOG43lE1YNWDNkKro49haGxkjwuFK-I8faWTKM6Jle9qb4ag=s88-c-k-c0x00ffffff-no-rj,30397847564,https://www.youtube.com/channel/UCEf_Bc-KVd7onSeifS3py9g,32700000,2024-11-01,UCEf_Bc-KVd7onSeifS3py9g,ZZ
Fixz,326,Provavelmente nesse exato momento estou construindo algo no Minecraft E-mail Profissional: fixz@linkme.live,https://yt3.ggpht.com/BbucNXiZIaw9vzDUc-4SccegP_3ztBy51CCD-VvDozFx6zQqYWKYPyJADzfGX60vRrjloFFPYA=s88-c-k-c0x00ffffff-no-rj,175340377,https://www.youtube.com/channel/UCgrFZP2B8H6pWgPL1bAqkiQ,1250000,2024-11-01,UCgrFZP2B8H6pWgPL1bAqkiQ,BR
Domingo Espetacular,8883,"Canal oficial do Domingo Espetacular, que é exibido aos domingos, às 19h45.",https://yt3.ggpht.com/MORc47bbwN4bqGXRiEwjSpNz65lcXp8ZHluoUHN493Q4rxNTSHHW_QSwy5pYVZ_GyYENxjYJxw=s88-c-k-c0x00ffffff-no-rj,2894990771,https://www.youtube.com/channel/UCP-Vg2PcmLiWpEdvMI1R35w,8060000,2024-11-01,UCP-Vg2PcmLiWpEdvMI1R35w,ZZ
Gaebe BS,490,"Olá! Eu sou o Gaebe, mais conhecido como Ervilha aqui no meu canal.Trago vídeos de dicas, além de tier lists e rankings, tudo para ajudar VOCÊ a ser tornar um melhor jogador de brawl stars!Além disso, para os que não são tão chegados a conteúdos mais sérios, estou sempre trazendo curiosidades e temas interessantes a respeito do que está acontecendo dentro do jogo, e sobre sua comunidade!Tenho certeza que você irá gostar dos vídeos, e não se esqueça de clicar no botão de inscrever-se eim!joaovpcwaquim@gmail.comwaquim77@gmail.com",https://yt3.ggpht.com/ytc/AIdro_k1F67pOSUhZxMZ-7CctUwLp9vg382aYByxxK7_d40XeTE=s88-c-k-c0x00ffffff-no-rj,75212366,https://www.youtube.com/channel/UCHkdAapLfLFYbrFJvtdb7LA,270000,2024-11-01,UCHkdAapLfLFYbrFJvtdb7LA,BR
Ben Azelart,354,SUBSCRIBE FOR GOODLUCK!🤑BIZ - ben@ampstudios.coINSTAGRAM - @benazelartTWITTER - @benazelartSNAPCHAT - @TheBenAzelart,https://yt3.ggpht.com/mdLQ_AP35nEMgCDSuOqj7l32s-2edWv8WEmZY8fxPiJ4tI5gWM867-P76O9l8vMxYFX-SkKBIA=s88-c-k-c0x00ffffff-no-rj,7675327017,https://www.youtube.com/channel/UCwVg9btOceLQuNCdoQk9CXg,32100000,2024-11-01,UCwVg9btOceLQuNCdoQk9CXg,US
Viih Tube,660,"Oi, meu nome é Vitória, Viih, e para alguns Viih Tube. Por que? Também não sei...publicidades@viihtube.com.br",https://yt3.ggpht.com/-p_adtPajgDzxDnuIHHpz4ql-LJX5choTflf19snomImOX-LBRiJiiNrbfVD5m5wT5jnfT-Ivh8=s88-c-k-c0x00ffffff-no-rj,956603621,https://www.youtube.com/channel/UCl5i1KWUAV7hdT5_tL8l6RA,11200000,2024-11-01,UCl5i1KWUAV7hdT5_tL8l6RA,BR
ZÉ DA ROÇA E SUA TURMA,357,,https://yt3.ggpht.com/AkLbdrddwFhfogZ6AOqf9TDLMz6mG1xAMAmSlJ9Z_DuyCGXGdcMwE5REz_OwuH_U7-TnZry0rg=s88-c-k-c0x00ffffff-no-rj,347631996,https://www.youtube.com/channel/UC_IXaDwOe5uvuNxcDk45yGg,1220000,2024-11-01,UC_IXaDwOe5uvuNxcDk45yGg,BR
Hoje em Dia,13475,"Canal oficial do Hoje em Dia, da RECORD, com Ana Hickmann, Celso Zucatelli, Renata Alves e Ticiane Pinheiro.",https://yt3.ggpht.com/ytc/AIdro_nX06KSKqBfTIlDvdhEryI3srBoX7hID561b1QnlRbkfw=s88-c-k-c0x00ffffff-no-rj,776860690,https://www.youtube.com/channel/UCN-opsqqDunWO6h5uCp9Y4g,3350000,2024-11-01,UCN-opsqqDunWO6h5uCp9Y4g,ZZ
HYBE LABELS,2172,"Welcome to the official YouTube channel of HYBE, the content hub for BIGHIT MUSIC, BELIFT LAB, SOURCE MUSIC, PLEDIS Entertainment, KOZ ENTERTAINMENT, ADOR and more.",https://yt3.ggpht.com/ytc/AIdro_l8g0yRFG8xoe_qeqk8Ki9UFy36cB2IjZEWZWz0h7gl-t0=s88-c-k-c0x00ffffff-no-rj,36578093771,https://www.youtube.com/channel/UC3IZKseVpdzPSBaWxBxundA,75900000,2024-11-01,UC3IZKseVpdzPSBaWxBxundA,KR
Blogueirinha,970,"Oi meninas e meninos também, tutupom? Bem-vindos ao canal da Blogueirinha. Blogueira, youtuber, ex mãe, vegana, modelo de passarela, modelo fotográfica, cantora, compositora, atriz  e internacional! ",https://yt3.ggpht.com/p4kCgOcKa9Xp3GgkTrG2bn2FbmpQbafNBKNNoPspA5qkMXzDVzsdgHoFU9z4Bmp0KlTXhXoeBUo=s88-c-k-c0x00ffffff-no-rj,223648960,https://www.youtube.com/channel/UCF8MQYobXcHejWAaet4nSxA,1760000,2024-11-01,UCF8MQYobXcHejWAaet4nSxA,BR
Sonar Produtora ,518,,https://yt3.ggpht.com/xbj60MeDkon8m9Vt_Bqj_0wVlkx0ORmewld5Y2etfpVuW___BDJN1HnWkt3pYRdQupxEyeIdEA=s88-c-k-c0x00ffffff-no-rj,1220083762,https://www.youtube.com/channel/UClhFyS7uI884HtPGyI31pRw,1330000,2024-11-01,UClhFyS7uI884HtPGyI31pRw,BR
Aline vida de Mãe ,765,"Olá PRECIOSAS ! Sejam muito bem vindas (os) ao canal . Me chamo Alline tenho 33 anos e venho compartilhar minha vida com vocês sendo mãe , dona de casa , mostro minhas rotinas , faxinas , comprinhas , vida real sendo mãe de 5 . Inscrevam se e venha fazer parte das minhas PRECIOSAS e PRECIOSOS aqui no canal ... ♥️",https://yt3.ggpht.com/hnMbD0auOYDAN4bO19q9IwD-lVwmU6ZtmWQUv5BUhTxQFdrvX-Ne_4Ihh54_K1NAeWBhGZ946g=s88-c-k-c0x00ffffff-no-rj,39000650,https://www.youtube.com/channel/UCiyfYuX4enlwYWl_9nZnMDA,194000,2024-11-01,UCiyfYuX4enlwYWl_9nZnMDA,BR
