Titulo,Numero_de_videos,Descricao,Imagem_de_perfil,Numero_de_visualizacoes,Link,Numero_de_inscritos,Data,Canal_ID,Pais_codigo
The Cosmonaut Variety Hour,265,"Games, movies, television, heartbreak! CVH is your new favorite YouTube channel!Why It Sucks/The Worst Superhero Movies Ever Made:Marcus either loves something or hates it. There is no in-between.Cosmonaut Picture Show:Marcus and the Cosmonaut crew watch movies and react to them!Cosmonaut Quickie:Marcus reviews the latest films!",https://yt3.ggpht.com/ytc/AIdro_msR1H9_Kc-dzhUEbhSrGvTvei7MtadVfdNOuFUWPayhlA=s88-c-k-c0x00ffffff-no-rj,348963859,https://www.youtube.com/channel/UCqTYHSnBUXZamsVcOlQf-fg,1420000,2024-11-01,UCqTYHSnBUXZamsVcOlQf-fg,US
Miniminter,2252,"If you want to see videos with 'KSI', 'my girlfriend' and 'the Sidemen' in titles, you've come to the right place!",https://yt3.ggpht.com/ytc/AIdro_mWGzGJLIMtTpkB82E54v_Fg_0V99UmJT5FiiQkL5HZeGM=s88-c-k-c0x00ffffff-no-rj,4109616593,https://www.youtube.com/channel/UCWZmCMB7mmKWcXJSIPRhzZw,10400000,2024-11-01,UCWZmCMB7mmKWcXJSIPRhzZw,ZZ
GD Colon,264,"Hi there! I'm Craig! (AKA Colon, the punctuation mark not the other one)I make original and humorous videos about Geometry Dash, usually exploring it from a game design perspective and focusing on more casual levels.I really love making stuff so I enjoy making videos, designing games, and especially programming.Also a part time kitsune boy.Upload schedule: One vid every month or two (usually)Profile Photo: @emoti_k0nBanner: @jyrocopter_ + @Nillie_VBFCharacter Art: @LoafeeBunsShrine Background: @NetBa_Art",https://yt3.ggpht.com/K8rChK-eEbBRFZidsAkCLLPFK8M38_0VU5AQOa0szpwQZDbtKDdgjyftvwO9S7hNDfRVa5o85w=s88-c-k-c0x00ffffff-no-rj,164326887,https://www.youtube.com/channel/UCFDsxSlQXpLLpVScy2NmbcQ,685000,2024-11-01,UCFDsxSlQXpLLpVScy2NmbcQ,CA
Veritasium,413,"An element of truth - videos about science, education, and anything else I find interesting.",https://yt3.ggpht.com/ytc/AIdro_nSatGjGLZG1_O1ztYxuKvRazCbk9A0kPhtt2NxEH4ZKfA=s88-c-k-c0x00ffffff-no-rj,2881244335,https://www.youtube.com/channel/UCHnyfMqiRRG1u-2MsSQLbXA,16500000,2024-11-01,UCHnyfMqiRRG1u-2MsSQLbXA,US
The Try Guys,1076,early & uncensored at 2ndtry.tvofficial merch: tryguys.compodcasts: youtube.com/trypod & patreon.com/tryguysbusiness inquiries: 2ndtrybusiness@gmail.com2nd TRY LLC STAFFRachel Ann Cole - Executive Producer & Chief Creative OfficerNick Rufca - Executive Producer & Chief Operations OfficerDevin Wangler - Director of FinanceErica Lynn Schmueck - Head of ProductionDesiree Hurlbut - Associate ProducerEmily Stikeman - Production CoordinatorLeslie Dueñas - Office Administrator / Assistant Production CoordinatorJack McGill - Production AssistantCailyn Hoertz - Social Media Department LeadAiko Igasaki - Social Media AssociateRainie Toll - Podcast ProducerJonathan Kirk - Audio Engineer and Podcast EditorDevlin McCluskey - Senior EditorYB Chang - Senior EditorElliot Dickerhoof - EditorMishelle Martin - EditorSkyler Klingenberg - EditorLiam Sullivan - EditorWill Witwer - Assistant Post Production SupervisorMoira Joy Smith - Assistant EditorChris Burke - Assistant Editor,https://yt3.ggpht.com/AFrVbCB_IUDdllR62GJn_8LfGpHNnTP6w0YMjvMoPxTOdJeTL36O3FfHutj12DBaLzkq1FR7=s88-c-k-c0x00ffffff-no-rj,2762617069,https://www.youtube.com/channel/UCpi8TJfiA4lKGkaXs__YdBA,7990000,2024-11-01,UCpi8TJfiA4lKGkaXs__YdBA,US
Korporate Bidness,361,Follow Me On Instragram For More Videos👉🏿 http://WWW.INSTAGRAM.COM/KORPORATE00,https://yt3.ggpht.com/0NPKDpynR21ImrPD9ocL5PzbsXStC87ijjwDbVSlT5QV1z3QqCk9bwuZdkZa063c4-JNZi5zaA=s88-c-k-c0x00ffffff-no-rj,608407324,https://www.youtube.com/channel/UCE5jd0TxC2My2rQwki9Z7Bg,2610000,2024-11-01,UCE5jd0TxC2My2rQwki9Z7Bg,US
Hoovies Garage,684,"Hoovies Garage documents the adventures of Tyler Hoover, an automotive writer who makes suicidal car purchases, and maintains a fleet of cars he calls the Hooptie Fleet.Best contact for collaboration opportunities is via email. hooviesgaragebiz@gmail.com.",https://yt3.ggpht.com/ytc/AIdro_ndojWkjaCug2sSPB0axaAFVPBDBSWM9KUj4xu--zTRt8w=s88-c-k-c0x00ffffff-no-rj,474363946,https://www.youtube.com/channel/UCdEczn3MVkx_4PnMZ10MVFA,1580000,2024-11-01,UCdEczn3MVkx_4PnMZ10MVFA,ZZ
LazarBeam,1338,THIS CHANNEL FEATURES AUSTRALIAN MANBusiness Inquiries - LazarBeam@night.co,https://yt3.ggpht.com/ytc/AIdro_kaAARWaab8Y9Jt3yWZb2IKs4qgJSHAye7qdbz2VfXacoE=s88-c-k-c0x00ffffff-no-rj,9579305536,https://www.youtube.com/channel/UCw1SQ6QRRtfAhrN_cjkrOgA,22500000,2024-11-01,UCw1SQ6QRRtfAhrN_cjkrOgA,AU
NRL - National Rugby League,9158,"The Official YouTube Channel of the National Rugby League.  Every week will feature exclusive interviews, highlights, and the greatest moments that the NRL has ever produced!Subscribe and hit that notification bell to know when new videos are available here.Follow us on social @nrl and visit NRL.com for all the latest news and updates!",https://yt3.ggpht.com/Pui0xFjDp_F-x0UK5Rkfh1tGkwZLy7fkU4Pr44Zht3DJcMwWXLnxoVIGSRS5Pr7SVxgES0-ouA=s88-c-k-c0x00ffffff-no-rj,358122790,https://www.youtube.com/channel/UC33-OkQ6VCYk8xtml8Pk4-g,451000,2024-11-01,UC33-OkQ6VCYk8xtml8Pk4-g,AU
Call of Duty,2083,"Welcome to The Official Call of Duty® channel! Subscribe and follow for the latest updates on the world's best-selling video game franchise. ESRB: Mature – Blood and Gore, Intense Violence, Strong Language, Suggestive Themes, Use of Drugs.© 2023 Activision Publishing, Inc. ACTIVISION and CALL OF DUTY are trademarks of Activision Publishing, Inc.",https://yt3.ggpht.com/Wz_UJUsKf5PQzlWBhSf0VfshMQbahqDf6byz2uXcSEp9L5nseaCqiYWoagrYjDs3tIOVUqbYRSM=s88-c-k-c0x00ffffff-no-rj,1615720336,https://www.youtube.com/channel/UC9YydG57epLqxA9cTzZXSeQ,7960000,2024-11-01,UC9YydG57epLqxA9cTzZXSeQ,US
JonTronShow,145,Welcome to JonTron! Hopefully laugh!,https://yt3.ggpht.com/ytc/AIdro_mSrXgDqI8wbFAqBf11i83MWuRa0aHwl-FPcWCpxdjNInU=s88-c-k-c0x00ffffff-no-rj,1376357332,https://www.youtube.com/channel/UCdJdEguB1F1CiYe7OEi3SBg,6520000,2024-11-01,UCdJdEguB1F1CiYe7OEi3SBg,US
Los Boyz,31,Los Boyz To The Moon ! ,https://yt3.ggpht.com/MniiuAYkrZ52wWTAg9zm3BuoXqeazE08x9DKUrcoslXSNLUpG72jKM_t7C50ScirQP5LEf2o=s88-c-k-c0x00ffffff-no-rj,9272244,https://www.youtube.com/channel/UCpUjuM2JxUfQxFe9ieyEVpg,151000,2024-11-01,UCpUjuM2JxUfQxFe9ieyEVpg,ZZ
CGP Grey,190,,https://yt3.ggpht.com/ytc/AIdro_nxrDGcxMGo8yKf2_Dw0eaGEWj39IAIdZQjAuz-_mBHjUI=s88-c-k-c0x00ffffff-no-rj,1075892383,https://www.youtube.com/channel/UC2C_jShtL725hvbm1arSV9w,6500000,2024-11-01,UC2C_jShtL725hvbm1arSV9w,GB
Jack Pembrook,25,Self-proclaimed Youtuber Business Inquiries: jackmngmt@gmail.com,https://yt3.ggpht.com/CRRP6luYEiGWhByexmFwu4KzkrG6I0t0MnTJT6b-3AhSnS8hfV8ZkSHUMbHmlqGD3G8aeG9jBA=s88-c-k-c0x00ffffff-no-rj,33563109,https://www.youtube.com/channel/UCm3T3KS21z4d77tt081bVRQ,598000,2024-11-01,UCm3T3KS21z4d77tt081bVRQ,ZZ
Dodger Blue,5139,"DodgerBlue.com is run by credentialed reporters and your trusted source for the latest Los Angeles Dodgers news, rumors, opinion, score updates and more involving Shohei Ohtani, Mookie Betts, Freddie Freeman and the entire team. Join the conversation with Dodgers fans everywhere!",https://yt3.ggpht.com/78-g4H-pC_zWeriAp2w4RbOLkMLLGkr4sVVaNNJV1g-Af4W9YhIXMuRJZYe8oQSnLEs7m5yH=s88-c-k-c0x00ffffff-no-rj,28998754,https://www.youtube.com/channel/UCNEmh_EFKWAu5Bujy6QGeXw,70900,2024-11-01,UCNEmh_EFKWAu5Bujy6QGeXw,US
CarynandConnieGaming,287,"yep, we’re twins and we love gaming! 👯‍♀️❤️",https://yt3.ggpht.com/ytc/AIdro_nnd18je-HRoftA4VnKHcrbk87dPBrMgf0StWIV8MU=s88-c-k-c0x00ffffff-no-rj,234097034,https://www.youtube.com/channel/UCiGnwS3OVEuqbc78ELEFDeQ,1140000,2024-11-01,UCiGnwS3OVEuqbc78ELEFDeQ,US
A24,711,"The studio behind MOONLIGHT, LADY BIRD, EX MACHINA, THE WITCH, EIGHTH GRADE, HEREDITARY, UNCUT GEMS, MINARI, THE GREEN KNIGHT, EVERYTHING EVERYWHERE ALL AT ONCE & more.",https://yt3.ggpht.com/ytc/AIdro_kA7-mt-6SgSSbhnjLQX7_qzvAle93pz26h5GQ9t7iyrpg=s88-c-k-c0x00ffffff-no-rj,1207062529,https://www.youtube.com/channel/UCuPivVjnfNo4mb3Oog_frZg,1350000,2024-11-01,UCuPivVjnfNo4mb3Oog_frZg,US
Safiya Nygaard,217,"Double, double toil and trouble 👽",https://yt3.ggpht.com/ytc/AIdro_lBrCkQ6kyfPMGTF1YrqNKgNC_ety8JGms3FH8rsxlNma8=s88-c-k-c0x00ffffff-no-rj,2025752733,https://www.youtube.com/channel/UCbAwSkqJ1W_Eg7wr3cp5BUA,10100000,2024-11-01,UCbAwSkqJ1W_Eg7wr3cp5BUA,US
"Tyler, The Creator - Topic",322,,https://yt3.ggpht.com/-1Bt8eufq601KzmA0Rk1yrIzz372UDDeBkIpWytlztkcAyh1w6g2bNfXVnR6hadnezvUCq0XICA=s88-c-k-c0x00ffffff-no-rj,1374082659,https://www.youtube.com/channel/UCo1DYcm1IZ9v3UPkpiAcgtg,91100,2024-11-01,UCo1DYcm1IZ9v3UPkpiAcgtg,ZZ
Apple,201,"Welcome to the official Apple YouTube channel. Here you’ll find news about product launches, tutorials, and other great content. Apple revolutionized personal technology with the introduction of the Macintosh in 1984. Today Apple continues to be a global leader in innovation with products like iPhone, iPad, Mac, Apple Watch and Apple Vision Pro. Our six software platforms (iOS, iPadOS, macOS, watchOS, tvOS, and visionOS) provide seamless experiences across Apple devices. Breakthrough services include the App Store, Apple Music, Apple Pay, and iCloud. And Apple keeps pursuing innovation with products like HomePod, Apple Fitness+, and Apple Card. Apple’s more than 160,000 employees are dedicated to making the best products on earth, and to leaving the world better than we found it. Additional products include AirPods, AirTags, Apple Arcade, Apple Books, Apple News, Apple Podcasts, and Apple TV.",https://yt3.ggpht.com/05lhMeAH6tZrPIUsp2yHNz3DwzhKbDUQcxcY0_qeXVyZttR_pktBzw0FcLUSR6D4fVqsEgL3ZO0=s88-c-k-c0x00ffffff-no-rj,1182083323,https://www.youtube.com/channel/UCE_M8A5yxnLfW0KghEeajjw,19800000,2024-11-01,UCE_M8A5yxnLfW0KghEeajjw,US
Micro TDH,136,Micro TDH,https://yt3.ggpht.com/ZQn80H1OkpVt9ciQMnOKCdvJn6394R-lehAamtelPxIBQ4XPV47QLPCLqVWH3JbalTIFMGB8VA=s88-c-k-c0x00ffffff-no-rj,1719339639,https://www.youtube.com/channel/UCiY0OXcrK16AqMS4aF3nYoQ,4000000,2024-11-01,UCiY0OXcrK16AqMS4aF3nYoQ,US
Steve Morris Engines,948,"Each year we prioritize and build less than 100 exclusive, full-custom engines. Our priority is the relationship we forge with our customers, many of whom have been with us for decades.Taking a holistic approach, we start with a conversation on concept, goals and aspirations. Our many years of experience have given us an opportunity to maximize returns for clients in ways they may not have previously considered.Our tuning process is in-depth and bespoke for each customer. We believe in testing and optimizing the engines we build. When faced with ever-increasing power output from our engine combinations, we set forth to improve our testing equipment. With our in-house prototype development and CNC machining capabilities, we developed and constructed our engine dyno to meet the rigorous demands. As a result we now have the capability to (engine) dyno tune engines that exceed 4,500 horsepower.",https://yt3.ggpht.com/nYyBTpGKJv5VRMEGJ-l6WEoz3oqmmXtuslPnWAF0D3lQLac2TKEL0WiCNzeVy8EPcd3XuUvN=s88-c-k-c0x00ffffff-no-rj,78865711,https://www.youtube.com/channel/UCYI0jaSzd7aLRj7KCGHkz3g,477000,2024-11-01,UCYI0jaSzd7aLRj7KCGHkz3g,US
MLB,296963,,https://yt3.ggpht.com/ytc/AIdro_m7Zarb7n7bd4-NiuFBupJiuYleRAvPl3O7I3fnbkaCC_Lo=s88-c-k-c0x00ffffff-no-rj,5807521762,https://www.youtube.com/channel/UCoLrcjPV5PbUrUyXq5mjc_A,5870000,2024-11-01,UCoLrcjPV5PbUrUyXq5mjc_A,ZZ
Sam and Colby,353,"What's up guys! On this channel we create haunted, exploration videos.  Our most popular series include Stanley Hotel, Hell Week,  The Attachment, Empath, and Queen Mary. Subscribe to explore, travel, go ghost hunting, and watch some scary content.Much love-S and C XPLR Clothing Twitter @SamandColby lnsta: @SamGolbach @ColbyBrock Business: SamandColbyBusiness@gmail.comscteam@night.co",https://yt3.ggpht.com/qlTX57wuRVmv3D9NxIbjoCBcnEcGuf3hMv4dUpPKTUe3OSDV71SE335_X8-wqZrfjjYu27r_jQ=s88-c-k-c0x00ffffff-no-rj,1937753195,https://www.youtube.com/channel/UCg3gzldyhCHJjY7AWWTNPPA,13200000,2024-11-01,UCg3gzldyhCHJjY7AWWTNPPA,US
Seanie Dew,532,Hello! My name is Seanie! Thanks for checking out my channel!,https://yt3.ggpht.com/jAF-NAYgJWKBXWTaNVr2z2S--RfAzo4cI67V-0rxb6yJSTsIdTcVWp67hc1M8wNuXEjg6WW0wQ=s88-c-k-c0x00ffffff-no-rj,262559875,https://www.youtube.com/channel/UC9OucCej3Rx7tS3O7df4ReA,584000,2024-11-01,UC9OucCej3Rx7tS3O7df4ReA,US
Skill Up,976,,https://yt3.ggpht.com/8xGO9b3h8aPyBZeGq96uLHWVgLAEpLNRf5n9lPdYg2pQ9vq3_z_5GLs4JvumwrP4FNRU3DtL9Q=s88-c-k-c0x00ffffff-no-rj,266226681,https://www.youtube.com/channel/UCZ7AeeVbyslLM_8-nVy2B8Q,1030000,2024-11-01,UCZ7AeeVbyslLM_8-nVy2B8Q,AU
G Herbo,297,"Platinum-selling rapper Herbert “G Herbo” Wright has endured a season of close calls and losing several of his closest friends to senseless gun violence in his native Chicago. All of this was channeled into his critically acclaimed double album, Survivor’s Remorse in 2022 which Rolling Stone called, “another potent look into his rattled, conflicted psyche that also doubles as a celebration of his 10-year run as one of the most enduring young rappers to come out of Chicago’s drill scene.” Following up from his 2023 mixtape, Strictly For My Fans 2, and earning  Platinum and Gold plaques for Nardo Wick’s “Who Want Smoke” and his late friend Young Dolph’s “One Scale” that same year, Herbo aims to reach his full potential as an artist with his celebratory offering for the summertime, Big Swerv. The album is executive produced by longtime collaborators Southside and Big Oz.G Herbo's four albums,”PTSD,” “25,” “Swervo,” and his debut, “Humble Beast” all reached the Billboard Top 200 chart.",https://yt3.ggpht.com/7jXlseXnRSZ-8U4DjJcIQitBQaRnt951CbvdRpWkkD_QS3XMWazmC0fWixDKTwjmGNqCYM16dw=s88-c-k-c0x00ffffff-no-rj,1233226439,https://www.youtube.com/channel/UCV0pIPt5HFfulonNog3cz1A,1670000,2024-11-01,UCV0pIPt5HFfulonNog3cz1A,US
Disney Dreamlight Valley,51,Journey across Dreamlight Valley to restore the magic alongside your Disney and Pixar heroes in this new hybrid life-sim adventure game. #LiveMagically ,https://yt3.ggpht.com/Av48lMm6gQz7Vo-nPdBTcLO3tzpLus6d0-voyzbcW_CQ2BauDnIYX0kEiDQWWsEKNd0zWYrT-A=s88-c-k-c0x00ffffff-no-rj,11781294,https://www.youtube.com/channel/UC2Dw_6M4WG-zxKIVRrHsdNw,54000,2024-11-01,UC2Dw_6M4WG-zxKIVRrHsdNw,ZZ
Universal Orlando Resort,1067,Shouldn’t researching vacations be as much fun as taking them? We think so. Right now you’re at the top of the roller coaster where the possibilities seem endless. We’re here with the videos and series to keep you smiling all the way down. Buckle up and keep your hands in the vehicle…From POVs of the best theme park rides and attractions to family vacation planning tools. From delicious food guides to hotel tours. We’ll give you all the info you need and entertain along the way.Subscribe to keep in the loop on all things Universal Orlando Resort!,https://yt3.ggpht.com/UMaX_Y0antDNNYgnDCEHNG8C5aJcUPlZJPoEGJe-NO1jyAQb7dmEKMguz8nBbXO6js_O64w3cg=s88-c-k-c0x00ffffff-no-rj,237939883,https://www.youtube.com/channel/UCGl3kbSLHfKb3QeOYG7pAuA,345000,2024-11-01,UCGl3kbSLHfKb3QeOYG7pAuA,US
The Royalty Family,796,"Welcome To THE #ROYALTY FAMILY Youtube Channel. We are a modern blended family based in Los Angeles that love to entertain you. We believe in family, fun, Love and are passionate about fashion, comedy and culture. Join us every week in sharing the good times of Andrea, Ali Saleh, Ferran and our Chihuahua Princesa. Best of all, we believe everyone can be ROYALTY so don’t forget to SUBSCRIBE!!FOR BUSINESS INQUIRIES EMAIL HERE  ➡ Royaltyfambusiness@gmail.com",https://yt3.ggpht.com/4bd4uTnsLgMv5x1eRrEfh8bu_7Wf45rkrbsteMs06f2r4SEj0smqML32Ub3pHihsgnk_hWSv=s88-c-k-c0x00ffffff-no-rj,8940007096,https://www.youtube.com/channel/UCja7QUMRG9AD8X2F_vXFb9A,26800000,2024-11-01,UCja7QUMRG9AD8X2F_vXFb9A,US
All Blacks,7951,"All Blacks is the official YouTube channel for the New Zealand's Teams in Black, including the All Blacks and Black Ferns. ",https://yt3.ggpht.com/ytc/AIdro_lkK4AcnsMwy14DBXkxVWTszFgjZh0DAmwHEYpmQUCQWgo=s88-c-k-c0x00ffffff-no-rj,404138569,https://www.youtube.com/channel/UCsAPiUMyBjtKamxYGbSUnLA,949000,2024-11-01,UCsAPiUMyBjtKamxYGbSUnLA,NZ
GrandTV,2225,Follows our GRAND shows and events from Miss Grand International and Miss Grand Thailand Pageant including other programs and features from MGI Media Group.,https://yt3.ggpht.com/FpcqY8fd_feHoQs1sSh_1IJo6pCtqaXu_wKEiTg27EgiGjHfHjp8XZ7mwHs-2cDYNJ0AcqMC=s88-c-k-c0x00ffffff-no-rj,265513851,https://www.youtube.com/channel/UCOuId57F0KOwFkLXCdTQSNw,2060000,2024-11-01,UCOuId57F0KOwFkLXCdTQSNw,TH
CS99TV,506,Just a group of friends creating baseball content. Also home to the Pottstown University Scouts. ,https://yt3.ggpht.com/NPRh_B90QYnDHWF4TWo1M0wvv9gDNYIrWpN5tLLHEdgrurhxcqK6XJhDGzPUlA9Ef6iZNm6reHM=s88-c-k-c0x00ffffff-no-rj,1647897157,https://www.youtube.com/channel/UCFSaBAqySWbnd61n9r3Dd1g,1290000,2024-11-01,UCFSaBAqySWbnd61n9r3Dd1g,ZZ
TanqR,850,"Welcome to my channel, I am a Roblox Video Star creator that makes gaming videos.Support me by using creator code TanqR on Roblox",https://yt3.ggpht.com/ytc/AIdro_nroVvwtUqkQbxr22X8bpy06QeirDqlvMC8zEave3fWaIA=s88-c-k-c0x00ffffff-no-rj,1467211039,https://www.youtube.com/channel/UCquKkmifC6eDU-bbKxqjJgw,4280000,2024-11-01,UCquKkmifC6eDU-bbKxqjJgw,GB
Joseph's Farm Design,64,"How’s it going? I’m Joseph, & welcome to my happy flock!Greetings from Canada, my name is Joseph and I’m here to make wholesome and informative videos, and most of all I want to be able to share my flock with all of you! My birds are my pets and keeping them is my favourite hobby, and I want to inspire and educate others who want birds of their own.I always love to hear what you have to say and love answering your questions! So leave all the comments you want and feel free to dm me on Instagram!That’s all I have for now, I hope to see you around here again some time. Until then, Have a good one, and See ya!",https://yt3.ggpht.com/QAdBp9N3LhWipqdLVc595w0KfeFLnS5khays08Gwr0DGN9tSfGZ2YtMb-u07OwqkWiBQ-d6z=s88-c-k-c0x00ffffff-no-rj,24149442,https://www.youtube.com/channel/UCrZEL4o7SYy8-FoYyvh7pJg,43100,2024-11-01,UCrZEL4o7SYy8-FoYyvh7pJg,CA
Deep Pocket Monster,243,"A Pokémon channel where every video is worth watching. The best challenges and the most fun you’ll find. Don’t miss out, and you might even win something too. ",https://yt3.ggpht.com/JyPzhWGWi2NNscxlRtwhlhtIwQURnXqE7M3-K-cc7bJVfYDctiWkDOF5K8OzyE_dkZc9BLhRf18=s88-c-k-c0x00ffffff-no-rj,224705655,https://www.youtube.com/channel/UCnnrLDosqnpRPQ_TH3uXnnQ,1000000,2024-11-01,UCnnrLDosqnpRPQ_TH3uXnnQ,US
Breakfast Club Power 105.1 FM,11757,Listen on iHeartRadio weekdays from 6-10am!Instagram: @BreakfastClubAMTwitter: @BreakfastClubAMTikTok: @BreakfastClubAMThreads: @BreakfastClubAM,https://yt3.ggpht.com/CP-F0Vy_lGS8DwZEG31BXHBlarXD6P9_-EWnd0h-tz3AwCKqZKVkcvYKk2Dp1xcExe0mIhzM2bI=s88-c-k-c0x00ffffff-no-rj,3286711597,https://www.youtube.com/channel/UChi08h4577eFsNXGd3sxYhw,5650000,2024-11-01,UChi08h4577eFsNXGd3sxYhw,US
COLORS,1298,"COLORSXSTUDIOS is a unique aesthetic music platform showcasing exceptional talent from around the globe. COLORS focuses on the most distinctive new artists and original sounds in an increasingly fragmented and saturated scene. All COLORS shows seek to provide clear, minimalistic stage that shines a spotlight on the artists, giving them the opportunity to present their music without distraction.@colorsxstudios on all socials",https://yt3.ggpht.com/ytc/AIdro_nFe5LeXpVm-ggGY9NH3JqYvVyU1NBcXHZ827U0JtoFa0M=s88-c-k-c0x00ffffff-no-rj,3109589117,https://www.youtube.com/channel/UC2Qw1dzXDBAZPwS7zm37g8g,7730000,2024-11-01,UC2Qw1dzXDBAZPwS7zm37g8g,DE
MrMattyPlays,3810,"If RPGs are your thing, you're in the right place meaning if you can level up in it, I'll be covering it. Historically, I create content for anything Fallout, Elder Scrolls, Mass Effect, Cyberpunk 2077, The Witcher, or Star Wars related, but it doesn't stop there. I do in-depth reviews, thoughtful discussions, walkthroughs, guides, tips/tricks, tutorials, and speculation, if that is your jam.Business Inquiries: mattyplaysbusiness@gmail.com",https://yt3.ggpht.com/ytc/AIdro_m3UHNKz6Ij09MCgy199Ytx2jiagJrvccvisMznocKfdmM=s88-c-k-c0x00ffffff-no-rj,225269741,https://www.youtube.com/channel/UCmXH6CX_juGwNFTj3PESdoA,577000,2024-11-01,UCmXH6CX_juGwNFTj3PESdoA,US
Brawl Stars,246,Fast-paced 3v3 multiplayer and battle royale made for mobile! Play with friends or solo across a variety of game modes in under three minutes.,https://yt3.ggpht.com/FVJpJyrV85TDL2nyiFbnaBuZzuYX1thQywPXCvilPAuw7DmPjFoXphPgkCqekYNIfqFtqGrvCg=s88-c-k-c0x00ffffff-no-rj,2934011885,https://www.youtube.com/channel/UCooVYzDxdwTtGYAkcPmOgOw,20600000,2024-11-01,UCooVYzDxdwTtGYAkcPmOgOw,FI
Caspahz,368,,https://yt3.ggpht.com/ytc/AIdro_nk10Pa_gI4SrQFTAwVHPE2VjTraEvaVSNtlfofQaG9J40=s88-c-k-c0x00ffffff-no-rj,44520869,https://www.youtube.com/channel/UClBnxUXbfpnwZjchDz52B7Q,196000,2024-11-01,UClBnxUXbfpnwZjchDz52B7Q,CA
HAUS PLANS™️,333,"General Contractor, Content CreatorMerch available https://crownquality.com/haus-plans-store.htm",https://yt3.ggpht.com/GeUGnUEM9aIQEDsL0BTBXLwfjHr0mkNWToFg1fVEF5Mq-Lxjkb54KPvpJjXLbrbmpYVn5gEwGg=s88-c-k-c0x00ffffff-no-rj,525878225,https://www.youtube.com/channel/UCFMGCDS4rQprREJJa8f4F0Q,878000,2024-11-01,UCFMGCDS4rQprREJJa8f4F0Q,US
Isaac Punts,1029,"I'm Isaac PuntsWelcome to the Darkside of Football where it's all special teams all the time.  I also give love to other leagues that need it as well.Thanks for checking me out, if you like the content, consider subscribing, if you don't, hit the Dislike Button on all my videos ",https://yt3.ggpht.com/BEgOHUeF_TpN9ZkUU1yJvqr9xL5MFoB6ZA53WWEayz4k1IwAUzTTHzksxR5I_ghg3e94e_6S=s88-c-k-c0x00ffffff-no-rj,90876921,https://www.youtube.com/channel/UCAND1td-OhOUbi7S1EnRWzg,91700,2024-11-01,UCAND1td-OhOUbi7S1EnRWzg,US
Ryland vlogs,106,,https://yt3.ggpht.com/ytc/AIdro_mS1tgg8j0uMR5LJtOdRKUf7DzVXDUkeBVTNgzh9fIPNw=s88-c-k-c0x00ffffff-no-rj,87822885,https://www.youtube.com/channel/UCVe_RrR9AMeY6Z8ixOv5gtw,558000,2024-11-01,UCVe_RrR9AMeY6Z8ixOv5gtw,US
Bandai Namco Entertainment,9688,バンダイナムコエンターテインメント　公式YouTubeチャンネルThis is the official site in YouTube of the Bandai Namco Entertainment Inc.=====※2022年4月よりコーポレートブランド変更に伴い「876TV」は「Bandai Namco Entertainment」へ名称が変更されました。=====,https://yt3.ggpht.com/tRyXJNKry6h_jWQOp-LEdw1hVJQDCVzyXLIlEGjfjg9U1woUwSkOjnlTjDzen_n_QPWn7tlbzA=s88-c-k-c0x00ffffff-no-rj,977288091,https://www.youtube.com/channel/UCqly9F4Fr_jf2Y1Cy5hacRg,1800000,2024-11-01,UCqly9F4Fr_jf2Y1Cy5hacRg,JP
TheAMaazing,71,"My names Maaz (TheAMaazing, get it?), and I'm the animator crafting high quality animated stories for everyone to enjoy!Banner by Nunu91011 ♥",https://yt3.ggpht.com/QEeSkUwlLfWePb_XJ4bHMIvWxfD2wzvzH1zHEMVXi-7mVNwUgwlmRq-HYNFRlBAFnqBCaQ-7=s88-c-k-c0x00ffffff-no-rj,132476012,https://www.youtube.com/channel/UCQ9HvHH-KRYHI5ynj2kbLwQ,1330000,2024-11-01,UCQ9HvHH-KRYHI5ynj2kbLwQ,AU
KAED,534,ROAD TO 1M ⭐️Here to bring lots of laughs and smiles.Subscribe for more videos!!Eddies Twitter: @Eddiezepeda36Karens Twitter: @Karenmendoza_xoEddies Instagram: _eddiezepedaKarens Instagram: karenmendoza__Eddies Snapchat: eddie_zepeda24Karens Snapchat: karen_mendoza 97For business inquiries: KAED@kashtm.net,https://yt3.ggpht.com/UG03tcJuh4_mGGT8-Ad1VA-6SK6M3ePH11MkkFwv_vVnwhDEfrRAPCMiatzmhEV5miScgC7x=s88-c-k-c0x00ffffff-no-rj,87927172,https://www.youtube.com/channel/UC2upFSUuyXXNDAFQ9Kt3nVA,495000,2024-11-01,UC2upFSUuyXXNDAFQ9Kt3nVA,US
Any Austin,359,THE worst video game shows on the internet. by far.,https://yt3.ggpht.com/37nWuIPBwv9jk88_wNbJsJlgRAEihks21R1kx_HiC9fJO7z-R9qj-vhFpDTh20jEJuhftSBmdw=s88-c-k-c0x00ffffff-no-rj,41389877,https://www.youtube.com/channel/UCH_7doiCkWeq0v3ycWE5lDw,525000,2024-11-01,UCH_7doiCkWeq0v3ycWE5lDw,US
Statman Dave,775,"I’m here to talk all things tactics, analysis and players in the biggest matches across all European leagues as well as player signings and the discovery of the next best players out there. Personable, on the ball analysis, presented by me, Statman Dave.300k subscribers and counting.Follow me across socials:Twitter & Instagram @StatmanDaveBusiness Enquiries info@statmandave.com",https://yt3.ggpht.com/Y5Hwg4hrQpAwJq8QJwksGnoAjJNDFeyumBD7Ah-9xaLAqf6yoWf51ccumerKGeKnGCrLU-gw3A=s88-c-k-c0x00ffffff-no-rj,44117055,https://www.youtube.com/channel/UCXzrxvm0Jqq1OpSZQhT6lEQ,340000,2024-11-01,UCXzrxvm0Jqq1OpSZQhT6lEQ,GB
Trixie Mattel,575,"Your favorite world famous drag queen with a passion for makeup artistry, the absolute Legend, Icon, and Star Trixie Mattel! Ages 3 and Up, Accessories Sold Separately, Batteries Not Included",https://yt3.ggpht.com/Svcaci29HMBNH9kkkqV3RWzNstLdQ0NSc2KuejMHOQ5IWOKfyqxpotZecMPzWLtdGW1rXGAivQ=s88-c-k-c0x00ffffff-no-rj,429230120,https://www.youtube.com/channel/UC0biFgrMdkv1hFAFLVePODQ,2180000,2024-11-01,UC0biFgrMdkv1hFAFLVePODQ,US
James Marriott,197,I make funny thingsbusiness: jamesmarriott@touchpoint.gg,https://yt3.ggpht.com/ytc/AIdro_nI_uPn702YkPjz5jV0dv0ciAz-Wtt07ROk9YiZ831rU2w=s88-c-k-c0x00ffffff-no-rj,224359448,https://www.youtube.com/channel/UCwM8W2IEsCLRQWc6krOlRVw,2010000,2024-11-01,UCwM8W2IEsCLRQWc6krOlRVw,GB
