Titulo,Numero_de_videos,Descricao,Imagem_de_perfil,Numero_de_visualizacoes,Link,Numero_de_inscritos,Data,Canal_ID,Pais_codigo
MC Luuky,13,"Canal oficial do cantor e compositor, MC Luuky.",https://yt3.ggpht.com/OshRY-a1ZfwYmbhBZTD5xhOrkkqqrD4a-DJa6Gatwu9vOYBeRugYsLubV8bSN4SCLhqJb5Oe=s88-c-k-c0x00ffffff-no-rj,92859687,https://www.youtube.com/channel/UCG90vRbG7aMXu0nD0DQ2wFA,122000,2024-11-01,UCG90vRbG7aMXu0nD0DQ2wFA,BR
SBT Sports,3836,"Casa da Copa Sul-Americana e Champions League, com cobertura diária dos principais torneios do mundo e informações exclusivas. Você também pode conferir tudo o que rola no programa esportivo mais raiz da TV, o Arena SBT.",https://yt3.ggpht.com/kwzMcZ6CQhfL9xVI-Qoa_QymBaqB6az-wbhONAWTo5v-kkWRHARJeC5MhxGEGO0oNbMyB0Pdte8=s88-c-k-c0x00ffffff-no-rj,313559107,https://www.youtube.com/channel/UCxc3marqP9BJSkQ0_K4mqDg,1350000,2024-11-01,UCxc3marqP9BJSkQ0_K4mqDg,ZZ
Nattan,355,"Canal Oficial do Nattanzinho Nascido em Sobral e criado em Tianguá, ambos interiores do Ceará, Natanael Cesário dos Santos, o Nattan, começou a cantar aos 15 anos na escola, bares e restaurantes. Com a carreira em ascensão desde que passou a usar o nome Nattan como marca, no final de 2020, o jovem cantor de apenas 21 anos de idade, chega como uma das grandes apostas para o tão concorrido cenário da música nacional. Apadrinhado por Xand Avião, Nattan já mostrou que pretende entrar com força total no mercado forrozeiro. E talento pra isso ele tem!",https://yt3.ggpht.com/jNNrrYSxzdlg9Ptot8f2kZEGz7dGxos2pkT1uplaMzca8942VNqpxDF3XgNJtzXX-RHpaZtiTw=s88-c-k-c0x00ffffff-no-rj,1814182759,https://www.youtube.com/channel/UC3EPFEI1TdOtPdDPS1nRt2w,2160000,2024-11-01,UC3EPFEI1TdOtPdDPS1nRt2w,BR
Henrique e Juliano,355,"Canal oficial da Henrique & Juliano. Seja bem-vindo(a). Aqui você vai ver o que a persistência, o trabalho, e principalmente a nossa FÉ tem feito em nossas vidas. ",https://yt3.ggpht.com/VU3-tA2KKIVn6QkIf0n36qKOzpuuLGuPvazF22yMosDxX3SSMOjgP2L8KLEQVz65p67ddsCVLQ=s88-c-k-c0x00ffffff-no-rj,17714911850,https://www.youtube.com/channel/UCfLTxnQboSLcoSakgONmukQ,16300000,2024-11-01,UCfLTxnQboSLcoSakgONmukQ,BR
TheWeekndVEVO,205,"The Weeknd on Vevo - Official Music Videos, Live Performances, Interviews and more...",https://yt3.ggpht.com/E9LfgUnjdf7A_d8_9iqVvai4HSwIvrE6NE6yKXOIQjHNXzWdWg5NNU7-a1flZGspflBmYXKtxw=s88-c-k-c0x00ffffff-no-rj,20207560776,https://www.youtube.com/channel/UCF_fDSgPpBQuh1MsUTgIARQ,10400000,2024-11-01,UCF_fDSgPpBQuh1MsUTgIARQ,CA
BABYMONSTER,332,BABYMONSTER Official YouTube Channel베이비몬스터 공식 유튜브 채널입니다.,https://yt3.ggpht.com/79MZT_n38ZBWrEUjhxwjOGVqsTtBLJBmUEojOvTNNcZguBuoxvZtQse-A-D0Kt6GamsYVPCnqQ=s88-c-k-c0x00ffffff-no-rj,2785108912,https://www.youtube.com/channel/UCqwUnggBBct-AY2lAdI88jQ,7200000,2024-11-01,UCqwUnggBBct-AY2lAdI88jQ,KR
Simone Mendes,57,"Simone Mendes, conhecida por sua energia, irreverência e respeito ao público, tornou-se uma das cantoras mais premiadas e ouvidas do Brasil em 2023. Seu primeiro projeto solo, Cintilante, foi um enorme sucesso, com a faixa Erro Gostoso ganhando prêmios importantes e acumulando certificações. O álbum atingiu mais de 600 milhões de streams, enquanto Erro Gostoso sozinho ultrapassou 320 milhões de streams.Simone lançou o projeto Cantando Sua História em fevereiro de 2024, com 30 milhões de streams até agora. Internacionalmente, ela realizou uma turnê bem-sucedida na Europa e recebeu um disco de platina em Portugal. Nas redes sociais, Simone tem uma presença massiva, com milhões de seguidores no Instagram, TikTok, YouTube e Twitter.",https://yt3.ggpht.com/ubBZP42md7T-83V8YvFHqcGhZw9cooUVP3ScvkK-GuZKo1Ek17OY1GRuyKvg-PndxCqZY5eUdg=s88-c-k-c0x00ffffff-no-rj,1662331926,https://www.youtube.com/channel/UCH7vP1JyEwTy-D-ikZUoCww,5880000,2024-11-01,UCH7vP1JyEwTy-D-ikZUoCww,BR
Emilly Vick,788,"Ei,espero que gostem dos vídeos e se divirtam bastante comigo.Me sigam no insta 🩷👇🏻https://www.instagram.com/p/CHBIt4-naJp/?igshid=1xuqdndah26v6-Parcerias:📨⭐️dosrosa@agenciacurta.com",https://yt3.ggpht.com/-j8MrNAuS0IHQpJGoWRnX0HMCzT6e213cd_Qcpl-Lrg41K0C3smPB3QrLxCf3dGGjdK_T8xTpu8=s88-c-k-c0x00ffffff-no-rj,9067296697,https://www.youtube.com/channel/UC63iwP6BtIjxB6xn1GKR6Lw,20200000,2024-11-01,UC63iwP6BtIjxB6xn1GKR6Lw,BR
Enaldinho,4592,"Falaaa, galera! Beleza??  Preparem-se para uma explosão de diversão toda semana no meu canal do YouTube! Pegadinhas, desafios e vlogs - tudo para garantir muitas risadas! Se inscreva já para não perder nenhum momento dessa aventura!",https://yt3.ggpht.com/ytc/AIdro_nuUiBgezNCkwsLB0lPoKEjHqLVuv9FGgAdFB9BQAqrYOM=s88-c-k-c0x00ffffff-no-rj,17581008884,https://www.youtube.com/channel/UC2bYhAHyaqfWlPXWBVk4BcA,39400000,2024-11-01,UC2bYhAHyaqfWlPXWBVk4BcA,BR
Jazzghost,5921,Jogo uns jogos e passo vergonha. CONTATO: comercial@agenciacurta.com,https://yt3.ggpht.com/_QWLAwBwKXViiV5aOQBIpipDrh7iMhrpv7EMbqIL4kfVealfeXJ7CY49Uma1VeqVnkYUucW4r8Q=s88-c-k-c0x00ffffff-no-rj,7854907737,https://www.youtube.com/channel/UCIXguhHCl8eDTkXpEuiGPUA,18000000,2024-11-01,UCIXguhHCl8eDTkXpEuiGPUA,ZZ
Netflix Brasil,5760,"Aqui você encontra trailers fresquinhos, novidades, recomendações e muuuuuuito mais. ✨Se inscreve aí para não perder nada!",https://yt3.ggpht.com/r4m9_f2nH87wTf1yoBFvwRe5pjE_lJIaKCZUkdgOq8MokC5dnpM6WbcJ4i5RQlBuBcsoRJB0cA=s88-c-k-c0x00ffffff-no-rj,1927675208,https://www.youtube.com/channel/UCc1l5mTmAv2GC_PXrBpqyKQ,12600000,2024-11-01,UCc1l5mTmAv2GC_PXrBpqyKQ,BR
Irmãos Dias Podcast,2682,"Canal OFICIAL Irmãos Dias Podcast. Toda semana, episódios completos e cortes sobre investimentos, negócios, empreendedorismo e política com convidados selecionados e que entendem muito sobre os assuntos explorados.Contato: ytirmaosdias@gmail.com ",https://yt3.ggpht.com/YdLTgYty6E9NqoK1lY-vwq073OMozZ-OMFAe_RLt48D2qdb0vSyBrW5wIfAxu58CKUCkGzxQ8A=s88-c-k-c0x00ffffff-no-rj,192296198,https://www.youtube.com/channel/UChBtPExX9RjCdmpAizK7ccQ,808000,2024-11-01,UChBtPExX9RjCdmpAizK7ccQ,BR
Canal GOAT,2783,"Faça parte da comunidade GOAT na Casa de Apostas!  Divirta-se! (+18 aposte com responsabilidade)Ao vivo, grátis e com imagens no YouTube! Série B, Libertadores Feminina, UFC, Liga Saudita, Bundesliga, NWSL, programação ao vivo  e muito mais! 🐐Publicidade: contato@canalgoat.com.br",https://yt3.ggpht.com/lQbsmXG4-b751D81rRQ2DSmXVsu7WRPelClSw4Oc3jkJ6dxzgUne8AyZL4A6v5uH74x659wnvA=s88-c-k-c0x00ffffff-no-rj,393167516,https://www.youtube.com/channel/UC_oToDrJ6uca7d1dFVBmLtg,3830000,2024-11-01,UC_oToDrJ6uca7d1dFVBmLtg,BR
Paramount+ Brasil,2032,Somos todos soldados da Zoe Saldaña 🫡,https://yt3.ggpht.com/9YbVRdlQhUyY_EyD5OmuILuutqiWop4P_2zH2ALtmR1L73E-b8IZoEUhiW73CvMHsrRAbmFWROM=s88-c-k-c0x00ffffff-no-rj,142153113,https://www.youtube.com/channel/UCAnCxJ1Weh2pUAKJW0bro0Q,512000,2024-11-01,UCAnCxJ1Weh2pUAKJW0bro0Q,BR
Cruzeiro Esporte Clube,5043,Canal oficial do Cruzeiro Esporte Clube,https://yt3.ggpht.com/tAM8Rhhw8sG42ZhtwtNWtkxxY9z7Lsn1JjdHpaElRx9Os2ZHZH1rgreZR-9KGnFT7_drF-T-=s88-c-k-c0x00ffffff-no-rj,101946961,https://www.youtube.com/channel/UCqifkpdmE1z3VhfQoJzwpJQ,638000,2024-11-01,UCqifkpdmE1z3VhfQoJzwpJQ,BR
MUSSA GAME,181,,https://yt3.ggpht.com/MD5bffqNH-8Mjpj6fOJI4C67jQvWoukbjjgQX1kqymVoqlWZyI6opY3dcODycPI8nLMdOAY_6Q=s88-c-k-c0x00ffffff-no-rj,62734537,https://www.youtube.com/channel/UCYC7HG92sGQjkcMrs8F4wBA,777000,2024-11-01,UCYC7HG92sGQjkcMrs8F4wBA,ZZ
Paramount+ Brasil,2032,Somos todos soldados da Zoe Saldaña 🫡,https://yt3.ggpht.com/9YbVRdlQhUyY_EyD5OmuILuutqiWop4P_2zH2ALtmR1L73E-b8IZoEUhiW73CvMHsrRAbmFWROM=s88-c-k-c0x00ffffff-no-rj,142153113,https://www.youtube.com/channel/UCAnCxJ1Weh2pUAKJW0bro0Q,512000,2024-11-01,UCAnCxJ1Weh2pUAKJW0bro0Q,BR
Mariah Carey,149,"Welcome to Mariah Carey's official YouTube channel!MARIAH CAREY is the best-selling female artist of all time with more than 200 million albums sold to date and 19 Billboard Hot 100 #1 singles (18 self-penned), more than any solo artist in history. Mariah is a singer/songwriter/producer recognized with multiple Grammy Awards, numerous American Music Awards, Billboard's 'Artist of the Decade' Award, the World Music Award for 'World's Best Selling Female Artist of the Millennium' and BMI's 'Icon Award' for her outstanding achievements in songwriting, to name a few – with her distinct five-octave vocal range, prolific songwriting, and producing talent, Mariah is truly the template of the modern pop performance. Mariah's ongoing impact has transcended the music industry to leave an indelible imprint upon the world at large.",https://yt3.ggpht.com/mkX_M8twWnQRIA8y5GLkGghbHqn59Cvefqs_RrCmICwmHaKgqok_LT2POUv5W9IHVqsRl8eDrg=s88-c-k-c0x00ffffff-no-rj,9188318968,https://www.youtube.com/channel/UCurpiDXSkcUbgdMwHNZkrCg,11200000,2024-11-01,UCurpiDXSkcUbgdMwHNZkrCg,US
Minha Rocinha Querida,772,Receitas Simples e da Roça♨️ ,https://yt3.ggpht.com/VXk3y3LqxyO4ZXrHjLxEdhR4opEOvSh8qeY9QGeJCAN0_9u1qWnCHizxWJJ1UH_XWuWTB75Hhmw=s88-c-k-c0x00ffffff-no-rj,20651558,https://www.youtube.com/channel/UCeOFd6of3vk5xxnnz2aZxyQ,225000,2024-11-01,UCeOFd6of3vk5xxnnz2aZxyQ,BR
DiaTV,2581,"AO VIVO 24 horas por dia, 7 dias da semana!",https://yt3.ggpht.com/E4TxH_YgL5cngYWNdVDxW8hQxL3ZgT2cAAo0n23oWqWPCYDbw688Nd2siaWe8TX4gwY-cuVa_Q=s88-c-k-c0x00ffffff-no-rj,214884455,https://www.youtube.com/channel/UCKnMcgDLxDeq9HqUgLhtYbQ,694000,2024-11-01,UCKnMcgDLxDeq9HqUgLhtYbQ,ZZ
Emilly Vick,788,"Ei,espero que gostem dos vídeos e se divirtam bastante comigo.Me sigam no insta 🩷👇🏻https://www.instagram.com/p/CHBIt4-naJp/?igshid=1xuqdndah26v6-Parcerias:📨⭐️dosrosa@agenciacurta.com",https://yt3.ggpht.com/-j8MrNAuS0IHQpJGoWRnX0HMCzT6e213cd_Qcpl-Lrg41K0C3smPB3QrLxCf3dGGjdK_T8xTpu8=s88-c-k-c0x00ffffff-no-rj,9067296697,https://www.youtube.com/channel/UC63iwP6BtIjxB6xn1GKR6Lw,20200000,2024-11-01,UC63iwP6BtIjxB6xn1GKR6Lw,BR
HeyDavi,341,,https://yt3.ggpht.com/Kd53GgeClA14OC9wlDmpIfcMi7MvLvJpB5-XEQPVvTSPnYeoEywbIi6FpA5n24YQf7rzNm-0=s88-c-k-c0x00ffffff-no-rj,760405058,https://www.youtube.com/channel/UCOPi8iWwV6BkL-boz69eJ5g,5540000,2024-11-01,UCOPi8iWwV6BkL-boz69eJ5g,BR
k a m a i t a c h i,105,"Rafael da Cruz Gonçalves, conhecido pelo seu nome artístico Kamaitachi, é um músico e compositor brasileiro nascido na cidade do Rio de Janeiro. Kamaitachi começou a escrever desde os 12 anos de idade, produzindo pequenos contos baseados em histórias fictícias. Em 2016, ele fundou uma banda chamada Sala31 junto com seus amigos de escola. Após os estudos, Kamaitachi decidiu seguir carreira solo e assim nasceu sua carreira como artista solo.As inspirações musicais de Kamaitachi são baseadas no que ele escuta no momento, mas ele agrega vários gêneros musicais, como indie, pop, rock, jazz, blues entre outros. Kamaitachi é um artista versátil e seu público-alvo são pessoas que gostam de letras ácidas e doce. O nome Kamaitachi é baseado no folclore japonês, onde Kama significa cortes e Itachi significa fuinha, representando o público ácido e doce respectivamente.",https://yt3.ggpht.com/K1EWWNDQX9Ew2FL-IlVcrJC2GJU4lR7HJ-jSY9LBIQmGfOQtfeDhbsBMYQUm-8dsCGYFdvcgXA=s88-c-k-c0x00ffffff-no-rj,607709236,https://www.youtube.com/channel/UCOgK2xOEXxCr6GnvRyXejqw,2870000,2024-11-01,UCOgK2xOEXxCr6GnvRyXejqw,BR
Tonigon,432,"Construindo alguma coisa no Minecraft nesse exato momento, VAI ASSISTIR MEU ULTIMO VÍDEO! ",https://yt3.ggpht.com/sExY7MWl0wQGH55-PAFWlAgplTf0ra013CN1fpf8yKE2ToSo1G1QhfFFDVYC61bSGA3ggvAzaA=s88-c-k-c0x00ffffff-no-rj,718535207,https://www.youtube.com/channel/UCukwGwBD-pAbGzoJo6ZXPtQ,3540000,2024-11-01,UCukwGwBD-pAbGzoJo6ZXPtQ,BR
Enaldinho,4592,"Falaaa, galera! Beleza??  Preparem-se para uma explosão de diversão toda semana no meu canal do YouTube! Pegadinhas, desafios e vlogs - tudo para garantir muitas risadas! Se inscreva já para não perder nenhum momento dessa aventura!",https://yt3.ggpht.com/ytc/AIdro_nuUiBgezNCkwsLB0lPoKEjHqLVuv9FGgAdFB9BQAqrYOM=s88-c-k-c0x00ffffff-no-rj,17581008884,https://www.youtube.com/channel/UC2bYhAHyaqfWlPXWBVk4BcA,39400000,2024-11-01,UC2bYhAHyaqfWlPXWBVk4BcA,BR
Mari Maria,2236,"Inscreva-se no meu canal para dicas de maquiagem, beleza, entretenimento e muito mais!",https://yt3.ggpht.com/C37eSgCwpw7O0mWM-JUIvcjr8JWcnDlqmCemS8_psLTzQ9J4kx3WIJ1KChppl9fpvf1EahAgNd4=s88-c-k-c0x00ffffff-no-rj,1552582300,https://www.youtube.com/channel/UCcHR0RvLYk33ppkjBw3UaEA,11300000,2024-11-01,UCcHR0RvLYk33ppkjBw3UaEA,ZZ
Corbucci Eats,946,Always hungry!Contato comercial e parcerias: contato@corbuccieats.com.br,https://yt3.ggpht.com/ytc/AIdro_mqWO2kReJL_xBhAIAbGfwKFdl7LtMkHHYbWMPrtPw-6ek=s88-c-k-c0x00ffffff-no-rj,1173001155,https://www.youtube.com/channel/UCFgDfnoYhWM48p072kjJ8zQ,4560000,2024-11-01,UCFgDfnoYhWM48p072kjJ8zQ,BR
Podpah,2652,O canal mais zika da internet📩 contato@podpah.com.br,https://yt3.ggpht.com/QvNQQksfT6NTkVZ51cueDFf62sEk6Yt3orCXTtKjVPj97IZCNMvlUSF13hGMvHLlhMkiMiajOQ=s88-c-k-c0x00ffffff-no-rj,1449996454,https://www.youtube.com/channel/UCj9R9rOhl81fhnKxBpwJ-yw,8680000,2024-11-01,UCj9R9rOhl81fhnKxBpwJ-yw,BR
The Weeknd - Topic,911,"The Weeknd is a multi-platinum, 7x Diamond certified artist who reshaped R&B and pop, making him one of the most listened-to musicians globally, with over 105 million monthly Spotify listeners. He was named “The Most Popular Artist in the World” by Guinness World Records in 2023. His album After Hours is the #1 most streamed R&B album ever, while Blinding Lights is the Diamond-certified Billboard Hot 100 song of all time. An Emmy and Oscar nominee, he has performed on major television platforms alongside a successful global tour amassing almost half a billion dollars to date. As a humanitarian, he has been the United Nations World Food Programme’s esteemed Global Goodwill Ambassador and has donated over $9 million to various causes, including significant contributions to tackle hunger in Ethiopia and Gaza.",https://yt3.ggpht.com/E9LfgUnjdf7A_d8_9iqVvai4HSwIvrE6NE6yKXOIQjHNXzWdWg5NNU7-a1flZGspflBmYXKtxw=s88-c-k-c0x00ffffff-no-rj,6562737089,https://www.youtube.com/channel/UClYV6hHlupm_S_ObS1W-DYw,255000,2024-11-01,UClYV6hHlupm_S_ObS1W-DYw,ZZ
Manchester United,4399,The official YouTube channel of Manchester United.,https://yt3.ggpht.com/Z2sZwVtMmdeMR-KEb7ATzyBX1_uf1A-zjgSYWuIviU2OEg2KQe2OBwyU9N9Fdm-_3vGgB3DGYQ=s88-c-k-c0x00ffffff-no-rj,2455493311,https://www.youtube.com/channel/UC6yW44UGJJBvYTlfC7CRg2Q,9460000,2024-11-01,UC6yW44UGJJBvYTlfC7CRg2Q,GB
Coisa Nossa,1987,Bem Vindos ao Coisa Nossa! O que não falta aqui é humor e naná hein...,https://yt3.ggpht.com/jmeIvVz1ZTSGcbpIgwxSzPLOTljRR8AwWBd9Obn0qHSndqSFw8NrIrMGqvNh6oPgaDDEt_EtkQ=s88-c-k-c0x00ffffff-no-rj,525399301,https://www.youtube.com/channel/UCbtlMIfdRVxPXZ1nI8NBN2A,2510000,2024-11-01,UCbtlMIfdRVxPXZ1nI8NBN2A,BR
OfficialGDRAGON,4,G-DRAGON Official YouTube ChannelG-DRAGON 공식 유튜브 채널입니다.,https://yt3.ggpht.com/EB3Z5-_HrnYoSMfhg714oVbLsib8f71RYukIym3LsIOg6TP0uVg53NYDKlYAWgzmAUmXux9NJQ=s88-c-k-c0x00ffffff-no-rj,347828157,https://www.youtube.com/channel/UCeU5qTuBiqTU5z-hyL6WITQ,2810000,2024-11-01,UCeU5qTuBiqTU5z-hyL6WITQ,ZZ
LadyGagaVEVO,221,"Lady Gaga on Vevo - Official Music Videos, Live Performances, Interviews and more...",https://yt3.ggpht.com/yzOEXrp_77aevhp7br98XrNC0Gl3afLllOStYv91C5_MdGr-s2GtRdCzWVqN2psTN6xlBhidCw=s88-c-k-c0x00ffffff-no-rj,15177344343,https://www.youtube.com/channel/UC07Kxew-cMIaykMOkzqHtBQ,8890000,2024-11-01,UC07Kxew-cMIaykMOkzqHtBQ,US
Melhor Futebol do Mundo - TNT Sports Brasil,3856,O canal de futebol internacional da TNT Sports Brasil! Veja aqui o que de melhor acontece na Champions League e fique por dentro do Melhor Futebol do Mundo - MFM!,https://yt3.ggpht.com/iuIoMs1x0E8iuXW8Iw8dCIa2zAOFjBh8ImytUgbYoZx5D2_9j3bNpPhyIPRVz9V4KS1GtJgI=s88-c-k-c0x00ffffff-no-rj,410008983,https://www.youtube.com/channel/UCiQ7Ll2Gsb5eQhgQQhZ2lGQ,908000,2024-11-01,UCiQ7Ll2Gsb5eQhgQQhZ2lGQ,ZZ
Lorrayne Oliveira,1595,"Oi meus amores, sejam bem vindos ao meu canal.Aqui vocês vão encontrar muita diversão.fiquem a vontade e se gostarem se inscrevam.BEIJOS AMO VOCÊS.",https://yt3.ggpht.com/t3bdaZsMTydJi16LQpeYaqBJuT13JPt5IClsbmjmutFETdNJhSbEooKIo6LDiLVhwokDxD4piQ=s88-c-k-c0x00ffffff-no-rj,2457861950,https://www.youtube.com/channel/UC--FL6OwLFWGIZfLfazY4yA,11700000,2024-11-01,UC--FL6OwLFWGIZfLfazY4yA,BR
Valquiria Santana,49,,https://yt3.ggpht.com/4acjitHIaVM5l3Dv4eQTeKFlqxlEhg-lO6LSjR83Y3UCZ1EGMq3llC2hQiYytL52V5kFt4-O-A=s88-c-k-c0x00ffffff-no-rj,7601176,https://www.youtube.com/channel/UCDyQyOvX2LjWoOqNue4Vyrw,48900,2024-11-01,UCDyQyOvX2LjWoOqNue4Vyrw,BR
Tottenham Hotspur,6008,"Welcome to the official Tottenham Hotspur YouTube channel. Hit the subscribe button and never miss a video! 🔵⚪️Exclusive behind-the-scenes access to training at Hotspur Way 💥Pre-match content and build up to EVERY single game 🍿All Premier League highlights ⚽️Your access all areas pass to our players 🙌Enjoy fan-favourites such as 'No rules FIFA' and 'How's your Touch?' series 📺New 🔥 uploads every week Join the Spurs family across Social Media on Facebook, Instagram, TikTok, Twitter and download the Spurs App below 👇https://www.tottenhamhotspur.com/spurs-official-app/",https://yt3.ggpht.com/LZq29V-hPkycwJDyK5uCnwRy90f-K4hnsn3JVH9V0Y9jbVTMxyBDY6hP6fBhC6xpzI9Emr4W=s88-c-k-c0x00ffffff-no-rj,1400309041,https://www.youtube.com/channel/UCEg25rdRZXg32iwai6N6l0w,3720000,2024-11-01,UCEg25rdRZXg32iwai6N6l0w,GB
ge,17992,"Bem-vindos ao nosso canal 🙌🙌O ESPORTE DA GLOBO ta muito on aqui no Youtube! 💥Aqui, vocês vão encontrar os melhores conteúdos de esporte com a qualidade que só a Globo tem.- melhores momentos do Campeonato Brasileiro ⚽- destaques dos principais eventos que só o sportv transmite ⚽🏐🏀- o melhor da programação dos canais de esporte da Globo 📺Além, é claro, de games, lives, vídeos com conteúdos originais e muita resenha!Todo dia, muuuuitos vídeos pra vocês maratonarem à vontade ⚽🍿DIVIRTAM-SE! ",https://yt3.ggpht.com/XHCE1FH6F1fBdRQjaf4Q08y4_GpdyiLU1vEFG20H2rs4sdRP00O-c6M8EBTJbwn01cHQ1lFR=s88-c-k-c0x00ffffff-no-rj,3220496871,https://www.youtube.com/channel/UCgCKagVhzGnZcuP9bSMgMCg,5390000,2024-11-01,UCgCKagVhzGnZcuP9bSMgMCg,BR
BABYMONSTER,332,BABYMONSTER Official YouTube Channel베이비몬스터 공식 유튜브 채널입니다.,https://yt3.ggpht.com/79MZT_n38ZBWrEUjhxwjOGVqsTtBLJBmUEojOvTNNcZguBuoxvZtQse-A-D0Kt6GamsYVPCnqQ=s88-c-k-c0x00ffffff-no-rj,2785108912,https://www.youtube.com/channel/UCqwUnggBBct-AY2lAdI88jQ,7200000,2024-11-01,UCqwUnggBBct-AY2lAdI88jQ,KR
Dani Nobrega,1388,"E aaaaai galera, como é que vocês estão? ",https://yt3.ggpht.com/YFikp64ynxAc-ngDSVafMnR4iw3GFv2OVcagmzu--ptVfXnOXu2kWb8qLLBmI3Z0xhIxgTyI-w=s88-c-k-c0x00ffffff-no-rj,536638932,https://www.youtube.com/channel/UC8gWf3nGUdGhp_fNUBOrCtA,2390000,2024-11-01,UC8gWf3nGUdGhp_fNUBOrCtA,BR
LUIZ DO SOM,2697,"Bem-vindo ao canal Luiz do Som, onde a diversão é garantida! Conheça Luiz, um senhor de idade que vive em um sítio cercado pelos seus queridos animais e que tem o banho como o seu inimigo número um. Acompanhe suas aventuras diárias com seu genro Manetikin e os personagens que adicionam uma dose de comédia ao canal, como Raul, o entregador que só quer receber o seu frete, Waldique, o feiticeiro dono de um ferro-velho, Delegado Ramos, o guardião da lei, e o amável Padre Serafim, entre outros.Embarque conosco em sagas repletas de terror, suspense, ação, aventura e muita diversão. Luiz do Som, Manetikin e sua trupe estão aqui para garantir muitas risadas em cada vídeo. Inscreva-se agora e prepare-se para se surpreender e se apaixonar pelo vovô mais amado do Brasil!",https://yt3.ggpht.com/J7VNa5rKO5m3pf8Fhb0m3Sui8q_OB5UcLqztgGONT2GXgD_UUnAalzfAB7uw3hwVP4HYjNE0=s88-c-k-c0x00ffffff-no-rj,641111415,https://www.youtube.com/channel/UCFJvAGjel1N2QWyOu50pNeQ,856000,2024-11-01,UCFJvAGjel1N2QWyOu50pNeQ,BR
Bruno Mars,103,"The official YouTube channel of Bruno Mars. Subscribe for the latest official music videos, live performances, official audio, and more: https://Atlantic.lnk.to/BMsubscribe 15x GRAMMY Award winner and 27x GRAMMY Award nominee Bruno Mars is a celebrated singer, songwriter, producer, and musician with iconic hits like The Lazy Song, That's What I Like, Just The Way You Are, 24K Magic, Locked Out Of Heaven, and When I Was Your Man. His legendary body of work also includes blockbuster albums such as Doo-Wops & Hooligans, Unorthodox Jukebox, and 24K Magic, as well as era-defining collaborations like Uptown Funk with Mark Ronson, Finesse with Cardi B, and Nothin' On You with B.o.B. Forever classic, yet supremely innovative, Bruno continues to redefine music, style, and popular culture, pushing the boundaries of pop, R&B, funk, soul, hip-hop, and dance, and remains as influential as ever.",https://yt3.ggpht.com/aqNdAvqqq69k4af_gfPdyw-UrP-K0sgXYpLPxpSLRA42bopt0iwUcMfdzYrsbaHZxWF5ld9cjA=s88-c-k-c0x00ffffff-no-rj,21888905651,https://www.youtube.com/channel/UCoUM-UJ7rirJYP8CQ0EIaHA,39000000,2024-11-01,UCoUM-UJ7rirJYP8CQ0EIaHA,ZZ
Emilly Vick,788,"Ei,espero que gostem dos vídeos e se divirtam bastante comigo.Me sigam no insta 🩷👇🏻https://www.instagram.com/p/CHBIt4-naJp/?igshid=1xuqdndah26v6-Parcerias:📨⭐️dosrosa@agenciacurta.com",https://yt3.ggpht.com/-j8MrNAuS0IHQpJGoWRnX0HMCzT6e213cd_Qcpl-Lrg41K0C3smPB3QrLxCf3dGGjdK_T8xTpu8=s88-c-k-c0x00ffffff-no-rj,9067296697,https://www.youtube.com/channel/UC63iwP6BtIjxB6xn1GKR6Lw,20200000,2024-11-01,UC63iwP6BtIjxB6xn1GKR6Lw,BR
FREITAS,817,Obrigado por assistir ❤️instagram: @freitaasp,https://yt3.ggpht.com/ytc/AIdro_knx5WsYetdy3arCn-9tnMwRbUsMPX2qWFMljO4iIkJFME=s88-c-k-c0x00ffffff-no-rj,404759290,https://www.youtube.com/channel/UCVse66mti9GN2SWF2eh_SCg,2740000,2024-11-01,UCVse66mti9GN2SWF2eh_SCg,BR
Rafa & Luiz,3809,"Aqui no nosso canal vocês vão encontrar vídeos legais, engraçados e super divertidos! Vocês fazem parte dessa aventura, então inscrevam-se já e não fiquem fora dessa !INSCREVAM-SE!   CONSULTAS EMPRESARIAS: comercial@rafaeluiz.com.br",https://yt3.ggpht.com/csgBd2Yk74cB4i6Zpi5JXSPoZmKd_bcA9ThWmwNcM6IzynYtlW-ZET8CLTW3Y8ITssmzZ86K=s88-c-k-c0x00ffffff-no-rj,10046215740,https://www.youtube.com/channel/UC6paX0kLA8D81aYogceMufw,27800000,2024-11-01,UC6paX0kLA8D81aYogceMufw,BR
FutParódias,983,📧 CONTATO: contato@futparodias.com.br--💼 COMERCIAL: comercial@futparodias.com.br🎤 SHOWS: shows@futparodias.com.brÉ o FutParódias original! 🎧⚽Vídeos novos toda terça e sexta às 11:00hSigam nossas redes!Dezão:📷 https://www.instagram.com/dezaofutparodias🐦 https://www.twitter.com/dezaodrumond👍 https://www.facebook.com/dezaodrumondLeon:📷 https://www.instagram.com/leonfutparodias🐦 https://www.twitter.com/leonwhosoever👍 https://www.facebook.com/leonwhosoeverFutParódias:📷 https://www.instagram.com/futparodias🐦 https://www.twitter.com/futparodias👍 https://www.facebook.com/futparodias,https://yt3.ggpht.com/43gv_N0qV_EXcXQkES6SFcXzEbPUgfXEfcRX9tNYjdf54fGHGwaed1E_jouI_SztDLCSaOJSDQ=s88-c-k-c0x00ffffff-no-rj,4973729529,https://www.youtube.com/channel/UCGFNp4Pialo9wjT9Bo8wECA,10700000,2024-11-01,UCGFNp4Pialo9wjT9Bo8wECA,BR
Canal GOAT,2783,"Faça parte da comunidade GOAT na Casa de Apostas!  Divirta-se! (+18 aposte com responsabilidade)Ao vivo, grátis e com imagens no YouTube! Série B, Libertadores Feminina, UFC, Liga Saudita, Bundesliga, NWSL, programação ao vivo  e muito mais! 🐐Publicidade: contato@canalgoat.com.br",https://yt3.ggpht.com/lQbsmXG4-b751D81rRQ2DSmXVsu7WRPelClSw4Oc3jkJ6dxzgUne8AyZL4A6v5uH74x659wnvA=s88-c-k-c0x00ffffff-no-rj,393167516,https://www.youtube.com/channel/UC_oToDrJ6uca7d1dFVBmLtg,3830000,2024-11-01,UC_oToDrJ6uca7d1dFVBmLtg,BR
By Pamella,1097,"A única coisa que existe entre você e seu sonho é o seu medo!Esse canal ainda vai ter 1M de inscritos, acreditem nessa menina 💖(Essa frase está aqui desde quando eu não tinha nenhum inscrito)Contato profissional: comercial@bypamella.com",https://yt3.ggpht.com/2qjHTPEhnMAmjFoZO8f-3n5c0rYEu8TTW-eoZeDZwpVSJyDSYYMMoI3PwCrcjDZagZO-3n4L_Q=s88-c-k-c0x00ffffff-no-rj,697751467,https://www.youtube.com/channel/UCpO4C7n86oFyCtlpiVPtcDA,7480000,2024-11-01,UCpO4C7n86oFyCtlpiVPtcDA,BR
Canal GOAT,2783,"Faça parte da comunidade GOAT na Casa de Apostas!  Divirta-se! (+18 aposte com responsabilidade)Ao vivo, grátis e com imagens no YouTube! Série B, Libertadores Feminina, UFC, Liga Saudita, Bundesliga, NWSL, programação ao vivo  e muito mais! 🐐Publicidade: contato@canalgoat.com.br",https://yt3.ggpht.com/lQbsmXG4-b751D81rRQ2DSmXVsu7WRPelClSw4Oc3jkJ6dxzgUne8AyZL4A6v5uH74x659wnvA=s88-c-k-c0x00ffffff-no-rj,393167516,https://www.youtube.com/channel/UC_oToDrJ6uca7d1dFVBmLtg,3830000,2024-11-01,UC_oToDrJ6uca7d1dFVBmLtg,BR
Hytalo Santos,802,"Mostro minha vida, rotina, a vida de um paraibano sonhador que ama seu povo e nunca desistiu de lutar ❤️",https://yt3.ggpht.com/sKWQSqvMGBMNj4oolmcYe8EzlhZ0Ovy0RMvbSqYBDcz6kXCnGoabQmKou1-pswSLgnTFXavG=s88-c-k-c0x00ffffff-no-rj,1513340067,https://www.youtube.com/channel/UC5K2cu7OuDEUFWeRKpeSH9A,6810000,2024-11-01,UC5K2cu7OuDEUFWeRKpeSH9A,BR
ESPN Brasil,39336,"Seja bem-vindo ao canal de esportes da Disney no Brasil.Aqui você encontra o melhor das principais competições do mundo: CONMEBOL Libertadores e CONMEBOL Sudamericana, Premier League, LALIGA, Campeonato Italiano, Copa do Nordeste, NFL, NBA, MotoGP, Grand Slams de tênis e muito mais!Além disso, aproveite as opiniões e análises da melhor referência de jornalismo esportivo do país e muito conteúdo original com o nosso pesado time de talentos!Para acompanhar todos os eventos esportivos assista à ESPN no Disney+: http://dis.la/ESPNenDisneyPlus_YT_BR#ESPN #DisneyPlus",https://yt3.ggpht.com/ytc/AIdro_ma030CksbiH0ueLUATKsGGEmZkmIdjFcS_uiI49Mton8Jz=s88-c-k-c0x00ffffff-no-rj,4333073400,https://www.youtube.com/channel/UCw5-xj3AKqEizC7MvHaIPqA,6480000,2024-11-01,UCw5-xj3AKqEizC7MvHaIPqA,BR
