Titulo,Numero_de_videos,Descricao,Imagem_de_perfil,Numero_de_visualizacoes,Link,Numero_de_inscritos,Data,Canal_ID,Pais_codigo
SBT Sports,3805,"Casa da Copa Sul-Americana e Champions League, com cobertura diária dos principais torneios do mundo e informações exclusivas. Você também pode conferir tudo o que rola no programa esportivo mais raiz da TV, o Arena SBT.",https://yt3.ggpht.com/kwzMcZ6CQhfL9xVI-Qoa_QymBaqB6az-wbhONAWTo5v-kkWRHARJeC5MhxGEGO0oNbMyB0Pdte8=s88-c-k-c0x00ffffff-no-rj,308793481,https://www.youtube.com/channel/UCxc3marqP9BJSkQ0_K4mqDg,1330000,2024-25-10,UCxc3marqP9BJSkQ0_K4mqDg,
HYBE LABELS,2153,"Welcome to the official YouTube channel of HYBE, the content hub for BIGHIT MUSIC, BELIFT LAB, SOURCE MUSIC, PLEDIS Entertainment, KOZ ENTERTAINMENT, ADOR and more.",https://yt3.ggpht.com/ytc/AIdro_l8g0yRFG8xoe_qeqk8Ki9UFy36cB2IjZEWZWz0h7gl-t0=s88-c-k-c0x00ffffff-no-rj,36466407891,https://www.youtube.com/channel/UC3IZKseVpdzPSBaWxBxundA,75900000,2024-25-10,UC3IZKseVpdzPSBaWxBxundA,KR
Manu Bahtidão,258,"Com certeza você já ouviu falar no Tecnomelody, estilo musical que vem crescendo no país e vem diretamente do estado do Pará. Manu Bahtidão, uma das maiores artistas do segmento, chegou para consolidar a carreira com o lançamento do seu DVD Daqui Pra Sempre.O DVD contém 11 faixas autorais e 3 versões. O primeiro single do projeto “Quem Perde É Quem Trai” conquistou os maiores influenciadores do país e se tornou um sucesso. Com a faixa-título, Manu emplacou um hit nacional e internacional colocando a canção em 1º lugar no Youtube Brasil, Top 10 no Youtube de Portugal, Top 2 no Spotify Brasil e mais de 1 milhão de vídeos nas redes sociais. Com o single Torre Eiffel, Manu atingiu o Top 1 no Spotify Brasil.A artista que é sucesso por onde passa, com shows lotados por todo o Brasil, cravou em 2023 o seu nome no cenário musical brasileiro e se tornou uma das maiores artista do País. No segundo semestre de 2024 ela dá continuidade ao seu sucesso lançando seu novo single Universo.",https://yt3.ggpht.com/OGGpgsYteTr_vd3K2kW_GoigzaAab_FKPVpQfsrsOcq6zU_i1U5vwc57SS9IXhSXfeEKWv2qtJs=s88-c-k-c0x00ffffff-no-rj,1398477088,https://www.youtube.com/channel/UCTa_X-4mmje4Tk0lig9t4Mw,2710000,2024-25-10,UCTa_X-4mmje4Tk0lig9t4Mw,BR
CazéTV,7530,,https://yt3.ggpht.com/XiDI4jKrS7jiTTMpQPVnjQUwiZlMmW-5uTqY8L2-2rFzijy16o2QsHvvF3JVrNBNzHqlIYbIag=s88-c-k-c0x00ffffff-no-rj,1918929641,https://www.youtube.com/channel/UCZiYbVptd3PVPf4f6eR6UaQ,16600000,2024-25-10,UCZiYbVptd3PVPf4f6eR6UaQ,BR
LadyGagaVEVO,220,"Lady Gaga on Vevo - Official Music Videos, Live Performances, Interviews and more...",https://yt3.ggpht.com/yzOEXrp_77aevhp7br98XrNC0Gl3afLllOStYv91C5_MdGr-s2GtRdCzWVqN2psTN6xlBhidCw=s88-c-k-c0x00ffffff-no-rj,15110959611,https://www.youtube.com/channel/UC07Kxew-cMIaykMOkzqHtBQ,8890000,2024-25-10,UC07Kxew-cMIaykMOkzqHtBQ,US
Canal GOAT,2707,"Faça parte da comunidade GOAT na Casa de Apostas!  Divirta-se! (+18 aposte com responsabilidade)Ao vivo, grátis e com imagens no YouTube! Série B, Libertadores Feminina, UFC, Liga Saudita, Bundesliga, NWSL, programação ao vivo  e muito mais! 🐐Publicidade: contato@canalgoat.com.br",https://yt3.ggpht.com/lQbsmXG4-b751D81rRQ2DSmXVsu7WRPelClSw4Oc3jkJ6dxzgUne8AyZL4A6v5uH74x659wnvA=s88-c-k-c0x00ffffff-no-rj,383743860,https://www.youtube.com/channel/UC_oToDrJ6uca7d1dFVBmLtg,3780000,2024-25-10,UC_oToDrJ6uca7d1dFVBmLtg,BR
Wiris Viana,253,"“A vida é uma peça de teatro que não permite ensaios. Por isso, cante, ria, dance, chore e viva intensamente cada momento de sua vida, antes que a cortina se feche e a peça termine sem aplausos.” ― Charles Chaplin",https://yt3.ggpht.com/Op2Vet0RCZNtT68fZ2sv8dCBDmnRVQYCFZTbdQQ8tND6Sfouy4CCi5kL5haT_T0txie5F895iks=s88-c-k-c0x00ffffff-no-rj,2016719969,https://www.youtube.com/channel/UCz2A8OXLR2xwYE63zWbu7IA,6260000,2024-25-10,UCz2A8OXLR2xwYE63zWbu7IA,BR
Hay Day,193,"Best. Farm. Ever. Welcome to Hay Day, the most popular farming game on mobiles and tablets, number one in 122 countries.Get Hay Day ►► https://link.haydaygame.com/Learn the lay of the land, tend to your crops, and trade goods with neighbors and friends. It’s a real special place where the crops never die even though it never rains. Sharing the farm with our quirky animals only makes things more fun!Hay Day is available for devices running iOS, Android and Kindle!Subscribe for more videos ►► https://supr.cl/SubHayDayFollow us on our Socials!Twitter ►► https://twitter.com/HayDay/Instagram ►► https://www.instagram.com/hayday Facebook ►► https://www.facebook.com/haydayofficialHay Day Discord Chat ►► https://discord.gg/F7BmubqHay Day Reddit ►► https://www.reddit.com/r/HayDay/",https://yt3.ggpht.com/3uuvLxttvZAZ7qZSWSa8jKQB1HZa7MKZnHgQTLAtvatZfAw_jKoWs52Uwi684l26qOEldDEE=s88-c-k-c0x00ffffff-no-rj,318462224,https://www.youtube.com/channel/UCBrMq7wkdPWb3PxR-GUR61A,2230000,2024-25-10,UCBrMq7wkdPWb3PxR-GUR61A,FI
TNT Sports Brasil,9045,Seja bem-vindo ao canal da TNT Sports Brasil! Veja aqui os melhores momentos da Champions League e o que de melhor acontece no futebol brasileiro e internacional!,https://yt3.ggpht.com/nbzvAOJQJTB_FzBJDvg9mcCAPwl5NkEv3dKVQrfsmaROJ7naWGv3sh4SgDifQo25x9JVC5Yxnw=s88-c-k-c0x00ffffff-no-rj,3083376317,https://www.youtube.com/channel/UCs-6sCz2LJm1PrWQN4ErsPw,11200000,2024-25-10,UCs-6sCz2LJm1PrWQN4ErsPw,BR
Iguinho e Lulinha,463,Canal Oficial da dupla Iguinho e Lulinha no YouTube.,https://yt3.ggpht.com/DoYi3VFIx1FHq5-Gbm8Xapb6nQ0eFxBRrfF_jOJEpXa6zpA5POjtnTC_itxh4MN5dBVH4IUrWPo=s88-c-k-c0x00ffffff-no-rj,706050934,https://www.youtube.com/channel/UCSS13SwFDxkiC6Yz-tF11UA,818000,2024-25-10,UCSS13SwFDxkiC6Yz-tF11UA,BR
Linkin Park,899,LINKINPARK.COM,https://yt3.ggpht.com/FPtlEh_UDOVYZ_A5YVAcodS8PP5wTVF2zP7za7hOtp3C-Ieh-qJHEgudKODznU60Eo1ctIQi=s88-c-k-c0x00ffffff-no-rj,16219417111,https://www.youtube.com/channel/UCZU9T1ceaOgwfLRq7OKFU4Q,22500000,2024-25-10,UCZU9T1ceaOgwfLRq7OKFU4Q,US
MC Poze do Rodo,32,CANAL OFICIAL DO MC POZE DO RODOINSCREVA-SE AGORAContatos:- Shows: showspoze@mainstreetrecords.com.br- Twitter: https://twitter.com/mcpozedorodo- Instagram: https://www.instagram.com/mcpozedorodo/,https://yt3.ggpht.com/QvUlwfjrhvPDNd3ZIMtNK7WCvfr4Gjpm3n7rgoLFw1J2xVqSve1Y2MkjlTD25l_I4Cl1iZtBIw=s88-c-k-c0x00ffffff-no-rj,1548932361,https://www.youtube.com/channel/UCsyd_nnNNDxlOs9TYrDvCoQ,4290000,2024-25-10,UCsyd_nnNNDxlOs9TYrDvCoQ,BR
MK MUSIC,6560,"Este é o canal oficial da gravadora MK Music. Aqui você fica por dentro de vídeos relacionados aos nossos artistas e seus lançamentos. Nosso conteúdo é atualizado diariamente, garantindo vídeos bastante diversificados como Clipes, Previews de lançamentos, VideoLetras de músicas exclusivas, eventos e apresentações ao vivo, Trailers de DVDs, além de Clipes #MemóriaMK: nossos arquivos desde 1986. Tudo isso bem separado em seções e playlists criadas especialmente para facilitar a sua vida.Aproveite e inscreva-se no nosso canal!    http://bit.ly/1vH0D1a ;)Obrigada pela sua visita!Acesse nosso site: www.mkmusic.com.br ",https://yt3.ggpht.com/aZfwVcxBOal4BZFbPZTcFvTcomcPDvOQfULViqMEcgUg3pB7j6txyXiQdaYzFz8thRuZ6iD77w=s88-c-k-c0x00ffffff-no-rj,11323897647,https://www.youtube.com/channel/UCbVwJCxsVbmaP1PFmbGQDeQ,17400000,2024-25-10,UCbVwJCxsVbmaP1PFmbGQDeQ,BR
Paramount+ Brasil,2021,Bebê da Rosemary 🤝 Apartamento 7A: me fazer ter medo de velhinhos simpáticos ,https://yt3.ggpht.com/9YbVRdlQhUyY_EyD5OmuILuutqiWop4P_2zH2ALtmR1L73E-b8IZoEUhiW73CvMHsrRAbmFWROM=s88-c-k-c0x00ffffff-no-rj,139626441,https://www.youtube.com/channel/UCAnCxJ1Weh2pUAKJW0bro0Q,505000,2024-25-10,UCAnCxJ1Weh2pUAKJW0bro0Q,BR
GR6 EXPLODE,3259,,https://yt3.ggpht.com/SahCIj4fyMUcrq0JGidN_XhfX93kGrwsLecVJ0drg5ycQVWKT9TTVPL6TYe0jzMm9GoX3iFtkQ=s88-c-k-c0x00ffffff-no-rj,28586573220,https://www.youtube.com/channel/UCNUQK9mQoqi4yNXw2_Rj6SA,41400000,2024-25-10,UCNUQK9mQoqi4yNXw2_Rj6SA,BR
NBA Brasil,3778,"Canal oficial no Brasil da NBA, a maior liga profissional de basquete do mundo que atinge 215 países.TODOS os dias, você acompanha aqui no canal o melhor dos jogos da noite anterior com o Rodada NBA, durante a temporada! Além disso, temos jogos ao vivo todas as segundas-feiras, junto com o melhor da rodada no Crunchtime.E todas as quartas vocês ainda acompanham os bastidores mais incríveis das franquias da NBA com o NBA Na Estrada. Aqui você fica por dentro de tudo que rola na Liga!",https://yt3.ggpht.com/nHdZcHfst2VxOuEe1o0wPO8X4w9xXjqO0zWIH06LNlUN8BimHIWXFisNZ4pEHUzZQiVVXDEI=s88-c-k-c0x00ffffff-no-rj,236497806,https://www.youtube.com/channel/UCsiCOcr5SZAWlJMfcw9P__w,1210000,2024-25-10,UCsiCOcr5SZAWlJMfcw9P__w,BR
Emilly Vick,780,"Ei,espero que gostem dos vídeos e se divirtam bastante comigo.Me sigam no insta 🩷👇🏻https://www.instagram.com/p/CHBIt4-naJp/?igshid=1xuqdndah26v6-Parcerias:📨⭐️dosrosa@agenciacurta.com",https://yt3.ggpht.com/-j8MrNAuS0IHQpJGoWRnX0HMCzT6e213cd_Qcpl-Lrg41K0C3smPB3QrLxCf3dGGjdK_T8xTpu8=s88-c-k-c0x00ffffff-no-rj,8934358319,https://www.youtube.com/channel/UC63iwP6BtIjxB6xn1GKR6Lw,20000000,2024-25-10,UC63iwP6BtIjxB6xn1GKR6Lw,BR
TNT Sports Brasil,9045,Seja bem-vindo ao canal da TNT Sports Brasil! Veja aqui os melhores momentos da Champions League e o que de melhor acontece no futebol brasileiro e internacional!,https://yt3.ggpht.com/nbzvAOJQJTB_FzBJDvg9mcCAPwl5NkEv3dKVQrfsmaROJ7naWGv3sh4SgDifQo25x9JVC5Yxnw=s88-c-k-c0x00ffffff-no-rj,3083376317,https://www.youtube.com/channel/UCs-6sCz2LJm1PrWQN4ErsPw,11200000,2024-25-10,UCs-6sCz2LJm1PrWQN4ErsPw,BR
JENNIE,54,,https://yt3.ggpht.com/et6Hg97svg-QT3lBhfA2V_URD0Ll7nuat2PLRpHAzRKveL1evz2iv3upwLX2Iy-wMZMA9SD1aw=s88-c-k-c0x00ffffff-no-rj,553522325,https://www.youtube.com/channel/UCNYi_zGmR519r5gYdOKLTjQ,12100000,2024-25-10,UCNYi_zGmR519r5gYdOKLTjQ,
Euphoric Brothers,123,2 young brothers addicted to game dev!The official creators of Garten of Banban.,https://yt3.ggpht.com/-iV42DwvFdtj22UBA2R7KFhXMoGcE8h4FH3gy7Rb5fgjS6vyt3Wq1Ls7VbeKUigl_AOcc76NUUQ=s88-c-k-c0x00ffffff-no-rj,193472776,https://www.youtube.com/channel/UCzDYgkEUa7tcWFmhfVItiiA,1200000,2024-25-10,UCzDYgkEUa7tcWFmhfVItiiA,
MUSSA,555,"Esse é o canal oficial do Mussa, seu Barbudo Favorito. Músicas divertidas e batalhas de rima para todas as idades. Aprenda a rimar, batalhe com os amigos e divirta-se com as Batalhas de Youtubers, Batalhas com Games e com as musicas e videos mais engraçados e animados do Mussoumano. Conteúdo livre para todos os públicos e idades. Chame sua família e entre agora no Mussa Style! Venha curtir as Batalhas de rap mais loucas do Youtube.Parcerias e publicidade:contato@mussastyle.com.brsiga @mussoumano",https://yt3.ggpht.com/HjS8Tj0OPumsW8joXIeBIP7dcSvlF-aAVqdzpYZBaMA96AI_EfT6hkHg9MqZh7VpyGNNeR0s=s88-c-k-c0x00ffffff-no-rj,2156478430,https://www.youtube.com/channel/UC607Gii1uo93qDqiGR6-c3w,13000000,2024-25-10,UC607Gii1uo93qDqiGR6-c3w,BR
Emilly Vick,780,"Ei,espero que gostem dos vídeos e se divirtam bastante comigo.Me sigam no insta 🩷👇🏻https://www.instagram.com/p/CHBIt4-naJp/?igshid=1xuqdndah26v6-Parcerias:📨⭐️dosrosa@agenciacurta.com",https://yt3.ggpht.com/-j8MrNAuS0IHQpJGoWRnX0HMCzT6e213cd_Qcpl-Lrg41K0C3smPB3QrLxCf3dGGjdK_T8xTpu8=s88-c-k-c0x00ffffff-no-rj,8934358319,https://www.youtube.com/channel/UC63iwP6BtIjxB6xn1GKR6Lw,20000000,2024-25-10,UC63iwP6BtIjxB6xn1GKR6Lw,BR
VIVINOS,48,vivinos@studiolico.com,https://yt3.ggpht.com/wxcTILsAW1bbpFsmxYd7MJRkUyhe8Drip5hCkjmLucD30OzVcCoTJ9avilOgDBP6NhBJkAc_=s88-c-k-c0x00ffffff-no-rj,178894770,https://www.youtube.com/channel/UCch9Dmg5Juwp8MZGvAmAp4Q,1440000,2024-25-10,UCch9Dmg5Juwp8MZGvAmAp4Q,
Botafogo TV,4826,Canal oficial do Botafogo!,https://yt3.ggpht.com/F1-jZe4_B3jlUvQBYpskpfF8P6DQdwg5QCraDy9s-MA64IbWFVlsGB5n3L-kQ6Tzp8ao8iTs0w=s88-c-k-c0x00ffffff-no-rj,127715983,https://www.youtube.com/channel/UCFxjZDrLCOCHkUCu632AmMQ,592000,2024-25-10,UCFxjZDrLCOCHkUCu632AmMQ,BR
Léo Foguete 🚀,5,Ouça agora o primeiro single da carreira do Léo Foguete com a participação de Kaká e Pedrinho.SHOWS - ACERTEI PRODUÇÕES :(85) 99982 -3582,https://yt3.ggpht.com/sNLrq3ybIhdrnROnTBDYSrywmBD444PO-76qoXbGu6OXZ6f5GRhw7UB3wqjw_x10FR6BfeetvaY=s88-c-k-c0x00ffffff-no-rj,10035901,https://www.youtube.com/channel/UC90eu9zXQkuE39brM_RZA0g,37400,2024-25-10,UC90eu9zXQkuE39brM_RZA0g,BR
Confederação Brasileira de Futebol,7349,"Este é o canal oficial da Confederação Brasileira de Futebol. Aqui você acompanha os melhores lances, bastidores e tudo sobre as Seleções Masculina e Feminina, além dos principais momentos das competições organizadas pela CBF. Inscreva-se!http://www.cbf.com.br",https://yt3.ggpht.com/ytc/AIdro_lGr-WYSe5SfEY765ddXowIwIwBxjp4fsFnBbtuefUK7-w=s88-c-k-c0x00ffffff-no-rj,239240113,https://www.youtube.com/channel/UCdQuDaRww5NkKpQQ1BJBWww,1740000,2024-25-10,UCdQuDaRww5NkKpQQ1BJBWww,BR
Bruno Mars,102,"An Evening With Silk Sonic: https://SilkSonic.lnk.to/AEWSSIDThe official YouTube channel of Bruno Mars. Subscribe for the latest official music videos, live performances, official audio, and more: https://Atlantic.lnk.to/BMsubscribe 11x GRAMMY Award winner and 27x GRAMMY Award nominee Bruno Mars is a celebrated singer, songwriter, producer, and musician with iconic hits like The Lazy Song, That's What I Like, Just The Way You Are, 24K Magic, Locked Out Of Heaven, and When I Was Your Man. His legendary body of work also includes blockbuster albums such as Doo-Wops & Hooligans, Unorthodox Jukebox, and 24K Magic, as well as era-defining collaborations like Uptown Funk with Mark Ronson, Finesse with Cardi B, and Nothin' On You with B.o.B. Forever classic, yet supremely innovative, Bruno continues to redefine music, style, and popular culture, pushing the boundaries of pop, R&B, funk, soul, hip-hop, and dance, and remains as influential as ever.",https://yt3.ggpht.com/aqNdAvqqq69k4af_gfPdyw-UrP-K0sgXYpLPxpSLRA42bopt0iwUcMfdzYrsbaHZxWF5ld9cjA=s88-c-k-c0x00ffffff-no-rj,21888905651,https://www.youtube.com/channel/UCoUM-UJ7rirJYP8CQ0EIaHA,38800000,2024-25-10,UCoUM-UJ7rirJYP8CQ0EIaHA,
Virgínia Fonseca,1532,"Oii, amigos! Sejam bem-vindos ao meu canal, por aqui conseguimos ficar ainda mais próximos. Inscreva-se! Instagram: @virginiaEmail para contato: virginia@talismadigital.com.br",https://yt3.ggpht.com/tiOzl6g-T-BIoyfV5r0ElpicAXogRkSIlYSy7IpTxr2QVD4kv6hXw4j9jmG0pkncV_20NOdi=s88-c-k-c0x00ffffff-no-rj,1567932821,https://www.youtube.com/channel/UCsaB2VrLZrtGbum6Eo0ClbA,11800000,2024-25-10,UCsaB2VrLZrtGbum6Eo0ClbA,BR
AddisonRaeVEVO,3,,https://yt3.ggpht.com/KjQpR7Zw5H5Ysu1xPtjZct5QSq_NxGhWzxEXLl4OPon4i_gUsQemkaSRtUdRDIypbfsY5nZXgQ=s88-c-k-c0x00ffffff-no-rj,7983387,https://www.youtube.com/channel/UC3Cs0kPcr0GQPCVzX32NQPg,200,2024-25-10,UC3Cs0kPcr0GQPCVzX32NQPg,
Megan Thee Stallion,337,Houston's own real H-Town Hottie! Young Tina Snow. ‘MEGAN’ Is Out Now https://mts.lnk.to/megan,https://yt3.ggpht.com/Isb1-iaJsOcWZAvnC6vDwEV7Qz6dl0OEBoStzSTzK6_tkpaCQy-PuIUxKGP3mjTSlY3LnCIYs1w=s88-c-k-c0x00ffffff-no-rj,3185885743,https://www.youtube.com/channel/UCKrdjiuS66yXOdEZ_cOD_TA,6880000,2024-25-10,UCKrdjiuS66yXOdEZ_cOD_TA,US
Weder Silva,742,Receitas Especiais direto de Goiás,https://yt3.ggpht.com/ytc/AIdro_mbuCnCDcIRVNJnLzq0Q_pQmhoQR1Hc-33QKXhNkdNQrrY=s88-c-k-c0x00ffffff-no-rj,295888976,https://www.youtube.com/channel/UCixcSMY0QCvK96xtO9Atifg,3030000,2024-25-10,UCixcSMY0QCvK96xtO9Atifg,BR
Iguinho e Lulinha - Topic,185,"Nascer em um pequeno município no interior do sertão Sergipano não impediu que Iguinho e Lulinha sonhassem com o sucesso e hoje, são a primeira dupla de cantores de piseiro do Brasil!Naturais de Canindé de São Francisco, SE, os irmãos tiveram as primeiras experiências artísticas ao lado do avó Zé Leobino, conhecido vaqueiro nacional e figura folclórica da região onde viviam.  A família sempre esteve muito presente na vida dos meninos. Na companhia do pai e tio, eles iam em cavalgadas, vaquejadas e até mesmo a programas de rádio e televisão local.",https://yt3.ggpht.com/DoYi3VFIx1FHq5-Gbm8Xapb6nQ0eFxBRrfF_jOJEpXa6zpA5POjtnTC_itxh4MN5dBVH4IUrWPo=s88-c-k-c0x00ffffff-no-rj,67985151,https://www.youtube.com/channel/UCEPpLe_ffyNrV8m1zt_1Keg,10600,2024-25-10,UCEPpLe_ffyNrV8m1zt_1Keg,
Naru,1109,"Oiieeee Eu xou o Naru, e voxê tem que axistir o meu canal!Contato Comercial: narueditsfunny@gmail.com",https://yt3.ggpht.com/Ku6fGxZASbPZhc2M02DhKF6R0XmHeN9upN0YvNJNFIuYb3UjMBdWNmDBzjhjL_hUaiQXucZrcCM=s88-c-k-c0x00ffffff-no-rj,115638370,https://www.youtube.com/channel/UCx6SJ-EWSTZM0Vgxk5HTjWg,1130000,2024-25-10,UCx6SJ-EWSTZM0Vgxk5HTjWg,BR
30PRAUM,133,30PRAUM▶ Shows: booking@30praum.com▶ Instagram: @30PRAUM▶ Twitter: @30PRAUM▶ Facebook.com/30PRAUMMATUÊ▶ Instagram: @matue▶ Twitter: @matue30WIU▶ Instagram: @hotwiu30▶ Twitter: @hotwiu30TETO▶ Instagram: @euteto▶ Twitter: @seutetoBRANDÃO▶ Instagram: @brandao085▶ Twitter: @brandao085,https://yt3.ggpht.com/LDh4W_e4WQ9AZdqOTw_wshwu61VdQjH_yM2Efuwd0CwTznKDQVv1BacdQvn60AfBOl12S1GV=s88-c-k-c0x00ffffff-no-rj,3943375919,https://www.youtube.com/channel/UCoHV8LxUFKeIvifJsB3c7Ww,6410000,2024-25-10,UCoHV8LxUFKeIvifJsB3c7Ww,BR
MC Kako,52,"Jackson Frayle Toledo Campos, conhecido como MC Kako (27), é um dos maiores nomes da música urbana. Nascido em Maringá, Paraná, ele teve contato com a música desde a infância, influenciado pelo pai, baterista de uma banda de rock. Aos 17 anos, já escrevia suas próprias letras e, hoje, acumula mais de 8 milhões de ouvintes no Spotify e milhões de visualizações no YouTube. Em 2023, lançou o álbum 734, mostrando sua versatilidade com músicas acústicas e um visual mais intimista. A canção Ísis, em homenagem à sua filha, foi um grande sucesso, com mais de 100 milhões de plays. Em 2024, Kako apresenta o álbum Coisas Que Eu Já Deveria Ter Dito Há Um Tempo, com canções que resgatam o estilo de sua trajetória inicial.",https://yt3.ggpht.com/miwA4DgdPj2OGzbZWzIHT7glr95GPnCASmKZ05IVbaDif5Ybx7gR0LB0R0PsdY2Ppc0LytiVIg=s88-c-k-c0x00ffffff-no-rj,389358423,https://www.youtube.com/channel/UC78CKlsbDeQt-zSkzvxOcsg,698000,2024-25-10,UC78CKlsbDeQt-zSkzvxOcsg,
ge,17866,"Bem-vindos ao nosso canal 🙌🙌O ESPORTE DA GLOBO ta muito on aqui no Youtube! 💥Aqui, vocês vão encontrar os melhores conteúdos de esporte com a qualidade que só a Globo tem.- melhores momentos do Campeonato Brasileiro ⚽- destaques dos principais eventos que só o sportv transmite ⚽🏐🏀- o melhor da programação dos canais de esporte da Globo 📺Além, é claro, de games, lives, vídeos com conteúdos originais e muita resenha!Todo dia, muuuuitos vídeos pra vocês maratonarem à vontade ⚽🍿DIVIRTAM-SE! ",https://yt3.ggpht.com/XHCE1FH6F1fBdRQjaf4Q08y4_GpdyiLU1vEFG20H2rs4sdRP00O-c6M8EBTJbwn01cHQ1lFR=s88-c-k-c0x00ffffff-no-rj,3195422624,https://www.youtube.com/channel/UCgCKagVhzGnZcuP9bSMgMCg,5360000,2024-25-10,UCgCKagVhzGnZcuP9bSMgMCg,BR
Enaldinho,4580,"Falaaa, galera! Beleza??  Preparem-se para uma explosão de diversão toda semana no meu canal do YouTube! Pegadinhas, desafios e vlogs - tudo para garantir muitas risadas! Se inscreva já para não perder nenhum momento dessa aventura!",https://yt3.ggpht.com/ytc/AIdro_nuUiBgezNCkwsLB0lPoKEjHqLVuv9FGgAdFB9BQAqrYOM=s88-c-k-c0x00ffffff-no-rj,17469627360,https://www.youtube.com/channel/UC2bYhAHyaqfWlPXWBVk4BcA,39300000,2024-25-10,UC2bYhAHyaqfWlPXWBVk4BcA,BR
Jazzghost,5915,Jogo uns jogos e passo vergonha. CONTATO: comercial@agenciacurta.com,https://yt3.ggpht.com/_QWLAwBwKXViiV5aOQBIpipDrh7iMhrpv7EMbqIL4kfVealfeXJ7CY49Uma1VeqVnkYUucW4r8Q=s88-c-k-c0x00ffffff-no-rj,7816628771,https://www.youtube.com/channel/UCIXguhHCl8eDTkXpEuiGPUA,17900000,2024-25-10,UCIXguhHCl8eDTkXpEuiGPUA,
Ricardinho,30,,https://yt3.ggpht.com/f8aLP9Y5gc6IUsZ-hMwFGc34nKmJw_l0NovE063alMs9X_INBxi2-HpiahA-xz8wAxGfGaC-jPE=s88-c-k-c0x00ffffff-no-rj,1695759,https://www.youtube.com/channel/UCtPYmhNzbNBoAaZByv9vwxg,74600,2024-25-10,UCtPYmhNzbNBoAaZByv9vwxg,BR
É o Vini,1061,,https://yt3.ggpht.com/cZE2WRHryYgvBGGgwdwtPwnXGAJXN5oCOoQWwq7S3l7OmrHduqOfKoDEGSDY4oFRMs9Y9Eu95w=s88-c-k-c0x00ffffff-no-rj,104535586,https://www.youtube.com/channel/UCHNc0vOmeDCRLSzw5VgvNrQ,1370000,2024-25-10,UCHNc0vOmeDCRLSzw5VgvNrQ,BR
rezendeevil,12333,Contato Comercial: Rezende@adragencia.com.brInstagram: rezendeTwitter: @rezende_evilSnapchat: Imrezende,https://yt3.ggpht.com/TX93DoEJrvJi10f8WrPOej9VS0YrMUmuRt_tzT6Kj5A3qBvFx6iOspfirq42jXDUo6cmRcVQ-A=s88-c-k-c0x00ffffff-no-rj,13662325984,https://www.youtube.com/channel/UCbTVTephX30ZhQF5zwFppBg,33800000,2024-25-10,UCbTVTephX30ZhQF5zwFppBg,BR
Emilly Vick,780,"Ei,espero que gostem dos vídeos e se divirtam bastante comigo.Me sigam no insta 🩷👇🏻https://www.instagram.com/p/CHBIt4-naJp/?igshid=1xuqdndah26v6-Parcerias:📨⭐️dosrosa@agenciacurta.com",https://yt3.ggpht.com/-j8MrNAuS0IHQpJGoWRnX0HMCzT6e213cd_Qcpl-Lrg41K0C3smPB3QrLxCf3dGGjdK_T8xTpu8=s88-c-k-c0x00ffffff-no-rj,8934358319,https://www.youtube.com/channel/UC63iwP6BtIjxB6xn1GKR6Lw,20000000,2024-25-10,UC63iwP6BtIjxB6xn1GKR6Lw,BR
Leozinn 077,434,"ola sou o leozinn ! sou youtuber, tik toker influencer digital ! meu unico e maior sonho e deixar todos felizes :) faco o que eu amo ! obrigado ",https://yt3.ggpht.com/qsyT5KRPkUOgcAsMpjPvHsQEfhnv0MoMkAyDK4K8EktfPC1ik_2ECsssCq5Mq9oaOZy73jL72w=s88-c-k-c0x00ffffff-no-rj,4517324657,https://www.youtube.com/channel/UCIRNu5s24r7zAPTFic_eWNw,12800000,2024-25-10,UCIRNu5s24r7zAPTFic_eWNw,
Família Oliveira,269,,https://yt3.ggpht.com/7mxsLz8-QhHx-f03m6Sz8ee3kQmJbokNw_IbMAZPpVrLufOpY9Pq5W_1CTuX0h9xN9kNvuCa=s88-c-k-c0x00ffffff-no-rj,182107008,https://www.youtube.com/channel/UCgJnKtIMg8gv_9jTwW-EFpA,851000,2024-25-10,UCgJnKtIMg8gv_9jTwW-EFpA,BR
Jazzghost,5915,Jogo uns jogos e passo vergonha. CONTATO: comercial@agenciacurta.com,https://yt3.ggpht.com/_QWLAwBwKXViiV5aOQBIpipDrh7iMhrpv7EMbqIL4kfVealfeXJ7CY49Uma1VeqVnkYUucW4r8Q=s88-c-k-c0x00ffffff-no-rj,7816628771,https://www.youtube.com/channel/UCIXguhHCl8eDTkXpEuiGPUA,17900000,2024-25-10,UCIXguhHCl8eDTkXpEuiGPUA,
Família Maria Clara e JP,351,"Sejam bem-vindos à Família Maria Clara e JP! Moramos em Orlando nos Estados Unidos e toda semana postamos vídeos do nosso dia a dia, viagens, desafios, jogos e fazemos vlogs de tudo! Esperamos que goste dos nossos vídeos ❤️Obrigado por visitar nosso canal. Por favor, inscreva-se para que você possa participar de nossas aventuras!╔♫═╗╔╗ ╚╗╔╝║║♫═╦╦╦╔╗╔╝╚╗♫╚╣║║║║╔╣╚═♫╝╚═╩═╩♫╩═╝╔╦♫═╦╦╗║║║║║║║╠═╠═╩═♥♫═╝Lembre-se: Uma família não precisa ser perfeita, só precisa ser unida.",https://yt3.ggpht.com/HPYwC-cjbgqSIhja966MW-kWxvC1jaWC3ZmPps7WX3l7wrlGYgi5mL-xAdNX0ShPaky7jvVYdg=s88-c-k-c0x00ffffff-no-rj,1867390924,https://www.youtube.com/channel/UC040XFJEsSRhTkmieXp1kDQ,6340000,2024-25-10,UC040XFJEsSRhTkmieXp1kDQ,BR
Larissa Miranda ,234,Uma menina que saiu da cidade grande para morar na roça e demonstrar o cotidiano no meio do mato sendo uma adolescente de 16 anos. Tiktok: larissamiranda.8Kawai: LarissaMiranda.08,https://yt3.ggpht.com/GN4sDBV6sUAk3r--MamZkcyYVPx386jAvJzGXP97w2Ef4z_J6SVFJieMcNTBbw8pOWurZjXVKXg=s88-c-k-c0x00ffffff-no-rj,1996332,https://www.youtube.com/channel/UC8hxLO3J5ld1Xhdo6lSDsiQ,15500,2024-25-10,UC8hxLO3J5ld1Xhdo6lSDsiQ,BR
K Tech,1348,"Sejam muito bem vindos ao canal K Tech, sigam as nossas redes sociais 😘https://linktr.ee/canalktech",https://yt3.ggpht.com/p7o02LBjihbnyO36l7Lfv-vsQ88CHPpLSCy4lyvF1W27fatS0oQIwRdyE8e0pzvTXBuLICvfCVo=s88-c-k-c0x00ffffff-no-rj,170558931,https://www.youtube.com/channel/UCJY41yD2uXdj3sV-8sMOcGw,1370000,2024-25-10,UCJY41yD2uXdj3sV-8sMOcGw,PT
BF///MS,1484,"O BF///MS é o ponto de encontro dos apaixonados pelo Off-road no Brasil!Agora no YouTube, vocês ficarão por dentro de avaliações, encontros, moagens, vídeos dos leitores e tudo o que acontece no nosso universo!Inscreva-se no nosso canal!BF///MS, o maior portal Off-Road do Brasil!",https://yt3.ggpht.com/EoWvEvQHkNKoyqWk-QiEV3NeZQIWXltnm62rkGdr3thVYYoG8hmperZqVNcgD13fDNAK9WJY=s88-c-k-c0x00ffffff-no-rj,102745530,https://www.youtube.com/channel/UC6an9PllWh3s_8VcKf1VNUA,424000,2024-25-10,UC6an9PllWh3s_8VcKf1VNUA,BR
LUIZ DO SOM,2682,"Bem-vindo ao canal Luiz do Som, onde a diversão é garantida! Conheça Luiz, um senhor de idade que vive em um sítio cercado pelos seus queridos animais e que tem o banho como o seu inimigo número um. Acompanhe suas aventuras diárias com seu genro Manetikin e os personagens que adicionam uma dose de comédia ao canal, como Raul, o entregador que só quer receber o seu frete, Waldique, o feiticeiro dono de um ferro-velho, Delegado Ramos, o guardião da lei, e o amável Padre Serafim, entre outros.Embarque conosco em sagas repletas de terror, suspense, ação, aventura e muita diversão. Luiz do Som, Manetikin e sua trupe estão aqui para garantir muitas risadas em cada vídeo. Inscreva-se agora e prepare-se para se surpreender e se apaixonar pelo vovô mais amado do Brasil!",https://yt3.ggpht.com/J7VNa5rKO5m3pf8Fhb0m3Sui8q_OB5UcLqztgGONT2GXgD_UUnAalzfAB7uw3hwVP4HYjNE0=s88-c-k-c0x00ffffff-no-rj,637335270,https://www.youtube.com/channel/UCFJvAGjel1N2QWyOu50pNeQ,854000,2024-25-10,UCFJvAGjel1N2QWyOu50pNeQ,BR
Tati Mantovani,291,"O futebol que eu acompanho de perto aqui em Madri, na Espanha :)",https://yt3.ggpht.com/yk3VkNcf9XUhWykYfZEkPKx2PwfjvpjHm0jJV5jcNKD8a_4Su5l5AnDxZLLVfK9gQKtMeX4J=s88-c-k-c0x00ffffff-no-rj,4707687,https://www.youtube.com/channel/UCLRLY0-mxf8x7p5nMgmYmyQ,83900,2024-25-10,UCLRLY0-mxf8x7p5nMgmYmyQ,ES
