Titulo,Numero_de_videos,Descricao,Imagem_de_perfil,Numero_de_visualizacoes,Link,Numero_de_inscritos,Data,Canal_ID,Pais_codigo
Henrique Carvalho,330,"Canal de construção de carro artesanal, feito do zero. Para você que curte entretenimento automotivo este é o canal. Vale muito a pena assistir essa serie de projetos de super carros caseiro  SE INSCREVA!",https://yt3.ggpht.com/HZfXyfZpa_Otc_gVa225b46H5CXRVifPxitGolXuetzeAz9-cbm5ikXvtvFd2QcISA3bMJwokQ=s88-c-k-c0x00ffffff-no-rj,84731629,https://www.youtube.com/channel/UC1Uc7VKcHGDSMxNnztQlHSA,614000,2024-25-10,UC1Uc7VKcHGDSMxNnztQlHSA,BR
Luan Santana,534,O cantor sertanejo mais ouvido do Brasil. 🇧🇷,https://yt3.ggpht.com/h4TX_7nXoRVOkrjsLwFLzYBMPbEk5HcO4-IqPYUjx80sTXkuUBziiPx1bdtE_tl1TqUwtza7ObY=s88-c-k-c0x00ffffff-no-rj,7001959868,https://www.youtube.com/channel/UC6rwiIxv0w2fbmmr66wl1rA,12700000,2024-25-10,UC6rwiIxv0w2fbmmr66wl1rA,US
ESPN Brasil,39023,"Seja bem-vindo ao canal de esportes da Disney no Brasil.Aqui você encontra o melhor das principais competições do mundo: CONMEBOL Libertadores e CONMEBOL Sudamericana, Premier League, LALIGA, Campeonato Italiano, Copa do Nordeste, NFL, NBA, MotoGP, Grand Slams de tênis e muito mais!Além disso, aproveite as opiniões e análises da melhor referência de jornalismo esportivo do país e muito conteúdo original com o nosso pesado time de talentos!Para acompanhar todos os eventos esportivos assista à ESPN no Disney+: http://dis.la/ESPNenDisneyPlus_YT_BR#ESPN #DisneyPlus",https://yt3.ggpht.com/ytc/AIdro_ma030CksbiH0ueLUATKsGGEmZkmIdjFcS_uiI49Mton8Jz=s88-c-k-c0x00ffffff-no-rj,4307337246,https://www.youtube.com/channel/UCw5-xj3AKqEizC7MvHaIPqA,6450000,2024-25-10,UCw5-xj3AKqEizC7MvHaIPqA,BR
MotoGP,9833,"First on the throttle, last on the brakes 🏁",https://yt3.ggpht.com/Ae6_xX9VoZWUUBqHInTaJ8vCzGHuYPZ4W-rNy1Q0SOjwEWzuNZoVgPDGASPYi7WpfNGJxOapEQ=s88-c-k-c0x00ffffff-no-rj,2751618583,https://www.youtube.com/channel/UC8pYaQzbBBXg9GIOHRvTmDQ,6520000,2024-25-10,UC8pYaQzbBBXg9GIOHRvTmDQ,
DOM Studio,661,"Welcome to DOM Studio's YouTube Channel!DOM Studio is an Iranian Animation Team that Creates ContentBased on Video Games If you Like our Videos Subscribe today to See More!This team was created by( MR.Rab Gamer, T.REX Kingdom, R Careful )Teammates:👇Puffy SpiderShayan💠Business Inquiries / Work Opportunities / Sponsorships can be discussed via email:domstudio.business@gmail.com#Animation #FiveNightsatFreddys #DOM_Studio #poppyplaytime #securitybreach 📌Follow our Social Media:🐦 Follow our Tweets: https://twitter.com/DomStudio📱 Check our Instagram: https://www.instagram.com/dom_studio_iran/▶️ Subscribe: https://www.youtube.com/channel/UCEbVfdA43w83_ilZ1ZlZH3Q",https://yt3.ggpht.com/5-2kfJj7Xzo637DEV2XVSeu9GugF2BR15iRP3JknJoy5ynhPH7I00VB14_I71SwHr8mPSPtTCuM=s88-c-k-c0x00ffffff-no-rj,3622228589,https://www.youtube.com/channel/UCEbVfdA43w83_ilZ1ZlZH3Q,10600000,2024-25-10,UCEbVfdA43w83_ilZ1ZlZH3Q,GB
OlaGUTI,611,,https://yt3.ggpht.com/qpA-TwGoDmj5d9cY9C1n9XIgvKkiSVeiXpRpFLX1PQ8eTx-NvU8s4iFV9slaa2CcMx7FDQ_UGQ=s88-c-k-c0x00ffffff-no-rj,82778041,https://www.youtube.com/channel/UCG2Zgy_atWmy139L_KWiq9w,434000,2024-25-10,UCG2Zgy_atWmy139L_KWiq9w,JP
Isamara Amâncio,1701,"Bem-vindo ao meu canal! Aprenda aqui muitas receitas deliciosas, fáceis, rápidas e que vão agradar toda sua família!",https://yt3.ggpht.com/cYFOUhcV-Pm67yS8RYkifKiHXDJGZDuqsdkBNLMX2wFOriRXtRlOywdA7WzGGItkbyScMQhlnA=s88-c-k-c0x00ffffff-no-rj,1322337736,https://www.youtube.com/channel/UCTNFtLQWA94BNeu0lE4YwuQ,9850000,2024-25-10,UCTNFtLQWA94BNeu0lE4YwuQ,BR
Guilherme e Benuto,645,CONTATO PARA SHOWS(19) 99605-2482MARCELO@GUILHERMEEBENUTO.COM.BR,https://yt3.ggpht.com/JzFr1IBFwvyqAHh7UQMX-F1ASqp0SfHbolptPU5TxKRA3GaC3ByCP6-o7Z82T0vE1F3YIz56XVQ=s88-c-k-c0x00ffffff-no-rj,2899702249,https://www.youtube.com/channel/UCfG0o17SqRg8qAjlpTdxZag,2500000,2024-25-10,UCfG0o17SqRg8qAjlpTdxZag,BR
Sobre Funk,608,"O maior canal de entretenimento e informação do funk. Passando a visão de maneira alegre e verdadeira, aqui mostramos o Funk como ele é... Cola com nós e vamos pra cima, família!contatosobrefunk@gmail.com©2023 SobreFunk®",https://yt3.ggpht.com/iy0aNa583B8LMNekNiUCzqFbrWD2gRaB_pQZAYyc3OjaJQbP-4AK61afeCJIQ_siH8ZQf__YdZ0=s88-c-k-c0x00ffffff-no-rj,597202371,https://www.youtube.com/channel/UCPML90bq8t2g6BpVgIVj-MA,1070000,2024-25-10,UCPML90bq8t2g6BpVgIVj-MA,BR
Corinthians TV,8081,O motivo da loucura do Bando! 🖤🤍,https://yt3.ggpht.com/EzueqD-B9WdAa9begx9VoIvJnqvOJjtLso-afb96Ql7K6a1qqOU8C3UfQsr5K0B4O9tnOmC6pQ=s88-c-k-c0x00ffffff-no-rj,349892567,https://www.youtube.com/channel/UCqRraVICLr0asn90cAvkIZQ,2280000,2024-25-10,UCqRraVICLr0asn90cAvkIZQ,BR
TesiveGames,484,Tesive games,https://yt3.ggpht.com/dlypqmX8fnUMMpwEfMybvr6VES-6W80NtmdW7im07XEISxO9dIrv6Cji48qkV0vW1sFoup4jJA=s88-c-k-c0x00ffffff-no-rj,316656507,https://www.youtube.com/channel/UCj58YQhdaE5YHcKqKfgSL-Q,1660000,2024-25-10,UCj58YQhdaE5YHcKqKfgSL-Q,BR
Canal GOAT,2707,"Faça parte da comunidade GOAT na Casa de Apostas!  Divirta-se! (+18 aposte com responsabilidade)Ao vivo, grátis e com imagens no YouTube! Série B, Libertadores Feminina, UFC, Liga Saudita, Bundesliga, NWSL, programação ao vivo  e muito mais! 🐐Publicidade: contato@canalgoat.com.br",https://yt3.ggpht.com/lQbsmXG4-b751D81rRQ2DSmXVsu7WRPelClSw4Oc3jkJ6dxzgUne8AyZL4A6v5uH74x659wnvA=s88-c-k-c0x00ffffff-no-rj,383743860,https://www.youtube.com/channel/UC_oToDrJ6uca7d1dFVBmLtg,3780000,2024-25-10,UC_oToDrJ6uca7d1dFVBmLtg,BR
Batatinha,948,"OIEEE, me chamo Batata, faço RP com personagens como a Anya, Chopper, Pomni... e outros aí, espero que goste dos vídeos!!Grupo do Roblox - https://www.roblox.com/groups/32620302/Familia-Batatinhas#!/aboutContato Comercial: batata@truue.com.br",https://yt3.ggpht.com/1jVszlRyueN2-BOrTyUuWUsb8ETyuwnchPRwmxbGJ_H4ATWvtMKmBBGfnhA6TxTBUhI3jGxwiQ=s88-c-k-c0x00ffffff-no-rj,166638733,https://www.youtube.com/channel/UCoymDTL_6Y3mIED9b9CA_6A,885000,2024-25-10,UCoymDTL_6Y3mIED9b9CA_6A,BR
SMTOWN,4439,Welcome to SM Entertainment Official YouTube Channel!You can enjoy SM artist's latest videos on SMTOWN Official YouTube Channel.,https://yt3.ggpht.com/_1Z4I2qpWaCN9g3BcDd3cVA9MDHOG43lE1YNWDNkKro49haGxkjwuFK-I8faWTKM6Jle9qb4ag=s88-c-k-c0x00ffffff-no-rj,30352057617,https://www.youtube.com/channel/UCEf_Bc-KVd7onSeifS3py9g,32700000,2024-25-10,UCEf_Bc-KVd7onSeifS3py9g,
EYstreem,1971,"When waves rise, You still them.🌊 (Psalm 89:9)Hey! Do you love Minecraft and Gaming content? Then Subscribe to jump on the EYwave and ride with me in my next video! I can't wait to see you there 😜Owned and operated by Spawnpoint Media.https://spawnpointmedia.com/",https://yt3.ggpht.com/u8YI5o1jCT3jz1I1gMLPJ1HYJGxRwZOOjiw2lU3DUhHpWMpvZ9Z3IUefGM5fusebUbolCKjs=s88-c-k-c0x00ffffff-no-rj,4087013214,https://www.youtube.com/channel/UC-g_O9HWb5B0rVDG1hLd5Hw,11000000,2024-25-10,UC-g_O9HWb5B0rVDG1hLd5Hw,AU
Sonar Produtora ,516,,https://yt3.ggpht.com/xbj60MeDkon8m9Vt_Bqj_0wVlkx0ORmewld5Y2etfpVuW___BDJN1HnWkt3pYRdQupxEyeIdEA=s88-c-k-c0x00ffffff-no-rj,1191829195,https://www.youtube.com/channel/UClhFyS7uI884HtPGyI31pRw,1310000,2024-25-10,UClhFyS7uI884HtPGyI31pRw,BR
Brubs,146,"Um canal feito para eu fazer o que eu mais gosto, contar as minhas histórias de vida absurdas e desenhar.Basicamente uma capsula do tempo pra mim. Espero que vocês gostem e se divirtam!!!!",https://yt3.ggpht.com/Sd6eJ3RAz5UtwJCTukUTYlZoi_D-ySTzmO0uby4eCm-rp-P3Z4QGXTi1GvGmjauxm_raoDgbOw=s88-c-k-c0x00ffffff-no-rj,80369862,https://www.youtube.com/channel/UC-_Czj1ogmZhctxzV7-pGKw,777000,2024-25-10,UC-_Czj1ogmZhctxzV7-pGKw,BR
ProbIems,3632,💙👇🏻Veja o Nosso SHOW👇🏻💙https://linktr.ee/turmadoproblemsProblems💙 https://www.instagram.com/problems_sr/Mel 💛https://www.instagram.com/kaikemel/Kadu ❤ https://www.instagram.com/kadukon/Stick 💚https://www.instagram.com/guualfaro/Zoom🧡 https://www.instagram.com/josedu4rdo/Email para fãs mandarem mensagens: problemsmensagens@gmail.comEmail Comercial: comercial@agenciacurta.com,https://yt3.ggpht.com/yV0e4Bz9ikJo3cnfNe7C7r6RovC_ejAnJZe9u84ftPg83lNfMni8BlEowxnygCsKy6zJlKXCSA=s88-c-k-c0x00ffffff-no-rj,5557308100,https://www.youtube.com/channel/UCrcBZDofBltcgGxphNia2tw,9210000,2024-25-10,UCrcBZDofBltcgGxphNia2tw,BR
Cavaleiros do Forró,396,A banda que desde 2001 vem levando muita alegria através de um bom forró para todos os lugares do Brasil! É mais uma da Padang Promoções! Contatos: + 55 (84) 99982-3032,https://yt3.ggpht.com/ZwWwcC_IuZlVe6rp1gD9Lp5iNDm_rM6qYpVAsQrbaTsvHLkzImciBvobPH3SgbK6jxyqb1B80g=s88-c-k-c0x00ffffff-no-rj,480318038,https://www.youtube.com/channel/UC24eqcXucH3sdxlD-y6I-kg,1050000,2024-25-10,UC24eqcXucH3sdxlD-y6I-kg,BR
Amado Batista,546,Canal Oficial do Cantor Amado Batista.Contato para Shows - Exclusivo Power Promoções(11) 5561-1902 (11) 93803-4613 (62) 99702-0700,https://yt3.ggpht.com/PTohgVKAvgt6w8UdnJ3v5mz6GKSAx5ljdaLbmiHolxoKCYIVeDT98XGKZqGLkNOk9gpQ3jmi0A=s88-c-k-c0x00ffffff-no-rj,2241500005,https://www.youtube.com/channel/UCQeEhNgnlXYuMUsEk98-Ecw,3640000,2024-25-10,UCQeEhNgnlXYuMUsEk98-Ecw,BR
Mayke e Rodrigo,140,"Mike Seemann e Antônio Oliveira, mais conhecidos como Mayke e Rodrigo, são naturais do interior de Rondônia e iniciaram uma parceria no ano de 2012.Naturais de Rondônia, Mayke e Rodrigo já colecionam posições no TOP200 do Spotify Brasil. A dupla soma mais de 20 milhões de streams nas plataformas e ganhou destaque com a música Tentação, parceria com Hugo e Guilherme.No final do ano de 2021, em Goiânia, a dupla gravou “Na Boca do Povo”, novo projeto produzido por Willi Baldo, que conta com 16 faixas no total. As participações especiais ficaram por conta da dupla Fred e Fabrício, do grupo de pagode Kamisa10 e de Hugo e Guilherme.Para marcar o novo momento da carreira, Mayke & Rodrigo gravaram o novo projeto “Virou Resenha” em novembro de 2023. Foi um projeto de regravações e contou com várias participações. E teve como música foco o single, “Quebração de Cara” e obteve mais de 4,5 milhões de plays nas plataformas.Contato para Shows: (62) 99695-0860 / (62) 99966-3636",https://yt3.ggpht.com/B52lmxrWiGPLAwk7gAAoEX8xXc3nbXIYAV1DG3dyC_yV1Pv2ZXIntqRD3xSxJ4LHLFSuh1cVRCE=s88-c-k-c0x00ffffff-no-rj,60013671,https://www.youtube.com/channel/UCdE7opc_bzOQbT0C9xcEABg,35000,2024-25-10,UCdE7opc_bzOQbT0C9xcEABg,BR
GR6 EXPLODE,3259,,https://yt3.ggpht.com/SahCIj4fyMUcrq0JGidN_XhfX93kGrwsLecVJ0drg5ycQVWKT9TTVPL6TYe0jzMm9GoX3iFtkQ=s88-c-k-c0x00ffffff-no-rj,28586573220,https://www.youtube.com/channel/UCNUQK9mQoqi4yNXw2_Rj6SA,41400000,2024-25-10,UCNUQK9mQoqi4yNXw2_Rj6SA,BR
Kitawari,26,,https://yt3.ggpht.com/nTiNwQbzR6HwkGGLQuxIvHHMGZjhVPD3YrnJnGhVXD_pqvMg4GerwixooHYnBwMfTFTtMtP-rQ=s88-c-k-c0x00ffffff-no-rj,2637559,https://www.youtube.com/channel/UCcP5qZQEqjK04TlWXlBdE8w,68400,2024-25-10,UCcP5qZQEqjK04TlWXlBdE8w,
Só Por Causa,1833,"(◣◢) 𝙨𝙚 𝙞𝙣𝙨𝙘𝙧𝙚𝙫𝙖, 𝙤𝙪 𝙨𝙚𝙧á 𝙤 𝙛𝙞𝙢 𝙙𝙚𝙨𝙨𝙚 𝙘𝙖𝙣𝙖𝙡．．．",https://yt3.ggpht.com/OtqAWuN4REGppHDuW8lhy7M2RAM05WZtXDR6E_WUV844Gb_cjSW227R1Khuz5XPAQg1EY9Hzt1s=s88-c-k-c0x00ffffff-no-rj,1354948966,https://www.youtube.com/channel/UCK_KzyBbDOxgrONcgPbRQtg,2770000,2024-25-10,UCK_KzyBbDOxgrONcgPbRQtg,BR
MC Jacaré,117,"Principal nome do funk no Centro-Oeste, Mc Jacaré se prepara para mais um grande marco da carreira. No dia 16 de agosto, o artista de 21 anos lança “Eletrofunk Raiz”, seu novo álbum que explora o gênero que o tornou referência nacional e que já chega estourado. A faixa de trabalho, “Pinxadão”, tem participação de Hungria e será acompanhada por um videoclipe no YouTube.O álbum tem oito faixas, sendo três lançadas já no primeiro semestre de 2024 e que viraram hits entre os fãs de funk. Duas delas, “Senta Pro Bruto” (feat Luan Pereira) e “A Culpa Não É Minha” (feat Mc Kevin O Chris), entraram no Billboard Brasil Hot 100. Autor de sucessos como “Vento Forte”, “Toma Tapa” e “Comprei Um Lança”, Mc Jacaré é um fenômeno nas redes sociais. Seus vídeos são sucesso instantâneo com seus 5,7 milhões de seguidores no total e garantiram algumas performances expressivas neste ano, com “Senta Pro Bruto” ficando entre as 50 músicas mais ouvidas no TikTok. Contato para shows: (62) 98631-7080 Euler",https://yt3.ggpht.com/wcf5cHqbnEzQrYKwNG6-ywexrSbD_xJjxvuQQj0WA-ojvIPxYnbhVRzfOEN3zZKxB1iBE0MDgQA=s88-c-k-c0x00ffffff-no-rj,601238382,https://www.youtube.com/channel/UCWr3qxmkD0SBtL57FBlaYag,1200000,2024-25-10,UCWr3qxmkD0SBtL57FBlaYag,BR
Fefo Caires,1142,"Oi pessoal, eu sou o Fefo!Sou kpopper desde 2011, quando me apaixonei pela SooYoung batendo cabelo em The Boys. Desde então, acompanho os girlgroups sul coreanos e sou fã da maioria deles, sendo que dos que não sou fã, no mínimo tenho grande respeito e admiração. Meu objetivo em criar esse canal foi ser um porta-voz para os girlgroups de kpop no Brasil, um país com uma quantia gigantesca de fãs de kpop, mas onde eu observava a falta de alguém para enaltecer os grupos femininos. Espero ser um desses incentivadores e despertar em vocês a paixão pelos girlgroups de kpop.",https://yt3.ggpht.com/9XPVapXXXBagXwH1S7Og5ylgBDY0iRBoHHbpn8eG0Pn_kl1Dz_qltdnIIGX2VDP_PHe8mobW-g=s88-c-k-c0x00ffffff-no-rj,37891842,https://www.youtube.com/channel/UC1nw9oKwbeHI98HJOylFbWw,225000,2024-25-10,UC1nw9oKwbeHI98HJOylFbWw,BR
東映アニメーション公式YouTubeチャンネル,1430,東映アニメーションのYouTube公式チャンネルです。This is the official site in YouTube of the TOEI ANIMATION.東映アニメーション公式サイトhttp://www.toei-anim.co.jp/,https://yt3.ggpht.com/ytc/AIdro_myyt_CjXcGgkWi4SsmF5nMJV6dVHQLRXVFRS5hXow3FOo=s88-c-k-c0x00ffffff-no-rj,428443568,https://www.youtube.com/channel/UCLhgIX2L5ZCaWdlaxR_oTAg,788000,2024-25-10,UCLhgIX2L5ZCaWdlaxR_oTAg,JP
JADEVEVO,10,,https://yt3.ggpht.com/0DynSHNQb0yG0a1ByN5VG8N8ZZ-S6HVmkNQ3kRQWU0GlLWHbImA1e80aOPR2h04evdwZGpUjRW8=s88-c-k-c0x00ffffff-no-rj,13605982,https://www.youtube.com/channel/UCqJIIqwYgqN0BUuk8Iea2yg,1050,2024-25-10,UCqJIIqwYgqN0BUuk8Iea2yg,
Yasmin Galvão,1914,"Todos os dias tem vídeo novo no canal para vocês, Baunilhas!!! Deixem nos comentários  opiniões de próximos vídeos 😊____________________________________________________________________⤵︎ CONTATO:💻  Para parcerias na net, publicidades e dúvidas - contato.yasmingalvao@gmail.com",https://yt3.ggpht.com/ichUFQNR5aN3mZQ7aLClCLILLNbYRRR-Gas1NAd93PCwI5kWXvbsr1bPZLKb07JhWTokoYY1QYk=s88-c-k-c0x00ffffff-no-rj,290024821,https://www.youtube.com/channel/UCOQ_KwPhg3IZbigiK7NCnfQ,1850000,2024-25-10,UCOQ_KwPhg3IZbigiK7NCnfQ,BR
Enaldinho,4580,"Falaaa, galera! Beleza??  Preparem-se para uma explosão de diversão toda semana no meu canal do YouTube! Pegadinhas, desafios e vlogs - tudo para garantir muitas risadas! Se inscreva já para não perder nenhum momento dessa aventura!",https://yt3.ggpht.com/ytc/AIdro_nuUiBgezNCkwsLB0lPoKEjHqLVuv9FGgAdFB9BQAqrYOM=s88-c-k-c0x00ffffff-no-rj,17469627360,https://www.youtube.com/channel/UC2bYhAHyaqfWlPXWBVk4BcA,39300000,2024-25-10,UC2bYhAHyaqfWlPXWBVk4BcA,BR
Zancanelli,292,"Acompanhe minha rotina de treinamento, meu dia a dia como atleta profissional  de fisiculturismo. Aqui você têm a oportunidade de acompanhar minha jornada, desde os bastidores das competições até os treinos desnecessários.Aqui você encontra insights sobre minha dieta, às vezes compartilho receitas saudáveis e estratégias nutricionais que eu sigo no meu dia a dia. Tópicos como recuperação, suplementação e mentalidade, fornecendo uma visão completa do estilo de vida de um atleta profissional de fisiculturismo.Meu objetivo é  ajudar o maior número de pessoas a transformar seus corpos e suas vidas. O fisiculturismo é minha paixão, por isso quero inspirar outros a perseguirem seus sonhos, e mostrar com os meus exemplos, que todos somos capazes, basta querer! ",https://yt3.ggpht.com/eYyV7q0iiWT1jmyx-vgnHE-uvNoKhx4CGLUVc92yqyC49pnayx0_cjdwKg66XJr_w3OBy6Estw=s88-c-k-c0x00ffffff-no-rj,11562416,https://www.youtube.com/channel/UCpAgJffQBIg4p_ga08It1mg,113000,2024-25-10,UCpAgJffQBIg4p_ga08It1mg,BR
Jogo Aberto,981,"Canal oficial do programa Jogo Aberto, exibido pela Band de segunda a sexta, das 11h às 13h. Confira diariamente a íntegra e os melhores momentos do programa.",https://yt3.ggpht.com/e_teE18eBcoIoqKtAiZE008ZY0Q_YKp9eu31QxEcLLveAJ9w6k-ui4bw0ViZvdYvbIMf0KMl=s88-c-k-c0x00ffffff-no-rj,103570349,https://www.youtube.com/channel/UCZaOZdn-Y-I5ikrofkWBLgQ,4950000,2024-25-10,UCZaOZdn-Y-I5ikrofkWBLgQ,BR
RafhaValent,1111,"Eae, meu nome é Rafhael mas pode me chamar de RafhaJá se inscreveu? Vem pro bonde você também, haha!Insta @RafhaValentJesus ama vocês!",https://yt3.ggpht.com/mKCG9E-22t_ZZ6e9eZj0XCV0i6v2N0_iUgTiK-qW5TK3faa8Xz5cwXk4aFynAqIvSmua7CsBOQ=s88-c-k-c0x00ffffff-no-rj,18613132,https://www.youtube.com/channel/UCVpuJFO62kt2htipgcZ_QGA,247000,2024-25-10,UCVpuJFO62kt2htipgcZ_QGA,BR
Sevdaliza,148,SEVDALIZA. STREAM 'NO ME CANSARE' FT. KAROL G BELOW.sevdaliza.com,https://yt3.ggpht.com/pIGX4AvIMOZSo6P7NIG8rr3d7gfa8NxCRKq8RZKE4abgrOlkBaUtwryG7rxyzsVOSVbEqih51A=s88-c-k-c0x00ffffff-no-rj,498588244,https://www.youtube.com/channel/UCONnf7g7QfOqzM3etLECtUA,995000,2024-25-10,UCONnf7g7QfOqzM3etLECtUA,NL
Band Receitas,7085,"Receitas fáceis, práticas e, claro, deliciosas para deixar seus dias cheios de tempero!",https://yt3.ggpht.com/BvFJFh24z94DlkLKW23OYR0Tyv-OTnCuno0t2kexG8MdQngYs-6XXsmcnY91KG_U0JODfnZccQ=s88-c-k-c0x00ffffff-no-rj,30613429,https://www.youtube.com/channel/UCvo0dAe4ffTzCN11u71uNLQ,223000,2024-25-10,UCvo0dAe4ffTzCN11u71uNLQ,BR
Max Titanium,1744,ESTAMOS DE VOLTA!,https://yt3.ggpht.com/J8njLcVYK7-vg2_UbsnKjjo98FU-L-TIWLfQec9VzjPtGeVbst01Yt17xFFSQmVoGWlbVLju3nk=s88-c-k-c0x00ffffff-no-rj,262826179,https://www.youtube.com/channel/UCy-R3H4s0z1HubB_uSiGsHA,1800000,2024-25-10,UCy-R3H4s0z1HubB_uSiGsHA,BR
PlayHard,2526,Jogos mobile e variedades!Mais gameplays no meu canal secundário Bruno PlayHard!E-mail:English/Português: bruno@canalplayhard.com.br,https://yt3.ggpht.com/ytc/AIdro_ncw5NSgyl0I5LGEiUvNHa2SsqdCXd2-JXOtiAhYfdyRIY=s88-c-k-c0x00ffffff-no-rj,2441068824,https://www.youtube.com/channel/UC4IMfO_--bwBaNgWeoLxAgg,14300000,2024-25-10,UC4IMfO_--bwBaNgWeoLxAgg,BR
Mari Maria,2234,"Inscreva-se no meu canal para dicas de maquiagem, beleza, entretenimento e muito mais!",https://yt3.ggpht.com/C37eSgCwpw7O0mWM-JUIvcjr8JWcnDlqmCemS8_psLTzQ9J4kx3WIJ1KChppl9fpvf1EahAgNd4=s88-c-k-c0x00ffffff-no-rj,1547243845,https://www.youtube.com/channel/UCcHR0RvLYk33ppkjBw3UaEA,11200000,2024-25-10,UCcHR0RvLYk33ppkjBw3UaEA,
MUSSA,555,"Esse é o canal oficial do Mussa, seu Barbudo Favorito. Músicas divertidas e batalhas de rima para todas as idades. Aprenda a rimar, batalhe com os amigos e divirta-se com as Batalhas de Youtubers, Batalhas com Games e com as musicas e videos mais engraçados e animados do Mussoumano. Conteúdo livre para todos os públicos e idades. Chame sua família e entre agora no Mussa Style! Venha curtir as Batalhas de rap mais loucas do Youtube.Parcerias e publicidade:contato@mussastyle.com.brsiga @mussoumano",https://yt3.ggpht.com/HjS8Tj0OPumsW8joXIeBIP7dcSvlF-aAVqdzpYZBaMA96AI_EfT6hkHg9MqZh7VpyGNNeR0s=s88-c-k-c0x00ffffff-no-rj,2156478430,https://www.youtube.com/channel/UC607Gii1uo93qDqiGR6-c3w,13000000,2024-25-10,UC607Gii1uo93qDqiGR6-c3w,BR
Gloria Groove,459,"Com apenas 29 anos e uma fabulosa trajetória artística, Gloria Groove celebra o título de uma das artistas mais ouvidas do Brasil. A paulista passou a se apresentar como Drag Queen em 2015, e lançou seu álbum de estreia “Proceder” em 2017.Em fevereiro de 2022, GG divulgou seu segundo álbum “Lady Leste”, uma exaltação à sua origem e um resumo de todas as referências artísticas que ela reuniu durante a vida. O disco teve os singles “Bonekinha”, “A Queda” e “Vermelho”.Em 2023, Gloria lançou seu terceiro álbum Futuro Fluxo em que apresenta o funk numa estética futurista com grandes participações nas faixas, como de Anitta, Ludmilla, DJ GBR, Mc Rick e hits como DA BRABA. Em 2024, GG se lançou no Pagode com a Serenata da GG. Em duas semanas, o projeto ultrapassou 10 milhões de streams. Uma das músicas, Nosso Primeiro Beijo, que já havia viralizado no TikTok antes do lançamento, chegou a ser a música de pagode mais escutada do país no Spotify. O 2º volume será lançado em breve.",https://yt3.ggpht.com/zQhsuXb1dpw3GfgiKilE1NH7nFQqdNbLyuLSBIH5S4Guxy4yrGfyQ3RCqjKqnOBNsWlf9JNs=s88-c-k-c0x00ffffff-no-rj,1654875607,https://www.youtube.com/channel/UCLoL96fSeaLOen3mpDYeqtA,3950000,2024-25-10,UCLoL96fSeaLOen3mpDYeqtA,BR
Caike Pro,76, IFBB PRO Classic Physique 🇧🇷/🇺🇸@darcsport code: Caike10@growthsupplements cupom: Caike,https://yt3.ggpht.com/XiH4zZcgSdJpatLW0O9wzAVmtVUez8AfrCzCx0lrCgQSgE78uhUl2iFmys1zHnoeBZZTGF1o1g=s88-c-k-c0x00ffffff-no-rj,6609083,https://www.youtube.com/channel/UCA_WXRDt9nz8exYNLto1gSA,188000,2024-25-10,UCA_WXRDt9nz8exYNLto1gSA,
Léo Foguete - Topic,4,,https://yt3.ggpht.com/sNLrq3ybIhdrnROnTBDYSrywmBD444PO-76qoXbGu6OXZ6f5GRhw7UB3wqjw_x10FR6BfeetvaY=s88-c-k-c0x00ffffff-no-rj,2896243,https://www.youtube.com/channel/UCeZzZFVIdC39pUBv4Bgu9yg,3210,2024-25-10,UCeZzZFVIdC39pUBv4Bgu9yg,
Canal Rivalidade FC,1059,"React Palmeiras, React Corinthians, React São Paulo, React Santos,  React FlamengoReact Atlético MG, React Vasco, React Fluminense, React Botafogo, React CruzeiroReacts de gols de jogos de Futebol.Contato: piclesmakers@gmail ",https://yt3.ggpht.com/Bd_zwkWemwsXyho8ZPRt1KVgMQsvUD8MNA_KZCJYUG_83f2wWh0m1cTfeVHfe1Lw_CKG-n-d=s88-c-k-c0x00ffffff-no-rj,44421386,https://www.youtube.com/channel/UC1gaUzbtmN3avX_JGP9Udaw,326000,2024-25-10,UC1gaUzbtmN3avX_JGP9Udaw,BR
Brawl Stars,243,Fast-paced 3v3 multiplayer and battle royale made for mobile! Play with friends or solo across a variety of game modes in under three minutes.,https://yt3.ggpht.com/FVJpJyrV85TDL2nyiFbnaBuZzuYX1thQywPXCvilPAuw7DmPjFoXphPgkCqekYNIfqFtqGrvCg=s88-c-k-c0x00ffffff-no-rj,2894709106,https://www.youtube.com/channel/UCooVYzDxdwTtGYAkcPmOgOw,20300000,2024-25-10,UCooVYzDxdwTtGYAkcPmOgOw,FI
Subnautica,81,"Subnautica and Subnautica: Below Zero are an underwater open world exploration and construction games, created by Unknown Worlds.",https://yt3.ggpht.com/74lMno6ceX5u7MM1N6Btu749Uk59aguAEgvQiTrD1uneoE409j0fIJv4d0zu75XF1cBoCu8UQis=s88-c-k-c0x00ffffff-no-rj,70278765,https://www.youtube.com/channel/UCx2StD8gHd_-nRo5z1qcJ8g,555000,2024-25-10,UCx2StD8gHd_-nRo5z1qcJ8g,US
Gabriel e Shirley - Games,1229,"Conteúdo para TODA FAMÍLIA, com Games, Histórias divertidas e vídeos engraçados!Vídeos novos às 11h da Manhã.Com Gabriel e Shirley!",https://yt3.ggpht.com/Q4ZySUGYfK8YjAQf-v1tyMZgp-QIkTbHG9xbQ9amtdm9a8G4NShUCBAyQIrgN7ckYoPd6YXorw=s88-c-k-c0x00ffffff-no-rj,2028378930,https://www.youtube.com/channel/UCymE80p2pHiTP4Xye327CVA,3570000,2024-25-10,UCymE80p2pHiTP4Xye327CVA,BR
Mnet K-POP,39736,K-POP Channel of World's No.1 Music Channel MnetWatch the latest and hottest K-POP contents on ✨Mnet K-POP✨ⓒCJ ENM. Corp ALL RIGHTS RESERVED,https://yt3.ggpht.com/ytc/AIdro_nUqO-dRLZjKIvfKHI-6pRWYjmx_5ZFEVgcKfMo0m6HTLKH=s88-c-k-c0x00ffffff-no-rj,16916742201,https://www.youtube.com/channel/UCbD8EppRX3ZwJSou-TVo90A,21200000,2024-25-10,UCbD8EppRX3ZwJSou-TVo90A,
FORMULA 1,7946,"The home of risk takers, late brakers and history makers! 💫NEXT UP - RACE 19 OF 24: MEXICO 🇲🇽 25-27 OCTOBER",https://yt3.ggpht.com/tyLW5LsJGwr4ViM30OeYbuLcu_MXfpRzP8y-X9_aKfTNJeMFHmnNbPyxxhaFDA9NRgwEu9mT-g=s88-c-k-c0x00ffffff-no-rj,7251372853,https://www.youtube.com/channel/UCB_qr75-ydFVKSF9Dmo6izg,11100000,2024-25-10,UCB_qr75-ydFVKSF9Dmo6izg,
Sunaika Bruna,703,"Oii pessoal, tudo bem com vocês?? Criei esse canal com o intuito de trazer um pouquinho mais de alegria na vida de vocês e compartilhar um pouquinho da nossa vida também😊 Sai videos 3 dias da semana, SEG, QUA, SEX entre 18:00 e 20:00 ❤️ Espero que vocês gostem porque é tudo feito com muito amor. E-mail para contato: comercial@sunaika.comCaixa Postal 8003 - Cep: 70680-970",https://yt3.ggpht.com/m_JIxJ_5TcBMSAwlnUbLIzPb-5y0UlL3tiH_axGzGW4i1tkCbbYQYUSvQR9z6x9nryC_XBHHvA=s88-c-k-c0x00ffffff-no-rj,336989923,https://www.youtube.com/channel/UC9eXFedzizQtlY5snZ-IFkg,3100000,2024-25-10,UC9eXFedzizQtlY5snZ-IFkg,BR
Chrono,108,Cronologicamente avançado!,https://yt3.ggpht.com/7slPeHaeWs1uKKLVMuvDtAaliaCnjtM51as5YyhGaaZG88tiicM8A8-obJt3Wfu7Vju9Z-oTBQ=s88-c-k-c0x00ffffff-no-rj,104264857,https://www.youtube.com/channel/UCIgwOzhDnR0uoT59pJJONxg,356000,2024-25-10,UCIgwOzhDnR0uoT59pJJONxg,
"Tyler, The Creator",89,"CHROMAKOPIA: Monday, October 28th",https://yt3.ggpht.com/-1Bt8eufq601KzmA0Rk1yrIzz372UDDeBkIpWytlztkcAyh1w6g2bNfXVnR6hadnezvUCq0XICA=s88-c-k-c0x00ffffff-no-rj,2393773921,https://www.youtube.com/channel/UCsQBsZJltmLzlsJNG7HevBg,5850000,2024-25-10,UCsQBsZJltmLzlsJNG7HevBg,
FutParódias,978,📧 CONTATO: contato@futparodias.com.br--💼 COMERCIAL: comercial@futparodias.com.br🎤 SHOWS: shows@futparodias.com.brÉ o FutParódias original! 🎧⚽Vídeos novos toda terça e sexta às 11:00hSigam nossas redes!Dezão:📷 https://www.instagram.com/dezaofutparodias🐦 https://www.twitter.com/dezaodrumond👍 https://www.facebook.com/dezaodrumondLeon:📷 https://www.instagram.com/leonfutparodias🐦 https://www.twitter.com/leonwhosoever👍 https://www.facebook.com/leonwhosoeverFutParódias:📷 https://www.instagram.com/futparodias🐦 https://www.twitter.com/futparodias👍 https://www.facebook.com/futparodias,https://yt3.ggpht.com/43gv_N0qV_EXcXQkES6SFcXzEbPUgfXEfcRX9tNYjdf54fGHGwaed1E_jouI_SztDLCSaOJSDQ=s88-c-k-c0x00ffffff-no-rj,4964667920,https://www.youtube.com/channel/UCGFNp4Pialo9wjT9Bo8wECA,10700000,2024-25-10,UCGFNp4Pialo9wjT9Bo8wECA,BR
