Titulo,Numero_de_videos,Descricao,Imagem_de_perfil,Numero_de_visualizacoes,Link,Numero_de_inscritos,Data,Canal_ID,Pais_codigo
HYBE LABELS,2153,"Welcome to the official YouTube channel of HYBE, the content hub for BIGHIT MUSIC, BELIFT LAB, SOURCE MUSIC, PLEDIS Entertainment, KOZ ENTERTAINMENT, ADOR and more.",https://yt3.ggpht.com/ytc/AIdro_l8g0yRFG8xoe_qeqk8Ki9UFy36cB2IjZEWZWz0h7gl-t0=s88-c-k-c0x00ffffff-no-rj,36466407891,https://www.youtube.com/channel/UC3IZKseVpdzPSBaWxBxundA,75900000,2024-25-10,UC3IZKseVpdzPSBaWxBxundA,KR
Marcelo Bechler,595,"Jornalista esportivo. Correspondente desde 2015 em Barcelona. Aqui para analisar futebol, da forma mais simples possível, para vocês!",https://yt3.ggpht.com/ytc/AIdro_m8krl9CuweQI-Y7wGTgvX6z5qTI_QR7G5VLxAzS0WkBBU=s88-c-k-c0x00ffffff-no-rj,29991349,https://www.youtube.com/channel/UCr3S50A3UmXeBsHBTHCW-Ow,242000,2024-25-10,UCr3S50A3UmXeBsHBTHCW-Ow,
Arthur Quezada,460,"Apaixonado por futebol e cerveja., Arthur Quezada é repórter esportivo da TNT Sports Brasil. Mora no Porto, Portugal, e trabalha há 8 anos cobrindo futebol europeu. Seis finais de Champions, duas Copas do Mundo, Eurocopa e por ai vai. Neste canal falaremos muito sobre Champions League e muito sobre o universo do futebol europeu, sempre molhando as palavras.",https://yt3.ggpht.com/1gG1NFwsDcOSmk7QusM32QnYwPNH1hMWNPQhbxzAszVTVljbUohnpHD03LtQOkvhE9rBuAUxY40=s88-c-k-c0x00ffffff-no-rj,4288599,https://www.youtube.com/channel/UCCLJoDshWYe1vV_Q-rmi_aw,68000,2024-25-10,UCCLJoDshWYe1vV_Q-rmi_aw,
ge,17866,"Bem-vindos ao nosso canal 🙌🙌O ESPORTE DA GLOBO ta muito on aqui no Youtube! 💥Aqui, vocês vão encontrar os melhores conteúdos de esporte com a qualidade que só a Globo tem.- melhores momentos do Campeonato Brasileiro ⚽- destaques dos principais eventos que só o sportv transmite ⚽🏐🏀- o melhor da programação dos canais de esporte da Globo 📺Além, é claro, de games, lives, vídeos com conteúdos originais e muita resenha!Todo dia, muuuuitos vídeos pra vocês maratonarem à vontade ⚽🍿DIVIRTAM-SE! ",https://yt3.ggpht.com/XHCE1FH6F1fBdRQjaf4Q08y4_GpdyiLU1vEFG20H2rs4sdRP00O-c6M8EBTJbwn01cHQ1lFR=s88-c-k-c0x00ffffff-no-rj,3195422624,https://www.youtube.com/channel/UCgCKagVhzGnZcuP9bSMgMCg,5360000,2024-25-10,UCgCKagVhzGnZcuP9bSMgMCg,BR
NBA Brasil,3778,"Canal oficial no Brasil da NBA, a maior liga profissional de basquete do mundo que atinge 215 países.TODOS os dias, você acompanha aqui no canal o melhor dos jogos da noite anterior com o Rodada NBA, durante a temporada! Além disso, temos jogos ao vivo todas as segundas-feiras, junto com o melhor da rodada no Crunchtime.E todas as quartas vocês ainda acompanham os bastidores mais incríveis das franquias da NBA com o NBA Na Estrada. Aqui você fica por dentro de tudo que rola na Liga!",https://yt3.ggpht.com/nHdZcHfst2VxOuEe1o0wPO8X4w9xXjqO0zWIH06LNlUN8BimHIWXFisNZ4pEHUzZQiVVXDEI=s88-c-k-c0x00ffffff-no-rj,236497806,https://www.youtube.com/channel/UCsiCOcr5SZAWlJMfcw9P__w,1210000,2024-25-10,UCsiCOcr5SZAWlJMfcw9P__w,BR
Enaldinho,4580,"Falaaa, galera! Beleza??  Preparem-se para uma explosão de diversão toda semana no meu canal do YouTube! Pegadinhas, desafios e vlogs - tudo para garantir muitas risadas! Se inscreva já para não perder nenhum momento dessa aventura!",https://yt3.ggpht.com/ytc/AIdro_nuUiBgezNCkwsLB0lPoKEjHqLVuv9FGgAdFB9BQAqrYOM=s88-c-k-c0x00ffffff-no-rj,17469627360,https://www.youtube.com/channel/UC2bYhAHyaqfWlPXWBVk4BcA,39300000,2024-25-10,UC2bYhAHyaqfWlPXWBVk4BcA,BR
Jazzghost,5915,Jogo uns jogos e passo vergonha. CONTATO: comercial@agenciacurta.com,https://yt3.ggpht.com/_QWLAwBwKXViiV5aOQBIpipDrh7iMhrpv7EMbqIL4kfVealfeXJ7CY49Uma1VeqVnkYUucW4r8Q=s88-c-k-c0x00ffffff-no-rj,7816628771,https://www.youtube.com/channel/UCIXguhHCl8eDTkXpEuiGPUA,17900000,2024-25-10,UCIXguhHCl8eDTkXpEuiGPUA,
Fraternidade São João Paulo II,3312,"Fundada em primeiro de maio de dois mil e doze (01/05/2012), por Pe. Ailton Fernandes Cardoso (fundador) Somos um Instituto de Vida Religiosa de natureza sacerdotal tendo como modelo inspirador João Paulo II. Após um período de inquietação e muitos sinais, nosso fundador sente-se chamado por Deus a deixar suas seguranças e se lançar na vontade do Senhor.Nosso carisma é expresso pelo lema  TOTUS TUUS IESU PER MARIAM, pois temos esse desejo de SER TODO DE JESUS POR MARIA, e em todas as coisas nos confiarmos a Mãe, pois sabemos que Ela nos levará ao seu Filho.Dentro do nosso carisma temos a missão de SANTIFICAR O CLERO através de nosso testemunho e sermos solícitos as necessidades dos sacerdotes, nos colocando a disposição pela oração e serviço. Com um zelo cada dia maior RESTAURAR AS FAMÍLIAS e movidos por um espírito missionário SALVAR A JUVENTUDE.Nossa regra é o EVANGELHO vivido na radicalidade onde seguimos o CRISTO POBRE, OBEDIENTE E CASTO.",https://yt3.ggpht.com/NwFas-BmhL-S3gcv6o2pmB0ryC60MgMEaknjrQxXsT97Jt7sL449igxUJIUR0GjNZ0Fp4M0w=s88-c-k-c0x00ffffff-no-rj,81839123,https://www.youtube.com/channel/UCvG8Ap6M8l0L80LvHA3wI1w,330000,2024-25-10,UCvG8Ap6M8l0L80LvHA3wI1w,BR
"Tyler, The Creator",89,"CHROMAKOPIA: Monday, October 28th",https://yt3.ggpht.com/-1Bt8eufq601KzmA0Rk1yrIzz372UDDeBkIpWytlztkcAyh1w6g2bNfXVnR6hadnezvUCq0XICA=s88-c-k-c0x00ffffff-no-rj,2393773921,https://www.youtube.com/channel/UCsQBsZJltmLzlsJNG7HevBg,5850000,2024-25-10,UCsQBsZJltmLzlsJNG7HevBg,
SkinSpotlights,5382,"This channel will showcase the latest Skins coming in League of Legends. Subscribe to keep upto date!This channel has all the skins up (Oldest and Newest) in 1080p60fps.  Quality over speed, the format will remain the same so you know what to expect every time.Final Spotlights when a skin is 100% finished will be in 4k60fps, Pre-release videos will vary between 4k60fps and 1080p60fps.EUW Server - UliTwitter - https://twitter.com/SkinSpotlightsTwitch - https://www.twitch.tv/SkinSpotlightsWeibo - https://m.weibo.com/u/6503851567Facebook - https://www.facebook.com/Skinspotlights/Bilibili - https://space.bilibili.com/3493083209533523TikTok - https://www.tiktok.com/@skinspotlightsYou do not have my permission to re-upload any of my videos or video clips. Twitter - SkinSpotlightsFacebook - SkinSpotlightsLeague News & Datamined Content:http://www.surrenderat20.net/Software:http://skinspotlights.com/",https://yt3.ggpht.com/ytc/AIdro_kNUkO8ugOH12V_RZtUYzEORSh7ta5wwLLHU8aLLEjASyQ=s88-c-k-c0x00ffffff-no-rj,2144182778,https://www.youtube.com/channel/UC0NwzCHb8Fg89eTB5eYX17Q,2700000,2024-25-10,UC0NwzCHb8Fg89eTB5eYX17Q,GB
ProbIems,3632,💙👇🏻Veja o Nosso SHOW👇🏻💙https://linktr.ee/turmadoproblemsProblems💙 https://www.instagram.com/problems_sr/Mel 💛https://www.instagram.com/kaikemel/Kadu ❤ https://www.instagram.com/kadukon/Stick 💚https://www.instagram.com/guualfaro/Zoom🧡 https://www.instagram.com/josedu4rdo/Email para fãs mandarem mensagens: problemsmensagens@gmail.comEmail Comercial: comercial@agenciacurta.com,https://yt3.ggpht.com/yV0e4Bz9ikJo3cnfNe7C7r6RovC_ejAnJZe9u84ftPg83lNfMni8BlEowxnygCsKy6zJlKXCSA=s88-c-k-c0x00ffffff-no-rj,5557308100,https://www.youtube.com/channel/UCrcBZDofBltcgGxphNia2tw,9210000,2024-25-10,UCrcBZDofBltcgGxphNia2tw,BR
Santos Futebol Clube,7910,"A Santos TV é o canal oficial do Santos Futebol Clube!Lives, bastidores das partidas, resenhas, gols e tudo mais que rola no nosso Peixe você só confere aqui!Inscreva-se agora e ative o sininho! É de graça e você não perde mais nenhum vídeo! ;)----------Equipe:Guilherme KastnerGuilherme GreghiLeandro ReisLeonardo RodriguesNickolas RibeiroPedro Silveira",https://yt3.ggpht.com/K00r6QliK2iFnCo-t8pVuW5gKTSY0i2YByg8HAUJnsEJXz2l7MXgdK-9HlqwXWdrWOjbvHOkhA=s88-c-k-c0x00ffffff-no-rj,362477762,https://www.youtube.com/channel/UC0uRT_armQXqds_rjTjqJ0g,1280000,2024-25-10,UC0uRT_armQXqds_rjTjqJ0g,BR
SMTOWN,4439,Welcome to SM Entertainment Official YouTube Channel!You can enjoy SM artist's latest videos on SMTOWN Official YouTube Channel.,https://yt3.ggpht.com/_1Z4I2qpWaCN9g3BcDd3cVA9MDHOG43lE1YNWDNkKro49haGxkjwuFK-I8faWTKM6Jle9qb4ag=s88-c-k-c0x00ffffff-no-rj,30352057617,https://www.youtube.com/channel/UCEf_Bc-KVd7onSeifS3py9g,32700000,2024-25-10,UCEf_Bc-KVd7onSeifS3py9g,
Domingo Espetacular,8848,"Canal oficial do Domingo Espetacular, que é exibido aos domingos, às 19h45.",https://yt3.ggpht.com/MORc47bbwN4bqGXRiEwjSpNz65lcXp8ZHluoUHN493Q4rxNTSHHW_QSwy5pYVZ_GyYENxjYJxw=s88-c-k-c0x00ffffff-no-rj,2884185449,https://www.youtube.com/channel/UCP-Vg2PcmLiWpEdvMI1R35w,8050000,2024-25-10,UCP-Vg2PcmLiWpEdvMI1R35w,
"Tyler, The Creator",89,"CHROMAKOPIA: Monday, October 28th",https://yt3.ggpht.com/-1Bt8eufq601KzmA0Rk1yrIzz372UDDeBkIpWytlztkcAyh1w6g2bNfXVnR6hadnezvUCq0XICA=s88-c-k-c0x00ffffff-no-rj,2393773921,https://www.youtube.com/channel/UCsQBsZJltmLzlsJNG7HevBg,5850000,2024-25-10,UCsQBsZJltmLzlsJNG7HevBg,
Gaebe BS,486,"Olá! Eu sou o Gaebe, mais conhecido como Ervilha aqui no meu canal.Trago vídeos de dicas, além de tier lists e rankings, tudo para ajudar VOCÊ a ser tornar um melhor jogador de brawl stars!Além disso, para os que não são tão chegados a conteúdos mais sérios, estou sempre trazendo curiosidades e temas interessantes a respeito do que está acontecendo dentro do jogo, e sobre sua comunidade!Tenho certeza que você irá gostar dos vídeos, e não se esqueça de clicar no botão de inscrever-se eim!joaovpcwaquim@gmail.comwaquim77@gmail.com",https://yt3.ggpht.com/ytc/AIdro_k1F67pOSUhZxMZ-7CctUwLp9vg382aYByxxK7_d40XeTE=s88-c-k-c0x00ffffff-no-rj,74593058,https://www.youtube.com/channel/UCHkdAapLfLFYbrFJvtdb7LA,267000,2024-25-10,UCHkdAapLfLFYbrFJvtdb7LA,BR
Fixz,326,Provavelmente nesse exato momento estou construindo algo no Minecraft E-mail Profissional: fixz@linkme.live,https://yt3.ggpht.com/BbucNXiZIaw9vzDUc-4SccegP_3ztBy51CCD-VvDozFx6zQqYWKYPyJADzfGX60vRrjloFFPYA=s88-c-k-c0x00ffffff-no-rj,174726841,https://www.youtube.com/channel/UCgrFZP2B8H6pWgPL1bAqkiQ,1240000,2024-25-10,UCgrFZP2B8H6pWgPL1bAqkiQ,BR
ESPN Brasil,39023,"Seja bem-vindo ao canal de esportes da Disney no Brasil.Aqui você encontra o melhor das principais competições do mundo: CONMEBOL Libertadores e CONMEBOL Sudamericana, Premier League, LALIGA, Campeonato Italiano, Copa do Nordeste, NFL, NBA, MotoGP, Grand Slams de tênis e muito mais!Além disso, aproveite as opiniões e análises da melhor referência de jornalismo esportivo do país e muito conteúdo original com o nosso pesado time de talentos!Para acompanhar todos os eventos esportivos assista à ESPN no Disney+: http://dis.la/ESPNenDisneyPlus_YT_BR#ESPN #DisneyPlus",https://yt3.ggpht.com/ytc/AIdro_ma030CksbiH0ueLUATKsGGEmZkmIdjFcS_uiI49Mton8Jz=s88-c-k-c0x00ffffff-no-rj,4307337246,https://www.youtube.com/channel/UCw5-xj3AKqEizC7MvHaIPqA,6450000,2024-25-10,UCw5-xj3AKqEizC7MvHaIPqA,BR
Viih Tube,656,"Oi, meu nome é Vitória, Viih, e para alguns Viih Tube. Por que? Também não sei...publicidades@viihtube.com.br",https://yt3.ggpht.com/-p_adtPajgDzxDnuIHHpz4ql-LJX5choTflf19snomImOX-LBRiJiiNrbfVD5m5wT5jnfT-Ivh8=s88-c-k-c0x00ffffff-no-rj,956117156,https://www.youtube.com/channel/UCl5i1KWUAV7hdT5_tL8l6RA,11200000,2024-25-10,UCl5i1KWUAV7hdT5_tL8l6RA,BR
Hoje em Dia,13430,"Canal oficial do Hoje em Dia, da RECORD, com Ana Hickmann, Celso Zucatelli, Renata Alves e Ticiane Pinheiro.",https://yt3.ggpht.com/ytc/AIdro_nX06KSKqBfTIlDvdhEryI3srBoX7hID561b1QnlRbkfw=s88-c-k-c0x00ffffff-no-rj,776003109,https://www.youtube.com/channel/UCN-opsqqDunWO6h5uCp9Y4g,3350000,2024-25-10,UCN-opsqqDunWO6h5uCp9Y4g,
Blogueirinha,958,"Oi meninas e meninos também, tutupom? Bem-vindos ao canal da Blogueirinha. Blogueira, youtuber, ex mãe, vegana, modelo de passarela, modelo fotográfica, cantora, compositora, atriz  e internacional! ",https://yt3.ggpht.com/p4kCgOcKa9Xp3GgkTrG2bn2FbmpQbafNBKNNoPspA5qkMXzDVzsdgHoFU9z4Bmp0KlTXhXoeBUo=s88-c-k-c0x00ffffff-no-rj,221602075,https://www.youtube.com/channel/UCF8MQYobXcHejWAaet4nSxA,1750000,2024-25-10,UCF8MQYobXcHejWAaet4nSxA,BR
League of Legends,1495,"Recently recognized as the most played video game in the world—100 million play every month—League of Legends® is a multiplayer online battle arena game (MOBA).Players choose a role from an expanding cast of powerful champions and join forces in strategic, fast-paced gameplay to take control of the enemy’s end of the battlefield.Sign up for a free League of Legends account at http://riot.com/signup",https://yt3.ggpht.com/olIZhSlrdVwqLu0Xte6d9yjTTKn256CEa1u36pXTKoioQ5c0rmOIV_MQRxybo5ekWzAbA4NV=s88-c-k-c0x00ffffff-no-rj,8222233316,https://www.youtube.com/channel/UC2t5bjwHdUX4vM2g8TRDq5g,15500000,2024-25-10,UC2t5bjwHdUX4vM2g8TRDq5g,US
Ben Azelart,353,SUBSCRIBE FOR GOODLUCK!🤑BIZ - ben@ampstudios.coINSTAGRAM - @benazelartTWITTER - @benazelartSNAPCHAT - @TheBenAzelart,https://yt3.ggpht.com/mdLQ_AP35nEMgCDSuOqj7l32s-2edWv8WEmZY8fxPiJ4tI5gWM867-P76O9l8vMxYFX-SkKBIA=s88-c-k-c0x00ffffff-no-rj,7628441172,https://www.youtube.com/channel/UCwVg9btOceLQuNCdoQk9CXg,31800000,2024-25-10,UCwVg9btOceLQuNCdoQk9CXg,US
ZÉ DA ROÇA E SUA TURMA,357,,https://yt3.ggpht.com/AkLbdrddwFhfogZ6AOqf9TDLMz6mG1xAMAmSlJ9Z_DuyCGXGdcMwE5REz_OwuH_U7-TnZry0rg=s88-c-k-c0x00ffffff-no-rj,346965678,https://www.youtube.com/channel/UC_IXaDwOe5uvuNxcDk45yGg,1220000,2024-25-10,UC_IXaDwOe5uvuNxcDk45yGg,BR
Livre como vento,1369,Seja bem vindo!,https://yt3.ggpht.com/ltsDptH2ciYE69qHXCYIqWZPTEyRpq9HNLaQh_hu9jP_1fPkLELnnHMhLQMvhtDwOuzgCIG8yA=s88-c-k-c0x00ffffff-no-rj,49307460,https://www.youtube.com/channel/UCcAfcmj6QbiWfxJLWTF3LcQ,207000,2024-25-10,UCcAfcmj6QbiWfxJLWTF3LcQ,BR
Bruno Perini - Você MAIS Rico,2058,"Canal de vídeos de Bruno Perini - criador do site de educação financeira Você MAIS Rico e do curso Viver de Renda.Aprenda mais sobre dinheiro, finanças e investimentos com quem realmente entende do assunto.Inscreva-se no canal e me siga nas redes sociais!",https://yt3.ggpht.com/ytc/AIdro_l6tUjwilRjMDBJ0p36NnmeSiU01y2N-4HZVS34VwheCrQ=s88-c-k-c0x00ffffff-no-rj,412870720,https://www.youtube.com/channel/UCCE-jo1GvBJqyj1b287h7jA,1740000,2024-25-10,UCCE-jo1GvBJqyj1b287h7jA,BR
Aline vida de Mãe ,763,"Olá PRECIOSAS ! Sejam muito bem vindas (os) ao canal . Me chamo Alline tenho 33 anos e venho compartilhar minha vida com vocês sendo mãe , dona de casa , mostro minhas rotinas , faxinas , comprinhas , vida real sendo mãe de 5 . Inscrevam se e venha fazer parte das minhas PRECIOSAS e PRECIOSOS aqui no canal ... ♥️",https://yt3.ggpht.com/hnMbD0auOYDAN4bO19q9IwD-lVwmU6ZtmWQUv5BUhTxQFdrvX-Ne_4Ihh54_K1NAeWBhGZ946g=s88-c-k-c0x00ffffff-no-rj,38749621,https://www.youtube.com/channel/UCiyfYuX4enlwYWl_9nZnMDA,193000,2024-25-10,UCiyfYuX4enlwYWl_9nZnMDA,BR
Ricardinho,30,,https://yt3.ggpht.com/f8aLP9Y5gc6IUsZ-hMwFGc34nKmJw_l0NovE063alMs9X_INBxi2-HpiahA-xz8wAxGfGaC-jPE=s88-c-k-c0x00ffffff-no-rj,1695759,https://www.youtube.com/channel/UCtPYmhNzbNBoAaZByv9vwxg,74600,2024-25-10,UCtPYmhNzbNBoAaZByv9vwxg,BR
HYBE LABELS,2153,"Welcome to the official YouTube channel of HYBE, the content hub for BIGHIT MUSIC, BELIFT LAB, SOURCE MUSIC, PLEDIS Entertainment, KOZ ENTERTAINMENT, ADOR and more.",https://yt3.ggpht.com/ytc/AIdro_l8g0yRFG8xoe_qeqk8Ki9UFy36cB2IjZEWZWz0h7gl-t0=s88-c-k-c0x00ffffff-no-rj,36466407891,https://www.youtube.com/channel/UC3IZKseVpdzPSBaWxBxundA,75900000,2024-25-10,UC3IZKseVpdzPSBaWxBxundA,KR
Sport Club Internacional,3463,"Canal oficial do Colorado no YouTube! De torcedor pra torcedor, aqui você acompanha os bastidores do Clube, desafios com personalidades, a paixão da torcida, os segredos e curiosidades de colorados e coloradas que fazem parte da trajetória do Clube do Povo e muito mais! Inscreva-se no Canal do Inter!Tem mais Clube do Povo nas nossas redes sociais:socio.internacional.com.brfacebook.com/SCInternacionaltwitter.com/SCInternacionalinstagram.com/SCinternacionalEsse canal é uma produção e realização da equipe de Comunicação do Sport Club Internacional.",https://yt3.ggpht.com/ytc/AIdro_lqDgM1b0OOKybMFzUQxJkCoEhkf_w13HpWta9ji4qngIo=s88-c-k-c0x00ffffff-no-rj,53465735,https://www.youtube.com/channel/UC7hAvFDWwVajRqrI86KCoxA,410000,2024-25-10,UC7hAvFDWwVajRqrI86KCoxA,BR
Só Por Causa,1833,"(◣◢) 𝙨𝙚 𝙞𝙣𝙨𝙘𝙧𝙚𝙫𝙖, 𝙤𝙪 𝙨𝙚𝙧á 𝙤 𝙛𝙞𝙢 𝙙𝙚𝙨𝙨𝙚 𝙘𝙖𝙣𝙖𝙡．．．",https://yt3.ggpht.com/OtqAWuN4REGppHDuW8lhy7M2RAM05WZtXDR6E_WUV844Gb_cjSW227R1Khuz5XPAQg1EY9Hzt1s=s88-c-k-c0x00ffffff-no-rj,1354948966,https://www.youtube.com/channel/UCK_KzyBbDOxgrONcgPbRQtg,2770000,2024-25-10,UCK_KzyBbDOxgrONcgPbRQtg,BR
Esporte na Band,3062,"Band, o canal do Esporte!",https://yt3.ggpht.com/izG4Fp23xVwBDAKKgfKUW13csHcqtwq048eN8fR52teg0iKNsofPv7x9paFTcgsjH09d99eSzqc=s88-c-k-c0x00ffffff-no-rj,106160806,https://www.youtube.com/channel/UC896QaWKoSGdZTmy9rHyU_g,800000,2024-25-10,UC896QaWKoSGdZTmy9rHyU_g,BR
FORMULA 1,7946,"The home of risk takers, late brakers and history makers! 💫NEXT UP - RACE 19 OF 24: MEXICO 🇲🇽 25-27 OCTOBER",https://yt3.ggpht.com/tyLW5LsJGwr4ViM30OeYbuLcu_MXfpRzP8y-X9_aKfTNJeMFHmnNbPyxxhaFDA9NRgwEu9mT-g=s88-c-k-c0x00ffffff-no-rj,7251372853,https://www.youtube.com/channel/UCB_qr75-ydFVKSF9Dmo6izg,11100000,2024-25-10,UCB_qr75-ydFVKSF9Dmo6izg,
Hora do Faro,4069,Este é o canal oficial no YouTube do programa Hora do Faro exibido pela Record e apresentado por Rodrigo Faro.,https://yt3.ggpht.com/LiW3Rhg0JgFgFEvJnWEFA2DxGRnHEd8eap1t1smCPqjx5QSJ4vSB01Vaj-WrN8qH7fGecEFV7A=s88-c-k-c0x00ffffff-no-rj,1102030062,https://www.youtube.com/channel/UC6IV24QPvsASJbzqDbmK8gw,4560000,2024-25-10,UC6IV24QPvsASJbzqDbmK8gw,
ge,17866,"Bem-vindos ao nosso canal 🙌🙌O ESPORTE DA GLOBO ta muito on aqui no Youtube! 💥Aqui, vocês vão encontrar os melhores conteúdos de esporte com a qualidade que só a Globo tem.- melhores momentos do Campeonato Brasileiro ⚽- destaques dos principais eventos que só o sportv transmite ⚽🏐🏀- o melhor da programação dos canais de esporte da Globo 📺Além, é claro, de games, lives, vídeos com conteúdos originais e muita resenha!Todo dia, muuuuitos vídeos pra vocês maratonarem à vontade ⚽🍿DIVIRTAM-SE! ",https://yt3.ggpht.com/XHCE1FH6F1fBdRQjaf4Q08y4_GpdyiLU1vEFG20H2rs4sdRP00O-c6M8EBTJbwn01cHQ1lFR=s88-c-k-c0x00ffffff-no-rj,3195422624,https://www.youtube.com/channel/UCgCKagVhzGnZcuP9bSMgMCg,5360000,2024-25-10,UCgCKagVhzGnZcuP9bSMgMCg,BR
Sonar Produtora ,516,,https://yt3.ggpht.com/xbj60MeDkon8m9Vt_Bqj_0wVlkx0ORmewld5Y2etfpVuW___BDJN1HnWkt3pYRdQupxEyeIdEA=s88-c-k-c0x00ffffff-no-rj,1191829195,https://www.youtube.com/channel/UClhFyS7uI884HtPGyI31pRw,1310000,2024-25-10,UClhFyS7uI884HtPGyI31pRw,BR
Daishikawa,87,"Faço vídeos, as vezes de terror, as vezes de humor, mas todos são bonitos👌",https://yt3.ggpht.com/icEMip5rqzgRVKvkmJn5ovlcPhsOUMoNFPQH6E8o6xgSxIsO0oflJ7mEvW6zb1xjawMAeSoFbNU=s88-c-k-c0x00ffffff-no-rj,24374785,https://www.youtube.com/channel/UCXFqI7y1ks-aTA4cffywiVQ,376000,2024-25-10,UCXFqI7y1ks-aTA4cffywiVQ,BR
Coluna do Fla / Flamengo,5415,"O 𝐌𝐀𝐈𝐎𝐑 site de futebol do Brasil. 👥 Mais de 𝟑,𝟒 𝐌𝐈 de seguidores nas redes sociais | 🥇 Pioneiros em transmissões na internet💻 Site: http://colunadofla.com/📺Coluna do Fla / Play (Vídeos): https://www.youtube.com/channel/UCDEB-RQLpOCfXoxAohxGuug?sub_confirmation=1📷 Instagram: https://www.instagram.com/colunadofla/🐤 Twitter: https://twitter.com/ColunadoFla👍 Fanpage: https://www.facebook.com/ColunaDoFla",https://yt3.ggpht.com/2gBqrW08HGcLSChKi1h5Y4o6IqWEyT3WBemRl1lBmnl8WQyofxTbW0rjsRJc25_1mkfvl52c=s88-c-k-c0x00ffffff-no-rj,191941366,https://www.youtube.com/channel/UCOH0UtunvcOtBYvmHfHK3Nw,931000,2024-25-10,UCOH0UtunvcOtBYvmHfHK3Nw,BR
Creative Squad,90,Canal oficial da Creative Squad 🖤,https://yt3.ggpht.com/cI6BPIfe4VYTAMuJJ4iiv5YABkC_T_xK2bqny4HDktqn4XIgNO8aPrNl3b-MhkVkkRQGFKBjpZw=s88-c-k-c0x00ffffff-no-rj,110742449,https://www.youtube.com/channel/UCPIQI08BxL0i9nES_uKajAA,690000,2024-25-10,UCPIQI08BxL0i9nES_uKajAA,BR
Porta dos Fundos,2713,"Porta dos Fundos é um coletivo criativo fundado em 2012 por Antonio Tabet, Fábio Porchat, Gregorio Duvivier, João Vicente de Castro e Ian SBF. O que começou despretensiosamente, com um grupo de amigos em busca de liberdade criativa, hoje é uma produtora consolidada, referência em entretenimento multiplataforma, atuando em séries, filmes, branded content, estabelecendo parcerias com empresas, canais de TV e plataformas de streaming, e vencedora do Emmy Internacional de Comédia em 2019, pelo Especial de Natal feito para a Netflix.É um dos maiores canais do YouTube Brasil, ultrapassando 7 bilhões de visualizações e 18 milhões de inscritos. Em abril de 2019, chegou ao México com o canal Backdoor - Humor por donde no lo esperas, já com 4,7 milhões de inscritos.Assista também aos esquetes exclusivos no Mercado Play, no site ou app do Mercado Livre: https://bit.ly/portanomercadoplayCONTATO: contato@portadosfundos.comCOMERCIAL: comercial@portadosfundos.com",https://yt3.ggpht.com/vPDI93oKZrpEF-5i2Q5n6UTW-DyQuCMtmtgHoZMTvDn-Xem-2mMad-ZSxBWkHOj_9Wp9i4c9=s88-c-k-c0x00ffffff-no-rj,8328811801,https://www.youtube.com/channel/UCEWHPFNilsT0IfQfutVzsag,18200000,2024-25-10,UCEWHPFNilsT0IfQfutVzsag,BR
BillieEilishVEVO,161,,https://yt3.ggpht.com/tdh4GB7GFwOd7e4cdull42vhyFYTkpni9bDkTLJn-UFLbuFA1ygJHeibVays0FN2yFNE-0hsdw=s88-c-k-c0x00ffffff-no-rj,11462630513,https://www.youtube.com/channel/UCDGmojLIoWpXok597xYo8cg,1120000,2024-25-10,UCDGmojLIoWpXok597xYo8cg,
BillieEilishVEVO,161,,https://yt3.ggpht.com/tdh4GB7GFwOd7e4cdull42vhyFYTkpni9bDkTLJn-UFLbuFA1ygJHeibVays0FN2yFNE-0hsdw=s88-c-k-c0x00ffffff-no-rj,11462630513,https://www.youtube.com/channel/UCDGmojLIoWpXok597xYo8cg,1120000,2024-25-10,UCDGmojLIoWpXok597xYo8cg,
Garena Free Fire Brasil,1886,"YouTube oficial Garena Free Fire Brasil, o jogo mobile de tiro e sobrevivência. #SuaBatalhaSeuEstiloBaixe no iOS e Androidhttp://freefire.com.br/",https://yt3.ggpht.com/GMXRnlpdwsu_EZhooEJn3sTeNqoVM1ATE9uy6DdiE5kV14RTFDXkOk3Rx-HtrYXBF7XWVqxETA=s88-c-k-c0x00ffffff-no-rj,1148999495,https://www.youtube.com/channel/UCr4ARxgElIO21GWfIraZezg,9570000,2024-25-10,UCr4ARxgElIO21GWfIraZezg,BR
Paulistão,6113,Canal oficial do Maior Estadual do Brasil!,https://yt3.ggpht.com/a_D1Cra3wCQqs3w79lAjLVFO3rkLGWJPQ21c6IdGFYYGcj9pRyxrUO_CQu_Lpiyp28HSokZghg=s88-c-k-c0x00ffffff-no-rj,447145324,https://www.youtube.com/channel/UCaf4uhI8ItLyM_6kZ5I5Zdw,3230000,2024-25-10,UCaf4uhI8ItLyM_6kZ5I5Zdw,BR
Canal GOAT,2707,"Faça parte da comunidade GOAT na Casa de Apostas!  Divirta-se! (+18 aposte com responsabilidade)Ao vivo, grátis e com imagens no YouTube! Série B, Libertadores Feminina, UFC, Liga Saudita, Bundesliga, NWSL, programação ao vivo  e muito mais! 🐐Publicidade: contato@canalgoat.com.br",https://yt3.ggpht.com/lQbsmXG4-b751D81rRQ2DSmXVsu7WRPelClSw4Oc3jkJ6dxzgUne8AyZL4A6v5uH74x659wnvA=s88-c-k-c0x00ffffff-no-rj,383743860,https://www.youtube.com/channel/UC_oToDrJ6uca7d1dFVBmLtg,3780000,2024-25-10,UC_oToDrJ6uca7d1dFVBmLtg,BR
porkinbr,506,"oi, eu sou o porkinbr :DCONTATO COMERCIAL: porkinbr@xpinfluence.com",https://yt3.ggpht.com/NWvGnwpwjEj1doqOI1oSoUJLNz-t3F-nfjvvRkZ2GeA9B6pcEc-jlHgNYA550HZWLVyteCt0dg=s88-c-k-c0x00ffffff-no-rj,211066088,https://www.youtube.com/channel/UCrty1Tce9UBFwpkAF_f56Yg,1230000,2024-25-10,UCrty1Tce9UBFwpkAF_f56Yg,BR
DAZN Boxing,6326,DAZN. The global home of boxing.Subscribe to our YouTube channel 👉  http://bit.ly/DAZNBoxingYouTubeDownload the DAZN app now 👉  http://DAZN.com/youtubeFollow DAZN Boxing On Social Media 👇Twitter: https://www.twitter.com/DAZNBoxingInstagram: https://www.instagram.com/DAZNBoxingFacebook: https://www.facebook.com/DAZN,https://yt3.ggpht.com/lR-8MjQOgWRoiOa_vmkHHAmsMHaZyeNLnc1TI3ypBX5oFIef2LCUoHH1uHhJdYRSgeFbFYr7jQ=s88-c-k-c0x00ffffff-no-rj,2009024121,https://www.youtube.com/channel/UCurvRE5fGcdUgCYWgh-BDsg,4450000,2024-25-10,UCurvRE5fGcdUgCYWgh-BDsg,US
Julia MineGirl,2571,💜Amo Games💜,https://yt3.ggpht.com/ytc/AIdro_nOrXpOqUTmS6jBDdMDmlEsflVdz2q-2hjmrslwODhvWoE=s88-c-k-c0x00ffffff-no-rj,8550023110,https://www.youtube.com/channel/UCEOGSdXwcXcNfcuDGbjmgOw,11200000,2024-25-10,UCEOGSdXwcXcNfcuDGbjmgOw,BR
Domingo Espetacular,8848,"Canal oficial do Domingo Espetacular, que é exibido aos domingos, às 19h45.",https://yt3.ggpht.com/MORc47bbwN4bqGXRiEwjSpNz65lcXp8ZHluoUHN493Q4rxNTSHHW_QSwy5pYVZ_GyYENxjYJxw=s88-c-k-c0x00ffffff-no-rj,2884185449,https://www.youtube.com/channel/UCP-Vg2PcmLiWpEdvMI1R35w,8050000,2024-25-10,UCP-Vg2PcmLiWpEdvMI1R35w,
Reversão,301,"Ria da nossa falta de habilidade, e divirta-se sem moderação! Bem vindo ao Reversão!",https://yt3.ggpht.com/m0ySjI_QUrBWhZtjLoBM-_w8UbMQIqSHPaB0FVLarbtaeiuVbz_Onlw2i416ZnQ4imLFqLRLkQ=s88-c-k-c0x00ffffff-no-rj,374626026,https://www.youtube.com/channel/UCyEHckavb7hMh5f8j4WEiIg,2310000,2024-25-10,UCyEHckavb7hMh5f8j4WEiIg,BR
King Legacy,6,Official King Legacy Youtube Account.Join our Discord here -- discord.gg/kinglegacyFollow us on Twitter(X)! -- https://x.com/PlayKingLegacy,https://yt3.ggpht.com/edk4R5qElqkQUFxEiewlJu6efPyC-AgXNuCA5P19GMjnWmNvHqfKuGWNMlC4n_eaKBPCgI7d=s88-c-k-c0x00ffffff-no-rj,839637,https://www.youtube.com/channel/UCNDDAdnOBm50NLF03eWj3RQ,39000,2024-25-10,UCNDDAdnOBm50NLF03eWj3RQ,US
ROSÉ,25,,https://yt3.ggpht.com/gYUhm-w3_GKgz07ndhZ2_TvnRB8vgPBiI0n1UillNmGiCHPfkoxVY4Qi5LEP6R8HC7HenTREsQ=s88-c-k-c0x00ffffff-no-rj,548760602,https://www.youtube.com/channel/UCBo1hnzxV9rz3WVsv__Rn1g,9750000,2024-25-10,UCBo1hnzxV9rz3WVsv__Rn1g,
Major League Soccer,19923,"Welcome to the official YouTube page of Major League Soccer! MLS features stars from around the world, including one 🐐 from Argentina. We score bangers only. Watch them here.",https://yt3.ggpht.com/asBGrXaLUz2kHgztHK4Jv_qCndwbRnIuplkGlbo6LpZwpc4aaK-dMWRgb71pPWxvIManSaNqjg=s88-c-k-c0x00ffffff-no-rj,703377879,https://www.youtube.com/channel/UCSZbXT5TLLW_i-5W8FZpFsg,1610000,2024-25-10,UCSZbXT5TLLW_i-5W8FZpFsg,
