Titulo,Numero_de_videos,Descricao,Imagem_de_perfil,Numero_de_visualizacoes,Link,Numero_de_inscritos,Data,Canal_ID,Pais_codigo
Apuh,1172,Oi eu sou Apuh!! :),https://yt3.ggpht.com/ttU1tIwQ3PhHlPlt29kNWxBg37rHHngyetfjSsyBezAXL7hF0pzyLJWRFN8fuzrXhuqKrDwTyw=s88-c-k-c0x00ffffff-no-rj,304712329,https://www.youtube.com/channel/UCAu_v9w-BXFtg1NAnB-JgVg,1440000,2024-25-10,UCAu_v9w-BXFtg1NAnB-JgVg,BR
CLAUDEMIR GIGLIOTTI,2488,Eai? Tá afim de curtir as estradas mais doida do pais? Porco gato né!Vem comigo Pia!🛡️ Para contato comercial enviar email para:comercial@canaldoneni.com.br⚖️Para assuntos jurídicos nosso contato é:juridico@canaldoneni.com.br✔️Para outros assuntos:contato@canaldoneni.com.br,https://yt3.ggpht.com/1_RCzu5EODRJ9F3h7o5n3LmPCpceFmTV9Ai6nnC5C0lJJEm6zxdQnz0jLeSN-Vln18FEYODFLCg=s88-c-k-c0x00ffffff-no-rj,481528285,https://www.youtube.com/channel/UCP78dbFMqqu6PeBbFl5U4_Q,1430000,2024-25-10,UCP78dbFMqqu6PeBbFl5U4_Q,BR
Embrulha Pra Viagem,1499,Canal de esquetes de humor criado para o seu entretenimento. Inscreva-se e divirta-se.Vídeos novos toda segunda e quinta às 12h.E-mail para consultas empresariais:contato@embrulhapraviagem.com.brINSCREVA-SE NO NOSSO CANAL:https://www.youtube.com/embrulhapraviagemSegue no INSTAGRAM: https://www.instagram.com/oembrulhapraviagem/Curta no FACEBOOK: https://www.facebook.com/embrulhaoficial/Segue no TWITTER: https://twitter.com/embrulhaoficial,https://yt3.ggpht.com/Do9Bcmj5n_DHk-V0KTQ2RRB_om3irddInAHdcUqDSyRJIQyLxh-i9z31Xe2ZdC1CgQfIG7RaAQ=s88-c-k-c0x00ffffff-no-rj,353729024,https://www.youtube.com/channel/UCnMrFH0xuvWQSHCscGFV9Gw,1020000,2024-25-10,UCnMrFH0xuvWQSHCscGFV9Gw,BR
Bauers,1270,"se-inscreva, te deixará mais feliz 💛Xinglau e seus amigos formam a BAUERGANG, com muitas aventuras, pegadinhas e curiosidades  todos os dias aqui no canal!se-inscreve para fazer parte dessa turma #BAUERGANG✉️ Contato profissional: bauers@agenciacurta.com",https://yt3.ggpht.com/2H_vY5OGeV0ESy50CI-U3J9LcfqzS7m2XJbTri_Z-kF9vDmGh0hlYVaYQtrtj0q7rJYu5GYqzQ=s88-c-k-c0x00ffffff-no-rj,1257987684,https://www.youtube.com/channel/UCQEUV7le_zYKNKGmUJOwvBw,4970000,2024-25-10,UCQEUV7le_zYKNKGmUJOwvBw,BR
PINK,159,Cozy UpJust dropped: the comfy new styles you’ll be living in until further notice. Shop now:: https://bit.ly/3wkOqbU,https://yt3.ggpht.com/d2-_Zb3pb47gAhMk7IOHiHIdpbk3Vc-eLtR572PyjS3GJTEA8LDslxkdZY6dyoBgykaGkbqs=s88-c-k-c0x00ffffff-no-rj,12132667,https://www.youtube.com/channel/UCAx72qxfBq_df6gTB1yNWwA,85700,2024-25-10,UCAx72qxfBq_df6gTB1yNWwA,US
CONMEBOL,4737,Canal Oficial de la Confederación Sudamericana de Fútbol. #CreeEnGrande | Canal Oficial da Confederação Sul-Americana de Futebol. #AcrediteSempre,https://yt3.ggpht.com/89JiHsaEsuCuzlcmtemfWyfMtRRbZrjMciCZrWTWT7oRonqiz29iOnBndDifmPQAcF54thytIQ=s88-c-k-c0x00ffffff-no-rj,430536323,https://www.youtube.com/channel/UCzU8-lZlRfkV3nj0RzAZdrQ,1710000,2024-25-10,UCzU8-lZlRfkV3nj0RzAZdrQ,
JYP Entertainment,2218,"JYPnation Official YouTubeLEADER IN ENTERTAINMENTThere are values and goals that JYP Entertainment (JYP) has pursued. JYP prides itself with those values and strives to be an exemplary leader in the entertainment industry. With the lead of Park Jin Young as one of Asia’s most prominent producers in the entertainment industry, JYP has discovered and produced some of the most popular and successful K-Pop artists, such as god, Rain, Wonder Girls, 2PM, 2AM, miss A, GOT7, DAY6, TWICE, Stray Kids, ITZY, Xdinary Heroes and NMIXX.Also, we have introduced and led K-Pop’s dominance by expanding the activities of our artists to the global music industry through the network of our overseas subsidiaries, JYP Japan and JYP China. JYP not only focuses on ordinary business, like planning and creating music, finding and managing artists, conducting online, mobile and overseas business, but also strives to scout creative talents and develop them to be suitable for the entertainment industry.",https://yt3.ggpht.com/kcV7NQkBm-UvvzVTJvrg1Yf1eHSqi-DLXuZPt_ECa3cHEPefujS951Dxj6KUEQ5i9Z7_fyMUjw=s88-c-k-c0x00ffffff-no-rj,23449741781,https://www.youtube.com/channel/UCaO6TYtlC8U5ttz62hTrZgg,29800000,2024-25-10,UCaO6TYtlC8U5ttz62hTrZgg,
Tomorrowland,2341,Relive all the magical moments of Tomorrowland all year long. ,https://yt3.ggpht.com/ELuL4kMKJpwlmnf2xkdGC5FJ40R9hufc3jYDvDOEXc-sbRLcd3xbW9EyVRpq-YUbTJSTONhdOvI=s88-c-k-c0x00ffffff-no-rj,2191298327,https://www.youtube.com/channel/UCsN8M73DMWa8SPp5o_0IAQQ,11200000,2024-25-10,UCsN8M73DMWa8SPp5o_0IAQQ,GB
Jimmy Kimmel Live,7070,"The official Jimmy Kimmel Live! YouTube Channel. Home of Celebrities Read Mean Tweets, YouTube Challenges and the rest of your favorite viral late night videos.",https://yt3.ggpht.com/ytc/AIdro_k-ki4dUsNVrqikgF_zqBJeb0ZtDXKAZ94vAYsLTKXi_3dk=s88-c-k-c0x00ffffff-no-rj,14006758926,https://www.youtube.com/channel/UCa6vGFO9ty8v5KZJXQxdhaw,19700000,2024-25-10,UCa6vGFO9ty8v5KZJXQxdhaw,US
Bruna Constantino,856,"Bem vindos ao meu canal, galerinha! Bruna Constantino na área! Vídeos todos os dias 12h no canal! Obrigada por me acompanharem e por realizarem meu sonho de chegar aos 100k! Começarei a postar shorts pra vocês como forma de agradecer! A meta agora é chegarmos nos 200k! Me sigam no insta e no tik tok @eubrunaconstantino para acompanhar meu dia-a-dia!",https://yt3.ggpht.com/SW_w7pRlerFOTye47XNoROdk72GpVBSrfWPRtU4Is1eXLXfMDc3KgYAq4mvi3q-nfqvpQlK4Jw=s88-c-k-c0x00ffffff-no-rj,560315888,https://www.youtube.com/channel/UCfW44jAwxqCI8VB_Dd7KkXQ,2500000,2024-25-10,UCfW44jAwxqCI8VB_Dd7KkXQ,BR
Rota Livre Pelo Mundo,1162,"Somos Thais Nakaguma e Diego Silva, de Limeira-SP, criamos o canal para compartilhar as diversidades culturais, conhecendo as maravilhas do Mundo. Tudo isso com um toque de aventura e simplicidade! Queremos te inspirar a seguir os seus sonhos! Vídeos Novos dia sim e dia não- Sempre às 19h30♥️Vocês nos ajudam muito assistindo, comentando, compartilhando e dando like 👍 nos vídeos! Gostaram do conteúdo? Então bora se inscrever no canal pra não perder nenhum episódio da vida real. Obrigado e tmj meus amigos!😉💰DESCONTOS AQUI- https://linktr.ee/rotalivrepelomundoContatos:👊Parcerias: rotalivreoficial@gmail.com ✅Siga no Instagram @rotalivrepelomundo☑email: 📧rotalivreoficial@gmail.comMÚSICA TEMA do Canal- SONHAR (MALLOO)https://youtube.com/@BICHODOMATOARTShttps://instagram.com/malloo_music?igshid=Yzg5MTU1MDY=",https://yt3.ggpht.com/ytc/AIdro_nMx778uHUnhsXbT44Ko1vKSLSYwHjaeCohpImvyReGXg=s88-c-k-c0x00ffffff-no-rj,63476628,https://www.youtube.com/channel/UCQykyH0hmyHY04QQcJOtZuw,280000,2024-25-10,UCQykyH0hmyHY04QQcJOtZuw,BR
Hay Day,193,"Best. Farm. Ever. Welcome to Hay Day, the most popular farming game on mobiles and tablets, number one in 122 countries.Get Hay Day ►► https://link.haydaygame.com/Learn the lay of the land, tend to your crops, and trade goods with neighbors and friends. It’s a real special place where the crops never die even though it never rains. Sharing the farm with our quirky animals only makes things more fun!Hay Day is available for devices running iOS, Android and Kindle!Subscribe for more videos ►► https://supr.cl/SubHayDayFollow us on our Socials!Twitter ►► https://twitter.com/HayDay/Instagram ►► https://www.instagram.com/hayday Facebook ►► https://www.facebook.com/haydayofficialHay Day Discord Chat ►► https://discord.gg/F7BmubqHay Day Reddit ►► https://www.reddit.com/r/HayDay/",https://yt3.ggpht.com/3uuvLxttvZAZ7qZSWSa8jKQB1HZa7MKZnHgQTLAtvatZfAw_jKoWs52Uwi684l26qOEldDEE=s88-c-k-c0x00ffffff-no-rj,318462224,https://www.youtube.com/channel/UCBrMq7wkdPWb3PxR-GUR61A,2230000,2024-25-10,UCBrMq7wkdPWb3PxR-GUR61A,FI
KISS OF LIFE,876,KISS OF LIFE Official YouTube Channel,https://yt3.ggpht.com/MHN6VXoyWmdlQ-1zVG59s_ZLeeFhICujj_XWk_m2CmujNJp1LQc0G0p8N67rwIs-rz0wlz6t=s88-c-k-c0x00ffffff-no-rj,842703884,https://www.youtube.com/channel/UCvEEeBssb4XxIfWWIB8IjMw,1700000,2024-25-10,UCvEEeBssb4XxIfWWIB8IjMw,
JENNIE,54,,https://yt3.ggpht.com/et6Hg97svg-QT3lBhfA2V_URD0Ll7nuat2PLRpHAzRKveL1evz2iv3upwLX2Iy-wMZMA9SD1aw=s88-c-k-c0x00ffffff-no-rj,553522325,https://www.youtube.com/channel/UCNYi_zGmR519r5gYdOKLTjQ,12100000,2024-25-10,UCNYi_zGmR519r5gYdOKLTjQ,
TROPA DO BRUXO,33,"@tropadobruxo_A TROPA DO BRUXO, é um projeto musical de TRAP idealizado pelo melhor jogador do mundo RONALDINHO GAÚCHO e  pela Wusta Studio. O projeto é um laboratório criativo de ideias , que consiste em juntar nomes relevantes  da cena musical em torno de uma obra artística,  e também para artistas iniciantes  e desconhecidos , dando a oportunidade para abrir caminhos,  e assim revelar novos  talentos .O projeto conta com lançamentos mensais , merchandising e conteúdos exclusivos.",https://yt3.ggpht.com/SwnvTEE2VxvO1Esd0yZ0hwvNFt7oD2_3P395mJcB5FgDzmK3iJQ-BKJmk7pU_Q5Hxau0AQEQfg=s88-c-k-c0x00ffffff-no-rj,216817102,https://www.youtube.com/channel/UCbEB64xwXwp87RhNFckuQBg,705000,2024-25-10,UCbEB64xwXwp87RhNFckuQBg,BR
PRIMO ESTRANHO YT,25,Insta: @primoestranhoyt,https://yt3.ggpht.com/7ahq59_ClyTxB3_PyB2cOHHI0QoZEdf390ngcEHZ749xVulidBkCudmBe1MDDQrHPrXDqHqr=s88-c-k-c0x00ffffff-no-rj,2248130,https://www.youtube.com/channel/UCuVW1b2_k64UaagPYjWKAsQ,44800,2024-25-10,UCuVW1b2_k64UaagPYjWKAsQ,
Leozinn 077,434,"ola sou o leozinn ! sou youtuber, tik toker influencer digital ! meu unico e maior sonho e deixar todos felizes :) faco o que eu amo ! obrigado ",https://yt3.ggpht.com/qsyT5KRPkUOgcAsMpjPvHsQEfhnv0MoMkAyDK4K8EktfPC1ik_2ECsssCq5Mq9oaOZy73jL72w=s88-c-k-c0x00ffffff-no-rj,4517324657,https://www.youtube.com/channel/UCIRNu5s24r7zAPTFic_eWNw,12800000,2024-25-10,UCIRNu5s24r7zAPTFic_eWNw,
Brawl Stars,243,Fast-paced 3v3 multiplayer and battle royale made for mobile! Play with friends or solo across a variety of game modes in under three minutes.,https://yt3.ggpht.com/FVJpJyrV85TDL2nyiFbnaBuZzuYX1thQywPXCvilPAuw7DmPjFoXphPgkCqekYNIfqFtqGrvCg=s88-c-k-c0x00ffffff-no-rj,2894709106,https://www.youtube.com/channel/UCooVYzDxdwTtGYAkcPmOgOw,20300000,2024-25-10,UCooVYzDxdwTtGYAkcPmOgOw,FI
ITZY,1757,ITZY GOLDhttps://ITZY.lnk.to/GOLD📌Release2024.10.15 TUE 6PM (KST) | 5AM (EDT)#ITZY #MIDZY#ITZYComeback#ITZY_GOLD,https://yt3.ggpht.com/6jkoL_f5fcFSsIJwDBF7OWVXXWZ6NJp-n9UxeS3QY6vPClfLE_ZDpns20rhbZJ3spC8cUVoX=s88-c-k-c0x00ffffff-no-rj,3022965106,https://www.youtube.com/channel/UCDhM2k2Cua-JdobAh5moMFg,9320000,2024-25-10,UCDhM2k2Cua-JdobAh5moMFg,KR
Delacruz,83,Canal oficial do cantor e compositor Delacruz.,https://yt3.ggpht.com/-AwthSJ31Yc7-27lwe8rc8aSBVq7J9MAxcPIRhJZCKZNdNmOJTid-0xok5qdEADUZfcBhkXpfK8=s88-c-k-c0x00ffffff-no-rj,517009523,https://www.youtube.com/channel/UCBda6I9ZUBEliGiLDLP6rWQ,1580000,2024-25-10,UCBda6I9ZUBEliGiLDLP6rWQ,
Zenless Zone Zero,196,"Zenless Zone Zero is HoYoverse’s brand-new urban fantasy ARPG. A calamity known as the Hollows has destroyed modern society in the game. New Eridu, the last remaining metropolis, has risen against the odds amidst this destructive catastrophe and become the last remnant of contemporary civilization. Players act as Proxies who explore Hollows alongside a wide range of unique Agents, fighting enemies, and completing commissions on their journey to unveil the mysteries behind New Eridu.Zenless Zone Zero is available on PlayStation®5, iOS, Android, and PC: https://hoyo.link/6SOkFDAL▼ Official Community ▼▶ X (Twitter): https://twitter.com/ZZZ_EN▶ Facebook: https://www.facebook.com/ZZZ.Official.EN▶ Instagram: https://www.instagram.com/zzz.official.en/▶ YouTube: https://www.youtube.com/@ZZZ_Official▶ TikTok: https://www.tiktok.com/@zenlesszonezero▶ Discord: https://discord.gg/zenlesszonezero▶ Reddit: https://www.reddit.com/r/ZZZ_Official/",https://yt3.ggpht.com/bhTyZchnZVHuXYHyvBbSv02rThHjV5pBk1G6Hi0wV_5F1RdXDEf3r7PdQoyl3s0KO0hDiiPc=s88-c-k-c0x00ffffff-no-rj,230232064,https://www.youtube.com/channel/UC2SpC8rL9LaeQriE4YNdyzA,990000,2024-25-10,UC2SpC8rL9LaeQriE4YNdyzA,US
Papyrus Da Batata,509,"Música nova todo sábado!(Eu acho)E-mail para contato: Ggamestutorialsplays13@gmail.comFaço música sobre jogos, desenhos, filmes, séries e muito mais. Venha acompanhar essa jornada comigo!❤🍟",https://yt3.ggpht.com/h4HuDE2rNkakhchoxepbYWTfSLkd7hI6N0TDTGGYjDfQj1vShO36MAGQTuHnUAhANnuafnDU=s88-c-k-c0x00ffffff-no-rj,267132737,https://www.youtube.com/channel/UCLQsllc7GEzKR9RMvwPdtYg,1010000,2024-25-10,UCLQsllc7GEzKR9RMvwPdtYg,
Iron Master,170,Canal focado em Música GeekVídeo novo todas as Terças e Sábados as 19:00,https://yt3.ggpht.com/mJ9hsjWHRHspAPUvx47u28ORfbJdCF-9CmWGdkRTeK6UhhJNtHeCl1OI5xnp81Tv6fQzBKp6=s88-c-k-c0x00ffffff-no-rj,256753084,https://www.youtube.com/channel/UC0AUSYG5r2ppPs7L9CPylPA,1180000,2024-25-10,UC0AUSYG5r2ppPs7L9CPylPA,BR
FutParódias,978,📧 CONTATO: contato@futparodias.com.br--💼 COMERCIAL: comercial@futparodias.com.br🎤 SHOWS: shows@futparodias.com.brÉ o FutParódias original! 🎧⚽Vídeos novos toda terça e sexta às 11:00hSigam nossas redes!Dezão:📷 https://www.instagram.com/dezaofutparodias🐦 https://www.twitter.com/dezaodrumond👍 https://www.facebook.com/dezaodrumondLeon:📷 https://www.instagram.com/leonfutparodias🐦 https://www.twitter.com/leonwhosoever👍 https://www.facebook.com/leonwhosoeverFutParódias:📷 https://www.instagram.com/futparodias🐦 https://www.twitter.com/futparodias👍 https://www.facebook.com/futparodias,https://yt3.ggpht.com/43gv_N0qV_EXcXQkES6SFcXzEbPUgfXEfcRX9tNYjdf54fGHGwaed1E_jouI_SztDLCSaOJSDQ=s88-c-k-c0x00ffffff-no-rj,4964667920,https://www.youtube.com/channel/UCGFNp4Pialo9wjT9Bo8wECA,10700000,2024-25-10,UCGFNp4Pialo9wjT9Bo8wECA,BR
Cadê a chave?,1852,"Nilce é jornalista,  empresária. Leon, mestre em Estudos Europeus e fissurado por ciência, conhecimento, cultura pop e todo tipo de Coisa de Nerd. Juntos, eles fazem do Cadê a Chave, o ponto de encontro diário para mais de um milhão de amigos, interessados em cinema, diversão, viagens, novas tecnologias, relacionamento, histórias e em rir dos tombos da vida. Quer fazer parte dessa comunidade? Chega mais! Para comercial: contato@coisadenerd.net",https://yt3.ggpht.com/ytc/AIdro_mAInGXZFTrSskkges8ao7XCcqNspGf0R3WjOKw5We5XTo=s88-c-k-c0x00ffffff-no-rj,1134424051,https://www.youtube.com/channel/UCtrjFP7i92_30uv6IehwE5Q,4370000,2024-25-10,UCtrjFP7i92_30uv6IehwE5Q,BR
rezendeevil,12333,Contato Comercial: Rezende@adragencia.com.brInstagram: rezendeTwitter: @rezende_evilSnapchat: Imrezende,https://yt3.ggpht.com/TX93DoEJrvJi10f8WrPOej9VS0YrMUmuRt_tzT6Kj5A3qBvFx6iOspfirq42jXDUo6cmRcVQ-A=s88-c-k-c0x00ffffff-no-rj,13662325984,https://www.youtube.com/channel/UCbTVTephX30ZhQF5zwFppBg,33800000,2024-25-10,UCbTVTephX30ZhQF5zwFppBg,BR
ITZY - Topic,258,,https://yt3.ggpht.com/6jkoL_f5fcFSsIJwDBF7OWVXXWZ6NJp-n9UxeS3QY6vPClfLE_ZDpns20rhbZJ3spC8cUVoX=s88-c-k-c0x00ffffff-no-rj,1064481379,https://www.youtube.com/channel/UCTP45_DE3fMLujU8sZ-MBzw,3060,2024-25-10,UCTP45_DE3fMLujU8sZ-MBzw,
Marvel Entertainment,9210,"Marvel is committed to bringing great stories, characters, and experiences to fans all over the world. We strive to foster an inclusive, diverse, respectful, and safe environment for all of our fans, and we ask the same of our fan communities. As such, we reserve the right to take action including but not limited to hiding, deleting, blocking, and reporting any posts on this account or page. Please also be aware that Marvel does not accept or consider unsolicited idea submissions.",https://yt3.ggpht.com/P_qIGe_-Jt5V4JT_UtIuURsq9RBRDIZ88tvFJx1AzACWzsuRIrrOfb6jDH2OnoukFdS06AN5nQ=s88-c-k-c0x00ffffff-no-rj,6246276254,https://www.youtube.com/channel/UCvC4D8onUfXzvjTOM-dBfEA,20900000,2024-25-10,UCvC4D8onUfXzvjTOM-dBfEA,US
Porta dos Fundos,2713,"Porta dos Fundos é um coletivo criativo fundado em 2012 por Antonio Tabet, Fábio Porchat, Gregorio Duvivier, João Vicente de Castro e Ian SBF. O que começou despretensiosamente, com um grupo de amigos em busca de liberdade criativa, hoje é uma produtora consolidada, referência em entretenimento multiplataforma, atuando em séries, filmes, branded content, estabelecendo parcerias com empresas, canais de TV e plataformas de streaming, e vencedora do Emmy Internacional de Comédia em 2019, pelo Especial de Natal feito para a Netflix.É um dos maiores canais do YouTube Brasil, ultrapassando 7 bilhões de visualizações e 18 milhões de inscritos. Em abril de 2019, chegou ao México com o canal Backdoor - Humor por donde no lo esperas, já com 4,7 milhões de inscritos.Assista também aos esquetes exclusivos no Mercado Play, no site ou app do Mercado Livre: https://bit.ly/portanomercadoplayCONTATO: contato@portadosfundos.comCOMERCIAL: comercial@portadosfundos.com",https://yt3.ggpht.com/vPDI93oKZrpEF-5i2Q5n6UTW-DyQuCMtmtgHoZMTvDn-Xem-2mMad-ZSxBWkHOj_9Wp9i4c9=s88-c-k-c0x00ffffff-no-rj,8328811801,https://www.youtube.com/channel/UCEWHPFNilsT0IfQfutVzsag,18200000,2024-25-10,UCEWHPFNilsT0IfQfutVzsag,BR
Bruno Perini - Você MAIS Rico,2058,"Canal de vídeos de Bruno Perini - criador do site de educação financeira Você MAIS Rico e do curso Viver de Renda.Aprenda mais sobre dinheiro, finanças e investimentos com quem realmente entende do assunto.Inscreva-se no canal e me siga nas redes sociais!",https://yt3.ggpht.com/ytc/AIdro_l6tUjwilRjMDBJ0p36NnmeSiU01y2N-4HZVS34VwheCrQ=s88-c-k-c0x00ffffff-no-rj,412870720,https://www.youtube.com/channel/UCCE-jo1GvBJqyj1b287h7jA,1740000,2024-25-10,UCCE-jo1GvBJqyj1b287h7jA,BR
Vitória MineBlox,1134,Inscreva-se! Vídeos novos todos os dias!Bem-vindos ao canal Vitória MineBlox🎬 VÍDEOS NOVOS TODOS OS DIAS ÀS 12H (MEIO DIA)Me siga também no TikTok e Instagram. Contato profissional: vitoriamineblox@gmail.com💗 Acredite nos seus sonhos! 💗,https://yt3.ggpht.com/ytc/AIdro_nYK8Q7VQY2nZi3MaFf2OMPyMJaL2QHnie2-e7CQfJgVvc=s88-c-k-c0x00ffffff-no-rj,2520896129,https://www.youtube.com/channel/UCZ7BbnhXm_OJO6hwhB4pWRw,4690000,2024-25-10,UCZ7BbnhXm_OJO6hwhB4pWRw,BR
Apple TV,2220,The official rabbit hole of Apple TV+Apple TV+ is a streaming service with original stories from the most creative minds in TV and film. Watch now on the Apple TV app: https://apple.co/_AppleTVapp,https://yt3.ggpht.com/ytc/AIdro_kjbQEFDiUGUQMyo7ETYP4DZI4piL-3msIXiyhE8V9one8=s88-c-k-c0x00ffffff-no-rj,1363319476,https://www.youtube.com/channel/UC1Myj674wRVXB9I4c6Hm5zA,1840000,2024-25-10,UC1Myj674wRVXB9I4c6Hm5zA,US
Growth TV,2216,,https://yt3.ggpht.com/Q7tFqUFJ9yTQeYC8U2B2vW4lCbzL8UZcubPng-vynEfw1_UYQaES1TOdhh0YNhaxG1iyBTYZUj4=s88-c-k-c0x00ffffff-no-rj,573741948,https://www.youtube.com/channel/UCGfrC6R2PSMeXv4hdhONB6Q,3050000,2024-25-10,UCGfrC6R2PSMeXv4hdhONB6Q,BR
Cortes do Flow [OFICIAL],8730,"Cortes do Flow [OFICIAL] é um canal com partes de assuntos interessantes que rolaram ao vivo no Flow Podcast, postados neste canal individualmente pra que pessoas que não tem tempo/paciência pra assistir o episódio completo, tenham uma ideia de como foi o papo com o convidado.",https://yt3.ggpht.com/fgy7u6dM3YxXfaCYF_pxvAUy2V2DfGOMBMAiiiE5KpBOIAsSUpBjlzExC9aUASUnZllbnny26A=s88-c-k-c0x00ffffff-no-rj,1231030525,https://www.youtube.com/channel/UC3uYvpJ3J6oNoNYRXfZXjEw,2800000,2024-25-10,UC3uYvpJ3J6oNoNYRXfZXjEw,BR
Renato Cariani,3788,,https://yt3.ggpht.com/ytc/AIdro_mFRcNgmptqL_HVJXr8Gx4WuXar5Dr4KNSh8ucWI00SN6o=s88-c-k-c0x00ffffff-no-rj,1333717162,https://www.youtube.com/channel/UCPX0gLduKAfgr-HJENa7CFw,7260000,2024-25-10,UCPX0gLduKAfgr-HJENa7CFw,BR
Luiza Martins ,165,"Sou Luiza Martins, cantora e compositora!Shows: (62) 99107-1374Publicidade: publicidade@luizamartins.comLuiza Martins é mineira, natural de Belo Horizonte, e começou na carreira musical como primeira voz e violão. A jovem, dona de uma voz forte e marcante, chama a atenção em cada tom que alcança. Sendo carinhosamente chamada pelos colegas de “Alcione do sertanejo”, a cantora se sentiu honrada em dividir o palco nas gravações do segundo DVD da dupla Luíza e Maurílio com a própria Alcione, que fez elogios a voz dos artistas e a escolha do repertório. Ao lado de Maurílio, Luiza consagrou hits como S de Saudade, Pode Sumir e Inamorável - canções que, em conjunto, ultrapassam quase um bilhão de visualizações -, entre outros. Luiza Martins se prepara para dar início a um novo momento da carreira, agora de forma solo.",https://yt3.ggpht.com/cQg4apD9PH6-m0MSvC1A9_uXRmdwa1NIIHndYY_LWiPKME7-Ib6D7NdBDqPz7j-BRNwqGDfkoQ=s88-c-k-c0x00ffffff-no-rj,177099743,https://www.youtube.com/channel/UCuqaXp9m4oqp2GtXsEKoUKQ,188000,2024-25-10,UCuqaXp9m4oqp2GtXsEKoUKQ,BR
Vitória MineBlox,1134,Inscreva-se! Vídeos novos todos os dias!Bem-vindos ao canal Vitória MineBlox🎬 VÍDEOS NOVOS TODOS OS DIAS ÀS 12H (MEIO DIA)Me siga também no TikTok e Instagram. Contato profissional: vitoriamineblox@gmail.com💗 Acredite nos seus sonhos! 💗,https://yt3.ggpht.com/ytc/AIdro_nYK8Q7VQY2nZi3MaFf2OMPyMJaL2QHnie2-e7CQfJgVvc=s88-c-k-c0x00ffffff-no-rj,2520896129,https://www.youtube.com/channel/UCZ7BbnhXm_OJO6hwhB4pWRw,4690000,2024-25-10,UCZ7BbnhXm_OJO6hwhB4pWRw,BR
Vitória MineBlox,1134,Inscreva-se! Vídeos novos todos os dias!Bem-vindos ao canal Vitória MineBlox🎬 VÍDEOS NOVOS TODOS OS DIAS ÀS 12H (MEIO DIA)Me siga também no TikTok e Instagram. Contato profissional: vitoriamineblox@gmail.com💗 Acredite nos seus sonhos! 💗,https://yt3.ggpht.com/ytc/AIdro_nYK8Q7VQY2nZi3MaFf2OMPyMJaL2QHnie2-e7CQfJgVvc=s88-c-k-c0x00ffffff-no-rj,2520896129,https://www.youtube.com/channel/UCZ7BbnhXm_OJO6hwhB4pWRw,4690000,2024-25-10,UCZ7BbnhXm_OJO6hwhB4pWRw,BR
Gigaton Games,835,"Um canal dedicado aos games, com humor e criatividade. Contato comercial logo abaixo.",https://yt3.ggpht.com/ytc/AIdro_nkHu5G6QXmUO0oTIXb14SloRDzC5vC7T_-hPn4SxBxzxs=s88-c-k-c0x00ffffff-no-rj,403061554,https://www.youtube.com/channel/UCAjKLSz8h3XJM5CSJWvmoNA,2840000,2024-25-10,UCAjKLSz8h3XJM5CSJWvmoNA,
Hi Gorgeous Anna Layza,1037,​​Sejam bem vindos unis!Eu sou a Anna Layza e aqui você vai encontrar muita positividade e entretenimento!Quase todo dia tem vídeo novoooSE INSCREVA aqui no canal Hi Gorgeous: https://bit.ly/2G7mCv4pra não perder nada e ativa sua notificação pra ser o primeiro a ver vídeos!MEU TIKTOK: https://www.tiktok.com/@annaLayzaMEU INSTAGRAM: https://www.instagram.com/annalayza/FANPAGE: https://www.facebook.com/annalayzaa Twitter: https://twitter.com/annalayzaBeijôôô!,https://yt3.ggpht.com/qav_bxB4bmYQQTQWOvrnSQvl7q29blrXyC7STZbr1B3SsYqkFjXxid7os9oXstruxz0WffQsjQ=s88-c-k-c0x00ffffff-no-rj,984439412,https://www.youtube.com/channel/UCRglkxcwiH3jrORNAvMPGKQ,7310000,2024-25-10,UCRglkxcwiH3jrORNAvMPGKQ,US
Vou sem volta,462,"Somos Fred e Laryssa, um casal brasileiro viajando o mundo de mochilão e de forma lenta, barata e imersiva. Tentamos sempre ter contato com os locais e aprender um pouco da vida real de cada país que passamos.Vou Sem Volta é sobre ir e nunca mais voltar a ser o mesmo!",https://yt3.ggpht.com/AuLoIm_i9ULOFKnmpvkBgacrQspvF4A2GUK87YzTTpniPLXiMH932-FB57BFW_NE3aTdQDop=s88-c-k-c0x00ffffff-no-rj,79761163,https://www.youtube.com/channel/UCHnasAyiyOfqsdfhterxZJQ,398000,2024-25-10,UCHnasAyiyOfqsdfhterxZJQ,BR
Murilo Huff,278,Seja bem vindo ao canal oficial do cantor e compositor Murilo Huff.Shows: (62) 98233-0008 - Cadu VicentiniPublicidade: luana@artinvox.com.br,https://yt3.ggpht.com/FzK2D1I-Tg-cjiXIfgC3j8cehcUhppX7N_iUTpD4gJ0h2JfqwewBv2paz46tpIrLHJXrIZDS=s88-c-k-c0x00ffffff-no-rj,2198362240,https://www.youtube.com/channel/UCMZKcLkNw1AMgfusg3Mjutw,1780000,2024-25-10,UCMZKcLkNw1AMgfusg3Mjutw,BR
Painzeiro,1300,Minha intenção é deixar vocês felizes !,https://yt3.ggpht.com/Rl-BQ1v6mA5cmGyQEAa5UkCGwgesNTJaU9SamUEAqMB50YpVR1yOCYDtJKREHEI9b6SVqEOpbw=s88-c-k-c0x00ffffff-no-rj,3803466210,https://www.youtube.com/channel/UCCnl0HqjHFj6akQZBW81whQ,20400000,2024-25-10,UCCnl0HqjHFj6akQZBW81whQ,BR
Dinah Moraes,1269,Canal de humor sobre coisas do cotidiano com humor nordestino!,https://yt3.ggpht.com/zMBEF141WxJoP_sVtJLtF1M3kJrbcqI1UJnFqcCK6MDomsNFpLBYxY5pdENcOnC9usoRvf5NIOY=s88-c-k-c0x00ffffff-no-rj,2690227763,https://www.youtube.com/channel/UCoIrFSMG4kt0hNF6KBgga0w,6130000,2024-25-10,UCoIrFSMG4kt0hNF6KBgga0w,BR
